334162854	2020-01-17T20:25:00.000Z	1218267999641251841	 Coming from a yankee fan, you’re a idiot hubbs. How did you think this tweet was going to work out?	{'place_id': '01a9a39529b27f36'}
39455009	2020-01-17T20:17:53.000Z	1218266209776476160	I met a hot London oomf and let him go to work (Nadine reference) twice. It was worth breaking my rule of not sleeping with people from Twitter 😌	{'place_id': '01a9a39529b27f36'}
111505259	2020-01-17T20:09:49.000Z	1218264182254075905	i never make videos like this before i go out or when i come back home... ima start. 	{'place_id': '011add077f4d2da3'}
183526052	2020-01-17T20:06:16.000Z	1218263285767843841	 Our thoughts and prayers go out to you Céline and the whole family.🙏🏻🙏🏻	{'place_id': '01a9a39529b27f36'}
1087205427614494721	2020-01-17T19:58:47.000Z	1218261402600857603	get that dumb bitch out and let Cone go to work, this would set him up nicely to become a manager a few years down the line 	{'place_id': 'bda900177f5d9f42'}
1137466374	2020-01-17T19:35:52.000Z	1218255635067867136	  And you're there disturbing Marto, see the real people that went to school	{'place_id': '011add077f4d2da3'}
40085651	2020-01-17T19:13:03.000Z	1218249892767895557	Mom wanted to go out to eat to the bar I was physically thrown out of Thanksgiving Eve so I had to lie and say I ate there and didn’t like the food.	{'place_id': '88c45dc6118d88a2'}
3010483279	2020-01-17T17:58:12.000Z	1218231057255976961	"In sports we call this type of dumbassery ""bulletin board material"" v interested to see how bloviating so loudly is going to work out for him when tables turn "	{'place_id': '011add077f4d2da3'}
756906336	2020-01-17T17:21:12.000Z	1218221744839909376	 What on earth are these people going on about? What's wrong with the poor guy moving out of Granny's house and going out in the world to live on his own like a real person?	{'place_id': '54719aecdeecbbe8'}
2602146772	2020-01-17T17:18:37.000Z	1218221097755316225	I was really gonna go to work 0 hours early and apologize for being late 🤦🏾‍♂️🤦🏾‍♂️	{'place_id': '002e24c6736f069d'}
139255909	2020-01-17T17:02:30.000Z	1218217042022666243	This does not only go out to my clients, but those reading this post. What can I do to help?           … 	{'place_id': '01a9a39529b27f36', 'coordinates': {'type': 'Point', 'coordinates': [-73.9938, 40.74123]}}
706979910510899201	2020-01-17T16:51:50.000Z	1218214357437427719	If we gonna smoke, and then just stare at walls afterwards.. don’t invite me. We need to go out to eat or something, cause I WILL go to sleep in a heartbeat.	{'place_id': '00c39537733fa112'}
23536646	2020-01-17T16:36:32.000Z	1218210506584010752	schady_j  is collecting for   by wearing a Kangaroo outfit to school please donate   dobbschools theellenshow   shady0… 	{'place_id': 'cd252b18da6e948e', 'coordinates': {'type': 'Point', 'coordinates': [-73.86611111, 41.01277778]}}
8956182	2020-01-17T16:33:50.000Z	1218209825290629120	Being a VC is such an emotional roller coaster. You can go directly from a conversation with a portfolio founder who’s destroying it to one who’s going out of business. I’m certainly not complaining, being a founder is the hard part but still an interesting dynamic.	{'place_id': '01a9a39529b27f36'}
4192137538	2020-01-17T16:26:22.000Z	1218207948285054980	 for 0 million kids forced to stop learning due to conflict and crisis.    will you help the world’s most vulnerable children get back to school by committing to  this year? 	{'place_id': '364a45c10832ed51'}
770777192250871808	2020-01-17T16:03:37.000Z	1218202221978046464	I really dont want to go back to school 😩😔	{'place_id': '364a45c10832ed51'}
142571431	2020-01-17T15:47:36.000Z	1218198190262050816	"It’s actually nice editing in a format other than 0x0. This edit is going out to Instagram, 0x0, 0:0.I customized my Premiere Pro workspace to maximize the screen display size on the LG 0"" 0:0 UltraWide Monitor.    "	{'place_id': '01a9a39529b27f36'}
397764772	2020-01-17T15:45:25.000Z	1218197641701601280	I just don’t understand this concept. If the album is so “Rare” and she wants people to hear it.. then why is she going out to buy the album in bulk HERSELF... it’s literally just to illegitimately spike her sales no REAL consumer is consuming the project.. 	{'place_id': 'a40c7aae22398af1'}
123628396	2020-01-17T14:55:13.000Z	1218185009892335616	Yea go to college they said it be fun they said 	{'place_id': '002e24c6736f069d'}
1055321195787231232	2020-01-17T14:47:24.000Z	1218183041723650048	Go out of your way to hear Circles. Listen to it all, it’s something special.	{'place_id': 'b046074b1030a44d'}
68676487	2020-01-17T14:45:46.000Z	1218182629285122049	English, Gujarati, Hindi, and Spanish is what I’d like be fluent in. I can understand 0% of Gujarati due to my parents, 0% of Hindi due to films, and 0% of Spanish due to school work 	{'place_id': '001fe4010762701b'}
298060397	2020-01-17T14:31:52.000Z	1218179132019892224	The problem with dressing for the weather is being stuck in a train for too long so by the time you get off you are drenched and you have to go out again.	{'place_id': '01a9a39529b27f36'}
3354324357	2020-01-17T14:17:24.000Z	1218175490793656320	"""YOU HAVE FAILED THIS UNIVERSE!"" ""AND I...AM...IRON MAN!"" Two Godfathers of each Universe going out in style in 0!    "	{'place_id': '011add077f4d2da3'}
1074698728332804096	2020-01-17T14:10:58.000Z	1218173872731754496	Having to miss reggae night at Taboga because I have to go back to school. 	{'place_id': '01a9a39529b27f36'}
1405827127	2020-01-17T13:53:53.000Z	1218169572907503617	 Thank you. I got her to school today so that feels like success.	{'place_id': '011add077f4d2da3'}
42979354	2020-01-17T13:48:52.000Z	1218168309931290626	. notes that students come to school at varying degrees preparedness, and we must be ready to reach them where they are to give every child an equitable chance.	{'place_id': '01a9a39529b27f36'}
4847467427	2020-01-17T13:40:47.000Z	1218166278210379776	Still trying to decide if I should get fit for the end of the world or go out fat and happy.	{'place_id': '011add077f4d2da3'}
3723504255	2020-01-17T13:03:00.000Z	1218156768204902400	Wow, one year ago today, I moved to NYC. I had no idea if the whole publishing thing was going to work out, or if I’d ever get so much as a job interview in children’s editorial. Even now, so much of this still feels unreal.	{'place_id': '01a9a39529b27f36'}
333558922	2020-01-17T12:50:31.000Z	1218153628860665857	Only thing motivating me to leave my apartment and go to work this morning is knowing a disembodied Awkwafina will tell me to hold my breath under the East River as my 0 train approaches Grand Central	{'place_id': '011add077f4d2da3'}
815002989362610177	2020-01-17T12:47:13.000Z	1218152797314699264	I really don’t wanna go to school 😣	{'place_id': '002e24c6736f069d'}
370821467	2020-01-17T12:17:31.000Z	1218145323232657408	I give my man so much props for being able to get out of our warm cuddly bed to go to work on days like this 😞	{'place_id': '00c39537733fa112'}
228535936	2020-01-17T12:01:56.000Z	1218141401562611713	0:0!!!My goal for the orangetheory mile today was to go sub-0:0. I knew that with the treadmill lag, I’d have to go out at a pace that’s way faster than what I’m comfortable running — and would have to max out… 	{'place_id': '53c4c0f31bd9e72b', 'coordinates': {'type': 'Point', 'coordinates': [-73.97788617, 40.81856523]}}
251732194	2020-01-17T10:41:44.000Z	1218121218785783809	Yoo y’all Americans never had to deal with your dad sharpening all your pencils with a knife you’d go to school looking crazy 😂😂😂 	{'place_id': '01a9a39529b27f36'}
89919378	2020-01-17T10:24:22.000Z	1218116844923555840	0s day celebration at my school for the 0th day of school. Anything for an excuse to wear a costume to school!     … 	{'place_id': '01a9a39529b27f36', 'coordinates': {'type': 'Point', 'coordinates': [-73.93591, 40.83944]}}
1108229653314064384	2020-01-17T06:44:14.000Z	1218061450679332864	When I was about 0 my mom was teaching me script (before we did it in school) I was so proud and brought my book with me to school to show and the librarian saw and laughed so loud and said it was so bad and I shouldn’t “show off” when it’s so bad anyways and ripped the book up🥴 	{'place_id': '011add077f4d2da3'}
31608649	2020-01-17T06:42:15.000Z	1218060949116026880	Have times Changed. And Ppl Calling it 'LITT' (0% of The Ppl Facebooking, Snapchatting, Instagramming, Social Media-ing, Taking Selfies) So Really? WTF you Really go out for? SMFH..... Turning back the Clock? Not… 	{'place_id': '011add077f4d2da3', 'coordinates': {'type': 'Point', 'coordinates': [-73.95, 40.65]}}
1133775667974291461	2020-01-17T06:38:35.000Z	1218060028223029249	 Just feel like everybody go the same set a places, like tracks and records etc. But if it’s your birthday you’re planning for go out and have fun 🤷🏽‍♀️	{'place_id': '23a06e5cc6d83009'}
30206473	2020-01-17T06:16:26.000Z	1218054454571945984	 Damn and I was going out there tonight... But im still in the Bronx with my bro smoking weed...	{'place_id': '002e24c6736f069d'}
330492553	2020-01-17T05:40:26.000Z	1218045393352773632	Not me doing my usual Thurs routine...😕(me getting hyped up all day long to go out only to have my going-out crew give a tepid response to what I wanna do, me developing too much anxiety to go alone, and then me wallowing alone with depressive thoughts) 🥴😞	{'place_id': '01a9a39529b27f36'}
169121365	2020-01-17T05:02:30.000Z	1218035846093463552	I honestly want to go back to school but then all I see is dollar signs 😭 	{'place_id': '002e24c6736f069d'}
948549529615392769	2020-01-17T04:20:35.000Z	1218025299532709889	Good news! Patricia’s family has reached out to my office to tell us she is safe and sound. Thank you to the wonderful community who helped locate her! 	{'place_id': '00c39537733fa112'}
316724580	2020-01-17T04:16:59.000Z	1218024390677483521	You’re invited! February’s Coffee with Cohen will be @ the new, gorgeous  @ 0 Adams St on Febr0rd from 0:0 - 0 am. Before going to work, start the new month with a, ☕️, a 🥐 + a good chat with your neighbors + your councilman.RSVP here:   	{'place_id': 'e9143a85705b4d40'}
3365321375	2020-01-17T04:08:44.000Z	1218022313746214913	FELT Im just tryna dress up and go out or have a slumber party 😩😂 	{'place_id': 'eee6d4242f7819c2'}
1967186084	2020-01-17T03:59:27.000Z	1218019978231865344	anywayssss we be going out for my first legal drinks in the us	{'place_id': '01a9a39529b27f36'}
945086367012478977	2020-01-17T03:55:01.000Z	1218018864316985349	 That’s just another ploy to take our minds off his impeachment. Not going to work Dumbnald.	{'place_id': '011add077f4d2da3'}
869769607627677696	2020-01-17T03:35:42.000Z	1218014002963415040	 oh man...i just got home...don’t make me go out & get some 😭😭	{'place_id': '01a9a39529b27f36'}
739246752	2020-01-17T03:19:02.000Z	1218009809297035265	Over it. Get me back to school	{'place_id': 'a227c629b631eea2'}
882761985334669317	2020-01-17T03:08:47.000Z	1218007230135644161	So sad to see the Respect go out the window. You’re doing a really good job at  the 🤦🏽‍♀️🤦🏽‍♀️🤦🏽‍♀️ 	{'place_id': '002e24c6736f069d'}
166850904	2020-01-17T03:07:04.000Z	1218006795576397824	I’ll always go out on a limb that  ‘s TD was the most important..my personal opinion is that, by shrugging off/barreling through several Pats, it showed the Jets weren’t gonna be pushed around that evening. Great W 	{'place_id': '00c39537733fa112'}
40591067	2020-01-17T02:55:25.000Z	1218003866056380417	 I mean no offense to you! also I’m sure we’ll go out and lose our next several games now	{'place_id': '011add077f4d2da3'}
2764015499	2020-01-17T02:34:00.000Z	1217998473615814656	  I was on a C shift and now im on a D shift the best shift for me is C a 0-0 but D got its promises yea u get at 0 you can still go out afterwards if yr commute isnt terrible and u get to sleep till 0pm 0 oclock	{'place_id': '01a9a39529b27f36'}
501413002	2020-01-17T02:24:33.000Z	1217996097014108161	If you go out of your way to be rude to me I will go out of my way to be just as rude right back foh 😂	{'place_id': '876ed0bcf9594134'}
4180708955	2020-01-17T01:39:44.000Z	1217984818862051328	 How about my debt, since I didn’t go to college. Can we take care of me too?	{'place_id': 'c2800db81ba22abc'}
19257498	2020-01-17T00:48:55.000Z	1217972031293214721	I don’t find myself tweeting as much when I go out.  I try to avoid being on here like less distraction	{'place_id': '00c39537733fa112'}
50179868	2020-01-17T00:47:12.000Z	1217971599053348867	 And you gotta learn to leave your block. Go out in professional settings. Many don’t have children.	{'place_id': '01a9a39529b27f36'}
284660370	2020-01-17T00:43:23.000Z	1217970639199506432	Second day of class and my crush is already going out of his way to speak to me 	{'place_id': '01a9a39529b27f36'}
4861170652	2020-01-17T00:34:28.000Z	1217968392596021249	 Sir I was raised in Charlotte NC and went to school in Durham. I know very well what I’m talkin about 😭😭	{'place_id': 'fa3435044b52ecc7'}
2839051893	2020-01-17T00:29:16.000Z	1217967083318861825	Oh my other fav is my health teacher did not teach us about health at all, mainly just showed us horror movies while he played on his phone. One time he told a kid to go out and get drinks from Starbucks and he did and our teacher got a nice talking to when the principal saw	{'place_id': '01a9a39529b27f36'}
19540882	2020-01-17T00:11:44.000Z	1217962671661899776	✨My favorite spot in the City...can you guess it?✨.✨If I could do it over again...I’d go to college at NYU after having taken a year to travel the world, during which time I’d have gotten to know myself inside and… 	{'place_id': '01a9a39529b27f36', 'coordinates': {'type': 'Point', 'coordinates': [-73.985131, 40.758895]}}
24163068	2020-01-18T23:42:53.000Z	1218680188910931968	I had to go out, so I took an arty hotdog shop shot in the snow. 	{'place_id': '07d9ec6bdf884002'}
796052617256386560	2020-01-18T23:35:00.000Z	1218678205529411585	If you’re going out tonight, be safe. ❤️	{'place_id': '00c39537733fa112'}
948981756140687360	2020-01-18T23:32:10.000Z	1218677489360429056	go out and paint tonight girlies! 	{'place_id': '00c39537733fa112'}
352580700	2020-01-18T23:32:07.000Z	1218677480292265984	Im in the Broadway Times Square area...and I rarely go out. Now I have always been a homebody but I always get to know my neighborhood people...not here though this is not it	{'place_id': '01a9a39529b27f36'}
749329028	2020-01-18T23:10:00.000Z	1218671912236220418	Dreading going to work while my baby is under the weather 😤	{'place_id': 'b046074b1030a44d'}
2296639425	2020-01-18T23:00:33.000Z	1218669536431525888	i’m so ready to go back to school	{'place_id': '10d2f6857b8ac152'}
435461216	2020-01-18T22:48:47.000Z	1218666572665040896	  As much as I would absolutely LOVE to see her get her ass kicked (it’s well deserved) she would shoot the person and claim it as “self defense”. But in all her videos you can clearly see she is going out of her way to get people riled up she’s a clown	{'place_id': '00c55f041e27dc51'}
109466047	2020-01-18T22:47:03.000Z	1218666137598210051	Kinda wanna go out , kinda don’t wanna deal with the snow , decisions decisions	{'place_id': '00c39537733fa112'}
21035326	2020-01-18T22:27:47.000Z	1218661289469321218	 Now if only they’d all go out and vote out the orange pig clown!	{'place_id': '19d790a2eb34f4e9'}
96256106	2020-01-18T22:11:35.000Z	1218657213570584576	I wanted to go out and buy food but NAHHH. Hoy se come confle	{'place_id': '011add077f4d2da3'}
35365877	2020-01-18T22:09:07.000Z	1218656592574451713	Now that Prince Harry is a regular guy, he has to go out and get a last name.	{'place_id': '00c55f041e27dc51'}
947671792155529218	2020-01-18T22:04:18.000Z	1218655380877856768	Why is it so hard for a girl to make some friends 🤦🏽‍♀️. I just wanna go out and have fun 😒	{'place_id': '00c39537733fa112'}
32702256	2020-01-18T22:04:14.000Z	1218655363156803584	    unions 0 all this at will bullshit  suxi've been a rn/ educator for 0 yrs & this is the lowest salary i've EVER made .MY strategic plan is to care for students &  myself..i'm not going to work when DOH MANDATES i stay home...i have a pre existing condition - sick day,deal w it	{'place_id': '27485069891a7938'}
43793642	2020-01-18T21:55:54.000Z	1218653265858105344	Charter reinstating Bicker, of all things, is wild - I don’t know how this is going to work 	{'place_id': '01a9a39529b27f36'}
2544958784	2020-01-18T21:48:48.000Z	1218651480095383553	Selena going out sad rn 😭	{'place_id': 'b74cebcb62a1a686'}
217699619	2020-01-18T21:47:49.000Z	1218651231540981761	Forky is that one friend you always got to keep an eye out for when you go out.	{'place_id': '00c39537733fa112'}
2165165732	2020-01-18T21:34:33.000Z	1218647892107415552	When it is snowing:0) I am staying in, watching Netflix and enjoying hot chocolate/tea 0)Going out, making a snowman and pretending to be a kid again.What type of person are u?——————————————————————Когда на… 	{'coordinates': {'type': 'Point', 'coordinates': [-73.977063, 40.672404]}, 'place_id': '011add077f4d2da3'}
240341799	2020-01-18T21:30:46.000Z	1218646939685859328	 Fortified with  to go out in the cold for the  . 	{'place_id': 'f97108ab3c4a42ed'}
2839051893	2020-01-18T21:27:34.000Z	1218646134400409602	  I mean how many times do we hear of sports coaches, teachers, or priests being sex offenders? Should we also not let our kids go to school or church or play sports?	{'place_id': '01a9a39529b27f36'}
2789093145	2020-01-18T21:20:44.000Z	1218644414735769600	Lunch with  Worth going out  in the snow. Even if we have the same hats on.   @ 0th Street/Eighth Avenue 	{'coordinates': {'type': 'Point', 'coordinates': [-74.00224944, 40.74022195]}, 'place_id': '01a9a39529b27f36'}
26914306	2020-01-18T21:09:23.000Z	1218641557257097217	Going out later, gonna need a nap soon	{'place_id': '00c39537733fa112'}
48199996	2020-01-18T21:02:35.000Z	1218639845398138882	grocery shopping is my new going out	{'place_id': '876ed0bcf9594134'}
36167772	2020-01-18T20:58:45.000Z	1218638882130071552	Watching a classic before I go to work @ Woodside, New York 	{'coordinates': {'type': 'Point', 'coordinates': [-73.9056, 40.7454]}, 'place_id': '00c39537733fa112'}
987871422	2020-01-18T19:43:19.000Z	1218619901042208769	Those regionals invites are going out! Just a heads up -that’s an exposure camp and it’s a MUST you go prepared. I hope you guys have been working! If you haven’t... start now!!!! Get with your trainers so you can perform!!	{'place_id': 'b046074b1030a44d'}
924993861772103680	2020-01-18T19:14:37.000Z	1218612676177416199	Everytime babes does make me do de Most or go out meh way for something i does always tell she, i deserve good head for it yes😂😂 wat does have me more  weak is she does take it seriously inno 🏅🥺	{'place_id': '011add077f4d2da3'}
742749163281088512	2020-01-18T19:01:51.000Z	1218609465630625794	Going out sad 	{'place_id': '00c39537733fa112'}
1114893099107606528	2020-01-18T18:53:34.000Z	1218607377223749633	I’m showing you the truth with my very consistent actions, why go out your way to deny it.	{'place_id': '00c39537733fa112'}
1125174824	2020-01-18T18:49:39.000Z	1218606392606633984	I can’t go out with people who are watching what is being ordered. Like if I want the porterhouse and a bottle of wine, imma get that shit bro. Don’t watch my pockets	{'place_id': '01a9a39529b27f36'}
20734655	2020-01-18T18:44:03.000Z	1218604982859173888	Took a lazy morning, reading in bed. Regretting it now I'm up and if I want to eat, I have to go out in a blizzard. 	{'place_id': '01a9a39529b27f36'}
463065417	2020-01-18T18:41:42.000Z	1218604392338939904	If you don’t have to go out today don’t none of the streets are clean in NB please be careful driving.	{'place_id': '00ca6959663f6d44'}
3347848829	2020-01-18T18:32:36.000Z	1218602101460348929	My  baby is really moving to college tomorrow!😫😥 I’m soo happy and proud of her like no one understands💙😭  	{'place_id': '858cec499f8adba6'}
1152369642582753281	2020-01-18T18:26:34.000Z	1218600585991159808	Want something good to eat but not trying to go out in the snow 🥺	{'place_id': '00c39537733fa112'}
135025658	2020-01-18T18:14:44.000Z	1218597607959863296	Yeah not going out there! Recording day! @ Long Island City 	{'coordinates': {'type': 'Point', 'coordinates': [-73.92443994, 40.76236534]}, 'place_id': '00c39537733fa112'}
2842326411	2020-01-18T17:53:54.000Z	1218592365650292736	Kinda wanna go outside today. Kinda don’t wanna go out in the cold & snow	{'place_id': '44453d2ae8e47fd5'}
27688418	2020-01-18T17:46:39.000Z	1218590537680400389	When I was younger, ppl showed up to smoke with me on my birthday because it’s 0, not because it was the day I was born. They would say happy birthday but they already knew I had herb on me and wanted to be sparked up before going out, the birthday wishes was an after thought 	{'place_id': '01a9a39529b27f36'}
1491570457	2020-01-18T17:30:43.000Z	1218586531012784128	My mama asked why I don’t be posting on Facebook when I’m going out of town anymore lol	{'place_id': '01a9a39529b27f36'}
2655155901	2020-01-18T17:11:57.000Z	1218581806464806918	people make excuses to go out there and make money. but complain all day saying you need money. 🤔 make it make sense	{'place_id': '002e24c6736f069d'}
256630873	2020-01-18T17:03:01.000Z	1218579560175812613	Sometimes they ain’t interested and that’s ok. One of “The Four Agreements” that I adhere too is “Don’t take things personally!” Benjamin Hey! ain’t for everyone and everyone ain’t for Benjamin Hey! Going out in a… 	{'coordinates': {'type': 'Point', 'coordinates': [-73.98644, 40.75839]}, 'place_id': '01a9a39529b27f36'}
1110054237378146305	2020-01-18T16:40:11.000Z	1218573811324456963	The one night I go out and chef is here for brunch I make a mistake 😒	{'place_id': '01a9a39529b27f36'}
143293701	2020-01-18T16:18:38.000Z	1218568389364457474	Played myself by going out for drinks then watching Bad Boys at 0PM. I missed half the movie😭	{'place_id': '01a9a39529b27f36'}
2428281584	2020-01-18T16:17:53.000Z	1218568199773573121	damn it’s crazy when i go out and actually enjoy myself!!!	{'place_id': '011add077f4d2da3'}
184833391	2020-01-18T16:15:53.000Z	1218567698273226757	Growing up Black in America is watching everyone rep their flags and go out to parades...but you don’t even know where you’re from 🙃	{'place_id': '002e24c6736f069d'}
168346842	2020-01-18T16:13:05.000Z	1218566994049622016	this girl i went to school with graduated and is a bottle girl with her ass out on IG and it’s just not adding up for me. you could’ve done that w/o the degree	{'place_id': 'c8cc2f5f5fe306fa'}
359686169	2020-01-18T16:12:59.000Z	1218566968309166081	Don’t complain. Just work. The common complaints:0. The lights 0. The balls0. My partner0. I’m tired You can think of a thousand excuses for not playing well. Nobody cares. Just go out there and try your best. It’s always enough       	{'place_id': '00357d030e4945c1'}
1107661872	2020-01-18T15:59:50.000Z	1218563658604851200	Why would this nigga ever make the reservation for 0?! Does he know who he asked to go out?! Bitch I’m still sleeping 🥴	{'place_id': '011add077f4d2da3'}
1154835519962062848	2020-01-18T15:38:38.000Z	1218558323286511616	Success isn't something given, it's something earned. So go out there, work hard, and make your dreams come true!	{'place_id': '00c39537733fa112'}
56880369	2020-01-18T15:25:12.000Z	1218554941859663873	 Girl I’m suppose to go out ... idk somebody might be mad tonight 🤣	{'place_id': '01a9a39529b27f36'}
1599268272	2020-01-18T15:19:57.000Z	1218553621559889921	Gang +  (who you can’t tag in photos because he gets too much TMZ/paparazzi) 📸 We’re on a mission! Tell a friend to tell a friend who wants to get into watchin the  this is the szn! I can’t wait to create. We’re going to work. Fr!😎👔💼  	{'place_id': '07d9e388e6485000'}
455066669	2020-01-18T15:19:06.000Z	1218553408413732864	Random conversation about the weather in the lobby of kid’s music school. Man typing away on laptop overhears, interjects with much more specific forecast - then says he’s a meteorologist and is getting ready to go to work. Everyone’s star struck.    	{'place_id': '01a9a39529b27f36'}
1137121219336134662	2020-01-18T15:09:51.000Z	1218551077311787008	I’m suppose to go to my friends birthday dinner tonight but it says it’s going to snow... who tf is trynna go out and bust her ass with ice on the floor... WITH HEELS not me 😤🙇🏾‍♀️	{'place_id': '00c39537733fa112'}
1711966177	2020-01-18T15:09:34.000Z	1218551007329816577	Bro I’m not going to work today😩 I only went to sleep for 0 hours at 0am. Ayanna dead had me outside all fucking night. Wicked 🤣	{'place_id': '01a9a39529b27f36'}
998773915	2020-01-18T14:43:40.000Z	1218544489817657345	When the manager asked who wants to volunteer not to go to work today bec of the snowstorm coming, my lazy self was so quick to reply ha ha ha	{'place_id': '00c39537733fa112'}
341782677	2020-01-18T14:08:10.000Z	1218535554092015616	I haven’t had a night out since September (!!!) and ofc my kid gets and there’s suppose to be a snow storm but gd I will go out and have fun 😩	{'place_id': '00c55f041e27dc51'}
844735609331699712	2020-01-18T13:31:16.000Z	1218526271006740481	  I need one for my grandson who lost his dad (my son) for his school work he’s ready to apply to college & needs it to do his schoolwork 💕💕	{'place_id': '00c55f041e27dc51'}
