770565390464352256	2020-01-15T05:47:12.000Z	1217322319439433728	I don’t wanna go to work tomorrow but guess who’s going 🥱	{'place_id': '01a9a39529b27f36'}
1145783638690271237	2020-01-15T05:44:22.000Z	1217321605505986561	I work with so many people, that when everytime I go out, a random person comes up to me like “yoo lou what’s good how you been”. I dead have to start a convo long enough to try to recognize who the person is ... looking at them like ... 	{'place_id': '00c39537733fa112'}
1074698728332804096	2020-01-15T05:31:42.000Z	1217318421349785600	 Literally me these last couple weeks before going back to school. I'm so bored. I wanna do some dumb shit.	{'place_id': '01a9a39529b27f36'}
62350999	2020-01-15T05:18:42.000Z	1217315147049570304	 My dad went to school (undergrad and grad) on tge GI Bill when such a thing was possible, and my Mom is an RN.	{'place_id': '00c39537733fa112'}
62350999	2020-01-15T05:15:45.000Z	1217314406117363717	 I wish the emphasis were on having a CRAFT, not a service job, if you don't want to go to college. Of my 0 siblings, 0 of us got BAs, and 0 did not. (LPN and CDL).	{'place_id': '00c39537733fa112'}
799071775	2020-01-15T04:30:22.000Z	1217302986189426688	Ion wanna go to work tmrw😭😭😭	{'place_id': 'd4aed8f0a0dd6fb4'}
622173143	2020-01-15T04:22:01.000Z	1217300884004188160	Me trying to wake up in the morning to go to work after staying up late to watch  ❤️  	{'place_id': '01a9a39529b27f36'}
21636062	2020-01-15T04:19:25.000Z	1217300227423657984	This lack of representation within the election conversation is precisely why we must continue to show up and march not just for women, but for all Americans to have bodily autonomy and reproductive freedom. Prochoice candidates from sheriff to school board run -- and win --	{'place_id': '01a9a39529b27f36'}
451201023	2020-01-15T04:13:58.000Z	1217298858163785728	 If poor whites after Brown v Board sent their kids to private schools just so they wouldn't have to go to school with black children, I too doubt rich people would be compelled to send their kids to free colleges. 	{'place_id': '011add077f4d2da3'}
860841	2020-01-15T04:11:34.000Z	1217298252544069632	 How might that work & do you have any folks you’d WANT to go out on the road with??!!	{'place_id': '01a9a39529b27f36'}
3119059065	2020-01-15T04:10:59.000Z	1217298107102384130	 Check out where almost all the Walton kids and grandkids went to school. Not all billionaires’ kids are hedge fund heirs with weird East Coast warped perception about the quality of stars schools.	{'place_id': '01a9a39529b27f36'}
2776662572	2020-01-15T04:01:55.000Z	1217295824549568512	I gotta go back to school this year i hate it here 😢	{'place_id': 'b8d145028b2571ac'}
200686962	2020-01-15T03:42:55.000Z	1217291041520353281	Just saw the deleted scene for how Black Widow was supposed to go out in endgame and they ate her up 	{'place_id': '011add077f4d2da3'}
14154023	2020-01-15T03:36:18.000Z	1217289378340446209	“Des Moines is an insurance town,” she asked hoping to own Bernie on M0A.“It’s written in to provide 0 years of salary, insurance and job training for insurance employees like the ones here in Des Moines.”Damn, 0yr salary & you don’t have to go to work? Sounds dope 	{'place_id': '011add077f4d2da3'}
306591177	2020-01-15T03:31:43.000Z	1217288224831426560	Here is what everyone is failing to say: the children of millionaires should be going to school with kids of lesser means.  It is precisely that exposure that will grow empathy in the people that need it the most.  	{'place_id': '011add077f4d2da3'}
145518909	2020-01-15T03:26:02.000Z	1217286793478971393	Shorter Mayo Pete: everyone who goes to college should be a debt servant forever because some people are too stupid for college	{'place_id': '0e5a55ac01c2bcfb'}
146343252	2020-01-15T03:09:41.000Z	1217282679009370112	Prayers 🙏🏿 still go out to the recently-found 0-year-old Brooklyn Tech freshman  🙌🏿 I can only imagine what an ordeal this has been for her and her loved ones. 	{'place_id': '011add077f4d2da3'}
4898515822	2020-01-15T02:57:49.000Z	1217279691524055041	 Back to school baby 😩😩😩🥺🥺🥺	{'place_id': '00c39537733fa112'}
876127166265733123	2020-01-15T02:33:18.000Z	1217273523263148032	Payton should of ran across the court and hit some players with a chair. Stone cold stunner they asses. Go out with a bang.	{'place_id': 'b87b05856ab8dbd8'}
249820262	2020-01-15T02:13:32.000Z	1217268550710308866	ladies, text your man “you not low bro lmfaoo bye.” then go out with your friends & don’t answer him until the morning	{'place_id': '01a9a39529b27f36'}
2789994768	2020-01-15T02:06:16.000Z	1217266721263902726	I wish I had gone to college with THESE types of white folks. Also notice her fist pump at the end. lol you single? 😂😂 	{'place_id': '00c39537733fa112'}
1631573138	2020-01-15T02:02:46.000Z	1217265840996921346	You’re right. He deserves to go out healthy. I just knew him and Cam would win one together 	{'place_id': '011add077f4d2da3'}
1130187402	2020-01-15T01:59:26.000Z	1217264999434985473	Yo fuck anyone who thinks  can’t run for Congress!! Why the fuck not!?! Y’all ain’t doing shit for y’all neighborhoods but wanna talk about Cardi trying to make a difference!! Y’all bugging the fuck out!! If she goes back to school and sets her mind I’ll support!! BRONX	{'place_id': '002e24c6736f069d'}
714070482	2020-01-15T01:21:27.000Z	1217255443434745856	Please don’t tell me this is all over some clips! Lmaooooo id throw a whole half just so mans ain’t go out sad like that 	{'place_id': '10d2f6857b8ac152'}
2564118515	2020-01-15T00:59:45.000Z	1217249979103924224	The media needs to stop giving  attention and no one would care about what he does anymore. He’s done in the NFL. Sad to see one of the best go out like this.	{'place_id': 'fb3c12bc62543193'}
2208870817	2020-01-15T00:44:35.000Z	1217246162983575552	Was Lovin New York I Think It’s⌚️I Go Back An Hop In The Stu & Grab One Of Those Chop Cheese Burgers  🍔 Dem B****** Ah Hit 💯 Maybe Somewhere New 0st tho Cuz I’m Tryna See The World 🌍 B0 I Go Out Ya Kno 💬😎 @ Times… 	{'coordinates': {'type': 'Point', 'coordinates': [-73.98644, 40.75839]}, 'place_id': '01a9a39529b27f36'}
1588695480	2020-01-15T00:34:51.000Z	1217243714780909570	Frontline defense. Vitamin C,☑️wash your hands, ☑️flu shot☑️. And please, please stay home if you are sick, don’t send sick kids to school. 😷   	{'place_id': 'ea36c6003e42f3d0'}
146296035	2020-01-15T00:30:52.000Z	1217242710601498631	Not going out my way for anyone	{'coordinates': {'type': 'Point', 'coordinates': [-74.403055, 40.609133]}, 'place_id': 'c735e25ad03113d5'}
42413273	2020-01-15T00:20:50.000Z	1217240187488612352	“That’s why Inyanga will be the first to go to magician’s college. She knows everything.”“If she already knows everything,” said Kyuma, “why does she need to go to school? Does she know more than the magicians on the news?” a fantasy  	{'place_id': '01a9a39529b27f36'}
343863244	2020-01-16T23:50:43.000Z	1217957381876985856	 Perfect, eh? Sounds like a good time to quit, go out on top. How about it?	{'place_id': '01a9a39529b27f36'}
102558152	2020-01-16T23:45:52.000Z	1217956163653861377	When Ayesha Erotica said, “I’ll be in my Gucci panties just going out of my mind.” But wow. What a moment.	{'place_id': '01a9a39529b27f36'}
711846178	2020-01-16T23:42:30.000Z	1217955316270292993	 This statement is the craziest thing I’ve heard! Try going to school and graduating with 0k worth of student loans! If I was good enough I’d pay for free education any day and thise coaches... that’s their job... to coach! If they’re making too much blame the media	{'place_id': '011add077f4d2da3'}
23891217	2020-01-16T23:30:46.000Z	1217952364730179585	 You’d go out in a blaze of glory	{'place_id': '01a9a39529b27f36'}
64378935	2020-01-16T23:28:13.000Z	1217951721965658112	 I agree! As a visual artist, IMO it changes your perspective when you've gone to school to study a subject for as long as I, (0 years). So let's not tell someone who is a proven MASTER what to think, its pretentious and insulting not only to the artist but to the arts entirely🎈	{'place_id': '00c39537733fa112'}
2242761	2020-01-16T22:59:24.000Z	1217944468369936385	  I grew up there and commuted to college so I’m familiar. I don’t understand how it’s cheaper than JC.	{'place_id': 'b046074b1030a44d'}
2359897377	2020-01-16T22:58:43.000Z	1217944297875693568	Can’t ever go out that sad to impress the net	{'place_id': 'b74cebcb62a1a686'}
37169245	2020-01-16T22:53:51.000Z	1217943074841726978	Going out of business! (@ A.C. Moore Arts & Crafts -  in Paramus, NJ) 	{'coordinates': {'type': 'Point', 'coordinates': [-74.05607209, 40.91748797]}, 'place_id': '4b6a1f748c5219fa'}
37303994	2020-01-16T22:28:36.000Z	1217936716671131649	everyone going out sad 	{'place_id': 'b046074b1030a44d'}
537426139	2020-01-16T22:28:22.000Z	1217936659595038722	Welcome to my world 🌎 And why can’t he wear this to school?!? 	{'place_id': '0102611f55c5f14b'}
3884508195	2020-01-16T22:04:02.000Z	1217930536674648064	I kinda want to stay in all night play Pokémon and go to bed early, but also I kinda wanna go out and kiss a boy. WHAT TO DO	{'place_id': '011add077f4d2da3'}
1133775667974291461	2020-01-16T21:58:28.000Z	1217929135793807366	Me going back to school next week. 	{'place_id': '23a06e5cc6d83009'}
18730183	2020-01-16T21:45:37.000Z	1217925902396542977	Then I went off to college, didn’t take my instruments with me and fell into singing and arranging I’m for acapella but it was more social than anything else. My younger brother turned the music thing into an actual career, which is so cool. But I just didn’t have the drive.	{'place_id': '01a9a39529b27f36'}
50706690	2020-01-16T21:45:33.000Z	1217925886223187969	Construction on  from Staten Island Expressway to school Road 	{'coordinates': {'type': 'Point', 'coordinates': [-74.065704, 40.603502]}, 'place_id': '00c55f041e27dc51'}
47155717	2020-01-16T21:16:14.000Z	1217918507997896704	I LOVE watching hospital/medical shows the action of being right their saving lives is amazing. I wanted to be a nurse and even went to school to become a PCT, but unfortunately for medical problems and personally I couldn’t take studying that much I stopped.	{'place_id': '00ca6959663f6d44'}
213452821	2020-01-16T21:16:09.000Z	1217918486145576963	I have to pull it together, need to go to work tomorrow smh! @ Newark, New Jersey 	{'coordinates': {'type': 'Point', 'coordinates': [-74.1849, 40.7352]}, 'place_id': 'fa3435044b52ecc7'}
2537962288	2020-01-16T20:47:25.000Z	1217911255467425792	  Idk where them niggas went to college	{'place_id': '00c55f041e27dc51'}
2964370851	2020-01-16T20:41:57.000Z	1217909877705756672	First y’all made fun of people for going out every weekend and spending too much money. Now y’all mad people wanna stay in. Smh. Can’t win. 	{'place_id': '011add077f4d2da3'}
1168256129547329536	2020-01-16T20:41:12.000Z	1217909689146585092	 I’m going out there day of draft but gonna be with a bunch of giants and jets fan 😡. We will have to meet up. Can’t stand my fellow New Yorkers 😂😂	{'place_id': '364a45c10832ed51'}
821403264893808640	2020-01-16T20:13:17.000Z	1217902665469960192	Trying to go to work and she wants another kiss.     	{'place_id': '002e24c6736f069d'}
1180708964847235073	2020-01-16T20:08:09.000Z	1217901372542156802	Only the Mets could have a guy go out there and embarrass opposing hitters, and still go 0-0 as a starter in 0 starts. That June and Or July were horrible. Historically bad. Think we went 0 - 0 one of those months of 0 	{'place_id': '00c55f041e27dc51'}
254398092	2020-01-16T20:04:22.000Z	1217900421999669249	I definitely just didn't go to work this morning🤷🏻‍♂️🥴	{'place_id': 'fa3435044b52ecc7'}
2242761	2020-01-16T19:32:10.000Z	1217892316922417152	 Gonna go out on a limb and say either taxpayers or Norcross or some combo of the two. (No, not taxpayers - seems to be a privately funded event.)	{'place_id': 'b046074b1030a44d'}
926103485577400320	2020-01-16T19:31:30.000Z	1217892150853226496	Berkeley’s 0th graders are on a road trip to college! They must calculate their gas, meal cost, cost to visit an attraction, and hotel! Real life applications to working with decimals! Mrs. McGuirk you rock ❤️thank you for making math meaningful! 	{'place_id': 'dc4ad595a56393ac'}
68689217	2020-01-16T19:04:57.000Z	1217885467061997574	after 0 days of being a couch potato bc binge watching  it’s time to go out & explore the city ➡️🏙🍎	{'place_id': 'b87b05856ab8dbd8'}
173245830	2020-01-16T19:04:49.000Z	1217885436317773826	I’m going out on a limb and saying any balloon, not just metallic. As a matter of fact, I’m going to say if you see anything caught in a powerline do not attempt to climb the utility pole. 	{'place_id': '0427846a106c0bd9'}
1190678006236418048	2020-01-16T19:02:48.000Z	1217884926630137857	 ma’am my mom said I can’t go out this weekend 🥴	{'place_id': '00c39537733fa112'}
104845111	2020-01-16T18:58:28.000Z	1217883836412882944	"The countdown is on for Experience Trevor—our annual ""back-to-school"" night for parents and the alumni community. TBT to illuminating evenings past.     @ Trevor… "	{'coordinates': {'type': 'Point', 'coordinates': [-73.9468, 40.78307]}, 'place_id': '01a9a39529b27f36'}
28121376	2020-01-16T18:57:51.000Z	1217883680351432705	Happy Born day going out to the one and only Ladies Love Cool James aka LL COOL J.aka JamesTodd Smith.A huge inspiration to myself and many from my era especially the 0s cats As Radio the Album will go down as my… 	{'coordinates': {'type': 'Point', 'coordinates': [-73.82591778, 40.71184206]}, 'place_id': '00c39537733fa112'}
1182374534172893191	2020-01-16T18:24:38.000Z	1217875324207292416	 Like what is n¡ggas doing, going out sad	{'place_id': '6b0f2ded51928926'}
173441370	2020-01-16T18:10:04.000Z	1217871655487385601	If you wanted to go back to school, you would	{'place_id': '00c39537733fa112'}
4821906545	2020-01-16T17:14:16.000Z	1217857615604191233	Me and my roommate 0 yrs ago: PARTYING AFTER WORK! SLEEPING 0 HRS!Us last night: LETS GO OUT!!! Asleep on the couch by 0pm	{'place_id': '01a9a39529b27f36'}
948220829439053828	2020-01-16T17:12:27.000Z	1217857157212839943	"Seddio going out in peak Seddio style, telling ""If I were any more transparent, I would be arrested for lewdness I don't know what else to do. Should I take off my underwear and let them see the rest of my body?""  via "	{'place_id': '011add077f4d2da3'}
2752948558	2020-01-16T15:42:49.000Z	1217834600233340928	 Nah😭can’t do the daycare and go to school it’s stressful especially with the classes I take so imma secure my grades	{'place_id': '926fea31818e07d2'}
66496935	2020-01-16T15:42:16.000Z	1217834462588874753	Actually getting up early and putting in effort on how I look to go to work is new to me 😭	{'place_id': 'cdc37bae2a45fc33'}
702668460816470017	2020-01-16T15:33:46.000Z	1217832320260018182	Wow back to school next Tuesday😩	{'place_id': 'b046074b1030a44d'}
40000214	2020-01-16T15:11:27.000Z	1217826705924071425	 On the Q train yesterday , bringing my sons to school -  0:0 AM , the smell from 0 sleeping homeless people,  so strong and pungent ,  car had to be emptied- of passengers - hard working people	{'place_id': '01a9a39529b27f36'}
39675591	2020-01-16T15:08:56.000Z	1217826073557241856	Not that I care what people think, but I cant just go to work looking all messy. Anywhere I go even without make up I look clean and put together no matter what.	{'place_id': '002e24c6736f069d'}
65748132	2020-01-16T15:06:28.000Z	1217825450514354179	 Please go to work and turn off your phone.... Hahahah 	{'place_id': '01a9a39529b27f36'}
1645737272	2020-01-16T15:05:54.000Z	1217825307287343105	Going to work the day before vacation suckssssss	{'place_id': 'fa3435044b52ecc7'}
1049834208552718336	2020-01-16T14:56:39.000Z	1217822982455930880	this is a good reminder to some. you don’t need to stick to anyone’s “schedule” besides yours. There’s never a wrong time to go back to school. 	{'place_id': '01476f41278c3cd7'}
71951572	2020-01-16T14:53:53.000Z	1217822284964077569	 Lmaoooo he doesn’t go out	{'place_id': '01a9a39529b27f36'}
57980068	2020-01-16T14:43:32.000Z	1217819678548119552	This is wild goofy   - students shouldn’t have to pay for parking, colleges tax children for EVERYTHING with no empathy whatsoever. Houston is vast af, not everybody can opt not to drive to school. How do you charge for parking then not have enough permits?! 	{'place_id': '011add077f4d2da3'}
617707303	2020-01-16T14:03:06.000Z	1217809504643026944	I’m really debating if I wanna go to school today.... its only my second day...	{'place_id': 'b46619b2722d9703'}
1172979493629284353	2020-01-16T14:01:47.000Z	1217809175838953473	Sometimes I look better when I’m at home then when I go out, no cap!!	{'place_id': 'b87b05856ab8dbd8'}
1051313227	2020-01-16T14:01:16.000Z	1217809042304917504	 I have to say bye for now I have to go to work.	{'place_id': '011add077f4d2da3'}
866116111254867968	2020-01-16T13:44:04.000Z	1217804713774714880	Made plans to go out with a coworker tonight yesterday bc I was in the mood and now I regret it..	{'place_id': '01a9a39529b27f36'}
7590252	2020-01-16T12:52:42.000Z	1217791788703997952	Out since 0am educating Jax Heights on the bus changes urging them to study  explained how bus will bring them to 0th St & several people on line explained that’s where they came from! They are going to school or bringing kids to school along  routes. 	{'place_id': '07d9d89034481003'}
3025047349	2020-01-16T12:35:45.000Z	1217787522715201536	dont talk bout the bag i go out and i x0 thatwake up like where is that chicken at🏃🏿💨	{'place_id': '5c7686d4c90a9bb0'}
977084178817630208	2020-01-16T12:28:06.000Z	1217785595877085186	 See if I can go sleep and then  wake up and GO TO SCHOOL and your still awake....thats a problem	{'place_id': 'e4faa50d904ab815'}
201547021	2020-01-16T11:55:01.000Z	1217777271911698432	Yea yea going to work	{'place_id': '002e24c6736f069d'}
15279130	2020-01-16T11:14:18.000Z	1217767026523025409	   Jerry is an entire  He needs to come to my office and teach us moves! 🙏	{'place_id': 'bceb8153865c4a49'}
233590739	2020-01-16T08:28:16.000Z	1217725239704084481	“I didn’t want to get married, I wanted to go to school” Married too early, Habiba had to drop out of school at the age of 0. Today she is an advocate against child marriage in her community.She tells her story. 	{'place_id': '011add077f4d2da3'}
701617244770533376	2020-01-16T06:12:32.000Z	1217691082743480320	I stopped going out of my way for people who couldn’t even meet me halfway or appreciate it.	{'place_id': '00c39537733fa112'}
14682928	2020-01-16T05:54:04.000Z	1217686434288717824	  Unless you are there to socialize I wouldn't recommend spending that money for banquet. Instead you can go out for dinner with your colleagues or people you will meet at IPS	{'place_id': '00c39537733fa112'}
2417571	2020-01-16T05:34:04.000Z	1217681403086823425	 No wonder you baited me with going out tonight but didn’t actually leave the apt — you were hiding under a pile of Homeland!	{'place_id': '01a9a39529b27f36'}
1163411726	2020-01-16T05:23:19.000Z	1217678699425882112	Is it a coincidence that after me and my manager argue, when I go out for break, my manager falls asleep with the door locked???	{'place_id': '01a9a39529b27f36'}
391382120	2020-01-16T05:01:17.000Z	1217673153654206464	i have to go to work tomorrow 	{'place_id': '01a9a39529b27f36'}
273760270	2020-01-16T04:42:15.000Z	1217668364623065094	He going to work 😭 	{'place_id': '23a06e5cc6d83009'}
526915375	2020-01-16T04:23:36.000Z	1217663668428640261	me when my boyfriend don’t roll up before going to work 🥺 	{'place_id': 'fa3435044b52ecc7'}
395063088	2020-01-16T04:17:17.000Z	1217662080288989186	I hope I get abducted by the UFOs tonight so I don't have to go to work anymore.	{'place_id': '364a45c10832ed51'}
106908377	2020-01-16T04:04:39.000Z	1217658901639979010	Love going out alone I'm constantly meeting dope people at the bars when I go solo	{'place_id': '00c39537733fa112'}
1708638252	2020-01-16T03:36:00.000Z	1217651691891384320	Laughed uncontrollably. My brother  crushed  so go out and buy issue  as well as his newest issue of  !      	{'place_id': '0fc339287895b002'}
334833630	2020-01-16T03:34:57.000Z	1217651424168960001	I rather stay home & plan trips then going out clubbing I can do em that when I go to the next state/country	{'place_id': 'b046074b1030a44d'}
288478554	2020-01-16T03:33:22.000Z	1217651026557374465	I really just wanna go back to college just so I could be around all my friends on a daily again, now niggas wanna go to seven different school in live in different parts of NJ/Country, disgusting.	{'place_id': '858cec499f8adba6'}
1068912066541625344	2020-01-16T03:23:42.000Z	1217648594628567040	fuck you there’s nothing against heelys here. when i get my heelys i’m wearing them to school for dress down 	{'place_id': '00c39537733fa112'}
913220073518718976	2020-01-16T03:08:10.000Z	1217644683926691840	who wanna go out tho	{'place_id': 'a227c629b631eea2'}
2348905996	2020-01-16T02:13:55.000Z	1217631031341342720	You guys are very dense. I never said it will never be cold and snowy again.. I stated we are in a downward cycle as of late, obviously that cycle will eventually reverse. But also predicting a cold and snowy winter every year is not going to work, if you don’t see that, well...	{'place_id': '812a6cfdd31b4a5f'}
112019954	2020-01-16T01:50:17.000Z	1217625087395999745	 My broadcast keeps going out.	{'place_id': 'b87b05856ab8dbd8'}
2500079166	2020-01-16T01:40:23.000Z	1217622596394659840	LMAOOOOO you do know la gente que tan en olla go out more right? 	{'place_id': '002e24c6736f069d'}
133691877	2020-01-16T01:35:06.000Z	1217621264124133376	When I was Growing Up, It was 0 Wresters All Black Kids Wanted to Be: ROCKY JOHNSON, TONY ATLAS & JIMMY “SUPERFLY” SNUKA!!!These Cats were the Greatest! Our Thoughts & Prayers Go Out to “The Rock” & His Family for… 	{'coordinates': {'type': 'Point', 'coordinates': [-74.26951, 40.69634]}, 'place_id': 'e4faa50d904ab815'}
4861170652	2020-01-16T01:13:41.000Z	1217615876037451776	BUT I don’t have a man so I’m bout to get ready for bed so I can go to work and buy everything myself 	{'place_id': 'fa3435044b52ecc7'}
735975897715646464	2020-01-16T01:13:26.000Z	1217615811990474758	If i go to school it’s for psychology.... thas what i’ve always wanted to do	{'place_id': '00c39537733fa112'}
1142923796	2020-01-16T00:25:32.000Z	1217603757648875520	If this headache doesn't go away by the time I go to work.. it's going to be a horrible shift.	{'place_id': '11cdb607ab2f17bb'}
30134456	2020-01-16T00:05:35.000Z	1217598735305388032	me: -just started a job debating going back to school to study law, has a side art hobby and writes-reylos: -waste their time making stupid charts-	{'place_id': 'f97108ab3c4a42ed'}
949146217711263744	2020-01-17T23:42:19.000Z	1218317659634393088	If you want to conquer fear, don't sit home and think about it. Go out and get busy.	{'place_id': '002e24c6736f069d'}
865701344	2020-01-17T23:12:03.000Z	1218310042677600256	To go out alone or to stay in???	{'place_id': '011add077f4d2da3'}
132332631	2020-01-17T23:07:21.000Z	1218308856763252739	It’s officially way too cold to go outside and not be driven to a destination. I refuse to take the bus to manhattan or go out without being driven by car, period	{'place_id': '002e24c6736f069d'}
839526140796600321	2020-01-17T22:55:19.000Z	1218305827980881926	Deadstar was talking to me im really going out sad :(	{'place_id': '011add077f4d2da3'}
85736442	2020-01-17T22:31:32.000Z	1218299844311375873	Going to work after and throwing up in a box . .. stashing the box. .. and someone finding it a week later & reporting it 🥴🥴🥴 	{'place_id': '011add077f4d2da3'}
197611120	2020-01-17T22:10:23.000Z	1218294520019857409	Now I could understand some of us adults not spelling correctly its been a few since school.But these mfers that go to school everyday and cant spell thats a problem yall must be winning attendance award 	{'place_id': '011add077f4d2da3'}
1209974605135458309	2020-01-17T21:50:00.000Z	1218289391921258496	I’m really not vibing with the fact that I have to actually go to college but I am really excited to sob in my dorm room and take pictures	{'place_id': '011add077f4d2da3'}
366251349	2020-01-17T21:49:37.000Z	1218289295427035138	  It’s not slander it’s concern. She means to much to the community to go out like big momma did.	{'place_id': '00c55f041e27dc51'}
109266393	2020-01-17T21:48:54.000Z	1218289114514182144	❄️Snow is on the way for Saturday☃️Not the worst storm, but you still need to exercise caution if you are going out.⚠️☃️❄️🥶🧊☃️❄️🥶🧊        @ News 0 New… 	{'place_id': '94542c3c348faf28', 'coordinates': {'type': 'Point', 'coordinates': [-74.34254, 40.50482]}}
48135716	2020-01-17T21:48:53.000Z	1218289111867498497	Any junior running back who goes back to school for their senior year is a fool	{'place_id': '01a9a39529b27f36'}
894596619227811845	2020-01-17T21:40:42.000Z	1218287049800929282	I don’t wanna go to work	{'place_id': '00c55f041e27dc51'}
22516507	2020-01-17T21:11:38.000Z	1218279738973872134	I smoke kush bout 0 times a day. I check on my businesses, go to work, sell my clothes, cook for myself and clean. If anything kush puts the battery in my back.	{'place_id': '01a9a39529b27f36'}
1917083281	2020-01-17T20:58:18.000Z	1218276382536556545	i can’t go out without buying my baby something 🥺	{'place_id': '002e24c6736f069d'}
928021057583411200	2020-01-17T20:36:11.000Z	1218270814036021249	I kinda wanna go out today...but then again I kinda don’t . Irk Wth I wanna do	{'place_id': '002e24c6736f069d'}
