466930786	2020-01-14T18:41:40.000Z	1217154834723483649	Help at first but I stg I’m not going out sad behind nobody so get right or get left 😂 	{'place_id': 'b74cebcb62a1a686'}
3022864946	2020-01-14T18:39:32.000Z	1217154297781194752	Don't go to work baby, call outtt	{'place_id': 'fa3435044b52ecc7'}
11493452	2020-01-14T18:07:53.000Z	1217146332831473664	 Walkability is key.  If we can walk to a corner store, if kids can walk to school, if there’s a bus stop out front, and if we can bike to work, then any town can be sustainable.  Farmland is different.  It has to be spread out to work.	{'place_id': '01a9a39529b27f36'}
632504066	2020-01-14T18:06:45.000Z	1217146044519264256	Lmfaooo your man is going out SAD 	{'place_id': '00c39537733fa112'}
15435149	2020-01-14T17:51:25.000Z	1217142185897988098	Cayley goes to college in Fredonia. Please help. 	{'place_id': '00c55f041e27dc51'}
2646076074	2020-01-14T17:32:59.000Z	1217137547794620417	 I brought her out in november ... & either way it’s not like you go out w camila anyways!!!!!!!!!!! 😡	{'place_id': '00c39537733fa112'}
1400200172	2020-01-14T17:28:56.000Z	1217136529472139264	 Yeah , go back to school, learn how to speak English, then maybe run for congress. 	{'place_id': 'b046074b1030a44d'}
419107016	2020-01-14T17:22:48.000Z	1217134985141981185	Y’all need to leave cardi alone. At least she’s trying to get educated. You’re never too old to go back to school and learn. 	{'place_id': '44453d2ae8e47fd5'}
188598756	2020-01-14T17:10:10.000Z	1217131806698430465	 Nothing crazy imo, a lot of owners just swearing they’re about to go out of business 🤦🏿‍♂️	{'place_id': '011add077f4d2da3'}
421254526	2020-01-14T17:07:05.000Z	1217131031242907650	I stopped going out every weekend and spending money like crazy. It has been great so far doing new and better things.	{'place_id': 'b74cebcb62a1a686'}
29995316	2020-01-14T16:35:45.000Z	1217123143401254912	People @‘ing the NCAA on the videos of  giving cash to  players are ALL TYPES OF CORNY. Why would you go out of your way to jam up a college kid for something that doesn’t affect YOU at all???? Cmon ppl. Be better.	{'place_id': '011add077f4d2da3'}
273760270	2020-01-14T16:26:22.000Z	1217120782398251021	This why i dont go out no more 	{'place_id': '23a06e5cc6d83009'}
2236727119	2020-01-14T16:16:03.000Z	1217118187810181120	why did you go out of your way to incorrectly proof read/edit her tweet... you changed it from her present thoughts to her saying once she felt this way... could’ve been nice instead and not said anything in the first place...  STOP BULLYING CELEBS ITS 0 FR 	{'place_id': '01a9a39529b27f36'}
769282947648192513	2020-01-14T15:23:14.000Z	1217104895779704832	 Your hands on dad preparing Odin lunch for school and taking him to school.	{'place_id': '10d2f6857b8ac152'}
1059225973	2020-01-14T15:06:16.000Z	1217100625764286465	Whenever I plan to go to work early I end up getting there extra late...	{'place_id': 'de7b13455f6b23f3'}
324097879	2020-01-14T15:04:50.000Z	1217100265771425793	 While having male company over my weird sleeping habits go out the window but i need fan running, 0 comforters and a podcast playing to catch some zzzzs	{'place_id': '011add077f4d2da3'}
55671226	2020-01-14T14:57:44.000Z	1217098478154846209	0 % of public schools in Puerto Rico were built prior to the existing building code. Would you let your kid go to school in a building not deemed safe on a highly seismic isle? Imagine the worry. To add, gov officials admitted 0% of tsunami alarms don’t work. Rough  	{'place_id': '01a9a39529b27f36'}
110505844	2020-01-14T14:42:36.000Z	1217094671169675266	Excellent piece by  on hiring. Don’t be afraid of the (observered) negative correlation.“Fancy schools” btw is the correct example. I’ve seen people go out of the way to anti-emphasize this category. Probably for reasons described 	{'place_id': '01a9a39529b27f36'}
260831150	2020-01-14T14:12:19.000Z	1217087050379333632	 Lmao I would’ve been look this isn’t going to work out anyway, I’ll meet you at the strippy 😂😂	{'place_id': '7356b662670b2c31'}
2500079166	2020-01-14T13:48:50.000Z	1217081139728461826	It’s ridiculous how mental health days still aren’t a thing. Waking up not emotionally and mentally there but still forcing yourself to go to work to avoid calling out is trash.	{'place_id': '01a9a39529b27f36'}
52541526	2020-01-14T13:46:22.000Z	1217080517209788416	  I am working dude so to reiterate you dont know me watch your mouth and to highlight my tweet again I AM ECONOMICALLY DISADVANTAGED. You troll go out into the world & ask several people what happened to them & you'll get several different stories not everyone is the same dude.	{'place_id': '011add077f4d2da3'}
14085037	2020-01-14T13:42:18.000Z	1217079494495830017	Sailor doesn’t want me to go to work 	{'place_id': '011add077f4d2da3'}
956799439	2020-01-14T13:39:54.000Z	1217078891753484289	I can’t wait to go to work pick up my check and call off bc I’m sick all at once. Today gonna be a relaxing day.	{'place_id': '926fea31818e07d2'}
410416649	2020-01-14T13:36:52.000Z	1217078128465543171	How tf do I forget to put shoes on and go to school	{'place_id': '00c39537733fa112'}
1525090999	2020-01-14T13:08:43.000Z	1217071044210692101	I wanna go out for margs todayyyy :)	{'place_id': '002e24c6736f069d'}
1169240700287950848	2020-01-14T11:57:06.000Z	1217053019554164736	 Sure I will listen to it on the drive to drop the girls off to school.	{'place_id': '002e24c6736f069d'}
1074415836230836225	2020-01-14T11:55:31.000Z	1217052622957547520	  I’m very curious because it seems to me you are not very well and you have nothing to do with your life, can you please answer the following questions sir. Do you have parents?Do you work ?Do you go to school ?How old are you?	{'place_id': '01a9a39529b27f36'}
1380313832	2020-01-14T11:52:14.000Z	1217051795748466689	the only good thing about going to work this early is that the sky is a beautiful color of periwinkle to purple to pink	{'place_id': '00c39537733fa112'}
167432446	2020-01-14T09:38:22.000Z	1217018105890852869	Being ignored is a trigger for me, so I go out my way to never ignore others & always respond to those who want to engage with me. But some people deserve to be ignored, left on read, ALL THAT! Because they intentions aren’t pure & they weirdos. Gotta leave um where they at.	{'place_id': 'b8d145028b2571ac'}
2733821896	2020-01-14T09:10:53.000Z	1217011189974274049	I really can’t break night and go to work anymore. Those days are officially over.	{'place_id': '00c39537733fa112'}
67728942	2020-01-14T06:36:06.000Z	1216972237661560832	 Same man it’s tough going out like that	{'place_id': '011add077f4d2da3'}
830491811504386048	2020-01-14T06:33:26.000Z	1216971567823052800	Me convincing my friends why we should go out for drinks on a Monday night.. 	{'place_id': '011add077f4d2da3'}
31483028	2020-01-14T06:29:38.000Z	1216970609898545152	  I went to school with quite a few of said people who absolutely never lived paycheck to paycheck, trust me. 0%ers and all that, end of the day they’re people just like us, I didn’t appreciate their take because i was never treated any differently by most of them.	{'place_id': '00c39537733fa112'}
913203614	2020-01-14T06:16:02.000Z	1216967186633437184	Cardi B says she wants to go back to school and possibly run for Congress  	{'place_id': '002e24c6736f069d'}
452363901	2020-01-14T05:46:37.000Z	1216959786937470978	going to school the day after losing a tooth was a bigger flex than going back to school with mcdonald’s after a doctor appointment	{'place_id': '01a9a39529b27f36'}
41624197	2020-01-14T05:26:25.000Z	1216954703579357184	 0-years-old. My mother worked full-time and her shift started early. I remember her walking me to school a few times until I remembered how to get there by myself.If I somehow lost my key, which I did more than once, I was stuck outside until she got home.	{'place_id': '011add077f4d2da3'}
21158034	2020-01-14T05:14:11.000Z	1216951622909202432	Good for Coach O for going out classy. I can’t believe the season is over.	{'place_id': '01a9a39529b27f36'}
300654243	2020-01-14T05:03:46.000Z	1216949003428028417	Me going out with my tall friends 	{'place_id': '00c39537733fa112'}
789907076583661569	2020-01-14T04:44:14.000Z	1216944086785167360	Nobody : Me Everytime I go out : 	{'place_id': '23a06e5cc6d83009'}
20080415	2020-01-14T04:27:24.000Z	1216939849472790528	The entire day has been a malfunction for   Any chance the  will honor Metrocards or will I have to go out of pocket AGAIN just to get home before dawn? 	{'place_id': '01a9a39529b27f36'}
763145974818697216	2020-01-14T04:27:11.000Z	1216939794196058118	I want to go to work like this one day. 	{'place_id': '01a9a39529b27f36'}
36765506	2020-01-14T04:05:49.000Z	1216934416523694080	 to my office Xmas party 😏 @ Havana Central 	{'coordinates': {'type': 'Point', 'coordinates': [-73.8576431, 40.960659]}, 'place_id': 'b87b05856ab8dbd8'}
1039921056293838848	2020-01-14T03:59:26.000Z	1216932813641068546	                    0) Undergrad in Communications  0) Worked for multiple top advertising agencies in NYC for 0 yrs - media planning 0) Decided to go back to school for Master of Arts in Teaching 0) Student taught 0th/0th gr. math/sci- landed job in same district- been doing it ever since (0)	{'place_id': '08838190f5c16b16'}
774746429902483456	2020-01-14T03:30:13.000Z	1216925458530476032	     Hubbard is going back to school	{'place_id': '011add077f4d2da3'}
25584255	2020-01-14T03:28:03.000Z	1216924913170374656	 Going out to dinner at 0 pm and being back home by 0 on the couch to watch TV on a Friday or Saturday night is my and my husbands perfect weekend 😂  👌🏻	{'place_id': '00c39537733fa112'}
29579144	2020-01-14T03:11:20.000Z	1216920706325340160	 Yo! He’s going out sad every every play	{'place_id': '01a9a39529b27f36'}
22178734	2020-01-14T02:59:06.000Z	1216917627978895363	 After the 0th goal, my son  said to me “I can’t wait to wear my    shirt to school tomorrow.” Long Island Rangers fans rule.   	{'place_id': '01a9a39529b27f36'}
2500208292	2020-01-14T02:56:19.000Z	1216916928524058625	            I’m going out on a limb  will win  🏈 championship 	{'place_id': '00c39537733fa112'}
23795997	2020-01-14T02:36:47.000Z	1216912010908180483	  He played minor league baseball for a few years after high school.  Then went back to college.	{'place_id': 'ea82a33637cabb81'}
15119539	2020-01-14T02:27:38.000Z	1216909708801597440	No wonder their was so many people I thought everyone woke up wanting to go to work today🤣 	{'place_id': '011add077f4d2da3'}
43326745	2020-01-14T02:25:06.000Z	1216909074027163648	  I hated going to school growing up in nassau county, getting it from the skanky islander fans. But, 0-0 those four games in the playoffs a sweep no less and then the cup. Wore my jersey almost everyday the following year.	{'place_id': '1e11d8be00564690'}
28230319	2020-01-14T02:22:29.000Z	1216908412526759938	The next game is in Brooklyn,I hope Sam don’t go out to Long Island by mistake!,He just said Thursday game at Nassau Coliseum! 	{'place_id': '011add077f4d2da3'}
974447129468067841	2020-01-14T01:37:36.000Z	1216897116892737536	Based on the  reaction to  I’m going to go out on a limb and say Trump has a shot at winning the Southern white male college football fan vote in 0.         	{'place_id': '01a9a39529b27f36'}
50179868	2020-01-14T01:05:38.000Z	1216889072909783040	If going out once a week with me is exhausting, maybe you shouldn’t date me lol 	{'place_id': '01a9a39529b27f36'}
50179868	2020-01-14T01:03:39.000Z	1216888573254828032	I’m not going to stay with a person too long if we don’t go out.	{'place_id': '01a9a39529b27f36'}
1207101091776811009	2020-01-14T00:52:30.000Z	1216885767340994561	 honestly y’all really can suck wild yang. The nerve of y’all to try to boost prices for shittttyyyyy fuckin services. People can’t go to work to help pay for y’all dumbass metro cards cause a bitch always late!!!! Ima have no job fuckin wit y’all!!!!	{'place_id': '00c39537733fa112'}
734389771	2020-01-14T00:45:42.000Z	1216884057688170497	I don’t want to go to work tomorrow 😩	{'place_id': '002e24c6736f069d'}
1190678006236418048	2020-01-14T00:45:10.000Z	1216883922979762176	weed is the foreplay before foreplay for me cause I be READY to go to work when I’m smacked 	{'place_id': '00c39537733fa112'}
50179868	2020-01-14T00:39:03.000Z	1216882382709690376	I don’t think going out once a week is unrealistic. It doesn’t have to be super expensive all of the time.	{'place_id': '01a9a39529b27f36'}
216883683	2020-01-14T00:34:17.000Z	1216881183868538881	 They wanted him to go out like his pops	{'place_id': 'b046074b1030a44d'}
414829775	2020-01-14T00:10:53.000Z	1216875293715156992	 Cardi B says she wants to go back to school and possibly run for Congress  	{'place_id': 'b87b05856ab8dbd8'}
569859600	2020-01-14T00:00:55.000Z	1216872787899535361	 watching Paz was one thing but seeing her bum ass son beg for Titi’s check to come for 0 minutes was even worse. Dude begging to go back to John Jay. Get that discover card and chop them payments up u scrub. “Mami can I go back to school”. Nigga u 0.	{'place_id': '7cc0ce33cac366fc'}
41428526	2020-01-15T23:56:00.000Z	1217596325434404865	Their wouldn’t be a Rock without the man who gave him life to and soul RIP RockyJohnson you will be missed and always loved prayers go out the Johnson family 	{'place_id': '00c39537733fa112'}
1423647433	2020-01-15T23:48:28.000Z	1217594428782792704	  The importance of these figures is not just about college but points out that fewer people have the ability to choose to go to college because it isn’t affordable. Bernie is leveling the playing field for Everyone-college, no college...	{'place_id': 'f0923c834fdcf0ec'}
1207101091776811009	2020-01-15T23:42:50.000Z	1217593011737112576	Right before I go to work, now y’all know I put in work... Rai0 I go bezerk ... you a new boy call u jerk ... I ain’t even goin’ in call the job like I’m hurt ...	{'place_id': '01a9a39529b27f36'}
2760924850	2020-01-15T23:34:23.000Z	1217590887439642625	Of course i walk into my house and now wanna go out to get a drink/food🤦🏻‍♀️	{'place_id': '25d1ef4322ba8e3c'}
705366186	2020-01-15T23:31:11.000Z	1217590081655123970	Guess who walked into a pole today and got a knot ???? Not I 😂😂😂😂  knot hella big, he’s lucky he’s not going to school tomorrow 🤣	{'place_id': '01a9a39529b27f36'}
18791723	2020-01-15T23:31:00.000Z	1217590035526176770	 I don't know what to classify myself anymore. I like going out but I don't always like going out and I'm much more introverted than people actually realize. Give me a night in with board games and beer and I'm happy.	{'place_id': '5d09360434c9b510'}
62711456	2020-01-15T22:53:35.000Z	1217580616893566976	 Would you rather go out back?	{'place_id': '011add077f4d2da3'}
17582746	2020-01-15T22:51:58.000Z	1217580211220492289	Not where I grew up but a town near where I went to college was called “Staunton” and pronounced “Stan-tin” and I think it was genuinely a shibboleth during the Civil War. 	{'place_id': 'c5e2e95296cb121d'}
1218979543	2020-01-15T22:48:46.000Z	1217579405838561280	 = the perfect excuse to go out and grab one of our new 0 oz cans. @ New York, New York 	{'coordinates': {'type': 'Point', 'coordinates': [-74.0064, 40.7142]}, 'place_id': '01a9a39529b27f36'}
1317790825	2020-01-15T22:46:57.000Z	1217578949213028354	Can’t go out with my sister cause I gain 0lbs in one sitting	{'place_id': '01a9a39529b27f36'}
3010420170	2020-01-15T22:33:20.000Z	1217575520885407747	currently contemplating going to work 😩 shit so ghetto	{'place_id': 'b87b05856ab8dbd8'}
993658111377502208	2020-01-15T22:14:38.000Z	1217570816457691138	Had my dad worried asf driving all the way from Baltimore they told my parents I wasn’t allowed to come back to school until I get mental help instead of getting the help I needed my mom shipped me off to live with my grandmother in a whole different country	{'place_id': '01a9a39529b27f36'}
3042580897	2020-01-15T22:11:00.000Z	1217569902237749259	The state owes $0.0 billion in Foundation Aid to school districts across New York! Tell lawmakers to fund our future and public schools @ 	{'place_id': '011add077f4d2da3'}
2372646146	2020-01-15T21:42:11.000Z	1217562649900265473	i do not want to go to work later	{'place_id': '011add077f4d2da3'}
284660370	2020-01-15T21:10:19.000Z	1217554630487441409	My coworker: yea you should just go out and meet people.Me: oh sure I’ll just drop my fellowship, quit trial team and skip homework	{'place_id': '01a9a39529b27f36'}
965331738670063616	2020-01-15T21:06:28.000Z	1217553661259386880	Black People The Only People Who Go To Work & Tell Them What They Not Fin To Do I’m Black People	{'place_id': '01a9a39529b27f36'}
146870481	2020-01-15T20:53:51.000Z	1217550486997471232	& i'm going backto schoolonly for the heauxs &a class or two.                                                     february 	{'place_id': '011add077f4d2da3'}
579493693	2020-01-15T20:33:23.000Z	1217545336585101313	Going to work when you are still kinda sick is the worst experience ever. Especially if you have to be around 0 kids all day.	{'place_id': '00c39537733fa112'}
1171454865903620096	2020-01-15T20:24:24.000Z	1217543076497055744	LMAOOO TOO ACCURATE OMGlowkey hate going out for this exact reason 	{'place_id': '609b31e0a50b4474'}
274273357	2020-01-15T20:06:32.000Z	1217538577086799873	  I have one question... but its in 0 parts. Back to school	{'place_id': '96ddfc4bf2f1a80c'}
167458189	2020-01-15T19:49:17.000Z	1217534235155869696	... y'all go to work & spend your hard earned money on these disrespectful little things?  	{'place_id': '01a9a39529b27f36'}
1274915940	2020-01-15T19:47:50.000Z	1217533874386939904	I don’t think ima ever go back to school	{'place_id': '002e24c6736f069d'}
29866683	2020-01-15T19:16:13.000Z	1217525915997167616	" Not my original locale, but I live in Newark, NJ now and went to school in Newark, DE and the latter is quite particular about pronunciation. It's not ""new-erk"" like the NJ city, it's ""new-ARK,"" Delaware."	{'place_id': '54719aecdeecbbe8'}
1936187359	2020-01-15T18:28:27.000Z	1217513895411298304	   “Vote Trump - I don’t want to be like Mexico!” Because unless Trump is President we will be WHAT exactly?  All speaking Spanish? Going to work and raising families? Living, laughing, and loving like most people do in Mexico??	{'place_id': '1e87657b94063b58'}
48933427	2020-01-15T18:03:03.000Z	1217507500817293312	The  beating the  is like a man and wife going out on a dinner date everybody knows what’s supposed to happen and it’s over before you know it	{'place_id': '01a9a39529b27f36'}
50179868	2020-01-15T17:53:46.000Z	1217505164816457728	Ehh not true. Went to school with primarily white people and my close friends were still Black. Black people won’t shun you because you have white friends. Black people are too accepting tbh. 	{'place_id': '01a9a39529b27f36'}
26034013	2020-01-15T17:51:07.000Z	1217504500572938240	Last night was EPIC! anitascipio also known as MAMA, you are the light in everyone’s life and we are all so lucky to have you a part of our story. I am truly going to miss you but I know we will hangout and go out to… 	{'coordinates': {'type': 'Point', 'coordinates': [-73.99099, 40.75183]}, 'place_id': '01a9a39529b27f36'}
1186752470690729985	2020-01-15T17:37:50.000Z	1217501156798271494	  Facts can still go home and go out at 0 and party. Saturday mornings are no joke	{'place_id': '01a9a39529b27f36'}
173860882	2020-01-15T17:37:03.000Z	1217500960412635137	I’m not just bouta go out there and say those two, but I’m not mad at it at all. 	{'place_id': '94542c3c348faf28'}
31313422	2020-01-15T17:24:19.000Z	1217497757109252098	They done fucked up though at my position.. I’m learned things people go to school for lol... tech support bitch !	{'place_id': '01a9a39529b27f36'}
899298833372467200	2020-01-15T17:20:40.000Z	1217496834517688322	no cap i miss going out w/  literally use to go everywhere & do everything with her 😕....	{'place_id': '4b6a1f748c5219fa'}
30153017	2020-01-15T17:15:59.000Z	1217495656291557376	 Go to work	{'place_id': '01a9a39529b27f36'}
3872893173	2020-01-15T17:15:14.000Z	1217495470852972545	If you have trouble getting to school on time, please dm us the inconveniences you might have to help improve the late system.	{'place_id': 'e71d8f8f8c005b92'}
2789987144	2020-01-15T16:58:40.000Z	1217491301077331968	when do these people go to work they probably don't go to work that's what it is and even if they told me that I didn't tell me they job I probably couldn't get it because of the color of my skin okay nevermind I'm not going to do it I'm just going to continue to work so I can	{'place_id': '011add077f4d2da3'}
1129999069	2020-01-15T16:15:40.000Z	1217480476883128321	When i’m back in NY I barley take pictures and mind you I go out basically every weekend...	{'place_id': '01a9a39529b27f36'}
771390869308137472	2020-01-15T16:07:53.000Z	1217478519913140224	THEY KEEP WAKING ME UP 🙄THAT IS REALLY MY NUMBER ONE PET PEEVE DONT FREAKING WAKE ME UP 🙃 and it’s just to ask me some stupid crap 🤦🏽‍♀️ send me back to college NOW!	{'place_id': '01a9a39529b27f36'}
1146784452	2020-01-15T15:38:46.000Z	1217471194364108802	Good morning, on my walk to school this morning a man cut in front of me yelling that he had to pee then peed right in front of me. Just New York things 🤩🤩❤️❤️🥰🥰	{'place_id': '01a9a39529b27f36'}
57980068	2020-01-15T15:01:47.000Z	1217461883957121024	This and hearing the same song within a 0 minute span is why I don’t go out anymore 😩 	{'place_id': '01a9a39529b27f36'}
782934003934519297	2020-01-15T14:41:52.000Z	1217456873743568898	"There is a Catholic high school that is just right for every 0th grader. As acceptances go out, our team wishes that each finds the right school for him or her, and for those men for whom Farrell is the right place, we can't wait to call you ""brother.""  "	{'place_id': '00c55f041e27dc51'}
29568627	2020-01-15T14:34:39.000Z	1217455055454048256	She storms into his office upset with him about not telling her and not respecting her wishes for space. They hold this conversation as they leave the office but they encounter some reporters who are thrilled to learn that she goes to school there.	{'place_id': 'b74cebcb62a1a686'}
29568627	2020-01-15T14:34:38.000Z	1217455052765397000	Peyton is heading off to college and hasn't really been making time for her dad lately. She chooses to head down to Miami for school getting as far away from the Boston because she never liked the fame that followed her dad.	{'place_id': 'b74cebcb62a1a686'}
87233731	2020-01-15T13:59:40.000Z	1217446253879054343	  Doesn’t matter. QBs & Passers are held in super high regard. Especially when he’s considered to be a game changer for the next 0 yrs. Would you take a chance on losing out on pass rusher like him if let’s says going to work with Haskins?	{'place_id': '002e24c6736f069d'}
4861170652	2020-01-15T13:59:27.000Z	1217446199961231360	Idk. It’s not his fault he was poorly educated doesn’t seem like something to leave a good guy for. Is he willing to learn? Or maybe go to school? 	{'place_id': '926fea31818e07d2'}
807532821439021057	2020-01-15T13:16:14.000Z	1217435324760121346	I want more friends who like to go out for brunch.... frequently....😔	{'place_id': '00c39537733fa112'}
87836718	2020-01-15T13:12:29.000Z	1217434380278358017	My WCW is my milkshake let’s go down the list and see why. Cooks ,cleans,conversation,smart , beautiful, works a full-time job , goes to school, full-time mommy,loving and gives the best… 	{'coordinates': {'type': 'Point', 'coordinates': [-74.0064, 40.7142]}, 'place_id': '01a9a39529b27f36'}
1197681291849846784	2020-01-15T13:06:52.000Z	1217432966755995648	Morning guys off to school I go	{'place_id': '011add077f4d2da3'}
246460039	2020-01-15T12:41:49.000Z	1217426663379820545	I hate going to work early . Even if it’s 0 min earlier , I gotta wake up a whole hr earlier 🙄🙄🙄	{'place_id': '23a06e5cc6d83009'}
1068912066541625344	2020-01-15T12:37:49.000Z	1217425654972583937	i haven’t even got to school yet but i’m ready to go home already	{'place_id': '00c39537733fa112'}
169982014	2020-01-15T12:13:54.000Z	1217419634644746240	Happy National Bagel Day. Go out and enjoy a great NYC Bagel!                        	{'place_id': '11cdb607ab2f17bb'}
2789987144	2020-01-15T12:02:02.000Z	1217416650435309569	WE SHOULD ALL GO TO COLLEGE AND ONLY MAJOR IN AFRICAN AMERICAN STUDIESNO OTHER MAJORNO BUSINESSNO SCIENCENO ENGLISHNO MATHEMATICS 	{'place_id': '00c39537733fa112'}
541082759	2020-01-15T11:47:05.000Z	1217412885867122688	Yo my doctor really won’t clear me to go to work ! That really still makes me so upset I wanted to give my mom the best birthday gift or at least one she could’ve enjoyed and she would’ve been so relaxed the main reason I wanted to go back !!!!	{'place_id': 'fa3435044b52ecc7'}
238255696	2020-01-15T11:33:15.000Z	1217409405647454211	I slept so good last night damn I’m tight I gotta go to work	{'place_id': '00ca6959663f6d44'}
3652959255	2020-01-15T10:02:18.000Z	1217386517699735552	idek if I should go to college cuz shit be so expensive for no reason smh	{'place_id': '01a9a39529b27f36'}
19308590	2020-01-15T09:45:09.000Z	1217382201324720129	I love it when I look at my phone and notice I have yet another sign telling me things are going to be fine.Let’s go out there and be the miracle. 	{'place_id': '00c39537733fa112'}
876012928599822336	2020-01-15T05:53:35.000Z	1217323925857886209	can’t wait to drive my kids to school and put this banger on 😭😭😭 	{'place_id': '00c39537733fa112'}
