3185061	2021-03-09T22:58:18.000Z	1369422319639265286	     I used a vinyl cutter (Silhouette) to whip up some small decals. They seem to stick pretty well to the arcade buttons but not as well as I would have hoped to the z-layers of the 0D print. Good enough for now though!	{'place_id': '4a5f89128099126d'}
363403741	2021-03-09T20:24:07.000Z	1369383520867659781	I should go to the gym since I’m already late for work	{'place_id': '1d9a5370a355ab0c'}
155948647	2021-03-09T19:26:52.000Z	1369369112363868162	Romantic Candlelit Wedding   	{'place_id': '1d9a5370a355ab0c', 'coordinates': {'type': 'Point', 'coordinates': [-87.6678788, 41.8998653]}}
49520205	2021-03-09T18:40:03.000Z	1369357331423784968	My niece asked me to officiate her wedding!I cried like a baby, I’m so honored. 😅🤪😎	{'place_id': '6af99a29bfae42a2'}
3521273117	2021-03-09T17:46:23.000Z	1369343825991393289	Yesterday was our 0 month wedding anniversary like omg times flying.	{'place_id': '41bc24e82dfe5a2c'}
1047251870299779072	2021-03-09T17:11:34.000Z	1369335060177051655	Ppl look at my wedding ring now and treat me different	{'place_id': '1d9a5370a355ab0c'}
1037397531506958337	2021-03-09T17:01:14.000Z	1369332462162214912	 Exactly! Women are usually always sad in their wedding photos 🥺	{'place_id': '1d9a5370a355ab0c'}
3088173817	2021-03-09T15:21:17.000Z	1369307309831319555	Haven’t been eating out much lately but I think I need to go back out to get these street foods soon. (Mandu, kimbap, sundae) How’s your week going?  @ Chicago, Illinois 	{'place_id': '1d9a5370a355ab0c', 'coordinates': {'type': 'Point', 'coordinates': [-87.632496, 41.883222]}}
84000294	2021-03-09T12:53:41.000Z	1369270163011420163	 Looks like you're a bit late to the party sis 😅	{'place_id': '1d9a5370a355ab0c'}
49065233	2021-03-09T12:02:10.000Z	1369257200439472128	I really want/need to go to the gym this morning...	{'place_id': '1d9a5370a355ab0c'}
2579503212	2021-03-09T03:43:41.000Z	1369131752443281413	 Doing anything tonight?? Come by wicker for a drink	{'place_id': '1d9a5370a355ab0c'}
176901888	2021-03-09T02:59:36.000Z	1369120659578761220	 You gotta to the gym with a shirt that say “ I’m not finna let you fuck” for niggas to get the picture 😂😂😂	{'place_id': 'a831a12094517a15'}
755515945305698304	2021-03-09T02:26:59.000Z	1369112448326905859	I’m trying to go on a date to Grand Lux	{'place_id': '1d9a5370a355ab0c'}
89000691	2021-03-09T02:14:34.000Z	1369109326615429123	Back to the gym 0ma 😭	{'place_id': '1d9a5370a355ab0c'}
14551761	2021-03-09T00:52:12.000Z	1369088595903021057	I’m watching last night’s  and Yara & Jovi’s mom’s love affair made me tear up.She didn’t get weird, jealous or manipulative when she was told she could not come to the wedding, she was genuine & Yara couldn’t say no.That is a good mom who loves her son!	{'place_id': '1d9a5370a355ab0c'}
1245229463631286272	2021-03-11T23:35:35.000Z	1370156477793632268	I’m single single. Like we can pop outside and go on a date single 🤣🤷🏻‍♀️	{'place_id': '1d9a5370a355ab0c'}
1285214545888321536	2021-03-11T20:43:21.000Z	1370113133428281350	I need motivation to go to the gym	{'place_id': '1d9a5370a355ab0c'}
539699081	2021-03-11T20:40:47.000Z	1370112489321590788	 Shouldn't be eating out anyway. 	{'place_id': '1d9a5370a355ab0c'}
716634989668872193	2021-03-11T20:03:25.000Z	1370103086438572034	Watching  I realize I’ll never be able to afford a wedding if the average budget is $0K!	{'place_id': '1d9a5370a355ab0c'}
826495641983528960	2021-03-11T19:53:01.000Z	1370100466059784200	 Summers rolling around again and I’m not prepared LMFAO. Imma go to the gym soon.	{'place_id': '1d9a5370a355ab0c'}
832431142049632256	2021-03-11T18:55:37.000Z	1370086024228057088	Just want to go to a bar, get two car bombs and then dip	{'place_id': '1d9a5370a355ab0c'}
911321841352003585	2021-03-11T18:23:26.000Z	1370077924238491654	A Limo will help protect your bride's dress from wrinkling in addition to contributing to the party/luxury/celebration atmosphere. Call us today at (0) 0-0 to reserve yours.      	{'place_id': '1d9a5370a355ab0c'}
1101620228209950720	2021-03-11T14:48:23.000Z	1370023805922476032	Congratulations! To last weekends couple Meghan and Amy 0/0/0. Thank you for choosing Chapel in the Pines for your big day!Become a part of our tradition. Chapel in the pines is a destination wedding venue.    	{'place_id': '8b351eeb91372dc7'}
795186516	2021-03-11T14:40:05.000Z	1370021717578420237	MOVING MY SHIT AND GOING SHOPPING TODAY AHHHHHH	{'place_id': '1d9a5370a355ab0c'}
1708483225	2021-03-11T14:30:28.000Z	1370019296991191047	 Sadly I could go for a drink too 😆	{'place_id': '1d9a5370a355ab0c'}
2388492578	2021-03-11T14:15:37.000Z	1370015560721956872	Thinking about a year ago today, my last time going to the gym and also the last delicious hamburger I ate at a bar. Grateful that we are starting to see the light at the end of the tunnel. 	{'place_id': '1d9a5370a355ab0c'}
1708483225	2021-03-11T13:14:53.000Z	1370000274912333827	Don’t feel like going to the gym but guess what I’m going my days always be sooo goood after the gym.	{'place_id': '1d9a5370a355ab0c'}
360188566	2021-03-11T11:08:50.000Z	1369968553361833985	"When that 0am alarm goes off you think, ""I can get up and go to the gym, or lay here in this warm bed and sleep for two more hours."""	{'place_id': '1d9a5370a355ab0c'}
2162107512	2021-03-11T09:26:04.000Z	1369942689400172544	“i need to start going to the gym” i think as i finish my 0th beer of the night	{'place_id': '1d9a5370a355ab0c'}
90968323	2021-03-11T08:58:46.000Z	1369935819151118339	If Im on a date with a girl and she says I'm Republican, I'm calling the waiter over asking for the check. That wouldn't happen though because I'm Mexican, and Republicans are racist 😂	{'place_id': '1d9a5370a355ab0c'}
55890474	2021-03-11T05:03:35.000Z	1369876635801972736	 Honestly I’d try it. I love eating out of bowls and smoothie texture can be eh for me	{'place_id': '1d9a5370a355ab0c'}
26284253	2021-03-11T04:03:15.000Z	1369861453310611456	I'm discussing “Illinois Events Coalition Chat” with  Collin Pierson, and Illinois Wedding Pros. Friday, Mar 0 at 0:0 AM CST on  Join us! 	{'place_id': '1d9a5370a355ab0c'}
912039647651475459	2021-03-11T03:13:44.000Z	1369848990150311938	Looking for Bill Murray to share or  bomb our son's wedding.  The kids live currently on ridge so uh th of lake north of wilmette ave, please advise!	{'place_id': 'f2da3efc48696715'}
257351607	2021-03-11T01:04:09.000Z	1369816377465376771	Listen we still in a pandarosa, don’t tweak and come to the gym without your mask 😷 Lucas or Tanner! Also gyms in the city are trash.	{'place_id': '1d9a5370a355ab0c'}
385136484	2021-03-12T23:56:28.000Z	1370524120581074945	I don't even have any motivation to go to the gym today 😪	{'place_id': 'e363b61fbd793d7d'}
1074056326920122368	2021-03-12T23:06:33.000Z	1370511562008625159	wow work took us to the movies with the kiddos 🤌🏽	{'place_id': 'c567a00616152df6'}
790886306	2021-03-12T21:48:42.000Z	1370491967071739906	IMO if an engagement lasts too long there won’t be a wedding someone’s stalling and there’s a reason	{'place_id': '1d9a5370a355ab0c'}
316229695	2021-03-12T21:23:42.000Z	1370485678392365061	Jennifer Lopez and Alex Rodriguez Break Up, Wedding Off!!  via 	{'place_id': '1d9a5370a355ab0c'}
1101620228209950720	2021-03-12T20:03:32.000Z	1370465501802065927	Breathtaking view of our grounds from the sky, shot by a drone. You can see the path from our chapel, cottage, gazebo, and garden, where so many brides have made their bridal walks to see their betrothed. Become a part of our tradition.   	{'place_id': '8b351eeb91372dc7'}
1429009130	2021-03-12T19:01:23.000Z	1370449860210655250	I need to go shopping for my bday outfits 😭who wanna go	{'place_id': 'da64cd6b4a6e157c'}
862064640456568833	2021-03-12T18:59:00.000Z	1370449261360472069	V excited to start planning a wedding soon. It’s going to be a funky ass desert disco party and we’re driving away in a 0 Monte Carlo. Your party favor will be a disco ball full of assorted party drugs.	{'place_id': '003cc2276dfcaca4'}
377212620	2021-03-12T15:36:38.000Z	1370398335752925184	I want to go bowling now more than ever 	{'place_id': '1d9a5370a355ab0c'}
425570702	2021-03-12T14:56:19.000Z	1370388188854956036	Pierre's Banquets Available for Small events           @ Pierre's Banquets 	{'place_id': 'e363b61fbd793d7d', 'coordinates': {'type': 'Point', 'coordinates': [-87.80264942, 41.83246952]}}
142109718	2021-03-12T14:43:03.000Z	1370384849903747073	I been up 0 days straight and all I can think abt is going to a bar soon as I get off this plane.	{'place_id': '1d9a5370a355ab0c'}
32004023	2021-03-12T12:24:06.000Z	1370349884465942533	I need the GIF of  cheering “We’re going shopping!” in my life 🤗	{'place_id': '1d9a5370a355ab0c'}
148530723	2021-03-12T11:55:04.000Z	1370342577510227969	0/0/0: Don’t be that guy. Get a haircut. Maintain your haircut every month or so. Book online at  ...🙏🏼 	{'place_id': '1d9a5370a355ab0c'}
1058859940872421376	2021-03-12T07:24:34.000Z	1370274502446317568	  Adorable. Today 0yrs ago i was married to a perfect man. Than n NOW. When you know ya know. Guess we KNEW. Vegas wedding WORKS 	{'place_id': 'cdf74b55fc0d4600'}
425570702	2021-03-12T06:01:14.000Z	1370253530481721344	Pierre's Banquets Available for Small events           @ Pierre's Banquets 	{'place_id': 'e363b61fbd793d7d', 'coordinates': {'type': 'Point', 'coordinates': [-87.80264942, 41.83246952]}}
3054733038	2021-03-12T04:10:51.000Z	1370225752298418179	  Nah, if I remember correctly worldwide more people watched Harry & Meghan’s wedding. If there is envy it’s not coming from them.	{'place_id': '1d9a5370a355ab0c'}
335410704	2021-03-12T03:37:30.000Z	1370217358145519617	 and  I have been ready all year long to provide the  you need for your  or special  . I am ready for the challenge!        	{'place_id': '6db05c8d8e092528'}
826495641983528960	2021-03-12T03:26:30.000Z	1370214592878612482	She’s having an open bar at the wedding so IDC 🤣🤣 	{'place_id': '1d9a5370a355ab0c'}
4866870628	2021-03-12T03:14:15.000Z	1370211509477982210	chile they found his wedding pics and put em all on facebook, omg it was bad for him	{'place_id': '1d9a5370a355ab0c'}
147278202	2021-03-12T02:47:04.000Z	1370204667238551553	Just wanna go to a bar and watch a game or something.	{'place_id': '1d9a5370a355ab0c'}
597812330	2021-03-12T02:11:47.000Z	1370195786814914570	That time My DJ  And I  A   I'm Not Here To Play!! They Say Outside Is About to Open Up! Book Us to  your next Party/Event/Wedding @ Chicago, Illinois 	{'place_id': '1d9a5370a355ab0c', 'coordinates': {'type': 'Point', 'coordinates': [-87.632496, 41.883222]}}
618581306	2021-03-12T02:03:48.000Z	1370193778431119360	f it dude, let’s go bowling. 🎳 - Drinking a f by  @ Gates of Ale  — 	{'place_id': '1d9a5370a355ab0c', 'coordinates': {'type': 'Point', 'coordinates': [-87.6834, 41.9538]}}
822931294136963072	2021-03-12T00:48:02.000Z	1370174712647716867	I just saw Alexa bliss turn down a fan for a date. Ok wwe fans your not gonna date these people ever!! I know i will never get a date with none of the wwe female superstars i'm no idiot but whoever ask alexa bliss out on a date is an idiot.😮	{'place_id': '1d9a5370a355ab0c'}
265090480	2021-03-12T00:36:35.000Z	1370171829776703491	 It would require me spending money 🥲 I’m trying to not eat out.	{'place_id': '4f798ddf05f97f68'}
31180179	2021-03-13T22:11:10.000Z	1370860010167808000	  We got this as a party favor at a wedding we went to in kentucky and it was excellent!	{'place_id': '1d9a5370a355ab0c'}
1319201438	2021-03-13T22:04:42.000Z	1370858384732340227	 Hell no we loved our wedding. Wish we could’ve invited a few more people we only had like 0.	{'place_id': '1d9a5370a355ab0c'}
2608627873	2021-03-13T20:33:59.000Z	1370835553243963394	Part 0 of my cuz wedding ❤️❤️❤️       @ Edo State, Nigeria 	{'place_id': '1d9a5370a355ab0c', 'coordinates': {'type': 'Point', 'coordinates': [-87.61954092, 41.76944847]}}
2894227430	2021-03-13T19:52:20.000Z	1370825073456742400	Idgaf how close you are to a restaurant, if you’re ordering for delivery, you better tip or get your ass up and get it yourself!	{'place_id': '50f296a1bd4198b6'}
14114579	2021-03-13T19:40:18.000Z	1370822043810332679	 That's what I'm saying! Just have a backyard wedding if it's that serious!	{'place_id': '1d9a5370a355ab0c'}
217276360	2021-03-13T19:38:43.000Z	1370821643145244684	milk said one of you should ask me on a date today 	{'place_id': '1d9a5370a355ab0c'}
183279350	2021-03-13T19:30:32.000Z	1370819585767788556	 Being invited to the wedding of friends’ kids is different, for sure.	{'place_id': '1d9a5370a355ab0c'}
14114579	2021-03-13T19:24:49.000Z	1370818148778323970	"I feel like half of these  stories are ""they chose the wedding but due to COVID-0 they didn't really have it anyway"""	{'place_id': '1d9a5370a355ab0c'}
1611024666	2021-03-13T16:56:07.000Z	1370780725507715075	My kind of wedding 😏 	{'place_id': '000a381c49091836'}
616871457	2021-03-13T16:25:06.000Z	1370772921292050433	I like going to the gym at night but it’s the fact the mfs on my block have so many cars and parking is a bitch that stops me	{'place_id': '1d9a5370a355ab0c'}
425570702	2021-03-13T02:16:33.000Z	1370559373580369930	Pierre's Banquets Available for Small events           @ Pierre's Banquets 	{'place_id': 'e363b61fbd793d7d', 'coordinates': {'type': 'Point', 'coordinates': [-87.80264942, 41.83246952]}}
425570702	2021-03-13T01:14:47.000Z	1370543831096070148	Pierre's Banquets Available for Small events           @ Pierre's Banquets 	{'place_id': 'e363b61fbd793d7d', 'coordinates': {'type': 'Point', 'coordinates': [-87.80264942, 41.83246952]}}
3301158974	2021-03-13T01:00:30.000Z	1370540234715320321	  are you coming to our wedding	{'place_id': '1d9a5370a355ab0c'}
777075338	2021-03-13T00:39:40.000Z	1370534993810841604	I’m going on a date tonight and I have no idea what the fuck to wear	{'place_id': '1d9a5370a355ab0c'}
