2021-12-29T23:27:59.000Z	1476334210977779719	 It's too bad that people are turning this into a civil war. I wear a mask and I have 0 doses in me. I have many friends that do not feel the same. I love them anyway and I am not afraid of seeing them. All the best on your wedding day.	{'place_id': 'a3c3c2f3573eacf7'}
2021-12-29T23:15:34.000Z	1476331084979838988	 I know I’m late to the party but 	{'place_id': '1d9a5370a355ab0c'}
2021-12-29T20:05:03.000Z	1476283139181920264	I do love to go out dancing, but not on a date, that shit is embarrassing	{'place_id': '1d9a5370a355ab0c'}
2021-12-29T19:04:05.000Z	1476267799588790273	Realizing you forgot you headphones when you get to the gym truly is a crushing blow.	{'place_id': '1d9a5370a355ab0c'}
2021-12-29T17:32:48.000Z	1476244824001064961	We narrowed it down to the Arcade Bar, they did Vaccine checks, but we let our guards down, as we were going to hang with each other. We swapped a few games with other groups, and we think that’s where we messed up.(No masks + no sanitation between uses)	{'place_id': '1d9a5370a355ab0c'}
2021-12-29T17:13:00.000Z	1476239843017506820	This sublime, jewel-toned bouquet made for a gorgeous bride on her New Year’s Eve wedding by Natalie   holds the 🗝 to our ❤️! 	{'place_id': '07d9d4c092085001'}
2021-12-29T14:51:07.000Z	1476204137125748738	 Have you watched What if on Disney plus? There’s an interesting storyline developing there around the black panther that I could see be brought to the movies. Don’t want to give out spoilers, just recommend it.	{'place_id': '1d9a5370a355ab0c'}
2021-12-29T12:39:18.000Z	1476170964807393281	I want to go to the gym so bad right now.I'd hit some sets of squats, then slide thru a breakfast spot after on my way home.Gotta get this r&r, though, this week.Saturday morning will be here soon enough. 	{'place_id': '1d9a5370a355ab0c'}
2021-12-29T09:22:53.000Z	1476121535656169472	0 Movies to Know Me:(I would list Disney animated movies but that is considered another category)Drop Dead GorgeousNow & ThenThe Princess DiariesSpice WorldPoltergeist (0)MatildaCharlie's Angels (0)My GirlThe Wedding SingerJu-On: The Grudge	{'place_id': '1d9a5370a355ab0c'}
2021-12-29T04:33:58.000Z	1476048827627020290	I wouldn’t mind goin back to the gym	{'place_id': '1d9a5370a355ab0c'}
2021-12-29T03:51:51.000Z	1476038227379249155	The way Carter introduces everyone to his fiancé as “Paris Hilton”, and the way he talks about how much money she makes, makes me cringe. The only reason he’s probably rushing this wedding and forcing everyone to get stuff done ASAP is cause he’s probably using her! 	{'place_id': '1d9a5370a355ab0c'}
2021-12-29T01:35:16.000Z	1476003853250277378	Today was an honor for me to serve as officiant in the wedding of Mrs. Shalonda and Alicia Brown. Thank you for allowing me to be of service in this joyous occasion! @ Chicago, Illinois 	{'coordinates': {'type': 'Point', 'coordinates': [-87.632496, 41.883222]}, 'place_id': '1d9a5370a355ab0c'}
2021-12-29T00:44:43.000Z	1475991135399120898	 i was fine except my arm hurt a little for a couple daysi shot a wedding the next day and even used a ronin	{'place_id': 'ed888f00de07aa3a'}
2021-12-29T00:36:58.000Z	1475989181402914820	just have a party, get drunk as fuck in my honor. ION WANT NO DAMN FUNERAL.	{'place_id': '1d9a5370a355ab0c'}
2021-12-29T00:15:11.000Z	1475983699984453642	who in chicago wants to go on a date with me to see superbad at the logan since my so called best friend wont be here for it	{'place_id': '07d9cff9cdc81002'}
2021-12-30T21:26:54.000Z	1476666125287141378	sister's wedding in good time to get plenty of sleep before reserve today.	{'place_id': '1d9a5370a355ab0c'}
2021-12-30T19:39:03.000Z	1476638984478601222	Open bar wedding on NYE that’s a 0 min walk from my place? RSVP sent	{'place_id': '1d9a5370a355ab0c'}
2021-12-30T17:38:36.000Z	1476608672117710849	Ryan is off of work today, and he’s taking Karen on a date to Petsmart. He’s been talking about it for days, and I’m just so happy to be with someone who loves her as much as I do. 🥺	{'place_id': 'e2c96cf8c0a43c1d'}
2021-12-30T15:48:17.000Z	1476580909755342852	 i said “how do i get away with wearing sweats to the gig” and…here we are	{'place_id': '1d9a5370a355ab0c'}
2021-12-30T05:30:27.000Z	1476425428608995337	TWITTER USERS I NEED HELP. my name is nicole and i went to the museum of science and industry in chicago today. me and this guy who looked 0-0, tall (0ft smthn) with fluffy brown hair kept glancing at eachother. he was wearing jeans+a gray hoodie PLEASE HELP ME FIND HIMme: 	{'place_id': '1d9a5370a355ab0c'}
2021-12-30T04:16:10.000Z	1476406734117867520	  U go , and send that wedding Inv then I’ll go 🤣🤣	{'place_id': '1d9a5370a355ab0c'}
2021-12-30T02:24:28.000Z	1476378624450342915	Starting a new series of  that we capture in our wedding films! 	{'place_id': '1d9a5370a355ab0c'}
2021-12-31T22:30:37.000Z	1477044548085989380	I go to the movies one afternoon and chaos ensues! Betty gone, then an album announcement?!? Let’s run the gambit of emotions, why don’t we?!? GODDAMNIT 0. 😤😤😤	{'place_id': '57ac88aefcd20988'}
2021-12-31T20:15:16.000Z	1477010487728553995	my mom talking about going to church on New Years 🤣 girl imma be sucking dick😭😭😭	{'place_id': '1d9a5370a355ab0c'}
2021-12-31T19:58:33.000Z	1477006279742832642	betty white really had the nerve to die on my wedding day???	{'place_id': '55c1f288b7e98c40'}
2021-12-31T17:45:43.000Z	1476972854155649029	Ending the year with a beautiful wedding!      @ Jen's Guesthouse 	{'coordinates': {'type': 'Point', 'coordinates': [-87.8818937, 41.7266753]}, 'place_id': 'f54a2170ff4b15f7'}
2021-12-31T16:39:37.000Z	1476956217515851778	I, for one, love being forced to go work a rich people wedding right now.  If u need me I’ll be in my car crying	{'place_id': '1d9a5370a355ab0c'}
2021-12-31T16:36:21.000Z	1476955397147738116	Valentine’s Day orders starting in the next few weeks. Then wedding season. W Mothers Day in Between. 😭😭 I’m going to cry at work at least 0 times	{'place_id': '1d9a5370a355ab0c'}
2021-12-31T15:36:34.000Z	1476940350409383937	 Sis we’ve been talking about going shopping getting you together for about 0 years now lol	{'place_id': '1d9a5370a355ab0c'}
2021-12-31T13:16:48.000Z	1476905178272047108	I want to eat some pussy  	{'place_id': '07d9c9d3f3081001'}
2021-12-31T12:22:42.000Z	1476891561493413922	 About to head to the gym.  How are you?	{'place_id': '1d9a5370a355ab0c'}
2021-12-31T08:32:36.000Z	1476833655330951168	0:0 am on the wedding day and future husband is explaining the plot of subway surfers. off to a good start!	{'place_id': '55c1f288b7e98c40'}
2021-12-31T01:34:36.000Z	1476728463423942668	When’s the wedding happening because 😂 	{'place_id': '1d9a5370a355ab0c'}
2021-12-31T01:28:30.000Z	1476726926400184323	💍 Our Wedding Day: 0.0.0 💍     @ Mission Hills Club 	{'coordinates': {'type': 'Point', 'coordinates': [-87.87757176, 42.1225561]}, 'place_id': 'ecbe21c16e88f161'}
2021-12-31T01:08:11.000Z	1476721814810337286	 Have you seen some of the pictures of what people wear to go shopping at like Costco or Walmart?I think you'd be just fine.😉	{'place_id': '1d9a5370a355ab0c'}
2021-12-31T00:39:42.000Z	1476714647558529027	Walking by yourself in the dark to the gym, thanks suicidal privileges!!	{'place_id': '1d9a5370a355ab0c'}
2021-12-27T18:38:31.000Z	1475536589119971332	 is a breeding ground and gathering place for racists.	{'place_id': '1d9a5370a355ab0c'}
2021-12-27T03:58:08.000Z	1475315032875577346	A boxing day gathering. ❤🎄 	{'place_id': '1d9a5370a355ab0c'}
2021-12-28T03:43:01.000Z	1475673614380843010	Good gathering of the boys from  with   	{'place_id': '07d9e2daeb080001'}
2021-12-29T17:51:41.000Z	1476249577456029705	If you plan on gathering for NYE, follow the guidance from  ✅ Get vaxxed and boosted✅ Wear a well-fitting 😷✅ Avoid gatherings and travel if you are unvaccinated✅ Get tested✅ If you are sick, stay home✅ Visit  	{'place_id': '1d9a5370a355ab0c'}
2021-12-29T11:11:26.000Z	1476148851023224842	PRE CHRISTMAS GATHERING WITH FAMILY Thank you Marco for gracing the family by your visit from Washington, DC, and treating us with dim sum! Yum! @ Minghin Naperville 	{'coordinates': {'type': 'Point', 'coordinates': [-88.12074983, 41.80044437]}, 'place_id': '3227bcceb76b6a37'}
2021-12-30T19:09:40.000Z	1476631590038085644	For Christmas, we had a pretty large family gathering (family circumstances were reuniting us after not spending  Xmas together in 0 years). Everyone had to be extra cautious the week before, we required day-of negative covid test upon party entry and we all wore masks (0)	{'place_id': '1d9a5370a355ab0c'}
2021-12-31T18:02:18.000Z	1476977024828903431	there are ways to overline your lips without looking like you’re on your way to the gathering of the juggalos	{'place_id': '1d9a5370a355ab0c'}
2021-12-31T15:41:59.000Z	1476941714589995012	  Thank you to both of you for your awesomeness and gathering all these resources and making them available to all the  and  community.	{'place_id': 'cdf74b55fc0d4600'}
