1323003504122908672	2021-09-20T23:21:25.000Z	1440093772122107905	This week I get a haircut 💇🏻‍♂️ and a beard line up 😮‍💨😂 in NEED 😭     	{'place_id': '1d9a5370a355ab0c'}
23164247	2021-09-20T22:42:47.000Z	1440084048164974602	I just want to go shopping with 	{'place_id': '1d9a5370a355ab0c'}
335410704	2021-09-20T21:54:27.000Z	1440071887418105857	  when the bride and groom get lifted in the air by their guests!              	{'place_id': '6db05c8d8e092528'}
1385056042497757184	2021-09-20T20:58:31.000Z	1440057808301355010	Suppose to go on a date with someone tonight… but I’m sooo tired….. buuut it’s crab legs…. I’m town	{'place_id': '1d9a5370a355ab0c'}
1100784378618220546	2021-09-20T18:18:14.000Z	1440017471763791874	I love when I can go to the gym in the morning before my meetings start or in between meetings 🥰🥰	{'place_id': '1d9a5370a355ab0c'}
1179862205786755072	2021-09-20T18:13:44.000Z	1440016342581714952	What is a wedding? What is that happiness?	{'place_id': '1d9a5370a355ab0c'}
325980964	2021-09-20T15:59:26.000Z	1439982541679865861	Some people at airport bars have like never been to a bar at all. A woman keeps on asking for “double limes” and doesn’t understand that it sounds like she’s asking for a double on the vodka“AbsolutVodkaDoubleLimesSprite”	{'place_id': '1d9a5370a355ab0c'}
21030624	2021-09-20T14:43:01.000Z	1439963311198593025	 Wow! Yes! I was there all afternoon. Did you see the wedding?	{'place_id': '1d9a5370a355ab0c'}
2568384055	2021-09-20T12:21:57.000Z	1439927813377769475	Ok yall. Who needs to lose some weight and get healthy. Let’s get this going. First step, no alcohol and no sugar for just one week, clean out that fridge, and put in whole delicious foods. Also, no fast food or eating out for a week + 0 mins of activity daily. Let’s do this!	{'place_id': '1d9a5370a355ab0c'}
29094377	2021-09-20T04:08:44.000Z	1439803687455633415	 Hi and congratulations on the upcoming wedding. We do not have a slower version of the album record of what About Everything, but I believe that there are apps that can do that for you. But, we do have a couple of other recordings that you should check out…	{'place_id': 'f48e110211eee6ef'}
3004018084	2021-09-20T03:38:54.000Z	1439796183728279554	We had a lovely time ￼celebrating our ninth wedding anniversary last night. Scott is now fixing the sink which leaked while we were out celebrating. He’s an all-around stud muffin. 💕🌈🌶 	{'place_id': '3009292baa8dda23'}
23258054	2021-09-20T03:09:14.000Z	1439788714927001600	 Especially when it’s a Mexican wedding. Those weddings never end. 0 days long!	{'place_id': '8b351eeb91372dc7'}
3332089785	2021-09-20T02:02:45.000Z	1439771986314645504	I want Calvin in my wedding as a Bros-maid 😭😭	{'place_id': '2eb3293957fd451a'}
335410704	2021-09-20T01:22:05.000Z	1439761750166056967	 scenes from an awesome  this weekend in  Congratulations to Tim & Brittany  ! Your  were amazing!           	{'place_id': '6db05c8d8e092528'}
635843404	2021-09-20T01:15:26.000Z	1439760077154660352	 I need your help asap for a waiting by the phone! My friend got stood up on a date!! Need to figure this out!	{'place_id': 'c5657257dc77abae'}
862747676630282240	2021-09-21T23:18:49.000Z	1440455506175225865	What you know about the truth? Junior year of highschool CPS gave out free tickets to the concert. Got 0 for me & had to talk a girl into giving me her ticket for my big cousin. Ended up sneaking into the “adult show” since the free concert for the “kids” ended at 0/0 	{'place_id': '1d9a5370a355ab0c'}
1311124887038234624	2021-09-21T22:32:44.000Z	1440443906110332929	 Honestly take me on a date to a buffet	{'place_id': '1d9a5370a355ab0c'}
1363342153246789632	2021-09-21T19:47:11.000Z	1440402247121195010	Wish I had friends to go shopping with and then getting martinis at gibsons with	{'place_id': '1d9a5370a355ab0c'}
242784309	2021-09-21T19:37:54.000Z	1440399910189219842	 You not going to the wedding? Lol	{'place_id': '1d9a5370a355ab0c'}
626392170	2021-09-21T19:30:09.000Z	1440397957564563458	Went on a date and now my anxiety is off the charts	{'place_id': '1d9a5370a355ab0c'}
335410704	2021-09-21T18:41:22.000Z	1440385684414472201	 the ultimate    Do you remember?    	{'place_id': '1d9a5370a355ab0c'}
327736079	2021-09-21T17:49:39.000Z	1440372668260225039	Told myself I’d drag my ass to the gym today. We shall see.	{'place_id': '1d9a5370a355ab0c'}
2182391980	2021-09-21T17:48:22.000Z	1440372345160421388	 and  team      and  show the 0 cities what you girls are made of and let’s have a party 🎉 in the USA 🇺🇸 	{'place_id': '454e631ab87f60a6'}
1302303643983638531	2021-09-21T17:47:42.000Z	1440372176985624576	For people just getting to the party:PLEASE! Leave your email at  Purpose of this project is to write a book on CFB and America 🇺🇸Free weekly newsletters w/vlogs & updates on the journey!Join the MOVEABLE TAILGATE across the country!	{'place_id': '1d9a5370a355ab0c'}
215762369	2021-09-21T16:21:25.000Z	1440350461391900675	Went to a cafe i haven't been too in ages since I'm in the city for an errandLatte art before I ruined it by stirring in sugar... 	{'place_id': '0fc399742b55b006'}
1227285698023231489	2021-09-21T16:00:45.000Z	1440345260916232201	Yeah dawg. Now we got to the theater kid portion of this. Love this guy already.	{'place_id': '1d9a5370a355ab0c'}
751275228	2021-09-21T15:58:24.000Z	1440344669632618508	I accidentally set up my website that it sent all my wedding requests to my old email and now I have a ton of people asking me about shooting their wedding and I haven’t responded to them in weeks because I’m dumb AF!!!!!!!	{'place_id': '1d9a5370a355ab0c'}
25308093	2021-09-21T14:48:30.000Z	1440327078151266315	 Remember that couple that sent out the invoice for people that didn’t come to their wedding? The groom just told the wife about his 0yr old child. Never brought the kid up until now and told her to just “deal with it”	{'place_id': '1d9a5370a355ab0c'}
589384668	2021-09-21T10:51:05.000Z	1440267332085903365	The torture of getting to the gym early and smelling the diner across the street! Damn you homefries and bacon !	{'place_id': '1d9a5370a355ab0c'}
831017674486472705	2021-09-21T06:14:11.000Z	1440197646182875138	 if i’m not like this at the next party don’t ever inv to a party again 	{'place_id': '5e4243758a966b81'}
242784309	2021-09-21T01:50:44.000Z	1440131346534486016	Why niggas doing choreographed dances at they wedding?!	{'place_id': '1d9a5370a355ab0c'}
1087817034929500172	2021-09-21T01:32:40.000Z	1440126801041186818	The hardest part is getting to the gym, but once I’m there I have no problem getting started	{'place_id': '1d9a5370a355ab0c'}
241812268	2021-09-21T00:47:22.000Z	1440115403817111554	I went to the movies 0 times this summer 🎥 	{'place_id': '1d9a5370a355ab0c'}
146613692	2021-09-22T22:46:03.000Z	1440809647510753282	Your real friends will never go to Streeter’s without you!Stop by and visit us for a drink, with ALL of your friends!            	{'place_id': '1d9a5370a355ab0c'}
379277465	2021-09-22T22:45:31.000Z	1440809512466665477	  Yes exactly. Remember, I was 0 years old walking the Stardust circa ‘0 with Dad just waiting for more quarters to go to the arcade and over to Circus Circus when he told me this. More of a “you don’t beat Vegas, you try to win with their money” lesson to remember.	{'place_id': '1d9a5370a355ab0c'}
4627224286	2021-09-22T22:23:51.000Z	1440804058495799299	I feel like I have to say this too frequently, but I promise you don’t need to wear Santal 0 to the gym	{'place_id': '1d9a5370a355ab0c'}
174913128	2021-09-22T22:22:47.000Z	1440803793503801350	Ugh, need motivation to go to the gym. Pretty sore from yesterday.	{'place_id': '1cf51d4fa867b58a'}
1079017901250826240	2021-09-22T21:56:35.000Z	1440797196673114117	love seeing wedding rings🥰    subscribe to see the full straight guys content😈             	{'place_id': '1d9a5370a355ab0c'}
898304871786586117	2021-09-22T21:23:04.000Z	1440788764486299648	who wants an Aweminus + DubHub meetup at  ???	{'place_id': '1d9a5370a355ab0c'}
106605104	2021-09-22T20:33:31.000Z	1440776292073295874	A Timeless & Intimate Wedding at The University Club with Clover Events & Christy Tyler Photography  	{'place_id': '1d9a5370a355ab0c', 'coordinates': {'type': 'Point', 'coordinates': [-87.624962, 41.8809638]}}
722862884703735808	2021-09-22T19:59:13.000Z	1440767664293433360	 Eat out. I don’t like to cook, but I have to.	{'place_id': '2180fafeb49b5684'}
1429009130	2021-09-22T19:31:27.000Z	1440760672934002694	I need to go shopping for my samf outfits 😩	{'place_id': 'f2c4d620e98066e2'}
3102689412	2021-09-22T18:51:22.000Z	1440750587113455619	Me and Drew attended a wedding- then got sick pretty quickly after so on Monday we went and got tested for covid (luckily it came back negative for covid). It was such an easy process but we both were overcome with stress about work. That needs to be addressed better	{'place_id': '1d9a5370a355ab0c'}
425347261	2021-09-22T17:24:42.000Z	1440728778624286724	  Happy anniversary!! It’s also my parents 0nd wedding anniversary, lucky day for ❤️	{'place_id': '222efb7ee8b98c58'}
269110631	2021-09-22T16:20:41.000Z	1440712668319416333	For the love of flowers!What kind of flowers are you having at your wedding?   @ Stan Mansion 	{'place_id': '1d9a5370a355ab0c', 'coordinates': {'type': 'Point', 'coordinates': [-87.7080378, 41.9250382]}}
1295809932365897733	2021-09-22T15:19:15.000Z	1440697207594704901	Our customizable ivy wall makes for a perfect wedding reception (Instagram) backdrop!  ..              	{'place_id': '1d9a5370a355ab0c'}
443833828	2021-09-22T14:17:56.000Z	1440681774552551427	I wana go to a wedding …preferably my own lmao 🤣	{'place_id': '1d9a5370a355ab0c'}
243473173	2021-09-22T13:33:23.000Z	1440670562905300996	It's mine and  's 0 year wedding anniversary today falls on the equinox and Autumn is our favorite time of year! ❤️      	{'place_id': '6af99a29bfae42a2'}
16744595	2021-09-22T11:59:46.000Z	1440647003273240583	Coming to the Museum of Broadcast Communations in Chicago very soon! 	{'place_id': 'c8b021ffd0c94ffc'}
23345811	2021-09-22T04:05:00.000Z	1440527527793938449	On a date kinda nervous 	{'place_id': '07d9e4792bc87002'}
276223271	2021-09-22T02:55:22.000Z	1440510001387225093	I went to a bar solo after class today and had suchhh a dope convo the whole time about music with two random people 😊 gotta love those kinda vibes	{'place_id': '1d9a5370a355ab0c'}
278720014	2021-09-22T02:30:53.000Z	1440503839703003136	    Unfortunately not..  told me if Dalton ends up starting he wants to skip the wedding we have and drive out to Cleveland.	{'place_id': '1d9a5370a355ab0c'}
225719042	2021-09-22T00:25:00.000Z	1440472162003873792	Went on a date a week after I got my eyebrows done and they were still pealing. My date told me he wanted to pull it off  that shit was so funny 😂💀	{'place_id': '003cc2276dfcaca4'}
36193803	2021-09-23T23:55:15.000Z	1441189449505910784	 They got one from my brother 0 days before our wedding!!	{'place_id': '1d9a5370a355ab0c'}
3301158974	2021-09-23T23:19:23.000Z	1441180423036411907	already have tickets to a concert the night of the caroline polachek show 	{'place_id': '1d9a5370a355ab0c'}
30869634	2021-09-23T21:20:16.000Z	1441150448912699392	 Hi love, congratulations on your wedding! Im currently planning mine and wanted to see if you can help me with some questions.	{'place_id': '50f296a1bd4198b6'}
280249391	2021-09-23T20:47:44.000Z	1441142258422599685	 Is this about the guy you went on a date with 👀	{'place_id': '1d9a5370a355ab0c'}
65510600	2021-09-23T20:02:08.000Z	1441130783272366085	Going to the gym literally purges all of my negativity, incredible.	{'place_id': '1d9a5370a355ab0c'}
265090480	2021-09-23T18:21:42.000Z	1441105509549887489	 I need to sprint to the gym tonight because JESUS CHRIST I inhaleddddd that 0 piece	{'place_id': '5cba3a162965b0e2'}
521825608	2021-09-23T17:55:02.000Z	1441098798072098827	   and photos where from  ! This was a beautiful wedding and was glad to be a part of it! Cheers to the new couple! May you live long n prosper! And have many good years together! 	{'place_id': '918c943e88cc3e5d'}
614014780	2021-09-23T17:30:46.000Z	1441092690993565714	Big Shout at a bar/wedding guy. Gets the people goin. Fully approve 	{'place_id': '1d9a5370a355ab0c'}
256833348	2021-09-23T17:26:41.000Z	1441091665221992448	Bride-to-be spent planned wedding day on ventilator before dying of COVID-0  😢	{'place_id': '1d9a5370a355ab0c'}
1006747044294418432	2021-09-23T16:53:35.000Z	1441083333115514881	Not everybody STILL want me to have a party!	{'place_id': '1d9a5370a355ab0c'}
1095478393313914880	2021-09-23T15:20:18.000Z	1441059856358727687	went to a party and ate an entire pear from this insane charcuterie board @ Ada Street 	{'place_id': '1d9a5370a355ab0c', 'coordinates': {'type': 'Point', 'coordinates': [-87.6624152, 41.91244449]}}
392481784	2021-09-23T13:53:07.000Z	1441037916466253827	 Never been to a concert yet. Soon	{'place_id': '1d9a5370a355ab0c'}
88227424	2021-09-23T03:37:04.000Z	1440882884928315392	 I have the same dilemma. I was invited to a wedding reception inside a restaurant in Chicago in November. Everyone is supposed to be vaccinated and to wear a mask. I stopped trusting people to do the right thing. I am not going and the mother of the bride understands.	{'place_id': '1d9a5370a355ab0c'}
1176565629635256320	2021-09-23T03:34:40.000Z	1440882280998838272	LMFAOOOOOOOOOOOOOOOOO  who wedding u was at 	{'place_id': '1d9a5370a355ab0c'}
898304871786586117	2021-09-23T01:40:31.000Z	1440853554525208583	 x  x DubHub Lost Lands meetup!! Saturday 0:0PM at the Asteroid - BYOB (beans) 	{'place_id': '1d9a5370a355ab0c'}
65510600	2021-09-23T01:17:37.000Z	1440847792138711044	Fit check before I take myself out on a date cuz I look cute as fuck 	{'place_id': '1d9a5370a355ab0c'}
232473289	2021-09-23T01:11:49.000Z	1440846329060626435	Stop going to church for horny ass reasons lol 	{'place_id': '90c2fa83ca7cbd80'}
335410704	2021-09-23T01:10:39.000Z	1440846035748900868	I'm most likely the easiest and most relaxing vendor you will work with!       	{'place_id': '6db05c8d8e092528'}
156991077	2021-09-23T01:00:07.000Z	1440843384348807168	Exhausted but going straight to the gym from the airport bec body dysmorphia is one hell of a bitch and i have to be at the office at 0 am tomorrow 🤡	{'place_id': '1d9a5370a355ab0c'}
265090480	2021-09-23T00:33:20.000Z	1440836646975389703	 Lmfao I only go to the gym in crocs or yeezy slides. Yall ain’t missing nothing.	{'place_id': '9fdc3d1edf51a0a0'}
1161976004816048128	2021-09-23T00:24:07.000Z	1440834328271863819	     Did  get a haircut?	{'place_id': 'c8b021ffd0c94ffc'}
276829207	2021-09-24T22:25:29.000Z	1441529246128779270	  No, but the government has a duty to protect its citizens from active threats.  I don't like the idea of people wearing masks at my wedding ceremony in seven weeks.  Hate it even.  But I'd much rather see a proactive approach to this than no approach at all like many states.	{'place_id': '9f3d755fe1a081a4'}
23164247	2021-09-24T22:07:43.000Z	1441524775050956800	Shopping for a wedding that your gonna be just a guest at is hard. The last wedding i went to i was a bridesmaid. That was 0 years ago lol.	{'place_id': '1d9a5370a355ab0c'}
37661483	2021-09-24T20:06:11.000Z	1441494189200580612	It's true! Less is more! Simple wedding invitation with all the elegant vibes.       @ Chicago, Illinois 	{'place_id': '1d9a5370a355ab0c', 'coordinates': {'type': 'Point', 'coordinates': [-87.632496, 41.883222]}}
104968131	2021-09-24T17:27:08.000Z	1441454163003691008	Dead ass  footworking in a wedding gown😭😭😭 	{'place_id': '1d9a5370a355ab0c'}
156991077	2021-09-24T14:46:03.000Z	1441413627177799683	 You and  should do it at the wedding	{'place_id': '1d9a5370a355ab0c'}
59378449	2021-09-24T13:14:05.000Z	1441390484199403523	 You a good 0 lbs at least tryna make it make sense but honestly if somebody go on a date wit they last 0 to they name sum not right upstairs	{'place_id': '1d9a5370a355ab0c'}
23712827	2021-09-24T13:00:09.000Z	1441386974649229313	A wedding coordinator that can’t spell the word “ceremony” 💀 	{'place_id': 'ed888f00de07aa3a'}
3911964683	2021-09-24T08:39:33.000Z	1441321393652600846	I ain’t gone lie…. I do the same thing and i pick out the colors of my wedding 😅 	{'place_id': '1d9a5370a355ab0c'}
706692452	2021-09-24T06:11:53.000Z	1441284230701453315	I can’t wait to go to the gym.	{'place_id': '1d9a5370a355ab0c'}
779466516504936449	2021-09-24T03:32:00.000Z	1441243995661746176	 I’m watching Wedding Crashers.	{'place_id': '1d9a5370a355ab0c'}
346137864	2021-09-24T02:48:23.000Z	1441233018853761025	the amount of wedding planning I did today. Phewwwww I deserved that bottle of wine 😂	{'place_id': '1d9a5370a355ab0c'}
241812268	2021-09-24T02:01:52.000Z	1441221314908340229	   absolutely wonderful show I hope y’all come back so we can see the wedding  ❤️🤗	{'place_id': '1d9a5370a355ab0c'}
28604635	2021-09-24T00:20:53.000Z	1441195901515538434	 Way to go  Btw I’m in Chicago… would enjoy a meetup.. I’ll buy the coffee or beers. Keep up the great work 🦾 ⚡️ 🍊🚀 	{'place_id': '1d9a5370a355ab0c'}
960237640372154369	2021-09-24T00:18:21.000Z	1441195264933433350	 I was on a date once and a stranger took a pic to tell me we looked cute.. told her delete that shit immediately. It’s a reason I’m hiding at the harbor	{'place_id': '1d9a5370a355ab0c'}
1188203090173784064	2021-09-24T00:04:43.000Z	1441191830905757703	decided to go to a concert alone🤨now i’m full of anxiety😐	{'place_id': '07d9e387e9481000'}
