1105685192809697280	2020-10-05T23:54:42.000Z	1313266393844862976	 Just go to college it doesn’t matter what you major in just go 😕	{'place_id': '3b77caf94bfc81fe'}
1080752284567359489	2020-10-05T23:54:36.000Z	1313266370805555200	i swearrrrr my mom sucks at driving bro like tf are u breaking so much for ??? everytime we go out she dont let me DRIVE MY OWN CAR?? LIKE ? im irritated	{'place_id': '3b77caf94bfc81fe'}
277194545	2020-10-05T23:37:36.000Z	1313262090409312256	Going out for myself all week and its always just the simple things that make me happy 😊	{'place_id': '3b77caf94bfc81fe'}
385255131	2020-10-05T22:50:55.000Z	1313250345091383296	let’s go out tonight to celebrate the bachelor life	{'place_id': '3b77caf94bfc81fe'}
2794939225	2020-10-05T22:09:42.000Z	1313239969570320385	remember going out and having fun	{'place_id': '59612bd882018c51'}
885197238	2020-10-05T21:55:29.000Z	1313236393577967617	 0) This is controversial, but take her to a place where she'll have guys on her like white on rice, like a night club.I'd go out on a limb and say that sexual attraction can be cultivated over time.	{'place_id': '3b77caf94bfc81fe'}
1238182337889726464	2020-10-06T23:57:59.000Z	1313629607661170688	Anyone else’s power go out?   	{'place_id': '1927193c57f35d51'}
904924837818142720	2020-10-06T23:42:46.000Z	1313625779322847232	Virtual Back to School Night Website is Now Live                                      	{'place_id': '01c060cf466c6ce3'}
376920261	2020-10-06T23:27:38.000Z	1313621972950024193	Got the same parking spot I left going to work this morning	{'place_id': '3b77caf94bfc81fe'}
550476464	2020-10-06T22:47:17.000Z	1313611815297851392	Trying to apply for a credit card like:-The SC# you provided wasn’t found, what’s your legal status?-oh,hmm, well I have DACA-Are there any restrictions with your DACA?-I just can’t go out to the country, I mean I could but you know, I can’t come back, not trying to leave tho	{'place_id': '3b77caf94bfc81fe'}
22803347	2020-10-06T22:06:46.000Z	1313601621562068992	 the mechas will look very cool, but not amplify your strength very much because that would be expensive, but you could go out and get lunch again with a really cool looking mech suit	{'place_id': 'b0b79caecef59fb5'}
709192053218009088	2020-10-06T21:56:43.000Z	1313599091176341506	Go out cali just to catch a vibe 	{'place_id': '3b77caf94bfc81fe'}
1218745458555703298	2020-10-06T21:55:17.000Z	1313598728498864128	 I am in total shock and disbelief that the greatest guitar Legend of our time has passed away Eddie was my first crush and my first love my thoughts and my prayers go out to his family and friends !    	{'place_id': '3b77caf94bfc81fe'}
1218745458555703298	2020-10-06T21:28:49.000Z	1313592069961596928	 R.I.P to the greatest Guitar God I woke up to the news of your passing what a very sad day in Rock N Roll I am so shocked and saddened prayers go out to his family	{'place_id': '3b77caf94bfc81fe'}
14755306	2020-10-06T21:08:03.000Z	1313586842449575936	Man I think Eddie Van Halen died with a goatee. Fuck. No great man should go out like that	{'place_id': '3b77caf94bfc81fe'}
292570390	2020-10-06T20:36:43.000Z	1313578960169496577	The boi  going out there like Rambo 🔫 	{'place_id': '59105f0e84773bdd'}
111220134	2020-10-06T20:28:48.000Z	1313576966096785408	   That’s definitely fair. I did go to college, but didn’t finish because it would’ve been financially terrible for me. Instead, I worked hard to develop skills without the formal education. I don’t have a degree to fall back on if my current gig doesn’t work out, but	{'place_id': '3b77caf94bfc81fe'}
479244615	2020-10-06T20:20:02.000Z	1313574758127001600	FILM OF THE DAY: The great  was born on this day in 0, here’s her delightful 0 classic screwball comedy about “forgotten man” going to work for daffy rich family. Brilliant work all abounds      #🎬 	{'place_id': '59612bd882018c51'}
1213228294516011008	2020-10-06T20:18:05.000Z	1313574269406699520	It amazes me how people think that I NEED football 😂🤦🏽‍♂️I’m actually smart bro I’ll get to college regardless	{'place_id': '3b77caf94bfc81fe'}
348651305	2020-10-06T20:14:20.000Z	1313573325751296001	Friend. Remember me? Did we go to school together? Did we share a moment? Then please listen. My country, my race, is under attack by Turkey and Azerbaijan. Thus far, they’ve bullied  Hailey Bieber, Justin Bieber (and MORE!) into SILENCE WITH DEATH THREATS.	{'place_id': '3b77caf94bfc81fe'}
111220134	2020-10-06T20:06:35.000Z	1313571374712025089	  Different cultures definitely play into this, but from the perspective of someone growing up poor in the US, my only perceived option was go to college and accrue tons of debt or not be successful. Other options should be visible and viable.	{'place_id': '3b77caf94bfc81fe'}
1306660309415780353	2020-10-06T19:59:28.000Z	1313569584910233600	 has the worst customer service ever. Just go out of business!! All  does is lose packages and claim they don’t have supervisors when you want more answers.	{'place_id': '3b77caf94bfc81fe'}
2872194229	2020-10-06T19:54:20.000Z	1313568291227492353	This y’all. We CANT rely on polling. All because Biden is up, it doesn’t do diddly squat if people don’t go out and vote     JUST  	{'place_id': '3b77caf94bfc81fe'}
830587286093918209	2020-10-06T19:46:18.000Z	1313566272299311104	 So is this a more polite “stay in your lane” request? Because that’s a shit thing to say to anyone just because they didn’t go to school for a poli-sci major. It’s their platform to use as they see fit, just how you use your platform as you see fit. Live and let live.	{'place_id': '3b77caf94bfc81fe'}
50729972	2020-10-06T19:12:15.000Z	1313557701457190912	Another offer going out for a value play on a dope little triplex.	{'place_id': '3b77caf94bfc81fe'}
232045579	2020-10-06T19:11:24.000Z	1313557489355350016	I’m going out of town for 0 days, so it’s safe that I packed 0 outfits right?😅	{'place_id': '3b77caf94bfc81fe'}
109360451	2020-10-06T18:49:58.000Z	1313552095019106304	  Exactly. I’m talking a small group. I don’t do large dinners anyway. Partly because of conversations like this. But, if me & two or three of my friends want to go out for lunch & one maybe only wanted drinks, she’s not tacky or ghetto for only putting in her portion	{'place_id': '65eb9ee22cdeb7a8'}
109360451	2020-10-06T18:46:38.000Z	1313551253436198913	 Same. & I’m also not gonna say some wild shit like my friends shouldn’t go out because they can only afford what they ordered. Like what???	{'place_id': '65eb9ee22cdeb7a8'}
172062467	2020-10-06T18:29:15.000Z	1313546882413551616	  So California, Texas and Florida can decide EVERY election?? Time to go back to school. You failed that course.	{'place_id': 'b0b79caecef59fb5'}
470918844	2020-10-06T18:09:19.000Z	1313541866025934848	the facts are that intelligence has everything to do with politicswhy is it that trump supporters skew to uneducated people? people who don’t go to college are more likely to be swayed by misinformation and be more susceptible to confirmation bias 	{'place_id': '2feb76248fd9c581'}
27731401	2020-10-06T17:56:45.000Z	1313538701381627905	I think we go out now, she texted me back. We’re moving forward.	{'place_id': '3b77caf94bfc81fe'}
52783689	2020-10-06T17:28:13.000Z	1313531521656066048	DO NOT LET THE POLLS CONVINCE YOU WE ARE SAFE YOU STILL NEED TO GO OUT AND VOTE 	{'place_id': '70707114a9202b98'}
778700704990978048	2020-10-06T17:21:41.000Z	1313529875953668096	Movies and sitting around with a big group of friends talking for hours.I'm going out for some careful, cautious dinners but never more than one person unless it's with my kids and their moms. 	{'place_id': '3b77caf94bfc81fe'}
14303901	2020-10-06T17:12:28.000Z	1313527559355658242	 At least Microsoft’s video had people going out and doing things in the world, and they’ve actually built hardware and software along these lines (Office, OneNote, Windows, etc.).Facebook has the VR goggles but none of it makes sense. Sun tried in 0. 	{'place_id': '3b77caf94bfc81fe'}
1167385009	2020-10-06T16:47:50.000Z	1313521356609208320	I’m so lazy to go to work today ☹️	{'place_id': 'fcd177d5a0545c9c'}
232316931	2020-10-06T16:05:11.000Z	1313510626115813376	I always buy my kids something when I go out of town ... gives them something to look forward to❤️	{'place_id': '3b77caf94bfc81fe'}
779706632	2020-10-06T15:16:36.000Z	1313498398742339584	Dude at this job interview mad at me cuz I go to school lmaoo what? Mf’in employers be on some bullshit  😂😂	{'place_id': '3b77caf94bfc81fe'}
91212005	2020-10-06T15:10:27.000Z	1313496852180869120	I haven’t gone out / drinking in about 0 + months and it’s amazing how many times a week people not only go out but consume alcohol.	{'place_id': '67571a7baaa5906b'}
27895757	2020-10-06T15:07:10.000Z	1313496024757936128	Y’all was just tryna have kids in school & i forgot wtf state but they said they was gonna fine em for NOT taking them to school. This country is so fuckin ass backwards. I’m fuckin tired of yalls bullshit bruh 	{'place_id': '853e23ffbf7f0201'}
3182335724	2020-10-06T13:10:08.000Z	1313466571914797056	I don’t wanna go to work	{'place_id': '7b2a70199c4d7b6d'}
3194398813	2020-10-06T10:12:19.000Z	1313421821526466561	None of this*Like real shit go out and register it’s literally on every application and it’s so easy to register,	{'place_id': '6f24e28976abe656'}
735614700721836033	2020-10-06T07:23:19.000Z	1313379293133635587	I’m Not Going Out In No Fish Bowl.	{'place_id': 'f2b1ac6c9d15503f'}
2497465339	2020-10-06T06:52:09.000Z	1313371448480722944	i never thought i’d say this but i really wanna go back to school It’s so hard for me to learn ANYTHING online	{'place_id': '3b77caf94bfc81fe'}
1581890190	2020-10-06T06:34:11.000Z	1313366928115687424	We really went to school eating pizza and carrots with chocolate milk together 	{'place_id': '2feb76248fd9c581'}
1532663826	2020-10-06T05:41:46.000Z	1313353738778636288	i just need to go out, cause i can sleep when i’m dead.. drop me off the Rox on sunset!!	{'place_id': '1927193c57f35d51'}
1481307732	2020-10-06T05:38:25.000Z	1313352892720398336	thought i was having a bad day this morning, but ended (or will end) it pretty well. i guess it was a good decision not going to work today. 🤷🏻‍♂️ lol. good night y’all!  	{'place_id': '3b77caf94bfc81fe'}
465043162	2020-10-06T04:54:33.000Z	1313341853706579969	I hate when ppl go out n “ask bout me “ like ask me anything tf 😒	{'place_id': '59612bd882018c51'}
754887867214639104	2020-10-06T04:43:25.000Z	1313339054604382215	  My parents wouldn't go out of their room when my dad got infected while working at Walmart. They did this so my brothers who tested negative wouldn't he infected they took EVERY protection.Trump is a disgrace and his behavior criminal.	{'place_id': '3b77caf94bfc81fe'}
118851968	2020-10-06T04:33:08.000Z	1313336464013287425	i may or may not have just yelled “i can’t believe i have to wake up 0 days a week and go to work for the rest of my life. JUST LET ME TWEET” 	{'place_id': '3b77caf94bfc81fe'}
1661109708	2020-10-06T03:59:30.000Z	1313328000662867969	Everyday many visitors coming in and going out fro US on visitor visas which is not considered essential visits, can b a key element in spreading the virus 	{'place_id': '3134f9d2892d2685'}
1042959927621312512	2020-10-06T03:26:21.000Z	1313319657810534401	Stop going out of your way for mf that won’t do the same. 💯	{'place_id': '3b77caf94bfc81fe'}
237998360	2020-10-06T03:12:38.000Z	1313316208465256448	 I am so sorry for your loss, my condolences go out to you and your family during this time ❤️	{'place_id': 'f8f8ee516109ee0e'}
31197211	2020-10-06T02:50:42.000Z	1313310685506330625	My point is that I hate how he says 'you shouldn't let it dominate your life' because there are countries where people don't because they trusted their leaders and beat this. And even if they have to wear masks they still go out and trust that things will be okay. 	{'place_id': '0c2e6999105f8070'}
4708615512	2020-10-06T02:23:29.000Z	1313303836300201985	I had a freakin blast this weekend I’m so glad I decided to go out !! Definitely one for the books, all thanks to  ILYBIAEGSLYB 🥺💗💗💗	{'place_id': '3b77caf94bfc81fe'}
34968277	2020-10-06T02:15:59.000Z	1313301951077965825	" Follow up- the only Cameron Crowe movie I've ever seen is Fast Times. Which, my mom put me into a private school, so I wouldn't have to go to Clairemont High. We knew the movie was filmed there, and I was, like, ""I don't want to go to school with those people."" So I didn't."	{'place_id': '3b77caf94bfc81fe'}
1058146684054593536	2020-10-06T01:19:40.000Z	1313287778038210561	 Went to school for business management and it 0% applies in all aspects of the business. Very pumped I got so lucky for it to come together like this 🤘🏼😁	{'place_id': '3b77caf94bfc81fe'}
22713259	2020-10-06T01:03:00.000Z	1313283582215876609	When I was a little kid my mom refused to send me to school sick. Even if it was just a head cold. She said it wasn’t about coddling me, but about being considerate to other kids, their families, & the teachers. (She is a teacher)Sharing this for no particular reason today.....	{'place_id': '3b77caf94bfc81fe'}
69512352	2020-10-06T00:34:00.000Z	1313276286144573440	 Prayers for your sister and all those in her position, so close to this. What she does is hard enough, without a global pandemic. Prayers also go out to those who've lost loved ones to this, unnecessarily. And of course, to all those suffering from this.	{'place_id': '3b77caf94bfc81fe'}
1121137869165174784	2020-10-06T00:30:35.000Z	1313275424416296960	I feel like I know the cast of Vanderpump Rules and we are going out dis weekend 🥂	{'place_id': '3b77caf94bfc81fe'}
976893548	2020-10-06T00:11:34.000Z	1313270638182723587	Ah yes don’t be afraid of the virus and go out there.  Don’t worry you’ll get the best meds in the world, get picked up by a heli to take you the best doctors to get the best meds. Most you’ll pay is maybe $0. 🤨 	{'place_id': 'dd9ada4135bc9668'}
3207717883	2020-10-07T23:46:43.000Z	1313989163532783618	Pence is going down tonight... on tRump. BUT, before that happens, he's gonna get taken to school by Harris - with the entire world watching. 🤘🙌👍👍👍✊✊✊✊	{'place_id': '3b77caf94bfc81fe'}
759259208336433152	2020-10-07T23:28:36.000Z	1313984601409216514	If you give the staff a hard time that’s gonna be the last time I go out with you 	{'place_id': 'f8f8ee516109ee0e'}
190799144	2020-10-07T22:45:33.000Z	1313973769824681984	  Yeah sorry Lindsey that’s not going to work. Bipartisan is not allowed.U are not allowed to work with any democrats.U are not allowed to work with anyone Democrat or Republican that’s a moderate.Ur in the party of trump stay the party line.On track 0k deaths by end of yr	{'place_id': '01c060cf466c6ce3'}
841675254372085760	2020-10-07T22:18:11.000Z	1313966880349138944	When you can get a mile walk in....just going to work....I'm about this life right here....I must get some more stars in before going back to work tonight @ South Los Angeles, California 	{'coordinates': {'type': 'Point', 'coordinates': [-118.3294, 33.989]}, 'place_id': '3b77caf94bfc81fe'}
481382326	2020-10-07T22:12:26.000Z	1313965433767092224	Whenever I visit  or  to support our  shops and go out to eat I ride Bird.  	{'place_id': '59612bd882018c51'}
172884865	2020-10-07T21:34:24.000Z	1313955860876468224	 Man, if you’re going to go out for a while, at least get a W lmao	{'place_id': '3b77caf94bfc81fe'}
39856810	2020-10-07T21:06:05.000Z	1313948735601348609	when you go out for your coffee fix and happen across your favorite sex shop. 	{'place_id': '07d9e396edc82001'}
1894752374	2020-10-07T20:56:21.000Z	1313946288136712192	If you can’t find me or get a hold of me for the next couple days: I got a Nintendo switch, my bathroom is in my bedroom, and I have snacks and waters in there. No need to go out at all 😊	{'place_id': '0c2e6999105f8070'}
712464797757939718	2020-10-07T20:54:10.000Z	1313945738506694656	 Next time I go out for a shoot I’ll hit you up if you want	{'place_id': '3b77caf94bfc81fe'}
988975103785365504	2020-10-07T20:09:17.000Z	1313934440599482371	  Rapid testing should be done all the time. Like Canada’s 0 day quarantine should be you get tested when you get there then if you are negative you can go out into the world	{'place_id': '3b77caf94bfc81fe'}
977630932080369664	2020-10-07T19:54:24.000Z	1313930697451565056	For my 0th bday I’m going out the country 🗺✌🏾	{'place_id': 'fb76b3aa366004c9'}
18867227	2020-10-07T19:45:17.000Z	1313928403498594304	 Trump ploy to trick Dems to stay home.  He'll no go out & VOTE.  Bring friends & family.  Fill up the van pack you breakfast lunch & Dinner	{'place_id': '59612bd882018c51'}
39100425	2020-10-07T18:38:44.000Z	1313911655147872257	And read Oped beforehandPowerful. Haley went to college at 0 and  Law at 0  🐎 	{'place_id': '59612bd882018c51'}
39100425	2020-10-07T18:35:29.000Z	1313910838831398912	Time to revisit Haley's amazing oped before Tonight   Haley went to college at 0 and   Law at 0   Pretty amazing 	{'place_id': '59612bd882018c51'}
1928499686	2020-10-07T17:43:08.000Z	1313897661586526208	I kinda need to go to work tomorrow. Please start making picks 	{'place_id': '48acdded0b77e66f'}
3270658459	2020-10-07T15:20:05.000Z	1313861663154528256	I can't go to work today, I have to watch this till I die. 	{'place_id': '122aef8d6840943b'}
3270658459	2020-10-07T15:19:13.000Z	1313861445038141442	I can't go to work today, I have to stay here and watch this till I die. 	{'place_id': '122aef8d6840943b'}
27508947	2020-10-07T14:12:37.000Z	1313844683202727938	  Yeah especially since we’re not going out Trump wasn’t testing daily or “multiple times a day”.	{'place_id': '3b77caf94bfc81fe'}
1250719677837279234	2020-10-07T07:50:23.000Z	1313748493861679109	y’all excited for halloween even tho we can’t go out !!	{'place_id': '3b77caf94bfc81fe'}
94860963	2020-10-07T06:34:12.000Z	1313729321551314945	The office of our governor reportedly said if we go out to restaurants we should put our mask back on in-between bites 🥴🥴 just throw all of 0 away. I’m done	{'place_id': '3b77caf94bfc81fe'}
2407400269	2020-10-07T06:21:51.000Z	1313726210178834432	 If he does go out, who do you think will fill the spot, agenda aside?	{'place_id': '3b77caf94bfc81fe'}
378839958	2020-10-07T06:20:53.000Z	1313725969845358592	    You're going out sad 	{'place_id': '3b77caf94bfc81fe'}
3069627972	2020-10-07T06:15:54.000Z	1313724715589013504	"   I went to college. I have zero degrees. I served in the Army. I am proudly voting for ""Amtrak"" Joe Biden."	{'place_id': '3b77caf94bfc81fe'}
1024440498977529856	2020-10-07T05:19:14.000Z	1313710454707871744	My mom and my sister fear I’m a get arrested for fighting every time I go out 😂	{'place_id': '3153d677b795e293'}
318203929	2020-10-07T05:04:34.000Z	1313706764458549251	 They said the open roof makes the ball go out	{'place_id': '3b77caf94bfc81fe'}
51631398	2020-10-07T04:46:47.000Z	1313702288792276992	Go out and Vote!	{'place_id': '3b77caf94bfc81fe'}
2215274581	2020-10-07T04:30:59.000Z	1313698311799410690	 Going out. I kinda remember what that was like. 🥺	{'place_id': '3b77caf94bfc81fe'}
1675113505	2020-10-07T04:22:34.000Z	1313696192711122944	Not me adding a whole ass research project to my list lmao. 🥴 I didn’t have time to go out and now I have even less ☺️😊 	{'place_id': '01c060cf466c6ce3'}
1689095424	2020-10-07T04:19:59.000Z	1313695542933766144	I miss going out with my bro’s! We need bro night 😫 	{'place_id': '3b77caf94bfc81fe'}
375040963	2020-10-07T04:17:07.000Z	1313694821530259456	Regreting not going out to see these games at a bar.	{'place_id': 'be347aa731d4353b'}
405679513	2020-10-07T03:49:40.000Z	1313687914199486465	 Oh come on. That’s not the only thing that separates you. You also have way less death in those who went to college. And then grad school. Actually, I feel like that needed an…	{'place_id': '3b77caf94bfc81fe'}
3150348842	2020-10-07T02:49:34.000Z	1313672789769908224	I don’t know who needs to hear this but go out some chapstick on yo dry ass lips 😂	{'place_id': '3b77caf94bfc81fe'}
155720430	2020-10-07T02:32:22.000Z	1313668461403361280	The time for them to be scared to go to work was January 0. To go to work there now is the kind of crazy that allows you to be locked up on a 0 hour psychiatric hold for your own safety. 	{'place_id': '714789cf3b7a50d0'}
850177458078760960	2020-10-07T02:17:07.000Z	1313664624353402882	Lil mad didn’t have to go out like that	{'place_id': '3b77caf94bfc81fe'}
309995093	2020-10-07T01:48:42.000Z	1313657470569512961	 Bro that first home run he hit 😂😂 what the fuck kinda swing is this and how does it go out of the park?? 	{'place_id': '3b77caf94bfc81fe'}
1030852017936199681	2020-10-07T01:47:32.000Z	1313657177874153474	I realize my life before the pandemic was just most of my day being school then going back home or going to work...I have so much time to myself now idk what to do	{'place_id': '3b77caf94bfc81fe'}
16541214	2020-10-07T01:42:15.000Z	1313655848644669441	 is losing his shit in real time on his feed. He’s at the end. How does he want to go out? On his feet with handcuffs or on a stretcher to Walter Reed?	{'place_id': '20ba6fb3b1ee82da'}
1230183165261570049	2020-10-07T01:20:02.000Z	1313650259365519360	"  I'm rusty myself....I learned Tai Chi when I went to school for massage therapy. I was ""0"" at the time. But I know what you mean I miss it myself. Perhaps you should take some time to get back into practice. I should do the same. 😉👍 "	{'place_id': '3b77caf94bfc81fe'}
416866438	2020-10-07T01:19:46.000Z	1313650188406276096	LeBron, WAKE THE FUCK UP AND GO TO WORK!	{'place_id': '3b77caf94bfc81fe'}
19882423	2020-10-07T01:05:49.000Z	1313646678763741185	   You should be afraid for your children that are going to school without masks and then probably learning backwards information. You shouldn’t be proud of the fact that you don’t care for other human lives and think eating at restaurants and gatherings are more important 🙄	{'place_id': '3b77caf94bfc81fe'}
64573094	2020-10-07T00:30:50.000Z	1313637874693103616	thinking that i should order food tonight n treat myself but it’s been so long since i was regularly going out to eat i don’t even know where to eat. what food do i like	{'place_id': '3b77caf94bfc81fe'}
60449291	2020-10-07T00:14:27.000Z	1313633751558053890	Hey  your engineers should code something up where we could set a certain “face” on our watch to default for a specific time range. I have 0 faces that I switch throughout the day that make sense based on my routine (gym, work, wind-down,go out) idk hire me I have ideas 🙇🏽‍♀️	{'place_id': '3b77caf94bfc81fe'}
27385394	2020-10-07T00:00:43.000Z	1313630295992659968	I can’t imagine going to work this week while all of this is still happening. I don’t have any ounce of “disney magic” in my soul right now. I just want to be with everyone else marching and protesting.	{'place_id': '3b77caf94bfc81fe'}
2407400269	2020-10-08T23:53:40.000Z	1314353298812465154	Didn't he go out to play golf? What info am I missing here? 	{'place_id': '3b77caf94bfc81fe'}
112051536	2020-10-08T23:47:56.000Z	1314351855556853760	This is the official endorsement of the  on the  . I  will vote No on 0. Go out or stay inside but Vote, Vote, Vote. @ Los Angeles, California 	{'place_id': '3b77caf94bfc81fe', 'coordinates': {'type': 'Point', 'coordinates': [-118.2445, 34.0564]}}
196551159	2020-10-08T23:14:43.000Z	1314343497403490304	Foot kinda hurt but still wanna go out for at least a walk today. Such a nice day !	{'place_id': 'e04653ebc39b100c'}
1006590780461346816	2020-10-08T23:05:37.000Z	1314341205933654016	 Are you really going out that way tho ?	{'place_id': 'cf2d9d01f16e9bd4'}
18456014	2020-10-08T22:51:05.000Z	1314337549033201665	Hey, who carried a trumpet or other instrument case to school every day on the bus like me? Then you too know what a confidence builder this stylish little popularity machine can be for an awkward adolescent.  	{'place_id': '3b77caf94bfc81fe'}
259616641	2020-10-08T22:23:06.000Z	1314330505509134336	I’m going out on a limb and picking the underdogs Stefanos Tsitsipas and Diego Schwartzman to upset Djokovic and Nadal at  tomorrow. 	{'place_id': '0d9a7f9b8f0baf12'}
2781373285	2020-10-08T22:21:08.000Z	1314330009595600897	I was recently made aware of this  recruiting app, and it is really beneficial for high school/JuCo players. It helps provide athletes with vital eligibility info as well as direct access to college coaches. I highly recommend.  	{'place_id': '01c060cf466c6ce3'}
911832090118725632	2020-10-08T21:45:23.000Z	1314321014881308673	and if you go out, do NOT go anywhere alone.....literally take anyone with you whether it be to the restroom or to your car....it’s getting scary out there and you have to be cautious 0/0!!!❤️✨ 	{'place_id': '70707114a9202b98'}
176927125	2020-10-08T21:41:01.000Z	1314319916338536448	Left to go to work early to get Starbucks and didn’t know it’s happy hour andddddd I’m gonna be late 🤣. Somebody has a 0 drink order 🤦🏻‍♂️	{'place_id': 'c1e1a49e92ce1ba0'}
898044855057657856	2020-10-08T21:37:01.000Z	1314318910661914626	My dad came to LA to pick up one of my cars and we went to breakfast went to a view had a heart to heart (I’m now going to work) but we are going to grab dinner before he leaves tomorrow 🥺💞 I luv that man	{'place_id': '3b77caf94bfc81fe'}
