313556317	2020-10-10T20:06:38.000Z	1315020937465528321	Go to college 😩 	{'place_id': '3b77caf94bfc81fe'}
2415926846	2020-10-10T18:55:39.000Z	1315003073983463424	Going out in public now is just navigating one logistical clusterfuck after another solely so businesses can create the illusion of safety for people who didn’t care in the first place.	{'place_id': '1927193c57f35d51'}
135684192	2020-10-10T17:28:18.000Z	1314981094555447303	 Because he’s trying to kill us all by infecting thousands who then go out into the cities and towns, infecting the rest of us.	{'place_id': 'c1e1a49e92ce1ba0'}
258977459	2020-10-10T17:25:13.000Z	1314980318542139392	Omg my philosophy TA told us a similar story and said this was why he ended up going back to school to study philosophy so he wouldn't be helping to murder people 	{'place_id': '6f24e28976abe656'}
1039721955316850690	2020-10-10T17:07:36.000Z	1314975885150154752	am i really gonna go to work running on like HOURS of sleep????? ugh yes 😔	{'place_id': '3b77caf94bfc81fe'}
20417113	2020-10-10T16:07:39.000Z	1314960798150610944	Still not really used to college football at 0am. 	{'place_id': '3b77caf94bfc81fe'}
1115596310759895040	2020-10-10T15:38:11.000Z	1314953379668390075	  It did. Sent normal kids off to college. Lobotomized ones came back.	{'place_id': 'e1e35d357ceefa52'}
1959168277	2020-10-10T15:01:17.000Z	1314944094179741697	For the last time I don’t go out it’s still Covid	{'place_id': '3b77caf94bfc81fe'}
4353738322	2020-10-10T13:34:53.000Z	1314922354045140993	  Going out saaad	{'place_id': '3b77caf94bfc81fe'}
443154625	2020-10-10T12:54:19.000Z	1314912142143832064	me @ 0PM: oh I’m going out with Chloe and Phil I should probably drink 0 shots of espresso first	{'place_id': '3b77caf94bfc81fe'}
59966208	2020-10-10T12:23:39.000Z	1314904424947412992	 Every time I go out, I am a patriot. Just like I would have proudly served my country if Mother Liberty ever came calling. Unlike Trump who only serves himself.	{'place_id': '5e68ca240e32025a'}
34653091	2020-10-10T11:35:40.000Z	1314892349458186241	usually good things happen to those who go out and make it happen	{'place_id': '3b77caf94bfc81fe'}
2985071827	2020-10-10T11:17:32.000Z	1314887785027780611	Need a friend girl friend I can go out to drink with and just dance😫 	{'place_id': '67571a7baaa5906b'}
1305154102712705024	2020-10-10T09:33:33.000Z	1314861617075507200	 Hey my name is Eric James Hall, D.O.B. 0/0/0, I.D. # B0. Could you please help me pay an old student loan of $0,0. If I pay it off or if you help me pay off, I will be able to return to school and study a subject that I love which is Animal Behavior.	{'place_id': '3b77caf94bfc81fe'}
1027749975688732672	2020-10-10T09:19:15.000Z	1314858019725864960	I would talk to y’all more but my twitter is too trifling to school in public🥴 	{'place_id': '56909099a1d44057'}
963427261	2020-10-10T08:56:22.000Z	1314852261118373888	I went to school with a lot of “hippy” chicks who preached for sustainable fashion. Yet ignoring the fact a dress is well over $0.You can’t shame people if you aren’t allowing access	{'place_id': '3b77caf94bfc81fe'}
30176318	2020-10-10T07:36:31.000Z	1314832165129973760	My  delivery guy Martin asked me where I was going out of LA? Me: NashvilleMartin: You following  there? (I won’t bore you with the rest, but a great friendship was made today 🇺🇸)	{'place_id': '3b77caf94bfc81fe'}
153319060	2020-10-10T07:14:48.000Z	1314826700115460098	My family had an intervention with me so I wouldn’t enlist and talked me into going to college instead.  Two of my cousins came back with severe PTSD after the war in Iraq and didn’t want me going down that same road.     I’m glad I listened 	{'place_id': '3b77caf94bfc81fe'}
2838567097	2020-10-10T07:04:59.000Z	1314824230563848192	Sike guys, we going out tonight	{'place_id': '2feb76248fd9c581'}
40140510	2020-10-10T05:15:11.000Z	1314796600435249153	"""Going out to eat with members of your household this weekend? Don't forget to keep your mask on in between bites."" A community service reminder from your  governor's office.Really?  via     "	{'place_id': 'c84cc6061e2af8da'}
2951611208	2020-10-10T04:34:26.000Z	1314786341461192704	 Thanks for going out tonight....	{'place_id': '0c2e6999105f8070'}
1179918841649872896	2020-10-10T04:04:17.000Z	1314778755471007744	I feel like going out to eat now lol	{'place_id': '01c060cf466c6ce3'}
154416309	2020-10-10T03:58:39.000Z	1314777336651292672	  Lmaooooo. She cold for letting that nigga go out there and recording. This gotta be blackmail footage. 😂	{'place_id': '3b77caf94bfc81fe'}
2932775066	2020-10-10T03:52:46.000Z	1314775856351342593	Looks like I’ll be going to work hungover on Monday y’all	{'place_id': 'dd9ada4135bc9668'}
3274852056	2020-10-10T03:45:38.000Z	1314774062334275585	Lakers going out sad	{'place_id': '3b77caf94bfc81fe'}
1152929520	2020-10-10T03:44:31.000Z	1314773782343544833	Now I’m going out Lmfaoo I’m upset	{'place_id': '3b77caf94bfc81fe'}
1201041176507211777	2020-10-10T03:40:06.000Z	1314772668063780864	Lakers no going out on a shot is not Mamba-esque	{'place_id': '3134f9d2892d2685'}
2413256330	2020-10-10T03:24:58.000Z	1314768860034166784	I’m going out on a limb here and saying Duncan Robinson’s Celtic fandom is fueling his attack on the Lakers right now.	{'place_id': '3b77caf94bfc81fe'}
3051955171	2020-10-10T02:11:28.000Z	1314750366781640704	Me and daisy at my god daughters back to school night 	{'place_id': '9da8666a1bd226d8'}
46092587	2020-10-10T01:40:43.000Z	1314742627443503105	I know  will ride to the occasion & go to work right now	{'place_id': '3b77caf94bfc81fe'}
1032646653147324416	2020-10-10T01:35:17.000Z	1314741258275840008	 I can’t go out sad like that 😭 I will easily go buy a 0rd pair	{'place_id': '3b77caf94bfc81fe'}
60163213	2020-10-10T01:33:57.000Z	1314740921422901248	You ever shave your legs, then go out into the cold air and it feels like your leg hot is automatically growing back to try and keep you warm?	{'place_id': '3b77caf94bfc81fe'}
216417515	2020-10-10T01:16:59.000Z	1314736655438278663	When you wanted to go out out so you did your makeup and then you couldn’t find anything to wear so you gave up and put a sweater on and are not going out anymore. Also could stan a good hair cut. 😫 	{'place_id': '3b77caf94bfc81fe'}
1291038679465472000	2020-10-10T01:07:24.000Z	1314734243570880512	 Agreed that poverty isn’t an indicator, but it’s harmful to characterize all terrorists as having abnormal psyches. Nearly anyone can be radicalized with the right (wrong) social circle and pressures. Source: thanks to college this is the only thing I’m qualified to argue about.	{'place_id': '3b77caf94bfc81fe'}
1152122397685796865	2020-10-10T00:32:31.000Z	1314725463764262912	0-0-0 going out with a bang 💯 	{'place_id': '2c1b78093786a74a'}
46092587	2020-10-11T23:58:37.000Z	1315441706183979008	What’s up with highschool niggas.. do they still have school or nah? Is home school? Sucks if niggas can’t go to school. Highschool is actually fun	{'place_id': '3b77caf94bfc81fe'}
49849687	2020-10-11T23:42:53.000Z	1315437747927019520	When the whole squad know you going out sad smh! Lol  	{'place_id': '97e336e1e3ed9e1e'}
958427918	2020-10-11T23:13:39.000Z	1315430391864594433	I'm old school. From equipment, to training. I was able to pick up this gem today. The sad part is I got it from a gym going out of business. Good thing it has found a new home @ Los Angeles, California 	{'coordinates': {'type': 'Point', 'coordinates': [-118.2445, 34.0564]}, 'place_id': '3b77caf94bfc81fe'}
27811737	2020-10-11T22:21:45.000Z	1315417330562736128	  Fred is correct. Parents need to listen to their personal physician who’s job is to give sound, principled advice. The last thing that parents need to do is listen to school administrators when it comes to health and safety of a particular student athlete.	{'place_id': 'fa424f169eef946e'}
1009307141339938816	2020-10-11T22:05:50.000Z	1315413325551788033	Are people really complaining about not being poor enough? Imagine being bitter that someone is going to college for free because they need it more than you do🥴 	{'place_id': '3b77caf94bfc81fe'}
282343246	2020-10-11T21:57:18.000Z	1315411177439023104	Why does my street have to be closed out today on my day off.... why can’t it be closed off tomorrow when I have to go to work 😩😩   	{'place_id': 'bcd6f5a92e969e33'}
387513814	2020-10-11T21:51:44.000Z	1315409776595988480	These people voting to keep getting away with doing this. Are you gonna standby and let it continue? Well then go out and vote it may not seem like much but it actually changes a lot. 	{'place_id': '3b77caf94bfc81fe'}
2446458362	2020-10-11T21:04:06.000Z	1315397787505233921	La Isla Bonita always takes me back to college with my roommates, high as fuck, poor as fuck, just vibing 	{'place_id': '3b77caf94bfc81fe'}
1490654780	2020-10-11T20:12:35.000Z	1315384823729586177	The less fun I get to go out and have the less time and energy I'll have to check in with y'all.. 😴 @ Los Angeles, California 	{'coordinates': {'type': 'Point', 'coordinates': [-118.2445, 34.0564]}, 'place_id': '3b77caf94bfc81fe'}
746310368	2020-10-11T19:28:33.000Z	1315373741661016064	I’ve never been so proud of Nigeria youths like I’ve been in the past few days. Y’all are the real MVPs! Thanks for going out there and using your platforms to protest! The time for change is now! Don’t give up because the battle is not over.  	{'place_id': '341aa0cdb944022e'}
585391355	2020-10-11T18:58:27.000Z	1315366166647300096	 We’re also putting new coversheets on all the TPS reports before they go out now. So if you could go ahead and try to remember to do that from now on, that'd be great.	{'place_id': '3b77caf94bfc81fe'}
130712338	2020-10-11T18:13:53.000Z	1315354953850843136	I just can’t honestly believe Rivera’s sermon on trying to be “competitive” when he refuses to make changes at the safety position or go out and bring in a veteran WR to help.	{'place_id': '714789cf3b7a50d0'}
1017088703427047424	2020-10-11T18:12:05.000Z	1315354499679096834	I was recently at a inspection for work and the inspector asked if I finished college out the blue. Like does it matter? But I said no and he encouraged me to go back to school. Here I am thinking about school ...	{'place_id': '3b77caf94bfc81fe'}
430359257	2020-10-11T18:09:37.000Z	1315353880478142464	Just saw the commercial for the J Balvin McDonalds meal. So does this the ice cream machine is going to work everytime?	{'place_id': '0c2e6999105f8070'}
830587286093918209	2020-10-11T17:56:47.000Z	1315350647596703744	 Actually, trade schools are rather inexpensive compared to college. His assumption that he’s in the 0% though is clear indication that he didn’t attend college. I would say “good for him” if he weren’t such a douchebag in this pic.	{'place_id': 'd64738e6377b26b3'}
779494438213070848	2020-10-11T17:34:48.000Z	1315345118551928838	 go to school	{'place_id': '1af9758d2214d4b8'}
586032448	2020-10-11T17:04:50.000Z	1315337574009860096	 You gotta go out and start collecting applications! Lol	{'place_id': '3b77caf94bfc81fe'}
145450373	2020-10-11T17:02:45.000Z	1315337053450633218	man, i’m with ya,  just go out there do the job ahah. 	{'place_id': '3b77caf94bfc81fe'}
30239239	2020-10-11T16:24:22.000Z	1315327390411677696	It feels so weird going to work in the mall	{'place_id': '3b77caf94bfc81fe'}
2363548021	2020-10-11T15:35:17.000Z	1315315041399451658	Go Out And Vote!  Your Vote Matters!! @ Duarte 	{'coordinates': {'type': 'Point', 'coordinates': [-117.965177, 34.138338]}, 'place_id': 'ddf8317a51899bd8'}
156285317	2020-10-11T15:30:23.000Z	1315313805283323906	Say it!!! White woman trying to distance themselves from the *evil white man* but they’re the ones that raised them, married them, live with them, go to school with them, benefit from them and etc etc! 	{'place_id': '3b77caf94bfc81fe'}
1263014636401553408	2020-10-11T14:37:23.000Z	1315300470630486017	 Can wait till Ken and jimmy pull up to school one day 😂	{'place_id': '3b77caf94bfc81fe'}
338990762	2020-10-11T14:31:29.000Z	1315298982453673985	The feeling of being late for work in a cold big city but without the going to work part	{'place_id': '3b77caf94bfc81fe'}
15767973	2020-10-11T10:36:12.000Z	1315239772818870274	  Remember when everyone was in agreement that it was wildly irresponsible to go to work with just the flu  and infect your coworkers...? How are his supporters okay with this? 	{'place_id': '3b77caf94bfc81fe'}
198420647	2020-10-11T09:26:34.000Z	1315222249721360384	Up like I don’t have to go to work today	{'place_id': '3b77caf94bfc81fe'}
1078894889482387457	2020-10-11T07:44:04.000Z	1315196454189723648	I want food but I know ima get bullied if I go to work and ask for something rn :(	{'place_id': '3b77caf94bfc81fe'}
2187703537	2020-10-11T07:22:34.000Z	1315191044946882560	I love that my friend & I both said to our parents that we were going out together but in reality we just used each other as an excuse to go out with someone else 😭	{'place_id': '3b77caf94bfc81fe'}
1358078280	2020-10-11T07:16:02.000Z	1315189399743680512	 We went to school together for a bit  😊	{'place_id': '3b77caf94bfc81fe'}
1306840549261864960	2020-10-11T06:25:51.000Z	1315176771600420865	LAUSD is working really hard to bring students back to school safely!!  Willie and I covid tested with Superintendent Austin Beutner and are pleased to say the process is easy, safe and painless!  Plus we received our results later that day!!  	{'place_id': '0fc3525b8114c001'}
941089920575160320	2020-10-11T06:05:45.000Z	1315171712447594496	  Yes but we can’t trust this we need to go out and make sure that everyone votes and that every vote is counted	{'place_id': '05b5c83b6407aaac'}
38868439	2020-10-11T05:40:04.000Z	1315165246869434369	Just going to go out on a limb and say that if youre also voting for the guy with both the Taliban and white supremacist groups around the world rooting for him... youre probably should take a goooood look in the mirror and reassess some things. 	{'place_id': '3b77caf94bfc81fe'}
181694711	2020-10-11T05:34:59.000Z	1315163970043613184	Lakers better win tomorrow. This time im not going out, ordering food or anything lol ....seriously get it done	{'place_id': '3b77caf94bfc81fe'}
2687032760	2020-10-11T05:11:52.000Z	1315158151637786625	I honestly believe that the definition of “love” is different for men and women, us guys definitely don’t love women, the same way they love us. No guy in the world has ever said, “Hey guys, let’s go out in the world and look for love”	{'place_id': '70707114a9202b98'}
953557670103076864	2020-10-11T05:11:38.000Z	1315158094498787328	 I died. The 0 for the key had me laughing. Remember when we got to school and they told us if we lost our apartment key it would be 0?	{'place_id': '741e9df4d2522275'}
753358988	2020-10-11T05:01:23.000Z	1315155514616025088	Lol 😂! These are the most peaceful loving activists ever ! Perhaps  should go out there and dance with them ! Look there’s a video of him dancing.   	{'place_id': '3b77caf94bfc81fe'}
1442533153	2020-10-11T04:58:42.000Z	1315154837110059008	You basically gotta go out in LA on the weekends cause it don’t be shit on tv	{'place_id': '3b77caf94bfc81fe'}
60017061	2020-10-11T04:14:00.000Z	1315143591224848384	Whenever me  girl Makennzee go out its main event. Flemings Steak house just look your best and eat your best.  @ Los Angeles/Hollywood California 	{'coordinates': {'type': 'Point', 'coordinates': [-118.3136344, 34.09073173]}, 'place_id': '3b77caf94bfc81fe'}
318514392	2020-10-11T03:54:16.000Z	1315138624237662208	Excited to go out tonight ... I NEED that	{'place_id': '6f24e28976abe656'}
1270713185402675203	2020-10-11T03:51:04.000Z	1315137816616079361	 Definitely a little less drugs, went to college and became a Architect.	{'place_id': '3b77caf94bfc81fe'}
1057125910204178432	2020-10-11T02:07:05.000Z	1315111650622496768	I’m so lazy to get ready rn 😔 but I want to go out	{'place_id': '3b77caf94bfc81fe'}
29045925	2020-10-11T01:37:07.000Z	1315104107565211648	Never went to college parties frat parties none of that lol well i did go to OSU parties in HS. Lol	{'place_id': '3b77caf94bfc81fe'}
29045925	2020-10-11T01:35:37.000Z	1315103728668565504	I didn’t to college and really know nothing about that life. Feel like i slight missed out.	{'place_id': '3b77caf94bfc81fe'}
50595242	2020-10-11T01:02:24.000Z	1315095370569969665	   He’s not American, so factor in that lack of understanding of our system and heritage. No idea why it’s all that endlessly fascinating for him going in circles trying to school us on our own govt style, while we are trying to resolve our internal issues.	{'place_id': '3b77caf94bfc81fe'}
45499651	2020-10-11T00:54:23.000Z	1315093353558503426	 You keep on dividing the pro-Israel community.I am going to work on uniting Democrats and Republicans in support of the State of Israel🇮🇱🇮🇱🇮🇱	{'place_id': '3b77caf94bfc81fe'}
198420647	2020-10-11T00:53:03.000Z	1315093016944680961	You gotta go to college to learn how to dress? Lmfao	{'place_id': '1100db27cd9d364c'}
