187012572	2021-02-08T23:43:17.000Z	1358924394807119880	"How do you reconcile ""non-essential, discretionary travel"" with ""faible revenu""? "	{'place_id': '01a9a39529b27f36'}
201448511	2021-02-08T23:37:02.000Z	1358922820844199938	It seems to be ranked  in Germany at the moment with no promotion so that’s pretty cool lol If you’d like to learn more and download  visit  🦒	{'place_id': '011add077f4d2da3'}
14144524	2021-02-08T23:20:31.000Z	1358918664393793537	We should shut down air travel as Australia did. This is serious. 	{'place_id': '00c39537733fa112'}
972862322111901696	2021-02-08T22:58:31.000Z	1358913128256438277	  😂 kickball and travel, both at once. But we already know he would say he scored 0 points in the first quarter.	{'place_id': '002e24c6736f069d'}
1074287190	2021-02-08T22:47:18.000Z	1358910302419623943	Privilege acknowledged: I have no student loan debt. I had scholarships, but my main source of college funding was a grant thru National History Day that I only got because I was privileged enough to travel for research for my NHD projects and be able to afford to go to nationals	{'place_id': '8739d0bab792509d'}
20877868	2021-02-08T21:57:04.000Z	1358897664277028864	Crazy for CLOVERS! We just got in our newest clover designs in time for  - Click to preview or visit our Oceanside showroom 💎 @ SVS Fine Jewelry 	{'place_id': '39411d80c106aa80', 'coordinates': {'type': 'Point', 'coordinates': [-73.64065, 40.6302]}}
362040322	2021-02-08T21:51:20.000Z	1358896220631097345	Babe Ruth wouldn’t make my town’s 0th grade travel team 😂😂😂 	{'place_id': '777dd5b3b30a625e'}
50521295	2021-02-08T21:51:05.000Z	1358896156827389963	 I’m a little over it. I still Travel much as I can. It’s a little disheartening not to see all the people working and Being joyful. That’s hurts. My Mental health is strong. It hurts me to see places closing and not being able to do certain things. That’s been brutal on me.	{'place_id': '00c39537733fa112'}
137789155	2021-02-08T21:36:47.000Z	1358892556554280962	  , my  has merchandise for sale. Are U looking for a  gift? Visit our website & check out our new sweatshirt — 𝙉𝙊𝙐𝙍𝙄𝙎𝙃𝙀𝘿 𝘼𝙁 , mugs, totes, aprons, tshirts, & hoodies too! ~&gt;  	{'place_id': '00c39537733fa112'}
25056022	2021-02-08T21:26:45.000Z	1358890033508417538	 Nice! It’s not the same anymore but still important to visit!	{'place_id': '01a9a39529b27f36'}
40591067	2021-02-08T21:22:36.000Z	1358888990439522304	 Hahaha I always made them wear them as well and they would always wear them when I went up to visit my aunt in Framingham	{'place_id': '011add077f4d2da3'}
891126938	2021-02-08T20:59:23.000Z	1358883147379793922	Okay two things: I have to visit Melbourne and get over the killer insects/animals. Why haven’t we followed Australia to freedom? 	{'place_id': '559cf1d51980ff42'}
771668058	2021-02-08T20:31:38.000Z	1358876160575340550	If you say you want kids in classrooms, you have to follow guidelines and wear a mask, socially distance, and not gather in large groups. And don’t visit some family member or friend that’s “safe” or “fine...they won’t have it”.   	{'place_id': '01a9a39529b27f36'}
321740014	2021-02-08T20:16:58.000Z	1358872472343482371	I’m really going through some shit right now... My life is not fun and I want to just fucking travel	{'place_id': '01a9a39529b27f36'}
1043964504483274752	2021-02-08T20:12:00.000Z	1358871221115445253	 the donuts sold by this franchises in NYC look ridiculously small, they are old , Boston cream or jelly almost without substance and the prices get 0-0% higher in the last 0 years!!😡😔 It’s a shame that every time I visit Europe they have such a beatiful, fresh	{'place_id': '01a9a39529b27f36'}
3123867002	2021-02-08T20:11:29.000Z	1358871093138833415	I need friends that wanna travel....	{'place_id': '00c39537733fa112'}
1349134188457426950	2021-02-08T20:02:33.000Z	1358868845042221057	Surf into the beginning of this week with a visit to our online store,   is the official home to the    &  A portion of all proceeds will be donated to the FDNY Foundation ( 	{'place_id': '00c39537733fa112'}
1009440197099040768	2021-02-08T19:35:08.000Z	1358861945890369538	Tired of living paycheck to paycheck, get a free health and wellness store today, visit	{'place_id': '011add077f4d2da3'}
1924904923	2021-02-08T19:28:21.000Z	1358860237042835457	💥Speed Training Giveaway ($0.0 value)Retweet+Follow ✅Speed Program✅Ladder✅Hurdles✅Foam Roller✅Massage Balls✅Cones✅Stopwatch✅Ankle BandsPerfect Pkg for Travel Programs0 Winner - 0/0  	{'place_id': '4b6a1f748c5219fa'}
1195361478238453760	2021-02-08T19:12:28.000Z	1358856238596038657	Thats the beauty of being a flight attendant, I can travel anywhere at the last minute	{'place_id': '00c39537733fa112'}
2675785703	2021-02-08T18:52:50.000Z	1358851300662861825	    He ordered test . He shut down travel from China. Democrats called it xenophobic. Seriously what would have someone else done . Lets say he should have shut down a week earlier.  How do you Trump haters blame every death. It's stupid	{'place_id': '00c39537733fa112'}
45091897	2021-02-08T17:54:16.000Z	1358836561425686530	 Ain’t nothing bittersweet lol. That’s damn near an all Black cast in Tampa. Shit was fly to watch.	{'place_id': '011add077f4d2da3'}
2805985965	2021-02-08T17:43:49.000Z	1358833930519130115	 Very true. For years, I wished there were programs at schools for production/backstage roles as there were for in ring & manager roles. Thanks be I was able to try, sometimes fail, watch others, and lucky enough to have people willing to let me visit & watch their product.	{'place_id': '002e24c6736f069d'}
745540429	2021-02-08T17:25:46.000Z	1358829389471973378	 Is this for domestic travel within Sweden? Bc that’s subject here	{'place_id': '01a9a39529b27f36'}
23698010	2021-02-08T17:22:27.000Z	1358828553668812800	Happy 0th Anniversary, Disney California Adventure!!! One of my favorite places I’ve had the pleasure to visit dozens and dozens of times since it’s opening year. Miss you!!! 	{'place_id': '00c39537733fa112'}
21469731	2021-02-08T16:23:56.000Z	1358813824778973184	"""This position is remote and may require post-pandemic travel (up to 0%)."" JOB ALERT | Civic Nation seeks Communications Manager - $0k to $0k  "	{'place_id': '01a9a39529b27f36', 'coordinates': {'type': 'Point', 'coordinates': [-74.0007613, 40.7207559]}}
3895821197	2021-02-08T16:19:01.000Z	1358812591410282502	  Have to meet up with you next time I visit	{'place_id': '01a9a39529b27f36'}
187012572	2021-02-08T16:16:23.000Z	1358811928177631232	"The federal public servant who was caught up in the international travel controversy that swept through Canadian politics following Christmas has given up her career with the government to pursue her career as a social media ""influencer""."	{'place_id': '01a9a39529b27f36'}
506730714	2021-02-08T16:11:38.000Z	1358810731324522496	It’s Monday! That means Stormy’s back in Bushwick today! Come visit her and Natasha for some fire cuts! ⚡️⚡️⚡️ @ Hairrari 	{'place_id': '011add077f4d2da3', 'coordinates': {'type': 'Point', 'coordinates': [-73.94017, 40.7087]}}
506730714	2021-02-08T16:11:02.000Z	1358810580648402945	It’s Monday! That means Stormy’s back in Bushwick today! Come visit her and Natasha for some fire cuts! ⚡️⚡️⚡️ @ Hairrari 	{'place_id': '011add077f4d2da3', 'coordinates': {'type': 'Point', 'coordinates': [-73.94017, 40.7087]}}
1316780704357847040	2021-02-08T16:09:22.000Z	1358810162723700740	 I work we got free pizza and puppies visit.  Cool.	{'place_id': '7356b662670b2c31'}
64688694	2021-02-08T15:56:27.000Z	1358806908539404288	Dear Congressman  please make more effort to fix health system. 0 hour visit at emergency service is $0. Who makes $0 in four hours but our hospitals do. Collaboration hospitals w insurance companies rip off America. 	{'place_id': '7356b662670b2c31'}
3124342311	2021-02-08T15:55:05.000Z	1358806567458648064	Today was THE day! A huge thank you to Mark and Ann from the  for their virtual visit to teach our  how to live a life with respect, determination, humility, and most importantly, courage. Feeling  to teach and live by Mark’s words everyday 	{'place_id': '94542c3c348faf28'}
4122305841	2021-02-08T15:52:59.000Z	1358806039613878280	Handmade Crystal RingVisit our website  	{'place_id': 'b46619b2722d9703'}
1150969998367698944	2021-02-08T15:39:31.000Z	1358802650914029568	 So we're going to need a vaccine to travel is that what your hinting at? Are pigeons going to need to be vaccinated? Birds can spread this virus to, along with the flu. You know covid will mutate every year. Then you'll say we need to stay up to date with our shots or else! 🧐	{'place_id': '00c39537733fa112'}
1662925963	2021-02-08T15:02:11.000Z	1358793252237901824	i gotta visit the northern lights	{'place_id': '002e24c6736f069d'}
114660927	2021-02-08T14:31:45.000Z	1358785594344812548	Can’t wait to visit my PA friends when we help get Fetterman elected ☺️ 	{'place_id': '00c39537733fa112'}
745540429	2021-02-08T14:23:45.000Z	1358783580932091904	0% of the US is vaccinated, ~0% have been infected already and Covid is down almost 0% here over the past monthThe CDC should NOT require Covid tests for domestic air travel. That it’s being considered is nonsensicalSafer air travel “In terms of perception” Pete says.... 	{'place_id': '01a9a39529b27f36'}
39675591	2021-02-08T14:21:40.000Z	1358783057046683652	Gm this is my latest travel vlog for   bday.I’d appreciate if you guys watched, comment, like or subscribedRiu Palace Bavaro|Traveling to D.R during Covid  via 	{'place_id': '002e24c6736f069d'}
950592782	2021-02-08T14:20:56.000Z	1358782872472215554	Registration begins on Monday, February 0th at 0pm. For more information, please visit  (0/0)	{'place_id': '10d2f6857b8ac152'}
1442576977	2021-02-08T14:15:53.000Z	1358781602260738048	Once I move my stuff Into storage just act like I died if u know me.. I’m finally a free being.. prepared for homelessness and cross country travel..	{'place_id': 'b74cebcb62a1a686'}
30175774	2021-02-08T13:59:50.000Z	1358777564223967234	Such an inspiring episode by    	{'place_id': '01a9a39529b27f36'}
367968266	2021-02-08T13:58:08.000Z	1358777135356383238	Becareful out there, very slippery by the wagons entrances and wagons are super cold too.    by the way not just this subway but other lines too. Mom becareful if you travel with kids. 	{'place_id': '01a9a39529b27f36'}
1336679192583430145	2021-02-08T13:09:45.000Z	1358764959887482882	    Smh lol if u knew me , u would never tell me to get out more, I travel regularly, & I'm promoter,   Its not judgemental, women half naked on social media is disgusting & self degrading. My lane is whatever comes across my timeline. I talk to young men & lead by example,	{'place_id': '01a9a39529b27f36'}
1360317896	2021-02-08T13:03:52.000Z	1358763477419048961	 and  for tourism recovery:  has become one of the hottest tech hubs in recent years.  looked at 0 French startups that thrived amidst the challenges brought in 0 and to look out for in 0.   	{'place_id': '01a9a39529b27f36'}
1150789123239792642	2021-02-08T12:42:17.000Z	1358758047850577920	We’ve got options....               	{'place_id': '011add077f4d2da3'}
1009440197099040768	2021-02-08T11:46:36.000Z	1358744032764190726	"Tired of singing the:""I DON'T HAVE ANY MONEY"" Blues, get a free CBD store today, limited time offer, visit"	{'place_id': '011add077f4d2da3'}
17965165	2021-02-08T11:35:23.000Z	1358741209632677888	 If they suddenly put a travel ban that no one could leave Florida for like a month (or ever again) Id almost be fine with it.  But that's the only if here.  What the fuck is Biden thinking?	{'place_id': 'eee6d4242f7819c2'}
1214596698258976768	2021-02-08T05:59:41.000Z	1358656727600791555	I never understood people who travel to other countries even cities and do basic shit like shop at the mall as if they didn’t already have an h&m back home. It baffles me.	{'place_id': '002e24c6736f069d'}
22971930	2021-02-08T04:32:39.000Z	1358634824546803715	  Worth a view.👀Lennon is holding Pan Am travel bag over BEA one.Pan Am execs were branding masters during an exciting time for aviation. Big bragging rights for this particular flight. Harrison has BEA bag.BEA would become British Airways a few years later.	{'place_id': '27485069891a7938'}
46829246	2021-02-08T03:39:17.000Z	1358621398240030727	 I live France .... I usually go every year ... when you go ... don’t just visit Paris - Lyon, France is amazing too ... it’s a 0 hour train ride	{'place_id': '858cec499f8adba6'}
973394483650973697	2021-02-08T03:38:41.000Z	1358621247299543048	Damn  must be saving a fortune on travel and lodging so they brought everyone on board for the    	{'place_id': '01a9a39529b27f36'}
25952444	2021-02-08T03:18:13.000Z	1358616094806835203	  Getting vaccine doesn’t prevent you from getting covid you’ll still get it if your body doesn’t fight it, it helps fight it but there is a chance you can still get it; a cough droplet can easily travel 0 feet in a open stadium	{'place_id': '00c39537733fa112'}
1036472717581709313	2021-02-08T03:00:00.000Z	1358611511606927365	 imma visit you in April	{'place_id': '011add077f4d2da3'}
41592008	2021-02-08T02:50:44.000Z	1358609180286885891	  Pet friendly travel from sea to shining sea! So many Covid puppies found homes this year. Sophie the Shihtzu traveled from Vegas to NYC.  	{'place_id': '0fc343f61214d000'}
1228703967175151621	2021-02-08T02:39:00.000Z	1358606224556773380	I did not vote today in the Ecuadorian elections. my parents are telling me I have to pay a fine whenever I visit Ecuador.... is this true ?	{'place_id': '00c39537733fa112'}
123823929	2021-02-08T02:23:26.000Z	1358602310050582530	We can’t travel, our schools are remote, school sports have been canceled and there is a pretty full stadium of fans at the Super Bowl all close together. I love football but this is disappointing and disrespectful to all who have spent the last year sacrificing  	{'place_id': '00c39537733fa112'}
350533556	2021-02-08T01:56:27.000Z	1358595518507741184	 I would love to visit you state. As soon as it turns blue. 🌊	{'place_id': '01a9a39529b27f36'}
14256006	2021-02-08T01:46:52.000Z	1358593106661277696	Why would Daft Punk ever leave France to fly to fucking Florida for a swampy American super spreader event?	{'place_id': '00c39537733fa112'}
1883718734	2021-02-08T01:42:18.000Z	1358591956738134020	Hey   Your half time show should have honored health workers and victims of Covid and not be a DARK visit to that oh so dark place where you all are going? Men with skeletal faces and RED jackets? But the music WAS good!  has talent!	{'place_id': '011add077f4d2da3'}
1100944267210571776	2021-02-08T01:36:55.000Z	1358590601688715266	 My Aunt married a British man. Soon after I turned 0, my Aunt/Husband planned to visit Harrogate, Edinburgh  & Glasgow Family members. My mom wanted me to go along. I negotiated a deal.   0 things: Visit Shakespeare’s apt, Ann Hathaway’s cottage and Parliament. Then Scottland 👍🏻	{'place_id': '011add077f4d2da3'}
1073530494988496896	2021-02-08T00:33:38.000Z	1358574676646244353	 Wya, I can host or travel to you now	{'place_id': '01a9a39529b27f36'}
38942981	2021-02-08T00:17:26.000Z	1358570599367520263	Since a lot people don’t have to travel to work tomorrow hopefully the Monday after the  finally becomes a holiday!	{'place_id': '002e24c6736f069d'}
30203368	2021-02-08T00:12:34.000Z	1358569372818829313	Oh this  commercial is doing that earlier space travel commercial NO favors 	{'place_id': 'bfde9c05b6e112fd'}
1007083909	2021-02-08T00:02:37.000Z	1358566868760551425	 Or did you travel by fax? 😂🤣	{'place_id': '00c55f041e27dc51'}
470419495	2021-02-09T23:46:05.000Z	1359287484279123973	Is it safe to visit Ga.? Not necessarily Atl.. I gotta go house shopping	{'place_id': '01a9a39529b27f36'}
760238605	2021-02-09T23:43:56.000Z	1359286945483026432	Why is the word “fuck” more offensive than the atrocities we visit upon each other?  Fuck civility.  Fight fascism. 	{'place_id': '647be94a01a83f96'}
29902828	2021-02-09T23:31:27.000Z	1359283804783972358	* same! if not married definitely to visit and perform STRUT. 	{'place_id': 'edd2aa964fa61ec9'}
180601880	2021-02-09T23:27:05.000Z	1359282701761712130	0 years ago. 🗽              @ Empire State Building 	{'place_id': '01a9a39529b27f36', 'coordinates': {'type': 'Point', 'coordinates': [-73.98536297, 40.74843498]}}
1062359644998393856	2021-02-09T22:59:48.000Z	1359275839003779075	 Thank you Asta. Hope you visit the W.,Tanager soon🙂	{'place_id': '01a9a39529b27f36'}
16362685	2021-02-09T22:52:37.000Z	1359274030306631684	 There are Starbucks in NYC, just none of them happen to be in my neighborhood right now. But yeah, I would love to visit Cali at some point!	{'place_id': '00c39537733fa112'}
1640981275	2021-02-09T22:47:23.000Z	1359272711068000260	NJDOC CLASS 0. We carry all the uniforms and equipment that are required for the academy. We offer great package prices, and are a NJ state approved vendor. Visit us for a one stop professional experience. We have over 0 years experience you can depend on!	{'place_id': 'e4faa50d904ab815'}
1150789123239792642	2021-02-09T22:28:34.000Z	1359267976483131396	We get it, you grow throughout your life and needs for housing style change. We’ve got you covered!.                 	{'place_id': '27485069891a7938'}
1732470085	2021-02-09T22:00:37.000Z	1359260945307025411	 Ummm my mother home that she grew up in...I can’t wait to visit again in July for my birthday	{'place_id': '01a9a39529b27f36'}
119081594	2021-02-09T21:10:37.000Z	1359248361392664582	I know my grandma is 0 and her memory isn’t quite what it is used to be...but does she have to ask me how my non-existent girlfriend is every time I visit? It’s like, come on Nana	{'place_id': '684ceb6509d97b6c'}
22149395	2021-02-09T20:59:30.000Z	1359245562403454976	See our latest Newark, NJ RN, Dialysis Nurse, Travel Nurse job opportunity and click the link in our bio to apply: Travel Dialysis Registered Nurse Acute RN- Newark NJ at Fresenius Medical Care  	{'place_id': 'fa3435044b52ecc7', 'coordinates': {'type': 'Point', 'coordinates': [-74.1723667, 40.735657]}}
167432446	2021-02-09T20:49:47.000Z	1359243119703846918	I be coming to visit my parents & all they do is nap and be glued to they phone on whats app. We just be sitting here spending quality time in silence lol	{'place_id': 'b8d145028b2571ac'}
275064785	2021-02-09T20:47:52.000Z	1359242635890851843	Travel With Me From NYC to DR  via 	{'place_id': '00c39537733fa112'}
18309597	2021-02-09T20:46:19.000Z	1359242243777982470	It's so sad seeing everyone just getting older. I really wish I could come and visit more often.	{'place_id': '011add077f4d2da3'}
884423902054809603	2021-02-09T20:35:38.000Z	1359239558995574790	Our Director Clinical Community Engagement, David, received his vaccine! He got his vaccine because he felt it required the least amount of effort to do the most good within the community. To learn more and sign up for an appointment, visit  	{'place_id': '23a06e5cc6d83009'}
1076193952133455874	2021-02-09T20:28:30.000Z	1359237761555914757	Fresh pressed juices! Visit our website to place an order. 	{'place_id': '01a9a39529b27f36'}
476444155	2021-02-09T20:07:46.000Z	1359232543632093187	All I want is take somebody's daughter, love her, take care of her, travel the world with her and give her like 0 kids. How is that a lot? How?	{'place_id': '01476f41278c3cd7'}
97269149	2021-02-09T19:55:59.000Z	1359229579064299521	 there's still time to correct your undemocratic behavior. It's the only way to  Democracy wins, Fascism can travel with  down any path he wants to lead them on. If it's to intimidate or threaten the US more, then he'll be held to account for tyranny.	{'place_id': '00c55f041e27dc51'}
1236118601452720129	2021-02-09T19:47:40.000Z	1359227484194168834	It’s a 0 day weekend for me and I have no date or travel plans 🥴	{'place_id': '002e24c6736f069d'}
1233908904079298567	2021-02-09T19:40:17.000Z	1359225626394255364	If I was rich I would deadass fly to DR, get some pica pollo and helados bon and come back home.	{'place_id': '01a9a39529b27f36'}
2797239879	2021-02-09T19:35:05.000Z	1359224319751032833	Weird shout out to my hometown of San Jose (not Costa Rica) today! 	{'place_id': '01a9a39529b27f36'}
3423406576	2021-02-09T19:13:09.000Z	1359218800491712516	Didn’t nobody take me to my official visit, my camps, my combines. Nobody flew on those flights with me. I sat in those rooms by MYself. Nobody held my hand a day in my life. I had to CREATE a team and support system that gave ME enough knowledge to make decisions on my own.	{'place_id': 'b0ea04d294343598'}
2669181985	2021-02-09T19:08:26.000Z	1359217610735427590	"A perfect  ""Rainbow Rose"" 🌹🌈🌹Buy prints and gifts when you visit our site. Shipping worldwide now available!! @ New York, New York "	{'place_id': '01a9a39529b27f36', 'coordinates': {'type': 'Point', 'coordinates': [-74.0064, 40.7142]}}
369705135	2021-02-09T18:58:24.000Z	1359215085361786883	I went to visit my parents over the weekend and we were talking about current events and it made me realize I pretty much don’t believe anything at all. If it’s on the news it’s not true.	{'place_id': '00c39537733fa112'}
2242638794	2021-02-09T18:35:34.000Z	1359209340209672195	It’s  &  has compiled a list of  testing sites throughout District 0. ⁣⁣⁣⁣⁣⁣👉 for more info. ⁣⁣⁣Don't see a testing site near you? ⁣⁣⁣⁣⁣⁣👩🏽‍💻 Visit  to access testing sites throughout  	{'place_id': '011add077f4d2da3'}
144398023	2021-02-09T18:22:04.000Z	1359205944618610691	I can travel this whole world. But nothing can fill my heart with more joy and happiness than these people. I know a bunch missing but y’all know the vibes. @ Roosevelt, New York 	{'place_id': '5e79986586911926', 'coordinates': {'type': 'Point', 'coordinates': [-73.5856, 40.6792]}}
1009958957753012224	2021-02-09T18:16:55.000Z	1359204647198720013	Now find your nearest vaccination site (you should be able to get vaccinated outside of your borough as long as you're a NYC resident and willing to travel as far) - 	{'place_id': '01a9a39529b27f36'}
223626448	2021-02-09T18:06:23.000Z	1359201996918689792	 Macron's government did however impose a ban on French people living abroad.We can't visit our loved ones despite being tested prior to boarding.	{'place_id': '01a9a39529b27f36'}
49759649	2021-02-09T17:28:48.000Z	1359192538310184963	 is Park Drive snow covered or clear for walking/running? What about the Bridal Path and Reservoir track, are they pretty snow covered and slippery? Just weighing a visit this weekend to the most beautiful park I know	{'place_id': 'fcf9c4a5d1459acd'}
36094572	2021-02-09T17:28:11.000Z	1359192385641566211	 Sam that is what all the travel experts are recommending to get airlines, hotel, cruise industries back any time soon.	{'place_id': 'f97108ab3c4a42ed'}
2183148738	2021-02-09T17:16:56.000Z	1359189550757773318	Welcome to the  Collins Vacation Rentals Bowl, presented by  These folks will help make your magical St. George Island vacation happen. Visit  to learn more.The matchup:(0)  🏀vs. (0)  🏈Poll below🔻  	{'place_id': '2ee2a9232db9851a'}
715426249	2021-02-09T17:05:05.000Z	1359186569308102656	This is also where the new stadium comes into play. It’s now possible to get some solid RPI programs to come north in early March, before the conference season starts. Will Florida come north? Probably not. But maybe Virginia, Michigan, Louisville or the like will come visit now	{'place_id': '1e87657b94063b58'}
40900881	2021-02-09T16:40:59.000Z	1359180504227020803	We need more volunteers for this Saturday’s  event! We’ll be helping our friends on the street throughout the east side! If you’d like to get involved visit  We can’t wait to serve alongside you this weekend, our outreach has been incredible! 	{'place_id': '27485069891a7938'}
16229683	2021-02-09T16:07:07.000Z	1359171981199966208	It's funny to watch Dallas housewives eat  in Richardson...that's just entry level exotic food for the 0nd generation who are trying too hard to be more Chinese than the people from China...wait till they visit a real Chinatown and try 😂  	{'place_id': '01a9a39529b27f36'}
42135903	2021-02-09T15:54:04.000Z	1359168699446493185	driving thru central park today feels the same as opening your fridge. no need to fly to NYC please stay home	{'place_id': '01a9a39529b27f36'}
45724974	2021-02-09T15:52:30.000Z	1359168305492295685	Our seniors should not have to travel 0, 0, 0+ miles during a health pandemic to access a lifesaving vaccine. NE  needs vaccination sites! 	{'place_id': '00c39537733fa112'}
3940851196	2021-02-09T15:47:05.000Z	1359166942880407554	What if you could visit with Sandra Markle? 0rd grade had a great author visit today! Ms. Markle did science magic, took us into her book closet & answered many of our questions! We even got a sneak peek at her next book!     	{'place_id': '6d4a758f41e684b0'}
950011618993344514	2021-02-09T15:46:20.000Z	1359166752316395524	Our summer Renegades Travel Program is open & ready to go.  Visit our website for more details at   Open to Northern Valley area players of all skill and experience levels. 	{'place_id': 'd0e8df0d2ae26e16', 'coordinates': {'type': 'Point', 'coordinates': [-73.98159, 41.01406]}}
378799677	2021-02-09T15:41:04.000Z	1359165426480070657	Someone wipe out my student loans so I can buy a van and travel the country PLS I am begging. This “working to pay for an apartment to live in that I’m not even at bc I’m working” life is not for ME	{'place_id': '64be9b322be0df48'}
4635231975	2021-02-09T15:36:03.000Z	1359164165668147213	Travel is life!	{'place_id': '00c55f041e27dc51'}
