404633223	2021-02-11T15:02:01.000Z	1359880377330974723	i will make it a priority to get out there and travel and shoot more once i get better. no excuses. i miss shooting and i miss exploring. but most importantly, i miss me.	{'place_id': 'dc4ad595a56393ac'}
1186752470690729985	2021-02-11T14:45:04.000Z	1359876111161819151	so I can travel travel 😌 	{'place_id': '01a9a39529b27f36'}
2803993319	2021-02-11T14:42:25.000Z	1359875443051134978	disabled have to travel long distances before finding a site if you can get an appointment and the shame is there are 0 hospitals both Montifiore that don't give vaccinations at either hospital. The Mayor calls it a game I call it systemic racism and thats the facts	{'place_id': '002e24c6736f069d'}
135541985	2021-02-11T14:23:28.000Z	1359870674832158720	 I really have to wonder about the endgame for politicians who want to keep us locked down despite science dictating otherwise.  and  are systematically destroying our great city. “The world reveals itself to those who travel on foot.” ~ Werner Herzog	{'place_id': '01a9a39529b27f36'}
2298888589	2021-02-11T14:13:48.000Z	1359868242462973956	I'm discussing “New York Travel”. Today, Feb 0 at 0:0 PM EST on  Join us! 	{'place_id': '01a9a39529b27f36'}
16874723	2021-02-11T13:44:16.000Z	1359860807648083974	White House looks at domestic travel restrictions as COVID mutation surges in Florida 	{'place_id': '01a9a39529b27f36'}
1081690339361071105	2021-02-11T13:28:13.000Z	1359856771003785217	  I'll  come  visit  you  and  we'll  do  the wild thing😉😉😘😘😘♥️♥️♥️😎	{'place_id': '00c39537733fa112'}
31066684	2021-02-11T13:23:09.000Z	1359855494865817600	Make a plan so you’ll be ready when it’s your turn. Our personalized, state-by-state guide will help you navigate when and where you are able to receive the COVID-0 vaccine. Visit  to make your plan.  	{'place_id': '01a9a39529b27f36'}
2174887676	2021-02-11T13:19:44.000Z	1359854634140119042	Visit The  Website At 	{'place_id': '01a9a39529b27f36'}
933757658640904192	2021-02-11T13:15:11.000Z	1359853491678810113	Happy Chinese New Year to all my friends! Welcome year of the Ox! We can look forward to better fortune and luck in friendships!             	{'place_id': '01a9a39529b27f36'}
1164904916487483394	2021-02-11T13:14:05.000Z	1359853213760057347	 Thank you for the follow! Not sure if I’ll visit Sweden. If you visit NYC, let me know so I trade you rate Pokémon! ☺️	{'place_id': '011add077f4d2da3'}
1209258427458949121	2021-02-11T13:01:26.000Z	1359850028651728896	 Wish him a short travel to a fiery hell	{'place_id': 'fa3435044b52ecc7'}
2730250464	2021-02-11T12:48:59.000Z	1359846897771552769	EV RIDER AUTO FOLDING SCOOTER          @ West Orange, New Jersey 	{'coordinates': {'type': 'Point', 'coordinates': [-74.2554, 40.7887]}, 'place_id': '96ddfc4bf2f1a80c'}
731803688	2021-02-11T12:17:26.000Z	1359838955739430915	 He was absolutely right that travel ban wouldn't stop virus by mid-March. It was much too late, as the China travel ban had been six weeks earlier.	{'place_id': '01a9a39529b27f36'}
1320607308234297345	2021-02-11T10:58:32.000Z	1359819100697096192	After that visit to the Dominicans, their lives had never been the same 	{'place_id': '011add077f4d2da3'}
1000235943503286272	2021-02-11T10:56:06.000Z	1359818490354536448	"Keeping the only  bar in NYC is vital! Black Queer Histories are also Black History and they often start at social corners! Visit  ""Foot The Bill"" initiative and buy our  designs! LL PROCEEDS GO DIRECTLY TO US "	{'place_id': '01a9a39529b27f36'}
30189340	2021-02-11T10:25:17.000Z	1359810731932319750	0 Travel Facts That Probably You Did Not Know (But You Want To Know)  	{'coordinates': {'type': 'Point', 'coordinates': [-74.0007613, 40.7207559]}, 'place_id': '01a9a39529b27f36'}
112500859	2021-02-11T09:51:23.000Z	1359802202529931265	0 Membership SpotlightThe SIEDC is grateful for the support of our members and sponsors.  We will be featuring SIEDC members who have signed up for 0 in this ongoing series.To join visit  	{'place_id': '00c55f041e27dc51'}
112500859	2021-02-11T09:51:10.000Z	1359802147483901954	0 Membership SpotlightThe SIEDC is grateful for the support of our members and sponsors.  We will be featuring SIEDC members who have signed up for 0 in this ongoing series.To join visit  	{'place_id': '00c55f041e27dc51'}
112500859	2021-02-11T09:50:58.000Z	1359802095864598533	0 Membership SpotlightThe SIEDC is grateful for the support of our members and sponsors.  We will be featuring SIEDC members who have signed up for 0 in this ongoing series.To join visit  	{'place_id': '00c55f041e27dc51'}
1009440197099040768	2021-02-11T09:34:27.000Z	1359797942484402178	Correction: visit  	{'place_id': '011add077f4d2da3'}
1009440197099040768	2021-02-11T09:23:01.000Z	1359795061886697473	Earn money from home by giving away free postcards like the one below, visit Click on CTFO 	{'place_id': '011add077f4d2da3'}
40951432	2021-02-11T07:40:52.000Z	1359769358122299394	From the archives 🗽••••••••             @ New York City 	{'coordinates': {'type': 'Point', 'coordinates': [-73.98366822, 40.76081647]}, 'place_id': '01a9a39529b27f36'}
48755145	2021-02-11T07:25:39.000Z	1359765526080274437	Fan girling in New York City.  in  fantastic show and trip to NY with  Ohhh to be able to travel @ New York, New York 	{'coordinates': {'type': 'Point', 'coordinates': [-74.0064, 40.7142]}, 'place_id': '01a9a39529b27f36'}
906940187439181827	2021-02-11T05:36:13.000Z	1359737986758418434	  I would love for you to come visit too!	{'place_id': '002e24c6736f069d'}
2297660780	2021-02-11T04:59:25.000Z	1359728726259433472	🚨 NEW MERCH ALERT 🚨 We just found an entire designer perfume collection including Prada, Burberry, & more! Make sure to visit our Waldwick, NJ mansion estate sale this weekend. Want more details? Text Ed @ 0-0-0. See you then! 	{'place_id': '0df743dc77b8dc10'}
517770840	2021-02-11T04:08:35.000Z	1359715931954573317	A man charged in the US Capitol insurrection requested permission to travel to Peru to get married	{'place_id': '01a9a39529b27f36'}
973335392	2021-02-11T03:26:11.000Z	1359705264459546629	 Next time I’m in Philly I’ll come visit you and I’ll tell you a story 😩😂🙏🏿It really was Once Upon A Time 😩 	{'place_id': '011add077f4d2da3'}
1251012582716116993	2021-02-11T03:11:20.000Z	1359701525183008771	finding out that bella can travel at the 0 weeks bby will be home next month 🥺🥺 	{'place_id': '00c39537733fa112'}
326798233	2021-02-11T02:43:19.000Z	1359694477351411713	 🥰 me tooo! So glad I got to FaceTime you the other night& cannot wait to visit when it’s safe	{'place_id': '011add077f4d2da3'}
137149554	2021-02-11T02:38:39.000Z	1359693301327290368	   Speak for yourself. This proud AMERICAN welcomes this Brit to visit this country, so fuck off.	{'place_id': '01a9a39529b27f36'}
1095847688686497792	2021-02-11T02:31:07.000Z	1359691405208260610	If you would like to make a donation you can visit our Amazon wishlist:  or donate to 	{'place_id': 'e9143a85705b4d40'}
119155159	2021-02-11T02:18:22.000Z	1359688196666372103	I paid my first visit last weekend to the African Burial Ground in Manhattan.It is the oldest and largest known excavated burial ground in North America for both free and enslaved Africans. It underscores the role slavery played in building New York.🔗 	{'place_id': '011add077f4d2da3'}
252783328	2021-02-11T02:15:46.000Z	1359687541495111688	The sun has just set behind northern Pennsylvania's Endless Mountains and the cold waters of the Susquehanna River wind through the January scene. For a 0K version of this picture and many like it, please visit  😎 	{'place_id': '01a9a39529b27f36'}
966820888946425856	2021-02-11T02:13:03.000Z	1359686859866128391	I’ll just have to walk through waterfront condos on Riverside Boulevard or fly to Sunny Isles Beach in Miami before I fall in love again. 😂😂😂Especially my building at One Manhattan Square.	{'place_id': '07d9db4bc3c87001'}
252687024	2021-02-11T01:19:07.000Z	1359673284661551105	NYC Advance Warning System: NYC Emergency Management Issues Travel Advisory for 0:0pm through 0:0am Thursday. Read full AWS here: 	{'place_id': '00c39537733fa112'}
2845336370	2021-02-11T01:01:40.000Z	1359668894890414080	 The college I teach at cancelled Spring Break (which is good to disuade travel, but it's gonna be a long slog!)	{'place_id': '011add077f4d2da3'}
28725944	2021-02-11T00:59:10.000Z	1359668264163553281	I ain't ready to visit Smith again one day and see yt folks treating it like a dog park and chilling on the plots like it's a picnic. They were already doing that before and it's just gonna get worse.	{'place_id': '002e24c6736f069d'}
3027955583	2021-02-11T00:51:04.000Z	1359666226746769415	   People in LI have been traveling to low income neighborhoods and taking vaccines from elderly living in low income areas that can not travel.They want to be able to cross borders go into low income neighborhoods to take but complain about low income going to their neighborhoods.	{'place_id': '002e24c6736f069d'}
1116951145409392640	2021-02-11T00:18:02.000Z	1359657913413894144	'Be the Difference, Make a Difference' is not just a  imperative for AIC Founding Member  It's a 0 days a year way of life. Read more on this exciting travel  in the Member Memo on our website.  📲  	{'place_id': '27485069891a7938'}
268586027	2021-02-11T00:04:01.000Z	1359654385362628612	White House looks at domestic travel restrictions as COVID mutation surges in Florida   	{'place_id': '1431759ce54802d2'}
2342401656	2021-02-11T00:01:25.000Z	1359653731021713409	The Watercolors Hoodie is here in unisex sizes S - XXXL. The unique mix of colors matched with the classic OC design brought this piece to life. Visit the website to purchase. 🥶  @ New York, New York 	{'coordinates': {'type': 'Point', 'coordinates': [-74.0064, 40.7142]}, 'place_id': '01a9a39529b27f36'}
352580700	2021-02-12T23:52:03.000Z	1360376150334259205	Like y’all wanna visit the famous Bronx steps like that shit ain’t in the fucking hood..and while most people are good in ever hood they go to..some of y’all are not..	{'place_id': '01a9a39529b27f36'}
185485574	2021-02-12T23:15:54.000Z	1360367053861978115	Until April 0, Eric Firestone Gallery in NYC will be featuring the exhibition “Mosaic is Light: Works by Jeanne Reynal, 0-0”. Reserve a time to visit: 📸 J.J. del Rosario / ©️  0 	{'place_id': '27485069891a7938'}
1290290872819515393	2021-02-12T22:41:26.000Z	1360358380376834050	    Fortunately, coyotes are infrequent visitors to Manhattan! During their breeding season (now) they often expand into new territories and we’ve had several visit Central Park in recent years. As long as folks & pets keep their distance, we can expect all parties to survive	{'place_id': '01a9a39529b27f36'}
34139148	2021-02-12T22:20:11.000Z	1360353031619891202	Open House Saturday February 0, 0:0-0:0pm. Come visit this fabulous new home. @ The Gandolfo Team at Century 0 American Homes 	{'coordinates': {'type': 'Point', 'coordinates': [-73.63945, 40.64007]}, 'place_id': '39411d80c106aa80'}
278636599	2021-02-12T21:53:39.000Z	1360346354812387330	Again, tonight's stream is brought to you by  Thanks for providing access to  and the boosted  app and Level 0  server we'll be using. Show them some 💜 and visit  and sign up for a free account.	{'place_id': '01a9a39529b27f36'}
15937071	2021-02-12T21:52:01.000Z	1360345942570975235	He didn’t know on Jan. 0th that Pence was in danger because... the impeachment that came weeks later happened too fast? 🙋🏻‍♂️Are you suggesting time travel is involved somehow? 	{'place_id': 'bc905fa51092b4d9'}
5977582	2021-02-12T21:46:54.000Z	1360344657444618243	 is fantastic. I’m gonna go to the Virgin Islands as soon as I feel like I can travel again.	{'place_id': '01a9a39529b27f36'}
20356655	2021-02-12T21:27:30.000Z	1360339772259127296	I'm discussing “Travel Industry - technology & disruption ” with  Oskar Bruening,  and  Wednesday, Feb 0 at 0:0 PM EST on  Join us! 	{'place_id': 'f461144fc197c3a0'}
304671643	2021-02-12T21:21:32.000Z	1360338271318982664	Goodbye to the rat, hello to the ox!🐮                   	{'place_id': '0fc2819af914f000'}
128711010	2021-02-12T21:08:30.000Z	1360334991687901186	Got a weird letter a couple of weeks ago, asking how my recent hospital visit went.I had not been.Now, there's a charge to my insurance for a visit to an emergency room.I had not been.I'm going to try to contact my insurance company...but it's weirding me out.	{'place_id': '01a9a39529b27f36'}
1355895481109516289	2021-02-12T20:42:19.000Z	1360328402843140099	Authentic Notary is here for your Notary Needs. Need a document notarize think of me I will travel to you. 💜⚖✒🗽 Book an appointment on our website.          	{'place_id': '002e24c6736f069d'}
304671643	2021-02-12T20:23:58.000Z	1360323783429660676	In honor of  Absalom Jones, born a slave in 0, he founded the the Free African Society in 0 & 0st black Episcopal congregation in 0.✊🏿           	{'place_id': '01a9a39529b27f36'}
886738653808144384	2021-02-12T20:01:13.000Z	1360318058959679491	The 0nd drop for our BHM sound off with  is now live. This week we are featuring London based DJ’s  &  🇬🇧Visit here to listen to these mixes & read the Q&A with   	{'place_id': '27485069891a7938'}
1090244790749446148	2021-02-12T19:41:58.000Z	1360313215264067586	Baal Lineage big opening TODAY at 0:0 UTC-0 (Brazil)Visit website (link in bio) and pre-download our client or patch!        em Link in Bio 	{'coordinates': {'type': 'Point', 'coordinates': [-74.0064, 40.7142]}, 'place_id': '01a9a39529b27f36'}
846532237801738243	2021-02-12T19:19:40.000Z	1360307604896034816	Marco Rubio responds Biden admin floating idea to limit Florida travel  via  Americans Rights are being Protected by Florida’s Leadership. Florida & SD a role model for the 🌎.	{'place_id': 'c418b0c82daabc44'}
368893556	2021-02-12T19:17:54.000Z	1360307157715984384	All couples are invited to join  for a virtual culinary event!Visit  for more info and registration. @ Trinity Christian Center 	{'coordinates': {'type': 'Point', 'coordinates': [-74.22994, 40.66372]}, 'place_id': 'b74cebcb62a1a686'}
22149395	2021-02-12T18:51:09.000Z	1360300426332020738	"Fresenius Medical Care is looking for teammates like you. See our latest RN, Dialysis Nurse, Travel Nurse, RN Roles job openings, including ""Travel Dialysis Registered Nurse - New York, NY"", via the link in our bio.  "	{'coordinates': {'type': 'Point', 'coordinates': [-74.0059413, 40.7127837]}, 'place_id': '01a9a39529b27f36'}
74622499	2021-02-12T18:21:38.000Z	1360292999092178949	Had to visit room 0 today with a few of my friends to write what I am grateful for! Thanks for the invite  that board is really filling up‼️    	{'place_id': '07d9c98a60882007'}
1414130274	2021-02-12T18:19:00.000Z	1360292335083479044	        Love the “..... and whatnot.” Popgen and favorite lunch spots in LAPopgen and Spotify playlistsPopgen and dream travel destinations Possibilities are endless! 🧬✈️🎶🌮	{'place_id': '01a9a39529b27f36'}
2716256951	2021-02-12T18:12:47.000Z	1360290772461961217	Got the chance to visit our    sister store today. Spent time w/ our NSOE’s and SD  Taking this dog with me!! 😄  	{'place_id': '0c3684797ad7967c'}
1360286701730598915	2021-02-12T18:09:25.000Z	1360289924315033602	A beautiful night in New York City 🌃 🌃🌃🌃🌃🌃🌃🌃🌃                  	{'place_id': '002e24c6736f069d'}
16013544	2021-02-12T18:08:07.000Z	1360289596962181127	 But Biden is about to ban travel to Florida. Lol	{'coordinates': {'type': 'Point', 'coordinates': [-73.96632248, 40.57657658]}, 'place_id': '2325e0629df41c93'}
2164819860	2021-02-12T17:58:38.000Z	1360287210440908804	We are running a SATURDAY schedule for Presidents’ Day, Monday February 0thFor Schedule details visit  	{'place_id': '0427846a106c0bd9'}
66213706	2021-02-12T17:51:39.000Z	1360285454315184129	Need custom stickers? Unlock a free $0 credit from  when you visit:  	{'place_id': '002e24c6736f069d'}
920858319610400769	2021-02-12T17:18:02.000Z	1360276991057006595	Trying to explain to people that you can’t spend the night or travel out of state even though you’re above 0 because your brown parents do not play that shit	{'place_id': '00c39537733fa112'}
1091741323940499457	2021-02-12T17:07:29.000Z	1360274338729979904	A moody departure of a recent surprise visit of a  A0 from JFK. This is another special collaboration, photo shot by me with a special edit by my friend Javi Sánchez of Barcelona!      	{'place_id': '01a9a39529b27f36'}
27935170	2021-02-12T16:51:44.000Z	1360270373783302146	I’m such a hopeless romantic. All I want to do is fall in love over and over again while we travel The World enjoying foreign cuisine, and exploring our love languages.	{'place_id': '01a9a39529b27f36'}
94414042	2021-02-12T16:46:49.000Z	1360269138967597058	I’ve attended many events at  and look forward to many more post  “The vital pulse of the arts and entertainment industry helps define New York, one of the key reasons that 0 million tourists visit the Big Apple annually” 	{'place_id': '01a9a39529b27f36'}
713104410	2021-02-12T16:46:36.000Z	1360269081308499970	Potential Ice Storm Threatens Tri-State Travel Danger, Power Outages This Weekend  	{'place_id': '01a9a39529b27f36'}
94414042	2021-02-12T16:06:46.000Z	1360259059446919172	Are you in the travel industry?      CC  	{'place_id': '01a9a39529b27f36'}
40900881	2021-02-12T16:04:33.000Z	1360258501554167808	We’re working hard today at our Times Square Community Center to provide fresh food for all those struggling in midtown! Please come and visit us at 0 West 0th St if your family is in need of assistance right now. We’re here to stand with you during this  pandemic! 🤝 	{'place_id': '0fc35952f9d46000'}
342448223	2021-02-12T15:53:58.000Z	1360255836342390788	“I wish I could freeze time so we could travel to the past and we could rewind.”	{'place_id': '01a9a39529b27f36'}
91216548	2021-02-12T15:47:33.000Z	1360254220465811467	 Click on the YouTube link or visit the Met site for more - all kids program online for the lunar new year	{'place_id': '01a9a39529b27f36'}
23208179	2021-02-12T15:32:48.000Z	1360250509584662528	It’s okay if you want to travel in the pandemic and it’s if you don’t want to , lol but me i ain’t Finna sit in this house waiting for a virus to disappear for the next 0 years 😭	{'place_id': '23a06e5cc6d83009'}
445986659	2021-02-12T15:21:47.000Z	1360247739485982721	Your biggest challenges provide your biggest rewards. Thank God it’s Friday and wishing you all a happy weekend! ❤️🤩 visit  	{'place_id': '01a9a39529b27f36'}
220343743	2021-02-12T15:07:19.000Z	1360244095541776389	Hey y'all! Help us build out our new channel  Please visit  and give us a follow. With my co-creators    &  you know you're getting creativity, drama, and more than a few spit-takes.	{'place_id': '01a9a39529b27f36'}
1349134188457426950	2021-02-12T14:29:38.000Z	1360234612694405123	Wrap-up the end of the week with a quick visit to our newly-formed  apparel shop! Sport your favorite   &  logo varieties! We’ve got you covered.  	{'place_id': '00c39537733fa112'}
837696233938497536	2021-02-12T14:26:50.000Z	1360233907506020352	📈Great store visit yesterday with  and the  Crew!!✅0 Signature PPV 📲 ✅0 Signature Upgrades 📲 Cross is Down with the  but we’re are taking over WESTCHESTER County !! 🗺 🗽 	{'place_id': '10c23468e3d79000'}
40900881	2021-02-12T14:26:24.000Z	1360233799704002560	“Remember that the happiest people are not those getting more, but those giving more.” - H. Jackson Brown Jr. We're always in need of help at our corps throughout New York! If you're looking for ways to serve your neighborhood during this pandemic, visit  	{'place_id': '07d9e535b8086004'}
321502536	2021-02-12T14:24:30.000Z	1360233319867252739	..do u and all the  staff promise to visit, Ms. Stokes at St. Lukes Hospital..0 months from this sunday, Mrs. Roscotto?..👶🎉👤         	{'place_id': '0b85103a6889009e'}
501203441	2021-02-12T14:18:47.000Z	1360231881137139713	Today is Pajama Day and a special Valentine’s Breakfast in  class! Even if we are remote, we can still have fun!!! Even had a special visit from  who had breakfast too! ❤️❤️❤️  	{'place_id': '1e11d8be00564690'}
15533854	2021-02-12T14:15:46.000Z	1360231123570335750	I typically enter Penn from the subway and never noticed this magnificent structure. Alas, it does not connect to NJ Transit, so will need to visit the remodeled interior tomorrow instead. 	{'coordinates': {'type': 'Point', 'coordinates': [-73.99499, 40.75107]}, 'place_id': '01a9a39529b27f36'}
14848078	2021-02-12T14:12:56.000Z	1360230409687203843	   That would be ideal but it needs special consideration given how popular the route is, to not create bottlenecks and let larger/faster packs safely overtake. Though perhaps they would just take a travel lane like they do now, instead of using the protected lanes.	{'place_id': '01a9a39529b27f36'}
444061116	2021-02-12T12:42:45.000Z	1360207715985989632	      For a long time now the sense of hopelessness of many had been strong. At the very same time as social media/education/travel have raised expectations enormously. This juxtaposition is an explosive dynamic esp in young males. Been raging since Independence	{'place_id': '01a9a39529b27f36'}
1097947197541367808	2021-02-12T12:20:57.000Z	1360202228724858886	Join us at 0pm EST for our first Club House Business Travel conversation  	{'place_id': 'b046074b1030a44d'}
101970219	2021-02-12T12:10:02.000Z	1360199482701455362	 Focus Helps Baystate Health Save $0,0 Per Visit in Risk-Based Population: 	{'place_id': '64be9b322be0df48'}
16223941	2021-02-12T11:18:21.000Z	1360186477561413633	...that is at or below freezing (0 degrees F), creating a glaze of ice on the ground, trees, power lines, or other objects. Even light accumulations can cause dangerous travel, while heavier amounts can cause significant damage to trees and power lines.  A significant...	{'place_id': '01a9a39529b27f36'}
2362407762	2021-02-12T09:28:12.000Z	1360158756001226755	Keeping travel incentives alive  	{'coordinates': {'type': 'Point', 'coordinates': [-74.0007613, 40.7207559]}, 'place_id': '01a9a39529b27f36'}
1009440197099040768	2021-02-12T09:13:25.000Z	1360155035963977728	 of having no money to pay your bills or have fun with your family? Start mailing FREE postcards from home, visit  click CTO. 	{'place_id': '011add077f4d2da3'}
1090608723905708032	2021-02-12T06:06:55.000Z	1360108101022670848	  Exactly, the further patients have to travel for drug treatment, the lower are their chances of success in treatment. Then why would  not place methadone clinics near where patients live?! 	{'place_id': '5f7f5e027ebb0a6a'}
39419107	2021-02-12T05:37:35.000Z	1360100719924281350	Celebrate Black History Month With These Free Virtual Events 	{'place_id': '011add077f4d2da3'}
1049484714682306560	2021-02-12T03:35:10.000Z	1360069913566736385	  Does it make you feel any better to know Myt was entirely benign? She's a little kid herself according to the museum. Her sarcophagus is currently off limits and I feel bad that I can't visit her a little better- I feel like I babysat her that year too.	{'place_id': '011add077f4d2da3'}
822049969943154689	2021-02-12T02:25:40.000Z	1360052421326757891	They went to farm up state. The get to run around and be happy. You can't visit, but they're happy. 	{'place_id': 'ca9ec2cf795362f4'}
39899632	2021-02-12T02:18:12.000Z	1360050542668619777	Super excited that my new Darley  venture is featured in   Starting this new adventure with a fellow female entrepreneur     	{'place_id': '01a9a39529b27f36'}
241362886	2021-02-12T02:03:57.000Z	1360046955540447233	To learn more about my accomplishments as an advocate and community organizer in city and statewide campaign wins led by the people - that can elevate the  visit  And  at 	{'place_id': '002e24c6736f069d'}
701933244623618048	2021-02-12T01:19:59.000Z	1360035892170219523	 How could I say no to that? I’ll visit you for horseback riding! 👯‍♀️🐎 🐎	{'place_id': '01a9a39529b27f36'}
1331769929394245632	2021-02-12T01:15:20.000Z	1360034722789875713	For  anchor  she has been reporting from around the world, add 🏔️ to her travel list.Norah: I'm going home.Captain Picard  Oh Norah, we are home. We live here now. On Mount Paramount. Isn't it glorious? 	{'place_id': '27485069891a7938'}
1346942144	2021-02-12T01:14:40.000Z	1360034553839157249	 : “Travel may become impossible and possibly life-threatening” 	{'place_id': '01a9a39529b27f36'}
2510841282	2021-02-12T00:58:07.000Z	1360030387196551170	Here I was in Xian- famous for Terracotta Soldiers and their outdoor street market in August 0. I can't wait until the pandemic is over so that we can officially travel again & explore new foods!        	{'place_id': '4b6a1f748c5219fa'}
633913421	2021-02-12T00:53:37.000Z	1360029256705863683	I lived in Dunedin for several years of my youth. Would love to visit cousins and watch football there with all the Canadian & New York refugees 🙏 	{'place_id': '00c55f041e27dc51'}
71595759	2021-02-12T00:20:49.000Z	1360021003762626560	I get a chance to travel  a little and  get some great pictures this weekend. Stay tuned.	{'place_id': '002e24c6736f069d'}
1359824264036294657	2021-02-12T00:10:22.000Z	1360018372298240000	Look forward to it every time I visit the chiropractor 	{'place_id': '00c39537733fa112'}
19257498	2021-02-13T23:53:46.000Z	1360738972142604291	Travel Column didn’t win Rachel Alexandria 	{'place_id': '00c39537733fa112'}
119518318	2021-02-13T23:25:55.000Z	1360731960839135235	Travel rig :     @ New York, New York 	{'place_id': '01a9a39529b27f36', 'coordinates': {'type': 'Point', 'coordinates': [-74.0064, 40.7142]}}
