1176500911	2021-02-13T23:12:02.000Z	1360728466656817153	Here's a listing of our restaurants to visit this Valentine weekend. Indoor dining is back, at 0%. Be safe and support local!    	{'place_id': '01a9a39529b27f36'}
22375981	2021-02-13T22:52:01.000Z	1360723432149671936	Had to visit the meow on her birthday! Happy Birthday to  Best bartender ever!  @ The Bayou 	{'place_id': '44453d2ae8e47fd5', 'coordinates': {'type': 'Point', 'coordinates': [-73.8358792, 40.9262048]}}
186258648	2021-02-13T22:44:30.000Z	1360721539587522563	The best compliment you can get is when your mom comes to visit you & says your place looks clean. That’s when you know	{'place_id': '011add077f4d2da3'}
1343293381405904897	2021-02-13T22:33:48.000Z	1360718846458486791	This is the line to check in to the TWA Hotel  no self check in and 0 people working the desk 😡    	{'place_id': '0fc29014d1946000'}
1294756727766867969	2021-02-13T22:30:15.000Z	1360717954556563456	Might visit 	{'place_id': '011add077f4d2da3'}
18618770	2021-02-13T22:13:42.000Z	1360713788048232451	The  nosh for a  visit — sweetness for the year ( pineapple tarts, onde onde (glutinous balls filled with palm sugar & topped with fresh coconut), Pandan cake) & homemade pork & chive  for good luck and fortune.   	{'place_id': '01a9a39529b27f36'}
78150104	2021-02-13T22:03:02.000Z	1360711103974670338	 Dakar/Accra/Hanoi/San Jose/Salvador Bahia/Managua/Okinawa/Taipei/Jeonju/Lisbon/Seville. Have to travel to each one to narrow it down.	{'place_id': 'fa3435044b52ecc7'}
5384642	2021-02-13T21:42:12.000Z	1360705860125790218	 It still drives me nuts that in that movie they were just like “oh right time travel yeah super easy” and then it never came up again 😂	{'place_id': '011add077f4d2da3'}
891716678509371392	2021-02-13T21:41:29.000Z	1360705679779115023	Check on your globetrotting friends who ain’t fool or selfish enough to travel abroad during a global pandemic. We’re not okay. 	{'place_id': 'fa3435044b52ecc7'}
46645097	2021-02-13T21:25:22.000Z	1360701623237021701	Take me away 🌍✈⛱.......      @ Sunshine 	{'place_id': '01a9a39529b27f36', 'coordinates': {'type': 'Point', 'coordinates': [-73.98812479, 40.76733111]}}
2499819646	2021-02-13T21:18:11.000Z	1360699815475240966	 The whole GOP is a dangerous disgrace, making a mockery of democracy, the rule of law, the Constitution...everything this country stands for. May karma visit each of them swiftly & bestow upon them the justice they deserve for choosing party over the well being of every American.	{'place_id': '01a9a39529b27f36'}
21275112	2021-02-13T21:05:17.000Z	1360696568853254144	" travelling with my 0 young kids at gate 0 at JFK airport. Flight is delayed bc they say ""pilot is late"" ""no updates available"". Please let us know what's going on."	{'place_id': '00c39537733fa112'}
22516507	2021-02-13T20:25:51.000Z	1360686645436104705	Sometimes u gotta travel somewhere alone and enjoy your own damn company w/ a lotta weed.	{'place_id': '011add077f4d2da3'}
3127594719	2021-02-13T19:45:04.000Z	1360676381772963848	You really want to get to know someone? Travel with them.	{'place_id': '011add077f4d2da3'}
446736121	2021-02-13T19:18:38.000Z	1360669730802044929	 Are we allowed to fly to other countries now with a US passport?	{'place_id': '01a9a39529b27f36'}
1328863947777249285	2021-02-13T19:07:09.000Z	1360666842965155844	I'm missing when friends visit and we go to lunch and order a bunch of food and drink Bloody Mary's and then do blow in the bathroom for dessert	{'place_id': '00c39537733fa112'}
3038029372	2021-02-13T18:59:22.000Z	1360664880546734084	Soar Scholar is proud to offer again two students from  Primary School a $0 USD scholarship towards their 0-0 high school tuition, books, and fees. Deadline April 0, 0. Visit Source  	{'place_id': '011add077f4d2da3'}
836996947856613376	2021-02-13T18:49:32.000Z	1360662405789941766	When you travel around the world if you do , be careful   &   , pushes over or not by Trump threats doesn’t justify the patriotism ingrained in your bloodline ,what would your forefathers do if you could bring them in as witnesses too attest too high crimes?  	{'place_id': '01a9a39529b27f36'}
1049171	2021-02-13T18:23:14.000Z	1360655788730114064	"""We need to confirm...our travel plans."" "	{'place_id': '44453d2ae8e47fd5'}
147516034	2021-02-13T18:12:31.000Z	1360653092006551552	Zona de amor                  @ New York, New York 	{'place_id': '01a9a39529b27f36', 'coordinates': {'type': 'Point', 'coordinates': [-74.0064, 40.7142]}}
147516034	2021-02-13T17:52:10.000Z	1360647971189125120	                    @ New York, New York 	{'place_id': '01a9a39529b27f36', 'coordinates': {'type': 'Point', 'coordinates': [-74.0064, 40.7142]}}
344266095	2021-02-13T17:05:47.000Z	1360636299716214786	Would love to visit sometime in the not too distant future !   (stock pic courtesy of photographer)  	{'place_id': '38718ccc91e76508'}
27771819	2021-02-13T16:11:50.000Z	1360622722611617792	It’s not Spree. It’s a scam. Also that photo was taken from a Garden of dreams visit to a hospital 0 years ago. 	{'place_id': '002e24c6736f069d'}
1064026080124854273	2021-02-13T15:49:49.000Z	1360617179641692161	  Nice try I suppose. Shortly after praising China he found out China was lying and the WHO was actively working to help China hide its culpability in the spread of Covid-0. He banned travel to and from China (allowing only US citizens to return home) and left the WHO.	{'place_id': '01a9a39529b27f36'}
142267469	2021-02-13T15:32:25.000Z	1360612802738724865	    I would too... but can we hope to return to travel safely in 0 ?	{'place_id': '01a9a39529b27f36'}
288937630	2021-02-13T15:29:19.000Z	1360612021331443714	Added it to my bucket list on  so I can stop by next time I’m in Atlanta.   Can’t wait to travel again! 	{'place_id': 'c2800db81ba22abc'}
2755819181	2021-02-13T15:01:46.000Z	1360605088109240321	See the thing is -- the virus is airborne! So the fact that students must be subjected to learning as if they're having a 0 min visit in a max security prison, makes the school to prison pipeline so much more -- visible. (Pun intended) 	{'place_id': '011add077f4d2da3'}
1081963083243966464	2021-02-13T15:00:26.000Z	1360604753512837120	DRIPPED DOWNNN 🥶 Exclusive accessories & apparel are  🥶❄️ — Visit my online boutique by clicking the  @ New York, New York 	{'place_id': '01a9a39529b27f36', 'coordinates': {'type': 'Point', 'coordinates': [-74.0064, 40.7142]}}
807512228	2021-02-13T14:50:11.000Z	1360602172270985217	FEBRUARY MARKS OUR 0 YEAR ANNIVERSARY! HAPPY BIRTHDAY TO US!! Come celebrate with us all month long! We're open Tues - Sun, 0PM to 0PM. For a current taplist, visit  	{'place_id': '002e24c6736f069d'}
42047224	2021-02-13T14:44:29.000Z	1360600739945598979	Valentine’s Day is in less than 0 hours but that’s ok! We’ve got you covered. Visit our website at  and check out our sweet treats! Curbside pickup on all orders available! 	
21643324	2021-02-13T14:25:26.000Z	1360595946011299843	 It says everything that despite this, McCarthy went to visit him weeks later to kiss the ring	{'place_id': '6813a7d84bf141d5'}
828445012304265219	2021-02-13T14:07:11.000Z	1360591351142780931	  They travel in a pack	{'place_id': '00c39537733fa112'}
227788561	2021-02-13T14:04:18.000Z	1360590624416792580	 I'd love to receive one! I've been having a rough time as of late, as I had to put my cat down and I've been separated from my boyfriend for 0 months because of the travel ban.	{'place_id': '00c39537733fa112'}
1597337148	2021-02-13T13:37:19.000Z	1360583837605126148	 please work on lifting border restrictions for US residents who are vaccinated. I am vaccinated and all I want is to visit my vaccinated grandparents in Toronto but the borders are still closed 😭	{'place_id': 'b46619b2722d9703'}
302950088	2021-02-13T12:28:04.000Z	1360566410162896897	ICYMI:  were back on the frozen tundra yesterday for first day of preseason practice. Hawks look to defend Big South title beginning March 0 when they travel to Robert Morris for spring season opener. 	{'place_id': '08838190f5c16b16'}
709699991758086144	2021-02-13T12:05:58.000Z	1360560847798628357	Just wanna dog i can travel with, cause the one i got now... is fucking MAWD	{'place_id': '00c39537733fa112'}
2345624612	2021-02-13T11:52:14.000Z	1360557388605116416	" 0 ""Stagecoach Mary"" Fields  0st black woman star rt carrier in U.S..   the fastest, never missed a day. If it snowed, horses were unable to travel, Ms. Fields delivered the mail with the mail sacks on her back. her town would close their schools on her BD.  Retired  @ 0 "	{'place_id': '00c39537733fa112'}
1009440197099040768	2021-02-13T10:58:11.000Z	1360543786825363457	Earn, money from home mailing free postcards, visit  click on CTFO. 	{'place_id': '011add077f4d2da3'}
236435263	2021-02-13T07:13:23.000Z	1360487214350802950	It is seriously on my bucket list to visit Paris during a protest.	{'place_id': '01a9a39529b27f36'}
3126937741	2021-02-13T06:39:53.000Z	1360478784009469953	😪 My heart goes out to everyone involved this is awful. We should not travel with snow on the ground 	{'place_id': 'c2270f3c90deeb93'}
129305568	2021-02-13T05:35:56.000Z	1360462689991094279	THIS IS INSANE. My song   💛➰ and I are on the same  playlist as  😱Ok, I know it might differ for each listener but hey I have a screenshot. Visit this link to play the playlist Spotify curated: ➡️  ⬅️	{'place_id': '01a9a39529b27f36'}
95303162	2021-02-13T05:03:10.000Z	1360454444421439490	 One of my favorite places to visit! Lmk if you need recommendations.	{'place_id': '07d9efa7da088001'}
28945033	2021-02-13T03:59:52.000Z	1360438516547747840	one of the things I like the most about this movie is the fact that it’s a sequel that’s not really a sequel. If you know what you’re looking for, then yes it’s a continuation. But it 0% works as a vacuum weird superhero time travel story with no prior knowledge required	{'place_id': '79f733f9fbf31f6b'}
423943090	2021-02-13T03:34:42.000Z	1360432182112706562	They claimed on this show that there was no such thing as other life because faster than light travel was impossible then turn the page. In 0 scientific proof of faster than light travel was found. Same this show! Ok people? Keep turning the page and accept all possibilities🌈	{'place_id': '01a9a39529b27f36'}
530792255	2021-02-13T03:14:15.000Z	1360427035089391616	Gong Hay Fat Choy 🧧Wishing a prosperous New Year and may the Year of the Ox bless you with health, wealth, and happiness.       	{'place_id': '01a9a39529b27f36'}
39899632	2021-02-13T02:30:06.000Z	1360415926139711488	            Love travel and Schitts Creek 🤷🏼‍♀️💕	{'place_id': '01a9a39529b27f36'}
81640100	2021-02-13T02:02:27.000Z	1360408968317796353	 COME VISIT	{'place_id': '00c55f041e27dc51'}
1306996616298102785	2021-02-13T01:59:04.000Z	1360408115716513792	imagine having an entire 0 bedroom apartment with a boyfriend who'd watch you sling dick to a nigga right on the couch & you want me to travel to you some 0+ miles away? after i just put half the rent up on payday. ain't no way in hell. ill beat my dick first!	{'place_id': '011add077f4d2da3'}
341528314	2021-02-13T01:32:55.000Z	1360401533922381828	My last year's Feb was chilly and cold...  I hope this year, you're mine to hold 😏   🇺🇸       @ Brooklyn Bridge 	{'place_id': '94965b2c45386f87', 'coordinates': {'type': 'Point', 'coordinates': [-73.9961493, 40.70542461]}}
142267469	2021-02-13T01:27:03.000Z	1360400057682571269	 I wish... but I am still in NYC, and cannot travel  . Is there a streaming scheduled. Anyway, all the best for the upcoming performances.	{'place_id': '01a9a39529b27f36'}
3293337327	2021-02-13T00:58:10.000Z	1360392790102978564	Billionaires like Bezos & Musk care more about space travel than benefiting their own employees. 	{'place_id': 'c67a441f9f6acc50'}
707569994062663681	2021-02-13T00:34:17.000Z	1360386778797080576	Today, 0.0.0 marks exactly one year since I’ve flown. My last plane ride was an uncertain descent into the 0 area code aka NYC on 0.0.0. I liked how those numbers worked out and was happy to be home but I miss travel, intensely. 	{'place_id': '27485069891a7938'}
42333137	2021-02-13T00:23:45.000Z	1360384129955733504	 i will! come visit us!	{'place_id': '01a9a39529b27f36'}
108166270	2021-02-14T23:55:12.000Z	1361101719753682951	We're trying all these restaurants out so we know where to bring friends when they visit. Or at least we thought. We just really like this one Japanese place and the BBQ place a LOT.	{'place_id': '00c39537733fa112'}
62862846	2021-02-14T23:51:33.000Z	1361100799628173332	Helsinki having heated sidewalks is so fly to me.	{'place_id': '00c39537733fa112'}
1352286202624409601	2021-02-14T23:33:47.000Z	1361096330668630018	Took my first visit walk around NYC with my human  we went down 0th Ave and then through Times Square. Boy chilly, but I was wrapped warmly with lots of treats.        	{'place_id': '10f7d07d9b169001'}
1179707024474550272	2021-02-14T23:04:54.000Z	1361089060614340608	  You need to know what you’re talking about before you talk about it stop trying to judge other people and worry about yourself or children did you visit or what children’s did you help	{'place_id': '00c39537733fa112'}
21407747	2021-02-14T23:01:55.000Z	1361088307959070723	I’ve driven this stretch many times in my life.  Very close to my hometown. Damn.   	{'place_id': '00c39537733fa112'}
147516034	2021-02-14T22:26:59.000Z	1361079518753079296	Freeeeeezin' cold                  @ New York, New York 	{'place_id': '01a9a39529b27f36', 'coordinates': {'type': 'Point', 'coordinates': [-74.0064, 40.7142]}}
1220021184319889408	2021-02-14T22:21:57.000Z	1361078252832509953	i have a couple food places i wanna try so bad but i dont cause i dont drive 😩😩... i really gotta visit these places tho deadass	{'place_id': '858cec499f8adba6'}
814942562070970368	2021-02-14T22:18:39.000Z	1361077420107960320	Everybody be pressed to come to NYC to visit TIMES SQUARE until they realize that na crackheads full that place😭	{'place_id': '01a9a39529b27f36'}
1259719414464884737	2021-02-14T21:00:06.000Z	1361057652407730177	WOW.... I WANT TO VISIT THIS UNDERGROUND CHURCH I NEVER WOULD HAVE THOUGHT ABOUT UNDERGROUND IM AMAZED THAT WHICH MAN HAS CREATED WHEN HE/SHE ALLOWS HISSELF/HERSELF TO BE VULNERABLE TO ALLOW CREATIVITY TO FLOW FREELY AS IN THESE MOMENTS OF VULNERABILITIES IS KEYS AND PATH	{'place_id': '002e24c6736f069d'}
990717649	2021-02-14T20:42:22.000Z	1361053190419054593	I William McCullough 0rd in Newyork City ( USA )  Delicious Iced Coffee to begin my Travel today. (  King ) (  Ace of Spade and King of Spade ) ( I Habibi -  I BeBella ) 	{'place_id': '01a9a39529b27f36', 'coordinates': {'type': 'Point', 'coordinates': [-73.99112517, 40.7588419]}}
65910119	2021-02-14T20:11:04.000Z	1361045314078199809	 I work for an ad agency that's focused exclusively on travel and destination marketing	{'place_id': '01a9a39529b27f36'}
216888457	2021-02-14T19:39:12.000Z	1361037293985947653	I love behind the scenes This is John DiMartino and I rehearsing last week for the show TODAY! Wont you join us at 0 pm EST Tickets $0Visit my website or LINKINBIO to grab ur livestream pass! 	{'place_id': '01a9a39529b27f36', 'coordinates': {'type': 'Point', 'coordinates': [-74.0090618, 40.7125746]}}
1050823058968203265	2021-02-14T19:31:19.000Z	1361035308683386883	 I miss u andrew, visit us soon	{'place_id': '011add077f4d2da3'}
742913791780900864	2021-02-14T19:27:02.000Z	1361034234102693891	0 years since Parkland and what has been done?  GAG paid a visit to the office of Rep. Nicole Malliotakis...      	{'place_id': 'c8cc2f5f5fe306fa'}
742913791780900864	2021-02-14T19:22:11.000Z	1361033011257630720	GAG paid a visit to the office of Rep. Nicole Malliotakis...      	{'place_id': 'c8cc2f5f5fe306fa'}
742913791780900864	2021-02-14T19:19:07.000Z	1361032241011453959	      GAG paid a visit to the office of Rep. Nicole Malliotakis... 	{'place_id': 'c8cc2f5f5fe306fa'}
363745484	2021-02-14T19:06:03.000Z	1361028950143750148	 Thank you for following me, right back at ya!	{'place_id': '01a9a39529b27f36'}
1192849628204548096	2021-02-14T18:38:11.000Z	1361021940920680452	 he ask you if you visit isarel ? I see you don’t Want to answer this question what’s wrong visiting is right I don’t understand without Israel is not going to be peace because he’s right is the key	{'place_id': '011add077f4d2da3'}
1343293381405904897	2021-02-14T18:33:04.000Z	1361020653365788677	The Centurion Lounge at  has a speakeasy hidden in the first floor. Pretty cool!        	{'place_id': '00c39537733fa112'}
396738651	2021-02-14T18:04:13.000Z	1361013392736157698	ppl on hinge really try to have u thinking their best travel story is getting kidnapped in an equatorial country???????	{'place_id': '011add077f4d2da3'}
1261337610309570564	2021-02-14T17:38:07.000Z	1361006823298506753	HOPEPrint Ph:  Location: LA .                       	{'place_id': '3be6e3e32603c621'}
29995316	2021-02-14T17:29:41.000Z	1361004700875816963	 Maybe I will. Still a little covid-hesitant to travel but I got my vaccine appointments so not out of the question. Let’s see how it plays out.	{'place_id': 'a227c629b631eea2'}
95269369	2021-02-14T16:42:31.000Z	1360992829489762308	I wish I could freeze timeSo we could travel to the past and we can rewind	{'place_id': '002e24c6736f069d'}
803458117799411713	2021-02-14T16:10:14.000Z	1360984704216875010	  You are a corrupt criminal & a disgrace. Get ready to visit your sweet trump daddy in prison with all the state charges coming. Or maybe you’ll have the cell next door. You are a treasonous coward & a co-conspirator to the incitement of insurrection. That’s your bio in history.	{'place_id': 'bf83670d90b7f0bc'}
1122224797457555457	2021-02-14T16:10:13.000Z	1360984702866370561	Nicole Benefield- A sustainable brand dedicated to simplicity and inclusion - for more info visit  or contact info 	{'place_id': '07d9e20187481003'}
1343293381405904897	2021-02-14T16:05:10.000Z	1360983431363100672	Good morning for   from the       	{'place_id': '00c39537733fa112'}
1343293381405904897	2021-02-14T16:03:20.000Z	1360982969750589441	Old school  Boeing 0 parked out on the tarmac at     	{'place_id': '00c39537733fa112'}
1343293381405904897	2021-02-14T16:01:34.000Z	1360982525573758976	Beautiful Airbus A0 taking off out of JFK this morning.       	{'place_id': '00c39537733fa112'}
993691880	2021-02-14T15:43:58.000Z	1360978096728518663	 Tania called fr  advanced tech she cud not get me internet service visit scheduled	{'place_id': 'b46619b2722d9703'}
153642236	2021-02-14T15:38:09.000Z	1360976631481987073	This, plus all that was covered in ’s visit to Freakonomics... “change it to reflect the 0st century,” to actually prepare our students for the jobs out there today. 	{'place_id': '011add077f4d2da3'}
960920161	2021-02-14T15:28:43.000Z	1360974257161961475	The many pauses & pivots in sports has eliminated and/or minimized required travel to jewel events in this traditionally busy 0Q window.   For the first time in years, I find myself home to celebrate  with my family and that’s an awesome silver-lining 	{'place_id': '011add077f4d2da3'}
103919118	2021-02-14T14:47:11.000Z	1360963804205641730	 Maybe you can be the exec producer one day for a site visit ;)	{'place_id': '01a9a39529b27f36'}
26403115	2021-02-14T14:43:19.000Z	1360962833077387265	   That’s on my list of places to visit!	{'place_id': '011add077f4d2da3'}
15941226	2021-02-14T14:34:46.000Z	1360960679285579788	All the X’s, O’s and  wishes from  and  !!!Grab a mask, grab your Valentine and visit the #❤️ofnewyork today!!!   @ Bloomingdale's NY 0th St 	{'place_id': '01a9a39529b27f36', 'coordinates': {'type': 'Point', 'coordinates': [-73.96765754, 40.7623309]}}
3169313744	2021-02-14T14:27:10.000Z	1360958768297705472	 Visit these agencies and speak to the people on the line. Tell them that you will run a more efficient agency.	{'place_id': 'f461144fc197c3a0'}
113252339	2021-02-14T14:25:46.000Z	1360958415141502976	 It’s all about time travel 🧭	{'place_id': 'fa9e955670752b3c'}
14827129	2021-02-14T14:05:15.000Z	1360953252095885316	 In addition to travel and spirits, I admire your weather reporting! Here’s to seeing non-stop sun and 0-plus temperatures soon!	{'place_id': '011add077f4d2da3'}
397400969	2021-02-14T13:42:54.000Z	1360947630596096007	 You need to visit nearby Mt. Tabor. Houses that will blow your mind	{'place_id': '27747238af7c459a'}
1173139357	2021-02-14T13:30:45.000Z	1360944569748250629	 Hey  church fans. Get to Birdt🐦wn to pray on Madis🇸🇰n Ave.       & visit  🥟h, and read the Strangeness of Truth. 	{'place_id': '002e24c6736f069d'}
26501786	2021-02-14T13:26:03.000Z	1360943387591999490	Getting a visit from home today, so excited to see a familiar face 🙌🏾	{'place_id': '00c39537733fa112'}
2343580758	2021-02-14T13:24:57.000Z	1360943110541443073	 Boys Hoops improves to 0-0 after defeating the Par Hills Vikings 0-0! Up Next : The Stangs will travel to MoTown on 0/0       	{'place_id': '00c606746b858396'}
1248207017598160896	2021-02-14T12:21:47.000Z	1360927214380974080	 Hi Rah-Fee—Will the inclement weather arrive Thursday late in the afternoon or evening ?   I surely hope so.  Have 0 travel from belleville to the Livingston Mall and my vaccine is 0 0:0pm. Thank you !!	{'place_id': 'a227c629b631eea2'}
1009440197099040768	2021-02-14T11:30:23.000Z	1360914278270779395	Great  ,Visit 	{'place_id': '011add077f4d2da3'}
385701680	2021-02-14T10:35:14.000Z	1360900402330353665	  i LOVE your new show! How I miss Scotland! And the haggis. So damn delicious! Thanks for creating this show so people like me can visit from my front room. I can't wait to come back for another visit. The show lifted and broke my ❤ at the same time.	{'place_id': '011add077f4d2da3'}
1107661872	2021-02-14T08:26:23.000Z	1360867973049815041	I want/need to visit my grandparents 🥺. I miss them but between Covid and their age/health I gotta keep it on FT	{'place_id': '011add077f4d2da3'}
2981859827	2021-02-14T07:23:12.000Z	1360852071931469824	Happy Valentine’s Day to all my friends and family out there. ❤️L❣️O❤️V❣️E.  🌆            🚢       📜🖋	{'place_id': '8479859139338fb7'}
959264353471123456	2021-02-14T04:47:06.000Z	1360812792190824449	im overdue for a doctors visit ! i know this vegan shit got me deficient somewhere 😂😂	{'place_id': '002e24c6736f069d'}
172480667	2021-02-14T04:24:51.000Z	1360807190966190088	I can't wait for my best friends to come visit me in NY so we can Broad City this bitch 😂	{'place_id': '011add077f4d2da3'}
76695351	2021-02-14T03:42:21.000Z	1360796495600095237	I’ve decided that my career ambition is to host a charity zoom drink & paint for  with  participating. And maybe a visit from  I think philanthropic competitive wet on wet painting is an idea who’s time has come. 	{'place_id': '00c39537733fa112'}
128059369	2021-02-14T03:42:09.000Z	1360796445981433858	 I am a New Yorker who has Buccee’s envy every time I go to Texas.  I think the kids have to spend more time there... when it’s safe to travel.	{'place_id': '01a9a39529b27f36'}
146525566	2021-02-14T03:09:12.000Z	1360788151476908035	I’m ready to visit a new city, perhaps Chicago...	{'place_id': '01a9a39529b27f36'}
65524531	2021-02-14T02:38:45.000Z	1360780489636929538	i just want to travel again	{'place_id': '80b4a4f48d3d0529'}
973598478793433088	2021-02-14T02:28:27.000Z	1360777898718867459	A couple of years back I commented on  Welcome To  fan made video on  (from my old account) that whenever I’d visit  I’d be listening to that song. Guess what?Right now I am in NYC listening to the song   🙏🍀😍😇 	{'place_id': '01a9a39529b27f36'}
44578937	2021-02-14T02:09:05.000Z	1360773023704449026	 Year0 Day0 in this alternate Earth..Aces are Wild..Errands..but first SelfCare..Trying Alcohol & Wine for the first Time..Family visit & Appreciation..Love has Arrived 💛..🧸  ..😘!      	{'place_id': '011add077f4d2da3'}
423943090	2021-02-14T01:35:00.000Z	1360764447380307969	The concept of time travel is just mental ability of my god souls mind mental lessons won of mental ability i will as a soul have to each place of just me place! think of selfs birth of this planet! Lesson won grants you a new miadus touch each win in lesson to grow never in ends	{'place_id': '01a9a39529b27f36'}
80984866	2021-02-14T01:23:46.000Z	1360761619140206592	  Hope this helps 🙂	{'place_id': '002e24c6736f069d'}
112500859	2021-02-14T01:18:00.000Z	1360760167869141000	0 Membership SpotlightThe SIEDC is grateful for the support of our members and sponsors.  We will be featuring SIEDC members who have signed up for 0 in this ongoing series.To join visit  	{'place_id': '00c55f041e27dc51'}
112500859	2021-02-14T01:17:47.000Z	1360760112172908544	0 Membership SpotlightThe SIEDC is grateful for the support of our members and sponsors.  We will be featuring SIEDC members who have signed up for 0 in this ongoing series.To join visit  	{'place_id': '00c55f041e27dc51'}
112500859	2021-02-14T01:17:34.000Z	1360760057433063426	0 Membership SpotlightThe SIEDC is grateful for the support of our members and sponsors.  We will be featuring SIEDC members who have signed up for 0 in this ongoing series.To join visit  	{'place_id': '00c55f041e27dc51'}
112500859	2021-02-14T01:17:21.000Z	1360760006891732992	0 Membership SpotlightThe SIEDC is grateful for the support of our members and sponsors.  We will be featuring SIEDC members who have signed up for 0 in this ongoing series.To join visit  	{'place_id': '00c55f041e27dc51'}
112500859	2021-02-14T01:17:08.000Z	1360759950318911490	0 Membership SpotlightThe SIEDC is grateful for the support of our members and sponsors.  We will be featuring SIEDC members who have signed up for 0 in this ongoing series.To join visit  	{'place_id': '00c55f041e27dc51'}
