23101413	2021-02-09T15:19:02.000Z	1359159881450856460	Happy National Pizza Day!  Choose your beach!   @ Vista Travel 	{'place_id': 'dfa88de1ece1a505', 'coordinates': {'type': 'Point', 'coordinates': [-74.33762, 40.59819]}}
65544386	2021-02-09T15:01:43.000Z	1359155522683953159	Haven’t seen a cow in a while. Gotta travel somewhere where I can drive, happen upon some cows and point and say, “Look! Cows!”	{'place_id': '011add077f4d2da3'}
110814433	2021-02-09T14:45:58.000Z	1359151559477780482	Hello from the  in                           	{'place_id': '01a9a39529b27f36'}
304671643	2021-02-09T14:39:42.000Z	1359149982461415426	A big 🙏to  for the shout-out!  is an antiquarian’s dream; 0 of its streets inspired Diagon Alley in the Harry Potter books.🇬🇧             	{'place_id': '01a9a39529b27f36'}
37980807	2021-02-09T14:38:04.000Z	1359149572212293636	          @ Lower East Side 	{'place_id': '01a9a39529b27f36', 'coordinates': {'type': 'Point', 'coordinates': [-73.982481, 40.716319]}}
2675785703	2021-02-09T13:46:19.000Z	1359136550387392514	  I got tired of Tom Brady with the Patriots keep winning .This was something else..Good story . Also a Trump supporter. I hope he blows off the visit to white house	{'place_id': '00c39537733fa112'}
950503611037048834	2021-02-09T13:45:21.000Z	1359136307864305669	Visit  to view the digital brochure for this distinctive Scarsdale estate! 🏡 @ Scarsdale, New York 	{'place_id': '8a9c191d2cf2e895', 'coordinates': {'type': 'Point', 'coordinates': [-73.787, 40.9921]}}
1009440197099040768	2021-02-09T12:54:09.000Z	1359123420655587335	So far this month, our team has recruited 0 new members. Congratulations to all the postcard mailers, visit,  	{'place_id': '011add077f4d2da3'}
19096158	2021-02-09T12:23:29.000Z	1359115704356790272	Food & Wine picks the best doughnuts in every state 🍩♥️🇺🇸	{'place_id': '00c39537733fa112'}
1009440197099040768	2021-02-09T11:18:59.000Z	1359099470277935104	If you can mail FREE postcards like this one,you can make money from home, please visit 	{'place_id': '011add077f4d2da3'}
25056022	2021-02-09T09:46:09.000Z	1359076111045562368	 Yep I’m planning to stay overseas for a long while until they let us travel again	{'place_id': '01a9a39529b27f36'}
25056022	2021-02-09T09:45:21.000Z	1359075906795560961	  I understand! I’ve taken my first dose of the vaccine because of fear I won’t travel (don’t judge please!!!🤣)	{'place_id': '01a9a39529b27f36'}
894914570522959873	2021-02-09T06:13:30.000Z	1359022592275976193	This  discussion on Beijing dialect 学说北京话 is properly curing my homesickness ❤️ Hope this is a regular thing till we can travel again 🙌🏻	{'place_id': '00c39537733fa112'}
322859571	2021-02-09T05:25:29.000Z	1359010512185544704	I can’t wait to visit home and get some sea food 😩	{'place_id': '01a9a39529b27f36'}
29916198	2021-02-09T04:54:35.000Z	1359002732506578945	Join the hottest travel group out right now Exclusivity Travel. Next destination Playa Del Carmen Mexico. Book your room now 	{'place_id': '00c39537733fa112'}
18137816	2021-02-09T04:47:05.000Z	1359000847326224387	Buttercup, you’re not in Columbia County anymore. A Winter home visit. @ New York City, N.Y. 	{'place_id': '01a9a39529b27f36', 'coordinates': {'type': 'Point', 'coordinates': [-74.00589108, 40.71270142]}}
723593107	2021-02-09T04:30:28.000Z	1358996664414048257	WARNING: Do not take if you are allergic to travel or suffer from a lack of imagination.   ✈️💊🌈 Your gift with purchase* now through Monday   @ New York, New York 	{'place_id': '01a9a39529b27f36', 'coordinates': {'type': 'Point', 'coordinates': [-74.0064, 40.7142]}}
1173739688345124865	2021-02-09T03:36:56.000Z	1358983190870974464	Vacation MOOD starting now 🛩  	{'place_id': '01a9a39529b27f36'}
409693411	2021-02-09T03:34:03.000Z	1358982465927475201	 I have a great acupuncturist who is a gem of a person, Buddhist east orientation who fixed a foot issues I have for a year in 0 visit, not all treatments worked as fast, but he is super safe and clean and has a sliding scale clinic on Saturday’s if needed.	{'place_id': '01a9a39529b27f36'}
409736345	2021-02-09T03:09:43.000Z	1358976342759510016	 Saw you on BronxTalk. I’d love to see Shuttle buses that travel across the Bronx and make one stop on each train line, in the Northern part of the borough.   B/D - Bedford,  Gunhill,  Gunhill and  Pelham Bay Park.  	{'place_id': '002e24c6736f069d'}
65524531	2021-02-09T02:23:49.000Z	1358964793865043968	my family finds it crazy that i want to travel and go away as much as i can. i want to make memories and have great experiences now. memories &gt; money 💯👏🏻	{'place_id': '80b4a4f48d3d0529'}
211531816	2021-02-09T02:09:28.000Z	1358961181663371265	Registration is still open for Pompton Lakes Riverdale Little League 0U Travel Softball Team for 0. There are still a few spots open.  	{'place_id': '0723adbed02c7153'}
1083131837780815875	2021-02-09T02:08:52.000Z	1358961028613169155	Registration is still open for Pompton Lakes Riverdale Little League 0U Travel Softball Team for 0. There are still a few spots open.  	{'place_id': '0723adbed02c7153'}
3857374283	2021-02-09T02:03:48.000Z	1358959756556312581	Well the depression monster has come to visit.	{'place_id': '01a9a39529b27f36'}
1358459646	2021-02-09T02:01:18.000Z	1358959127482019845	Thank you North Bellmore Public Library for a great virtual trip today. Miss Jane told us about all the things the library has for us, took us on an amazing tour & read 0 great stories! We are so excited to visit!!     	{'place_id': '897598c208cde261'}
55562909	2021-02-09T01:49:34.000Z	1358956172833738752	We celebrate 0 years this year! Est. 0COME & VISIT        @ Harrison, New Jersey 	{'place_id': '75ba1d57eca49b3f', 'coordinates': {'type': 'Point', 'coordinates': [-74.15291111, 40.74295556]}}
977228807873683457	2021-02-09T01:47:38.000Z	1358955687360032773	Out to get my haircut. And couldnt resist to come visit you  !  	{'place_id': '01a9a39529b27f36'}
19547723	2021-02-09T00:43:55.000Z	1358939650459652100	 If the  ever make the big game I will 0% be in attendance. After they win I will fly to Motown for the parade. No matter the cost or schedule. I will pause my entire life for it.	{'place_id': '011add077f4d2da3'}
112500859	2021-02-10T23:43:20.000Z	1359649181095313415	0 Membership SpotlightThe SIEDC is grateful for the support of our members and sponsors.  We will be featuring SIEDC members who have signed up for 0 in this ongoing series.To join visit  	{'place_id': '00c55f041e27dc51'}
112500859	2021-02-10T23:43:03.000Z	1359649109834145802	0 Membership SpotlightThe SIEDC is grateful for the support of our members and sponsors.  We will be featuring SIEDC members who have signed up for 0 in this ongoing series.To join visit  	{'place_id': '00c55f041e27dc51'}
777459	2021-02-10T23:42:02.000Z	1359648855529295874	Hi  please take me off your robocall list.  When travel resumes I will consider this.  Thanks in advance.  	{'place_id': '321b586a5c8bb311'}
839283383784071168	2021-02-10T23:36:35.000Z	1359647481638883333	      Maybe when COVID is under control we can go to  and visit her, here in  When she returns that is.	{'place_id': '27485069891a7938'}
49226953	2021-02-10T23:17:27.000Z	1359642668792508420	 your not the one to judge trump he is America’s president just because you had a few who went to visit the capitol doesn’t make Trump culpable of their behavior your an idiot just like pelosi and Schumer	{'place_id': '00c55f041e27dc51'}
972862322111901696	2021-02-10T23:02:30.000Z	1359638905956544512	 I have to travel so far from my house, just for this food. And I can’t wait. I’ve been thinking about it since I picked it up.	{'place_id': '002e24c6736f069d'}
897800636099690497	2021-02-10T22:04:08.000Z	1359624217038360578	Visit The Ever Blower Brownstone and have ritually-slaughtered, delectable roof garden beef rump. Lavishly accompanied by Bear Mountain cherimoya alongside a cup of  foam	{'place_id': '011add077f4d2da3', 'coordinates': {'type': 'Point', 'coordinates': [-73.9459427, 40.6957992]}}
431737598	2021-02-10T21:54:07.000Z	1359621697285074949	I love to draw places I've never been. I’m momentarily transported from my New York studio to somewhere warmer. I'm sure I'll visit Capri someday. I'll take a morning ferry from Naples. Sit on the sand and paint the faraglioni. Until then I'll have to settle for this commission. 	{'place_id': '01a9a39529b27f36'}
702394792	2021-02-10T21:17:40.000Z	1359612522245013511	I wish I had friends who could come and travel with me with short notice :(	{'place_id': 'b046074b1030a44d'}
1101178249181384710	2021-02-10T20:16:30.000Z	1359597131460452353	 Juniors!Are you eligible for the QuestBridge College Prep Scholars Program?The application is now open!Awards include full scholarships to summer programs, up to $0,0 for a laptop,essay feedback, and more.Visit  to learn more and apply. 	{'place_id': 'fa3435044b52ecc7'}
2329390400	2021-02-10T20:04:14.000Z	1359594044532400134	Cue  🗣🎶”I’m from Neeeeww Yooooooooooork”💃🏾💃🏾🎶😅 In case you missed it, here’s a clip from ’s appearance on the  Aired on  0/0/0 on the  For more info., visit  	{'place_id': '00c39537733fa112'}
707618503533182979	2021-02-10T19:58:50.000Z	1359592683250077698	Paying a visit to ‘s district! Hi Samy! 🤗  	{'place_id': '011add077f4d2da3'}
531916677	2021-02-10T19:35:20.000Z	1359586769235288069	Reminder that you can call 0-0-VAX-0-NYC or visit  to schedule an appointment. More appointments will become available as the City receives more vaccines.  	{'place_id': '07d9f5b998c82003'}
1185980776917225472	2021-02-10T19:34:51.000Z	1359586649089441795	✈️ TRAVEL DATES:Atlanta, GA: Feb 0nd-0thLos Angeles, CA: Feb 0th-Mar 0st     	{'place_id': '002e24c6736f069d'}
19696169	2021-02-10T19:21:35.000Z	1359583310335344641	". Set the standard and extend airline credits for customers for the duration of the  I was told by a supervisor (""Alisha"") that she could not grant my extension. Great for your bottom line, but what about your corporate responsibility?   "	{'place_id': '011add077f4d2da3'}
19269539	2021-02-10T19:19:47.000Z	1359582855723184132	Attempted to do my first speech therapy session via video visit this morning. SLP says I need to be seen in person. So now it’s first speech therapy session take two! 🗣	{'place_id': '01a9a39529b27f36'}
560690510	2021-02-10T19:15:30.000Z	1359581779930316800	I got my first Dermaplane facial yesterday and my skin feels so soft & rejuvenated. First time I’ve felt pretty in my skin in a long time, I am now a big fan of dermaplane and will recommend it to everybody I know who could benefit from it visit Touchbynat on IG for her services 	{'place_id': '01a9a39529b27f36'}
254415475	2021-02-10T18:59:16.000Z	1359577694153945092	this is why i travel alone to get away from everyone and everything	{'place_id': '002e24c6736f069d'}
2242638794	2021-02-10T18:14:42.000Z	1359566476374646789	(0/0) Want to have your voice heard? Become a local leader by running for a seat on a Community or Citywide Education Council! ⁣⁣Visit  to learn more about eligibility, how to complete your application, and more!⁣ 	{'place_id': '011add077f4d2da3'}
256403518	2021-02-10T17:39:43.000Z	1359557675697254401	Travel to so many places you can wake up and forget where you are	{'place_id': 'b74cebcb62a1a686'}
501203441	2021-02-10T17:25:52.000Z	1359554189211410433	After a morning of remote learning with  learning about fun winter activities and the Lunar New Year, Judah decided to take matters into his own hands and pull out his loose tooth! Guess we are getting a visit from 🧚‍♂️ tonight 😊   	{'place_id': '1e11d8be00564690'}
889883458855677952	2021-02-10T17:23:12.000Z	1359553518651252747	Starts next Saturday, 0/0! Visit  to learn more and sign up! $0 off w code ITSTIME             	{'place_id': '011add077f4d2da3'}
14535651	2021-02-10T16:52:08.000Z	1359545700476981251	 Ughhhh hate you! We are having a brutal winter this year. And normally in March I go visit my sister in FL but this year I’m not 😭😭😭 	{'place_id': 'b45ae2b5def8048f'}
1017156917121208320	2021-02-10T16:48:03.000Z	1359544671966556166	"Honored to have been invited to my ""0nd"" Rubio TOP 0 Invitational Camp. Last year I was 0 of only 0 Class of ‘0 Long Snappers to be invited out of 0 attendees. At last year's  TOP 0, I won the Day 0 Championship. Visit  for highlights. "	{'place_id': 'c5e2e95296cb121d'}
2836409157	2021-02-10T16:42:10.000Z	1359543192031539212	 Two reasons, one the Power, the other the fear that power will be taken away. They are so scared Trump will form his own party and take the base with him, splitting the Republican Party. That’s the reason McCarthy went to Florida to visit his Daddy🙄	{'place_id': '01a9a39529b27f36'}
25684933	2021-02-10T16:30:27.000Z	1359540243033120771	❄️ Happy Wednesday! Visit Gertrude NYC for LIVE music and the best baked goods in New York City.  	{'place_id': '01a9a39529b27f36'}
1044610748167725056	2021-02-10T16:28:02.000Z	1359539636071260167	A middle aged woman walked into my building surprised that we have so many doctors. She then proceeds to tell me “see i didnt know you had all these doctors here cause i only visit the throat and ass doctor” 😳😳	{'place_id': '00c39537733fa112'}
15817884	2021-02-10T16:02:20.000Z	1359533164956422151	 The download counts when the part of the audio file where the ad is downloaded. Only the IP Address and mobile user agent is sent back. Podcast metrics are moving more towards connecting the IP address of the download to a future action such as a purchase or website visit	{'place_id': '011add077f4d2da3'}
351139360	2021-02-10T15:28:23.000Z	1359524623344431108	  Can’t wait to be able to travel again and hit them up (and ALL the breweries!)	{'place_id': '011add077f4d2da3'}
2343580758	2021-02-10T15:26:34.000Z	1359524167318708230	 Boys Hoops (0-0) defeats Mount Olive 0-0! Up Next:  will travel to Morris Knolls on 0/0 at 0PM        	{'place_id': '00c606746b858396'}
275112709	2021-02-10T15:21:31.000Z	1359522892954947584	"So happy to be doing more episodes of ""The Chair"". Spent the last few days @ St. Patrick's Cathedral in NYC.  We've shot over 0 episodes & next month will mark 0 years on this amazing endeavor. Blessed to have been involved in such a project & to work & travel with a great crew. "	{'place_id': '1076f9d811141005'}
542653859	2021-02-10T14:56:16.000Z	1359516539997872128	✈️Traveling cloths seem to tie dye sweatsuits these days  	{'place_id': 'fa3435044b52ecc7'}
1284168002498367488	2021-02-10T14:16:19.000Z	1359506486653812738	Please go visit tonight’s stream she’s amazing 	{'place_id': '011add077f4d2da3'}
1223075246	2021-02-10T13:18:56.000Z	1359492045610614785	" When Susan was with Chloe, Susan said ""wish Brady well for me"" as if she hadn't seen Brady, but she did visit him only 0 episodes ago. Did the writers forget that?"	{'place_id': '876ed0bcf9594134'}
1296069528925986817	2021-02-10T13:14:07.000Z	1359490834211733504	 I may have to come pay you a visit	{'place_id': '011add077f4d2da3'}
1009440197099040768	2021-02-10T12:54:47.000Z	1359485969167245313	Visit: 	{'place_id': '011add077f4d2da3'}
1009440197099040768	2021-02-10T12:52:38.000Z	1359485427284127746	Today schedule:A. 0 to 0pm, work hard to make the boss rich.B. 0pm to 0 pm, start pointing people to your free website, visit Click on CTFO 	{'place_id': '011add077f4d2da3'}
135541985	2021-02-10T12:38:23.000Z	1359481840881516544	 “The world reveals itself to those who travel on foot.” ~ Werner Herzog	{'place_id': '01a9a39529b27f36'}
1009440197099040768	2021-02-10T10:11:37.000Z	1359444905475645440	If you can point people to a free website or mail a postcard, you can earn money from home, visit,  	{'place_id': '011add077f4d2da3'}
16874723	2021-02-10T06:14:22.000Z	1359385198765432834	Recovered from Covid? You may be able to travel without a vaccine passport 	{'place_id': '01a9a39529b27f36'}
16874723	2021-02-10T05:46:17.000Z	1359378130700492801	Airbnb Hosts Can Request Guests' Health Information Before Checking In 	{'place_id': '01a9a39529b27f36'}
474482756	2021-02-10T04:30:54.000Z	1359359161436426240	I wanna go visit but idk if they’ll even remember me	{'place_id': '01a9a39529b27f36'}
838892076095918080	2021-02-10T03:19:47.000Z	1359341264332861442	 War criminals briefings!Atleast, they cannot travel to 0 countries.	{'place_id': '00c39537733fa112'}
1074287190	2021-02-10T02:29:16.000Z	1359328553532284928	 Hotels. I remember those. Travel was great, wasn't it?	{'place_id': '8739d0bab792509d'}
2971453463	2021-02-10T02:08:37.000Z	1359323352989634563	 Do you ever visit NYC?	{'place_id': 'b46619b2722d9703'}
352580700	2021-02-10T01:59:45.000Z	1359321122441990149	“Black American and Asian Solidarity Throughout History” with  and August Wilson Room - Theatre, Film, TV, Travel, Politics. Today, Feb 0 at 0:0 PM EST on  	{'place_id': '01a9a39529b27f36'}
1358981062345523200	2021-02-10T00:18:55.000Z	1359295748194598916	Say Hello 👋 to ™ straw. Say BYE to plastic! We provide you fully  and home  straw that functions and feels JUST like traditional straw! Visit our website to request free sample!     	{'place_id': '011add077f4d2da3'}
62350999	2021-02-10T00:08:01.000Z	1359293005560184838	 UPPITY? That ought to be a automatic visit to Twitter jail.	{'place_id': '00c39537733fa112'}
2242761	2021-02-10T00:03:52.000Z	1359291958578065411	Oh hahah my travel expenses are $0. Awesome.	{'place_id': 'b046074b1030a44d'}
897800636099690497	2021-02-11T23:46:28.000Z	1360012355757895681	Visit The Band Sisters - super-sized, finger-licking prison farm raven terrine	{'coordinates': {'type': 'Point', 'coordinates': [-73.96420131, 40.69787423]}, 'place_id': '011add077f4d2da3'}
424586525	2021-02-11T23:44:49.000Z	1360011941452926976	Happy Lunar New Year Eve! After 0 weeks, my parents are finally COVID negative, and they were able to visit me in New York! It was our first time celebrating the holiday together in 0 years. We made dumplings :) 	{'place_id': '01a9a39529b27f36'}
813422719232516096	2021-02-11T23:31:39.000Z	1360008628095303686	 Visit me	{'place_id': '011add077f4d2da3'}
567459938	2021-02-11T23:16:00.000Z	1360004689685807107	  I think Molly was being hopeful and I am sure she will adjust her travel plans to the conditions prevailing in July.	{'place_id': '00c39537733fa112'}
803639496386355200	2021-02-11T22:50:28.000Z	1359998266725830657	    When you visit 🇪🇸 though you don’t get the sense that they are in such a hurry	{'place_id': '0f6d9c748d8af8b4'}
3027955583	2021-02-11T22:49:34.000Z	1359998040208203778	 Bye CVS I am taking my buissness across the street to Walgreens. If Walgreens bans my pillow I will take my buissness one block down to Jack's and so on. I will not hesitate to travel across the street to avoid stores that ban My Pillow.	{'place_id': '002e24c6736f069d'}
62862846	2021-02-11T22:30:30.000Z	1359993240536166401	 My left side on the regular ones stopped working like 0 months in using it and it’s hard to get a time to visit the Apple store smh	{'place_id': '011add077f4d2da3'}
1337958340014592001	2021-02-11T22:19:26.000Z	1359990456956911617	 Of course he would. He lucky Fred Hampton Jr didnt pay him a visit	{'place_id': '011add077f4d2da3'}
3023363075	2021-02-11T21:23:35.000Z	1359976398467829760	 Wonderful  ! You have an open invitation to the TMALS family. We are so proud of you and all you represent to our community...your visit brought all of us joy today at a time we really needed it. Keep it coming 😊🍽	{'place_id': '00c39537733fa112'}
633913421	2021-02-11T21:11:19.000Z	1359973312420544516	Not a good travel poster this 	{'place_id': '00c55f041e27dc51'}
15996789	2021-02-11T20:43:44.000Z	1359966372344791042	 NZ is a special case. It’s surrounded by ocean so all travel in and out is trivially controllable.I can say one thing though: Only SOME world leaders understand exponential growth. 	{'place_id': '34030d071fb1e14f'}
993245107821465600	2021-02-11T20:08:06.000Z	1359957402490134530	  Business travel never the same again. Not even close. And that’s what pays the bills for airlines	{'place_id': '01a9a39529b27f36'}
1688380896	2021-02-11T20:05:31.000Z	1359956755061555208	🗓️ REMINDER: NYC public schools will be closed tomorrow Friday, February 0, 0 in observance of ￼. There will be no remote or in-person learning. Meal hubs will offer free meals from 0pm to 0pm. Visit  to find a location near you. 	{'place_id': '002e24c6736f069d'}
2374079065	2021-02-11T19:46:48.000Z	1359952044350660613	Our Traffic Safety Officers stopped by our Senior Center on Rockaway Boulevard to hand out Flyers again! Great community visit.     	{'place_id': '11dc584895d4c005'}
3679404797	2021-02-11T19:42:45.000Z	1359951022966394883	Our own very fabulous 0nd grade teacher Ms. Hillery received a special appreciation visit from The Bachelor !!!!! !!!! And TMALS got a shout out as well😊😊😊❤️❤️❤️ Thank you  	{'place_id': '01a9a39529b27f36'}
40900881	2021-02-11T19:09:20.000Z	1359942614959722502	This month of  gives you a chance to get out there and make a lasting difference in NYC, especially if you've never volunteered in this way before! The next outreach is happening in two days on the east side. If you'd like to help out, visit  👍 	{'place_id': '27485069891a7938'}
1346942144	2021-02-11T19:00:37.000Z	1359940423020593152	DO NOT TRAVEL in Austin, TX area. Freezing rain is a real threat! 	{'place_id': '01a9a39529b27f36'}
17578324	2021-02-11T18:50:24.000Z	1359937851144691714	Paid a visit to the  headquarters yesterday. 🦍 @ Bronx Zoo 	{'coordinates': {'type': 'Point', 'coordinates': [-73.87963096, 40.8480663]}, 'place_id': '002e24c6736f069d'}
513663188	2021-02-11T18:21:40.000Z	1359930618461777921	I have all the fenty skin products and love them but I can justify buying that travel toothpaste size eye cream for $0	{'place_id': '011add077f4d2da3'}
808716329398181888	2021-02-11T17:40:34.000Z	1359920275022880771	Today I received my first dose of the vaccine... it didn’t hurt at all!  Sign up to get yours too! Visit   	{'place_id': '07d9c93003c86002'}
1090608723905708032	2021-02-11T17:37:57.000Z	1359919615950934018	   Please also address the issue that methadone dispensing facilities are highly unevenly distributed in NY State. A more well throughout locational strategy will help so patients don’t have to travel so far to get treatment. 	{'place_id': '5f7f5e027ebb0a6a'}
963764892342935552	2021-02-11T16:46:36.000Z	1359906696001433609	Beginning February 0, New Yorkers with certain underlying conditions will be eligible to receive the vaccine and can begin scheduling their appointments on February 0th!To determine eligibility and schedule an appointment visit    or call 0-0-0. 	{'place_id': '002e24c6736f069d'}
152448004	2021-02-11T16:38:53.000Z	1359904752121839620	Sometimes when body dysmorphia comes to visit I just send him my latest underwear selfie	{'place_id': '01a9a39529b27f36'}
1026968186	2021-02-11T16:37:08.000Z	1359904313477324801	0 days away from my campaign kick-off.  Looking forward to seeing my friends, family and supporters. Visit Or email info to rsvp.     	{'place_id': 'b87b05856ab8dbd8'}
334494122	2021-02-11T16:19:09.000Z	1359899786376343555	 I lived in Texas for a bit and I visit regularly. Inch of snow destroys them. They have no understanding of how ice works. If they can do 0 they're doing 0	{'place_id': '00c39537733fa112'}
3246501357	2021-02-11T16:17:45.000Z	1359899436034510849	🚨 ENDORSEMENT ALERTThe  is proud to endorse  for Council District 0. We are thrilled to work w/ Pierina & know that she will hit the ground running when elected. To learn more about Pierina & how to get involved visit  	{'place_id': '002e24c6736f069d'}
1041279416	2021-02-11T16:08:18.000Z	1359897055074922508	 Well in my case, I don’t live with my family members. I live alone. If I were to travel to Cali for example, I’ll take these measures & when I fly back, I get tested again and still quarantine for 0 weeks before seeing anyone new.	{'place_id': 'fa3435044b52ecc7'}
3307122141	2021-02-11T16:00:47.000Z	1359895165092126721	As a Sagittarius I must travel. See ya 	{'place_id': '00c39537733fa112'}
1041279416	2021-02-11T15:46:27.000Z	1359891557747417089	As long as you follow protocols, get tested before & after flying (depends on where you go), get tested when you arrive & quarantine, do social distancing activities, and don’t fly to countries with a high population of indigenous ppl or high poverty...you should be good. Lol 	{'place_id': 'fa3435044b52ecc7'}
97273575	2021-02-11T15:46:04.000Z	1359891462054416388	   One visit to the East Village and he’s Sid Vicious.	{'place_id': '011add077f4d2da3'}
3314157681	2021-02-11T15:39:01.000Z	1359889687494721541	Hey   can y’all hire me so I can travel around the world and document different ppl and culture. K thanks 😊 I take some wild portraits of ppl 🤍. 0- Thailand0- LA0&0- Colombia 	{'place_id': '00c39537733fa112'}
884423902054809603	2021-02-11T15:27:46.000Z	1359886855894937602	 that fits tightly to your face to reduce the spread of COVID-0. A new CDC report found that appropriate sized masks reduced infectious particles by 0%. To learn more, please visit the CDC website.      	{'place_id': '23a06e5cc6d83009'}
336248276	2021-02-11T15:11:23.000Z	1359882734538289159	I def need a travel buddy one with a passport cause once they start opening up shit we out no cap	{'place_id': '00c39537733fa112'}
2294806395	2021-02-11T15:03:58.000Z	1359880867657744387	If I’m being so honest what keeps me the most motivated in this life are two things :0. I want a beautiful home 0. I wanna travel the world	{'place_id': '6813a7d84bf141d5'}
