129874804	2020-02-25T15:08:14.000Z	1232321411282350080	We are in the ONE MONTH ZONE! Season 0 hits Chicagoland lakeshorepbs 0/0 + other  markets that week! Following that watch NATIONALLY on amazon and  app! WANT VIP TICKETS to the premiere? Visit link in bio… 	{'place_id': '1d9a5370a355ab0c', 'coordinates': {'type': 'Point', 'coordinates': [-87.63798, 41.89338]}}
458931608	2020-02-25T14:41:15.000Z	1232314618762141696	That wraps up one of the most engaging  to date! Based on the amount of laughter in the room, you would assume there was a two drink minimum. Thanks for coming to visit, 	{'place_id': '1d9a5370a355ab0c'}
91212191	2020-02-25T14:39:14.000Z	1232314114376192000	Had an amazing trip to Europe for  and to visit  but man was it great to come home to this from my guys ☺️🌷🥰 	{'place_id': '1d9a5370a355ab0c'}
894279020	2020-02-25T14:32:44.000Z	1232312476999585792	Why is it that birds get to travel the world for free?!	{'place_id': '1d9a5370a355ab0c'}
46387313	2020-02-25T14:31:42.000Z	1232312219100229632	I keep finding myself humming Hava Nagila when I visit businesses in Skokie.	{'place_id': '4b3758bc32868265'}
25442697	2020-02-25T14:25:25.000Z	1232310635062611968	Happy Mardi Gras from family to yours👑Stop by and visit us tonight. bsbrass will  be raising the roof💜💚💛🎉🎊🎭📿⚜👑 @ Heaven on Seven Wabash 	{'place_id': '1d9a5370a355ab0c', 'coordinates': {'type': 'Point', 'coordinates': [-87.62575, 41.88347]}}
40450439	2020-02-25T14:25:02.000Z	1232310538329260034	Truly an adventure every time you visit and something new! As seen here from “Two Sisters Vintage”. Come see what everyone’s talking about! Affordable Antiques & More located at 0 N. Naper Blvd. in Naperville. 0-0-0    	{'place_id': '107ffde2a954d000'}
733332854038368257	2020-02-25T13:53:50.000Z	1232302688886513666	                                                 true love all ways last for everybody	{'place_id': '1d9a5370a355ab0c'}
733332854038368257	2020-02-25T13:53:20.000Z	1232302563799773184	                                                nice picture my friend	{'place_id': '1d9a5370a355ab0c'}
733332854038368257	2020-02-25T13:52:51.000Z	1232302438335512576	                                                My heart is trapped trying to get out	{'place_id': '1d9a5370a355ab0c'}
733332854038368257	2020-02-25T13:52:28.000Z	1232302345452691456	                                                a silver heart I love the animation to	{'place_id': '1d9a5370a355ab0c'}
733332854038368257	2020-02-25T13:51:14.000Z	1232302032981237761	                                                 the ladies look great in both of these pictures	{'place_id': '1d9a5370a355ab0c'}
733332854038368257	2020-02-25T13:50:43.000Z	1232301903503077379	                                                A Rubik's cube filled with beautiful colors	{'place_id': '1d9a5370a355ab0c'}
29250272	2020-02-25T13:49:27.000Z	1232301582877937664	I really rearranged my entire travel schedule this week for the biggest storm this season of 0-0 inches?	{'place_id': '1d9a5370a355ab0c'}
733332854038368257	2020-02-25T13:47:36.000Z	1232301118367182850	                                                 The tulips are so pretty my friend I love its colors	{'place_id': '1d9a5370a355ab0c'}
733332854038368257	2020-02-25T13:47:19.000Z	1232301049203056641	                                                awesome pictures my friend	{'place_id': '1d9a5370a355ab0c'}
733332854038368257	2020-02-25T13:46:57.000Z	1232300956324368384	                                                 the colors are incredibly charp and the camera work looks great as well	{'place_id': '1d9a5370a355ab0c'}
733332854038368257	2020-02-25T13:45:52.000Z	1232300681400406017	                                                 amazing pictures Oscar	{'place_id': '1d9a5370a355ab0c'}
733332854038368257	2020-02-25T13:45:15.000Z	1232300528346025985	                                                 what a beautiful and very charming lady	{'place_id': '1d9a5370a355ab0c'}
733332854038368257	2020-02-25T13:43:20.000Z	1232300046860849152	                                                 nice pictures my friend	{'place_id': '1d9a5370a355ab0c'}
733332854038368257	2020-02-25T13:42:08.000Z	1232299743973384194	                                                  The colors are just extraordinary good nice pictures	{'place_id': '1d9a5370a355ab0c'}
733332854038368257	2020-02-25T13:41:37.000Z	1232299615208210435	                                                  hello Ahmed I really love your pictures	{'place_id': '1d9a5370a355ab0c'}
274765314	2020-02-25T13:40:29.000Z	1232299327055372289	The early bird gets to California by lunchtime!         @ Chicago Midway International Airport 	{'place_id': '1d9a5370a355ab0c', 'coordinates': {'type': 'Point', 'coordinates': [-87.74588742, 41.78656582]}}
733332854038368257	2020-02-25T13:37:04.000Z	1232298467965440000	                                                 nice picture Oscar	{'place_id': '1d9a5370a355ab0c'}
733332854038368257	2020-02-25T13:36:37.000Z	1232298356619317248	                                                 hello Oscar	{'place_id': '1d9a5370a355ab0c'}
733332854038368257	2020-02-25T13:36:12.000Z	1232298250746679301	                                                  hello my friend	{'place_id': '1d9a5370a355ab0c'}
40450439	2020-02-25T13:31:39.000Z	1232297104699203585	TUESDAY SNIPPETS Another day in paradise and living the dream! Visit today and unearth treasures 0:0AM-0:0PM. Shop/ship 0-0-0. Thank you to our photographer, Keri!     	{'place_id': '107ffde2a954d000'}
3238920173	2020-02-25T13:26:06.000Z	1232295710470606848	Look at what dominick0 found when he was on his visit    @ Sullivan Athletic Center 	{'place_id': '1d9a5370a355ab0c', 'coordinates': {'type': 'Point', 'coordinates': [-87.653167, 41.923901]}}
158750697	2020-02-25T11:59:34.000Z	1232273932062990337	windy city in film 🌬 boy, did I ever miss traveling? 🌃☹️ @ Chicago, Illinois 	{'place_id': '1d9a5370a355ab0c', 'coordinates': {'type': 'Point', 'coordinates': [-87.632496, 41.883222]}}
732583794113314817	2020-02-25T11:02:06.000Z	1232259470908153857	"""Create in me a clean heart, O God, And renew a steadfast spirit within me.""Psalms 0:0 NKJVVisit us @  "	{'place_id': 'f1dfa58974449052'}
30252520	2020-02-25T10:43:24.000Z	1232254762751549440	Combined with the Mamoru Hosada limited exhibit, another great reason to visit this spring! 	{'place_id': '1d9a5370a355ab0c'}
17050748	2020-02-25T10:41:58.000Z	1232254402305478656	It's Bear weather...whatever that means.  We’ll have the latest travel times and snow totals, up next.  @ WGN Morning News 	{'place_id': '1d9a5370a355ab0c', 'coordinates': {'type': 'Point', 'coordinates': [-87.69360065, 41.94720256]}}
381322263	2020-02-25T06:46:17.000Z	1232195090136870913	Everytime I travel it motivates the fuck outta me. New ideas. New perspective. Inspiration for the life I want to live.	{'place_id': '1d9a5370a355ab0c'}
24652043	2020-02-25T05:59:52.000Z	1232183408333377536	 We treat it more like an MLB organization. 0 man “showcase” roster with 0-0 that will travel and 0-0 that stay local. The remainder all “play up” and are a mix of 0/0/0u and stay local/regional.0s play in college wood bat league to prep for their frosh fall.	{'place_id': 'cdf74b55fc0d4600'}
130510962	2020-02-25T05:17:34.000Z	1232172762946527234	 I’ve literally only been to Texas once to visit Nip and Andrew at their old place LOL	{'place_id': 'ed888f00de07aa3a'}
34496663	2020-02-25T04:33:26.000Z	1232161656907685888	The same 0 ppl visit me here in Chicago lol my momma, my cousin, my bestfriend & my ex. Clearly they the only ones who love me 😆	{'place_id': '1d9a5370a355ab0c'}
1646463500	2020-02-25T04:19:18.000Z	1232158100968349696	holding my spine because I'm (c)old but can't help but wiggle on a site visit. manifesting another collab with _e.lee_ and the  hubbardstreetdancecenter HSPro students, working in residence at  ticket link… 	{'place_id': '1d9a5370a355ab0c', 'coordinates': {'type': 'Point', 'coordinates': [-87.6034787, 41.7850467]}}
7790622	2020-02-25T03:50:54.000Z	1232150954549665795	Is there even a travel call in the NBA anymore? 	{'place_id': '1d9a5370a355ab0c'}
39018093	2020-02-25T03:33:19.000Z	1232146529525342210	If you could travel anywhere this weekend, anywhere in the world and spend two days, where would you go? Assume logistics, travel time and cost are not an issue.	{'place_id': '1d9a5370a355ab0c', 'coordinates': {'type': 'Point', 'coordinates': [-87.6952932, 41.9054567]}}
109041798	2020-02-25T02:11:26.000Z	1232125922549141504	I’m probably gonna catch some flack for this but I can handle it, Nike’s men’s yoga line is legit!      	{'place_id': '1d9a5370a355ab0c'}
17376573	2020-02-25T01:46:34.000Z	1232119663867330566	Haha you know I can come visit you anytime you need! 😊 	{'place_id': '07c0b6b4c3ac42c4'}
2959463559	2020-02-25T01:41:01.000Z	1232118267097108481	Stress can cause imbalance of our Central Nervous System🧘Please visit our page to learn about our Stress Release Programs 😍 Nirvana Naturopathics0 Lake… 	{'place_id': '72efa03540804278', 'coordinates': {'type': 'Point', 'coordinates': [-87.84554, 42.15191]}}
732667862360457216	2020-02-25T01:23:23.000Z	1232113829355687937	“we should start a sisterhood of the traveling underwear”“sisterhood of the traveling yeast infection”	{'place_id': '1d9a5370a355ab0c'}
871891472987160579	2020-02-25T00:49:14.000Z	1232105235394519046	 Hey crazy lady.. Your the one who bitched when he stopped air travel	{'place_id': '1d9a5370a355ab0c'}
36898720	2020-02-25T00:01:59.000Z	1232093345096355841	I am available now in Schaumburg  & Chicago, Illinois, United States! To contact me, visit  0 0 0 	{'place_id': '918c943e88cc3e5d'}
31790899	2020-02-26T23:59:42.000Z	1232817547566833665	Wound up being ready for tonight’s show WAY early because I forgot I don’t have travel time, as it’s in my hotel. Turns out it’s happy hour at the hotel bar, and they have $0 dark sour pints. Clap for value drankin’! 	{'place_id': '1d9a5370a355ab0c'}
262765295	2020-02-26T23:50:41.000Z	1232815279140474880	Enjoying his visit to Nana and Grampa’s, especially the hours-long nap on Grampa! @ Hyde Park, Chicago 	{'place_id': '1d9a5370a355ab0c', 'coordinates': {'type': 'Point', 'coordinates': [-87.59, 41.8]}}
4333865267	2020-02-26T22:04:59.000Z	1232788678424043531	     I am, is that Trump travel ban like the wall is ineffective. They are more campaign slogans then effective policy.	{'place_id': '1d9a5370a355ab0c'}
4333865267	2020-02-26T21:50:58.000Z	1232785151895187456	     Yes, and they won so Trump had to modify his travel ban.	{'place_id': '1d9a5370a355ab0c'}
24652043	2020-02-26T21:42:02.000Z	1232782900824854534	 Also a place that doesn’t require them to sit in a classroom for 0 hours a day, or has 0U travel teams.	{'place_id': 'cdf74b55fc0d4600'}
91830343	2020-02-26T21:38:58.000Z	1232782130842873861	Spent the afternoon with a bunch of talented Tigers 🐯 Thanks for a wonderful visit,  	{'place_id': '222efb7ee8b98c58'}
176632447	2020-02-26T20:38:26.000Z	1232766897105637376	 Girl if I pay to live alone, I would never be able to leave my house unless it’s for work. & I like fun and traveling too much. 😭	{'place_id': '1d9a5370a355ab0c'}
44983352	2020-02-26T19:50:10.000Z	1232754748966735872	Before U  read your governments' travel advisories 0   0 DECENCY GOP Senators                  	{'place_id': '5cba3a162965b0e2'}
2153981407	2020-02-26T19:42:02.000Z	1232752702272106497	This patient came in for her 0 month follow-up visit after a lipoabdominoplasty and BBL.  The goals of this surgery are to tighten the abdominal muscles, removed excess abdominal skin and fat, and to improve the… 	{'place_id': '1d9a5370a355ab0c', 'coordinates': {'type': 'Point', 'coordinates': [-87.62461156, 41.89389191]}}
816065906958888960	2020-02-26T18:35:49.000Z	1232736039212584961	Simply the best music festival in the world for the price: 0$US  Come visit my hometown of Québec City for this year edition! This is the best time to plan your first trip or comeback to see how great the city is! 🎶 🥘 🎤 ☀️   	{'place_id': '1d9a5370a355ab0c'}
19689880	2020-02-26T17:50:49.000Z	1232724714931417088	 Join Me Today at 0:0 in Nirvana A.  We Will Travel to the Chrome Depot as we look to Create with Chromebooks: Filling Your Toolbox with Tools for Every Learner!   See you there! 	{'place_id': '918c943e88cc3e5d'}
1038885730490171392	2020-02-26T17:12:31.000Z	1232715073912786945	no that’s not a giant space station in the middle of the era of exponential growth in the industry of private space travel and exploration and colonization, that’s uh, ah, that’s a second mini moon the earth just got from space	{'place_id': 'c8b021ffd0c94ffc'}
195130492	2020-02-26T17:10:16.000Z	1232714510278021121	Done. Right?!?  If you’re at  this weekend visit us at booth 0. We might except tamales as payment. Just sayin.      @ McCormick Place 	{'place_id': '1d9a5370a355ab0c', 'coordinates': {'type': 'Point', 'coordinates': [-87.61665344, 41.85159813]}}
929486707233304576	2020-02-26T16:53:06.000Z	1232710188454596609	A Day in Folegandros!  	{'place_id': '1d9a5370a355ab0c'}
360374526	2020-02-26T16:52:32.000Z	1232710048402608129	Dead spirit airlines, fuck you for only having service to Chicago from ORLANDO, so my trip to NC has to really be just a quaint 0 hour travel day. And, then booking me in a row with two INFANTS. This should be an absolute blast.... 	{'place_id': '1d9a5370a355ab0c'}
822611836478586880	2020-02-26T16:49:56.000Z	1232709391687864320	Looking forward to  visit to  as keynote at  0Apr0    	{'place_id': '1d9a5370a355ab0c'}
953116465665859584	2020-02-26T16:33:48.000Z	1232705331463163906	  Because only maniacs travel on Wednesday! 😁	{'place_id': '1d9a5370a355ab0c'}
1472073320	2020-02-26T16:10:45.000Z	1232699531072098306	Tomorrow, I fly to Albuquerque, New Mexico to begin a project closer to my heart than just about anything else I've ever been a part of. Anyone who knows me knows my long adoration for  / Levi Macallister… 	{'place_id': '5a483763a916e21d', 'coordinates': {'type': 'Point', 'coordinates': [-87.914753, 41.892386]}}
25700265	2020-02-26T15:55:50.000Z	1232695778495340544	me trying to be excited about multiple travel trips planned throughout this year but remembering coronavirus is turning into a pandemic and most public spaces will probably be shut down: 	{'place_id': '1d9a5370a355ab0c'}
112654315	2020-02-26T14:54:11.000Z	1232680264649887744	Chicago streets...Chicago streets are full of musicians playing instruments or singing specially at Michigan Ave............      … 	{'place_id': '1d9a5370a355ab0c', 'coordinates': {'type': 'Point', 'coordinates': [-87.73001293, 41.95580876]}}
3057393935	2020-02-26T14:29:39.000Z	1232674091267764229	My tarot’s said I’m finna be traveling a lot and I just felt I was anyway....	{'place_id': '1d9a5370a355ab0c'}
2492531060	2020-02-26T13:57:18.000Z	1232665949565788160	 goes to this glass-ceiling, space-exploring, medically-trained, Chicago-raised astro babe  🚀💫🪐 As the first black female to travel to space, Mae served as a specialist on the Endeavor. Prior to that,… 	{'place_id': '1d9a5370a355ab0c', 'coordinates': {'type': 'Point', 'coordinates': [-87.632496, 41.883222]}}
2811975708	2020-02-26T13:21:01.000Z	1232656815227375617	Wrigley's Gum RARE 0 vintage poster by Otis Shepard.Can be purchased on our websiteVisit us      … 	{'place_id': '1d9a5370a355ab0c', 'coordinates': {'type': 'Point', 'coordinates': [-87.63325, 41.9017]}}
732583794113314817	2020-02-26T11:24:13.000Z	1232627425206525952	"""So when they had brought their boats to land, they forsook all and followed Him.""Luke 0:0 NKJVCome visit us @  "	{'place_id': 'f1dfa58974449052'}
527792850	2020-02-26T11:10:29.000Z	1232623965870469124	 Traveling the world and buying expensive gold jewelry from everywhere I go 😂	{'place_id': '389e765d4de59bd2'}
809303974050430976	2020-02-26T10:17:52.000Z	1232610725387997185	 Ohh em geeeee!!! Happens to me allll the time! They try to strike a convo asking how you enjoyed a certain place saying they also wanna visit! Then they drop a link. So annoying!! This girl did it to me and I wasn’t aware of it then	{'place_id': '1d9a5370a355ab0c'}
31269294	2020-02-26T07:33:29.000Z	1232569358473408512	All I want as a Mega fan of the  is travel to boston and atleast attend one home game 😩😩😩	{'place_id': '1d9a5370a355ab0c'}
130930020	2020-02-26T06:41:26.000Z	1232556257350950912	i’m just trying to buy flowers, make you laugh, eat a lot, travel, and make memories. however, nobody wants it.  🥴	{'place_id': '1d9a5370a355ab0c'}
131723478	2020-02-26T06:04:12.000Z	1232546889326829568	bakit ang haggard mag travel. 😂	{'place_id': '1d9a5370a355ab0c'}
14064239	2020-02-26T05:30:57.000Z	1232538522063642625	We gotta go visit her in the new digs.	{'place_id': '1d9a5370a355ab0c'}
89860333	2020-02-26T05:21:43.000Z	1232536197479751681	To learn more about this partnership and it’s upcoming programs, visit              	{'place_id': '1d9a5370a355ab0c'}
22236319	2020-02-26T04:33:09.000Z	1232523975013654528	 If I'm not intruding, I would love to visit! I'm trying to get to Illinois more often now, too.	{'place_id': '1d9a5370a355ab0c'}
17022515	2020-02-26T03:30:01.000Z	1232508088219000832	    Then didn’t visit Wisconsin once after convention. Expect the opposite of that arrogance  from Bernie	{'place_id': '7ca9cc3e813b1534'}
23264123	2020-02-26T00:50:54.000Z	1232468043856396288	   Whoah!!! He visited my daughter’s school a couple of years ago & she’s been obsessed ever since. We’re going to his local visit in a week or two (my mind blanked on the date). Can’t wait!! 😬😬	{'place_id': '1aa7803ca6707875'}
496173030	2020-02-26T00:30:01.000Z	1232462790469640193	         If you ever wanna visit Sprout HQ, I’ve got you!	{'place_id': '1d9a5370a355ab0c'}
26414118	2020-02-26T00:25:13.000Z	1232461581675454464	 My first visit to the LA SST store I bought all the Opal they had.	{'place_id': '1d9a5370a355ab0c'}
787706570620694528	2020-02-26T00:21:05.000Z	1232460541152546818	Cool how my brother  can go to Rockford, IL but he can't visit me in Chi	{'place_id': '1d9a5370a355ab0c'}
574653994	2020-02-27T23:42:49.000Z	1233175684400451584	   Thank you! Next time I come visit Oklahoma I’ll let you know, maybe we could link up.	{'place_id': '1d9a5370a355ab0c'}
1225106361429757952	2020-02-27T23:41:58.000Z	1233175470138679299	Nothing like a surprise visit from Oscar to check out our awesome ConnectionSaver exhibit at Connections 0!         	{'place_id': '1d9a5370a355ab0c'}
792354847626498048	2020-02-27T23:38:16.000Z	1233174539678384131	 Does the Level 0 advisory apply to those only traveling through South Korea? I will have a layover in Incheon on the way to Philippines. Will never leave the airport, but will be there approx. 0 hours	{'place_id': '1d9a5370a355ab0c'}
3309478300	2020-02-27T23:23:00.000Z	1233170697557565445	You know it’s gonna be *BIG* when ALL FOUR HOURS of  go on a trip! 	{'place_id': '8b351eeb91372dc7'}
678403	2020-02-27T23:02:53.000Z	1233165635082911744	 Yes! He’s great... come over and visit us at North Shore sometime. I’ll get back to your student tomorrow; this week has been a little crazy!	{'place_id': 'f16f37294392e394'}
50447756	2020-02-27T22:51:44.000Z	1233162829827657729	A traveling photographer like myself always tuning into this problem 	{'place_id': '1d9a5370a355ab0c'}
15552986	2020-02-27T22:47:09.000Z	1233161678625398787	 What date are you thinking? I’d go if I could but I have to travel for work right around Easter	{'place_id': '1d9a5370a355ab0c'}
111395646	2020-02-27T22:26:43.000Z	1233156535196381184	By    visit our page ....         lion tattoo  lion king tattoo… 	{'coordinates': {'type': 'Point', 'coordinates': [-87.7245499, 41.9393]}, 'place_id': '1d9a5370a355ab0c'}
91830343	2020-02-27T21:04:11.000Z	1233135765166620672	Bulldog pride—and a fantastic visit with the 0th grade—at Franklin Middle School! 	{'place_id': '57ac88aefcd20988'}
44388921	2020-02-27T20:57:26.000Z	1233134066377142278	 Generally speaking that’s the US and East coast of Canada. There’s more travel for less dense areas as you cover larger regions.	{'place_id': '5b0b1baf24cf0a6a'}
1068609510896488450	2020-02-27T20:38:32.000Z	1233129307532341249	  I will travel to UIUC for the home opener with you	{'place_id': '1d9a5370a355ab0c'}
987674924021178368	2020-02-27T20:32:27.000Z	1233127778951847937	   I need to come visit you this year!	{'place_id': '6af99a29bfae42a2'}
945333491515969537	2020-02-27T20:22:17.000Z	1233125220677976065	Your ORDSW Team is hosting a ThankU event today! Please stop by to visit with Sunday Riley, NARS, MoveSmart, ORDTK, puppies and more! 	{'place_id': '1d9a5370a355ab0c'}
114931613	2020-02-27T20:16:33.000Z	1233123777766133760	Great photos! Thank you for coming to visit the Social Media Care booth  	{'place_id': '1d9a5370a355ab0c'}
489971721	2020-02-27T20:13:11.000Z	1233122928906113035	Looking Forward To One Day Having A Personal Driver. Glam Squad (For Hair, Make Up, & Wardrobe). An Abundant Flow Of Income. Being Able To Travel More. The Loml. Being Able To Make Sure My Mama Straight. All That	{'place_id': '1d9a5370a355ab0c'}
1038885730490171392	2020-02-27T20:10:12.000Z	1233122179170127873	that’s my recommendation. if you’ve never been to Chicago, come in May and walk the river and the 0, tour a Frank Lloyd Wright house and visit the art institute you’ll be blown away by those 0 activities.	{'place_id': 'c8b021ffd0c94ffc'}
1038885730490171392	2020-02-27T20:10:10.000Z	1233122171540721665	The art institute is basically the only blockbuster chip I have in convincing people in New York or LA to visit Chicago. the Frank Lloyd Wright tours are a bonus.	{'place_id': 'c8b021ffd0c94ffc'}
1038885730490171392	2020-02-27T20:05:54.000Z	1233121095647211521	The art institute of Chicago has a great surrealist collection that pairs well with a visit to the creepy violent renaissance works they also have	{'place_id': 'c8b021ffd0c94ffc'}
22344092	2020-02-27T19:55:29.000Z	1233118476090429440	A couple of weeks ago it was time for a visit to Ronnie's.  Yes. I had the Mexican inspired yumfest.My friend,  the turkey tips and looked heavenly.     … 	{'coordinates': {'type': 'Point', 'coordinates': [-87.63170208, 41.88493443]}, 'place_id': '1d9a5370a355ab0c'}
849451016261185536	2020-02-27T19:54:44.000Z	1233118285153128448	 can You help me with a straight answer about group travel? Trying to book 0 RT flights for a reunion trip to Montego Bay. One rep said yes you do groups,another said NO to groups, help please.	{'place_id': '1d9a5370a355ab0c'}
820969297	2020-02-27T19:53:28.000Z	1233117968583839744	Saffron rice with shrimp, mussels, clams, scallops and squid! Yes please! Bring a friend and join us for dinner. Make a reservation today. Call us at 0.0.0 or visit    … 	{'coordinates': {'type': 'Point', 'coordinates': [-87.62793042, 41.86108431]}, 'place_id': '1d9a5370a355ab0c'}
2658485572	2020-02-27T19:50:10.000Z	1233117136257781761	I need to visit your class over there!!!! This looks awesome! 	{'place_id': '99700cd6fc455c13'}
2162007806	2020-02-27T19:48:35.000Z	1233116739493343232	Excited to visit Savannah/Hilton Head today! 	{'place_id': '1d9a5370a355ab0c'}
2162007806	2020-02-27T19:06:47.000Z	1233106219805663234	Heading for a visit to Savannah/Hilton Head.  First stop—Sam Sneads key lime pie!   Tomorrow morning at  to see a great Media Professor and friend Reed Smith!!	{'place_id': '1d9a5370a355ab0c'}
251950387	2020-02-27T19:03:03.000Z	1233105279652225024	 That’s exactly why I am traveling this weekend lol. I need to get outta here	{'place_id': '1d9a5370a355ab0c'}
2836935673	2020-02-27T18:47:00.000Z	1233101239950479360	Pay $0 for carry on luggage? I don’t think so! 0 sweaters, 0 pants, 0 shirt, 0 pair of booties, pajamas, makeup , & travel size toiletries all in one backpack! 🎒😎    @… 	{'coordinates': {'type': 'Point', 'coordinates': [-87.70666667, 41.92833333]}, 'place_id': '1d9a5370a355ab0c'}
191289422	2020-02-27T17:41:44.000Z	1233084816972812288	Thinking it’s time for another visit to the Big  Apple! 	{'place_id': '1d9a5370a355ab0c'}
1101919188	2020-02-27T17:38:12.000Z	1233083927532797952	𝗧𝗛𝗔𝗡𝗞 𝗬𝗢𝗨, intrinsicschools / intrinsicmustangs for the visit yesterday, celebrating  .𝐒𝐇𝐎𝐔𝐓- 𝐎𝐔𝐓 to  for being our featured guest and influencer sharing his story on how… 	{'coordinates': {'type': 'Point', 'coordinates': [-87.72636, 41.92318]}, 'place_id': '1d9a5370a355ab0c'}
864134986508664832	2020-02-27T17:37:42.000Z	1233083799317229570	They call it the Venice of the North. ław is nestled on the banks of the  River which branches out here to form 0 islands. Over 0 bridges connect these pieces of land! Join me for a visit to this    this week in episode  of  	{'place_id': 'cdf74b55fc0d4600'}
344897679	2020-02-27T16:53:55.000Z	1233072781706878976	Deus é bom, o tempo todo Deus é bom!📸🥶🇺🇸🇧🇷        @ Morton Grove, Illinois 	{'coordinates': {'type': 'Point', 'coordinates': [-87.7865, 42.0411]}, 'place_id': '24d27a430ae5569f'}
733332854038368257	2020-02-27T16:41:58.000Z	1233069776467001344	                                                  hello my friend	{'place_id': '1d9a5370a355ab0c'}
733332854038368257	2020-02-27T16:39:27.000Z	1233069142913224704	                                                  You're absolutely right	{'place_id': '1d9a5370a355ab0c'}
256710782	2020-02-27T16:37:49.000Z	1233068729832964096	What a great visit to   class last night by  alums Ariana Smith & Jack Flowers (& James!) to tell the amazing growth story of  (formerly Pressbox and acquired by P&G). Ariana was employee     	{'place_id': '07d9f5f015c87000'}
223266825	2020-02-27T16:09:50.000Z	1233061688641032193	 God I need to visit Toronto.	{'place_id': '1d9a5370a355ab0c'}
