2738813435	2020-02-29T20:00:29.000Z	1233844507684331520	   I genuinely hope I get to visit and get to meet you both! I can’t seem to find photos but I really enjoyed time with the ducks and swans in Hljomskalagardur Park and was in awe of Hallgrimskirkja. And loved the National Museum and wandering around Hólavallagarður too!	{'place_id': '1d9a5370a355ab0c'}
756903193901162496	2020-02-29T19:37:17.000Z	1233838672048467974	Mexico will impose restrictions on traveling to the Germy ass US. 	{'place_id': '1d9a5370a355ab0c'}
4786595255	2020-02-29T19:36:08.000Z	1233838382675111937	Im using  to visit my parents in Knoxville. Can’t do that without the support of family. It will be good to see mom and dad. そろそろ行きますか。親孝行できるかな?	{'place_id': '1d9a5370a355ab0c'}
1217938840834465798	2020-02-29T19:21:17.000Z	1233834643167817728	     Confused, travel restrictions?	{'place_id': '1d9a5370a355ab0c'}
1217938840834465798	2020-02-29T19:18:29.000Z	1233833940105994240	     Also what border was closed? Travel restrictions from China have nothing to do with any border	{'place_id': '1d9a5370a355ab0c'}
523973859	2020-02-29T19:06:56.000Z	1233831034418073600	Travel abroad and the noise is even louder from those who live outside of the US 	{'place_id': '0335b0e33f0fb9cf'}
258055650	2020-02-29T18:57:15.000Z	1233828598387224576	Starting in March I will be living the true “broke but not broke” lifestyle so I can travel for the rest of 0 ✌🏾	{'place_id': '1d9a5370a355ab0c'}
369535703	2020-02-29T18:50:49.000Z	1233826979327225856	 We’re like a week from Trump shutting down all international travel into the US.	{'place_id': '47628c71a783286b'}
225935027	2020-02-29T18:41:59.000Z	1233824756488646657	We are currently re-evaluating our  services @ the Archive Research Room-St. Louis because of local rules & procedures that place research room staff’s work load ahead of providing vets records in a timely manner.  Please visit  0 more info	{'place_id': '1d9a5370a355ab0c'}
33049952	2020-02-29T18:29:54.000Z	1233821714905206784	I blame  for my wrestling shirt addiction. If she would travel with me I wouldn't buy so many shirts. I would trust her to hold my wallet	{'place_id': '1d9a5370a355ab0c'}
341915046	2020-02-29T18:08:45.000Z	1233816389481353218	 That’s fine I got some of my ppl out there, I now have more of an excuse to visit them 🤣	{'place_id': '1d9a5370a355ab0c'}
2292889856	2020-02-29T18:03:55.000Z	1233815173623943174	Anyone else get anxious napping when you’re traveling alone on a train or airplane?	{'place_id': 'ecbe21c16e88f161'}
581643655	2020-02-29T17:22:11.000Z	1233804671036334080	Crazy to think that as it becomes more prevalent, questions in the ED or PCP office about travel history and other risk factors will become irrelevant  ー0 	{'place_id': 'ed888f00de07aa3a'}
69770355	2020-02-29T17:13:37.000Z	1233802517932380160	i’m a loyal customer of  but this time i’m flying  (for the first time) because it’s cheaper to fly to cancun on this date and there’s already issues prior to boarding 🙄no wonder WSJ ranks american as the second worst US airline in 0	{'place_id': '1d9a5370a355ab0c'}
195601283	2020-02-29T17:10:22.000Z	1233801700563181568	Early voting starts this Monday. Get out and vote! Punch  Visit  to find your early voting location and more! 	{'place_id': '1d9a5370a355ab0c'}
16783996	2020-02-29T17:01:30.000Z	1233799468551725060	My nephew is studying in Barcelona and my sister just put her daughter and her friends on a plane to visit him. Life has to go on. Take precautions. And lots of hand sanitizer 🖐🏼 🦠 😁✌🏼	{'place_id': '1d9a5370a355ab0c'}
37503584	2020-02-29T16:52:51.000Z	1233797291577925632	A trip to Chicago would be incomplete without a visit to  Who can guess what shirt I’ll be wearing tonight??     	{'place_id': '1d9a5370a355ab0c'}
304025954	2020-02-29T16:51:57.000Z	1233797065806897153	The city increased the police budget by $0Million for this year.  For what? The freedom of movement and the ability to travel safely is a human right. Chicagoans deserve to travel without being terrorized and murdered by racist police. And that's not a radical take. 	{'place_id': '1d9a5370a355ab0c'}
772153328	2020-02-29T16:39:56.000Z	1233794038001737733	         şamlar şk #çok_güzel  💖 #çalışma    şehir 	{'place_id': '1d9a5370a355ab0c'}
934373196312338433	2020-02-29T16:26:52.000Z	1233790749432582144	yikes  It was kind of scary last night. I went to two movies and granted they were obscure movies, but still one theater had on a Friday night.  0 people  and my last screening of seberg had me.  And just me 	{'place_id': '1d9a5370a355ab0c'}
25528240	2020-02-29T16:25:14.000Z	1233790341024768002	Last weekend for Andersonville Restaurant Week! Visit  after 0pm for $0 three-course prix fixe...soup/salad choice, choice of shepherd's pie, fish and chips or veggie pot pie and of course - sticky pudding.  	{'place_id': '1d9a5370a355ab0c'}
1112795871861751808	2020-02-29T16:21:09.000Z	1233789313076416512	☀️ Great Morning Chicago! For everything and anything Real Estate 🏡 visit   or tweet me.  	{'place_id': '51e20b11ca1deda7'}
20537497	2020-02-29T16:07:09.000Z	1233785789592432640	 day 0! Come visit me at the artist alley! 💓💓💓 I'm at table F0!⭐This is the only show I'll be doing around here, so make sure you drop by!… 	{'place_id': '1d9a5370a355ab0c', 'coordinates': {'type': 'Point', 'coordinates': [-87.615043, 41.85183]}}
107535817	2020-02-29T15:48:13.000Z	1233781024657756161	Day ✌️ of the  is underway! As you map out your visit today, be sure to stop by Booth 0 for CDGA memberships, giveaways, prizes and more!Follow along with all of the show happenings 👉 	{'place_id': 'f48e110211eee6ef'}
44983352	2020-02-29T15:42:59.000Z	1233779709214896130	   Without more information about where you are, who you had contact with & where you traveled as well as the dates of travel, your health & situation in your state nothing rules U out but at present in general in USA the risk is extremely low today at present time	{'place_id': '5cba3a162965b0e2'}
596501802	2020-02-29T14:37:15.000Z	1233763164006866944	How far I have to travel to meet a gay person in Chicago: 	{'place_id': '1d9a5370a355ab0c'}
846212754247745536	2020-02-29T14:26:47.000Z	1233760533272317959	One of my recent passions since getting into the travel industry is hotel interior design!! I’m thinking of starting a blog or a twitter or something to share my favorite cool hotels. I think hotel designers are doing some of the most ground-breaking work in design these days. 	{'place_id': '1d9a5370a355ab0c'}
21089995	2020-02-29T14:04:08.000Z	1233754829287231489	 I’d fly to Florida but decline the cruise — as I would have done even in the absence of the coronavirus, since I don’t care for cruises.	{'place_id': '1d9a5370a355ab0c'}
35065205	2020-02-29T13:01:46.000Z	1233739135334191109	On a mission to visit all 0 states before I’m 0(0 months to go)Currently heading to #’s 0-0 for the weekend.	{'place_id': '1d9a5370a355ab0c'}
9362802	2020-02-29T12:50:16.000Z	1233736243931942912	Wow. Amazon directs its global workforce to halt travel because of Coronavirus. This is going to get a whole lot worse.	{'place_id': '51e20b11ca1deda7'}
53660578	2020-02-29T12:31:59.000Z	1233731641291542528	My newest nephew everyone 🥺🥺 his older brother has a nickname nugget. And they called this little one, dumpling 🥺🥺🥺 wanna fly to cali now!!! 	{'place_id': '1d9a5370a355ab0c'}
25588979	2020-02-29T12:07:35.000Z	1233725500511674369	I asked the kid if I should get him a plane or a train ticket. Train ticket $0, plane ticket $0, he picked the train because a friend asked him to be her travel buddy.	{'place_id': '1d9a5370a355ab0c'}
56168587	2020-02-29T09:34:51.000Z	1233687061967839233	I wish I had the ability to travel anywhere with just a single thought. Cause I promise you I’d travel here for work only and go straight back to my house in Mexico 😂 así para que vivo muy feliz.	{'place_id': '1d9a5370a355ab0c'}
258055650	2020-02-29T05:32:13.000Z	1233626001508380672	When the closers don’t want take tables so I can go home 🙄I just keep telling myself “I’m building my travel fund, I’m going to see the world.” Send deliverance for my face 🙌🏾🤬 	{'place_id': '1d9a5370a355ab0c'}
393738955	2020-02-29T05:19:29.000Z	1233622797303324674	Amazon halts employee travel in US and abroad over coronavirus fears - Business Insider 	{'place_id': '1d9a5370a355ab0c'}
22639515	2020-02-29T03:50:27.000Z	1233600392719667200	 That’s good you should encourage  to visit your state so he can help  lose like Bevin in Kentucky and Trump’s pick for Governor in Louisiana.	{'place_id': '1d9a5370a355ab0c'}
2226651390	2020-02-29T03:35:49.000Z	1233596710498263040	  Im thinking I visit a class of yours as well as  and 	{'place_id': 'cdf74b55fc0d4600'}
24493516	2020-02-29T03:13:45.000Z	1233591156820316161	 B0b’s are dumb b0b’s with travel are just completely idiotic...	{'place_id': '1d9a5370a355ab0c'}
320565422	2020-02-29T02:29:12.000Z	1233579944787181568	 Fantastic work by everyone!!  I really enjoyed my visit!	{'place_id': '530c22e82c7a2868'}
15221581	2020-02-29T02:16:40.000Z	1233576793518432256	hello + welcome to an  appreciation post ✌🏼i’ve loved them since like 0 + now they’re touring the united states all summer on an epic traveling festival created + curated by our favorite boys … 	{'place_id': '1d9a5370a355ab0c', 'coordinates': {'type': 'Point', 'coordinates': [-87.632496, 41.883222]}}
1055820398	2020-02-29T02:11:54.000Z	1233575593599520774	Great trip but love being home in  via       	{'place_id': '07d9e6aa68084000'}
3287732502	2020-02-29T02:05:35.000Z	1233574002918031363	Had to learn how to travel and make people think it’s a step back 🙄 	{'place_id': '1d9a5370a355ab0c'}
595043538	2020-02-29T01:59:17.000Z	1233572416758128642	 Why tf is everyone telling me to wear them, as if I hadn’t already thought of this, even if I wasn’t getting a spray tan I still wouldn’t wear white all day traveling	{'place_id': '1d9a5370a355ab0c'}
595043538	2020-02-29T01:58:30.000Z	1233572217637740545	 I just got a spray tan I am NOT wearing white pants traveling on an airplane sitting in a spray tan all  day 🤦🏼‍♀️	{'place_id': '1d9a5370a355ab0c'}
257609882	2020-02-29T01:30:39.000Z	1233565211526823936	 Been traveling tonight & just arrived in Chicago on way back to Omaha tonight. Tuned into game on 0 stream. Why is Dave Ahlers calling tonight’s game?	{'place_id': '1d9a5370a355ab0c'}
1223824611881766912	2020-02-29T01:18:54.000Z	1233562255704363009	Getting ready to board!!! 🤩🤩🤩     	{'place_id': '0fc7e0a406d55000'}
107091643	2020-02-29T00:50:13.000Z	1233555037474971648	Had a blast with  today talking about that  Take a listen and if you're an applicant or Cannabis worker, visit  and learn about the union difference!  	{'place_id': '1d9a5370a355ab0c'}
53325633	2020-02-29T00:07:50.000Z	1233544369308938240	How similar are we?0% D&D0% food experiences0% billiards0% trivia junkie0% travel0% video games0% staying up too late0% karaoke0% puns0% space law0% inability to do math 	{'place_id': '1d9a5370a355ab0c'}
619316741	2020-02-29T00:07:23.000Z	1233544257350307840	i can't wait to decompress this weekend i feel like I've had an immense weight on my shoulders for the last two weeks nonstop with traveling for my day job that's been intense and EH. Thank y'all for being patient with me lately 💜	{'place_id': '1d9a5370a355ab0c'}
24493516	2020-02-29T00:07:19.000Z	1233544238090063872	  No I say it like he had to cover on 0+ shot attempts 0 nights ago and made over 0 saves in back to back games. Plus having to get on an airplane to travel. Lactic acid is a thing and that much leg work in a week can wear on someone.	{'place_id': '4b3758bc32868265'}
1029793559363416068	2020-03-01T23:54:59.000Z	1234265909834813440	Love this eco-friendly initiative with  - reducing plastic water bottle waste any way you can is a great small step for the environment (especially when traveling to countries where you can’t drink from the tap!) 🚰♻️   	{'place_id': '1d9a5370a355ab0c'}
950758571821629441	2020-03-01T23:40:13.000Z	1234262194268844037	Had a great time Friday at St Albert the Great’s Fish Fry in Burbank, where the only thing better than the food was the company. Always a pleasure seeing Pastor Nawalaniec & my good friend Lou Viverito. Let me know in the comments what other Fish Fries I should visit!  	{'place_id': '07d9ed55e1881000'}
1067120437	2020-03-01T23:14:40.000Z	1234255766846148608	Oh, right before I have to visit for work in 0 weeks. Cool, cool. 	{'place_id': '1d9a5370a355ab0c'}
240373695	2020-03-01T23:07:57.000Z	1234254073521672194	"I can confirm...the ""City"" is indeed ""Windy""    @ Bucktown, Chicago "	{'place_id': '1d9a5370a355ab0c', 'coordinates': {'type': 'Point', 'coordinates': [-87.675103, 41.916925]}}
17150789	2020-03-01T22:43:18.000Z	1234247871681253377	Have heard from several US + British  leaders today who are deliberating this weekend + some tomorrow morning whether to cancel upcoming gatherings + further limit travel. Some considering restrictions on non essential US travel.    ー0	{'place_id': '1d9a5370a355ab0c'}
32561984	2020-03-01T22:09:08.000Z	1234239272099643392	Such a beautiful Sunday in  again this weekend I had to visit the Hippo at the    	{'place_id': '1d9a5370a355ab0c'}
990360570120491008	2020-03-01T21:53:01.000Z	1234235217168207877	I ain’t down for a boring relationship. I hope you ready for unsuspecting trips to Disneyland, Six Flags, Dinner Dates, travel far af for no reason.	{'place_id': 'f04813ea26f51186'}
216242374	2020-03-01T20:49:24.000Z	1234219206914211842	 This is why I'll only visit Atlanta	{'place_id': '1d9a5370a355ab0c'}
420198116	2020-03-01T20:46:29.000Z	1234218471958962177	  This is one of the many reasons I always never wanna travel with  . I feel your pain bruh	{'place_id': '1d9a5370a355ab0c'}
86104643	2020-03-01T20:33:34.000Z	1234215224896622594	Yes, not going to a family wedding in Nice, France, in mid-June. Will revisit other travel plans as time goes on. 	{'place_id': '0a1066f231fd366d'}
2298649357	2020-03-01T20:16:24.000Z	1234210901672300546	Visit our website to purchase NIU cheer gear! ONLY OPEN UNTIL MARCH 0rd! 	{'place_id': 'cdf74b55fc0d4600'}
24258417	2020-03-01T20:07:34.000Z	1234208678938587141	 All of them I think. I read them when I travel and get bored.	{'place_id': '1d9a5370a355ab0c'}
381603281	2020-03-01T19:47:50.000Z	1234203712467460097	Thanks for a great first visit to Chicago  The sunset view from the Navy Pier ferris wheel was beautiful send off. See you next year!🙇🏻‍♂️🌇    	{'place_id': '0fea0aaefe16c000'}
15244373	2020-03-01T19:28:46.000Z	1234198915001528320	While  are building job-creating and scalable  few observers notice how rarely  take sustained breaks, travel on extended  or even yield to national   transports such busy minds for rapid reorientation and relaxation. 	{'place_id': '0b9c2aedc0d4a001'}
192618908	2020-03-01T18:54:57.000Z	1234190406344048640	Period !!! .. 🛒 .             … 	{'place_id': '1d9a5370a355ab0c', 'coordinates': {'type': 'Point', 'coordinates': [-87.5645996, 41.7643773]}}
562247987	2020-03-01T18:43:03.000Z	1234187411304964097	Got this travel promotion in my inbox. I get there’s no  emergency in Rome but should we really be encouraging travel to anywhere in Italy right now?! 	{'place_id': '1d9a5370a355ab0c'}
24051570	2020-03-01T18:19:01.000Z	1234181362850111488	I’m really excited for my trip to Vegas in April for  ! I also will spend an extra few days in Vegas, see a few shows and go on a food tour thanks to my Sister Kathy, travel agent extraordinarie! She works for  and she was a great help! 	{'place_id': '1d9a5370a355ab0c'}
10697982	2020-03-01T18:14:42.000Z	1234180276705808391	 One slight problem… when asked why Costco is so digitally behind “why would we encourage people to not visit our stores?” was the unenlightened answer	{'place_id': '58d824d197abba8e'}
53544165	2020-03-01T18:13:17.000Z	1234179917857935365	Grateful that Greg Young had time to visit today during a layover in Chicago on his way home fromCPAC 0.  Blessed to share stories and prayers. 	{'place_id': '0fc7e0a406d55000'}
160126165	2020-03-01T17:53:36.000Z	1234174966444195845	This a travel in 0 	{'place_id': '1d9a5370a355ab0c'}
348166536	2020-03-01T17:37:54.000Z	1234171015988727809	And I hope that staffer is traveling with the VP because when they travel alone, they tend to make friends and get distracted.	{'place_id': '1d9a5370a355ab0c'}
409530974	2020-03-01T17:36:11.000Z	1234170585263026176	Bikers were out on the scene with the skaters as well. _________           … 	{'place_id': '1d9a5370a355ab0c', 'coordinates': {'type': 'Point', 'coordinates': [-87.632496, 41.883222]}}
336563611	2020-03-01T17:34:52.000Z	1234170250083655683	 Thank you Mr. Solt! Tell Anthony to come back and visit sometime he won’t listen to me	{'place_id': '1d9a5370a355ab0c'}
233617120	2020-03-01T17:26:02.000Z	1234168030206287874	 isn’t   or any nationality. It’s the family of cold viruses that mutated to be highly contagious, and causes death to people with other illnesses. Stop spreading  , Take precautions like the  report travel history and save loved ones.	{'place_id': '1d9a5370a355ab0c'}
633916577	2020-03-01T17:07:19.000Z	1234163320606818304	Swipe 👉🏾 for the  photos. This lovely 😊 wore protective styles for awhile, which practically gave me a blank slate for this  visit. Thanks to tosha_karizma for trusting me to bring your vision to life… 	{'place_id': '1d9a5370a355ab0c', 'coordinates': {'type': 'Point', 'coordinates': [-87.6416625, 41.86749783]}}
2347867058	2020-03-01T16:51:28.000Z	1234159328652861445	i’d like to travel ONCE for spring break... please.... i’m tired of staying home in this coldass state watching everyone go party on the beaches getting tans	{'place_id': '50f296a1bd4198b6'}
24704505	2020-03-01T16:33:38.000Z	1234154842714705920	Young fan  If you could change anything in the MCU movies, what would it be? I would have changed Tony dying. There’s always time travel... wink, wink.I think I would have liked to have seen Black Widow and Banner give it more of a college try.  	{'place_id': '1d9a5370a355ab0c'}
39686369	2020-03-01T16:20:10.000Z	1234151454119809024	 Is At The  (Benefiting  & Ready To Plunge!  We Are Still Looking For Donations, Please Visit  To Donate & Show Us Some ❤️! 	{'place_id': '07d9c945f0488000'}
139130700	2020-03-01T16:17:42.000Z	1234150833908060163	From Medina to Mecca we travel far and near to see and hear the leader.The brotherhood...   @ South Shore, Chicago 	{'place_id': '1d9a5370a355ab0c', 'coordinates': {'type': 'Point', 'coordinates': [-87.58, 41.76]}}
52585436	2020-03-01T16:06:29.000Z	1234148008012472322	Excited to be traveling to   today. A couple of days of meetings and media. So much to discuss     ー0	{'place_id': '1d9a5370a355ab0c'}
1169504438	2020-03-01T16:00:01.000Z	1234146383793397769	After  - visit  for ’s Improvised Dungeons and Dragons - tix pay-what-you-can at    	{'place_id': '1d9a5370a355ab0c'}
18701208	2020-03-01T15:47:25.000Z	1234143212748582919	Stand by and STAY TUNED! visit  to hear The Honorable Minister Louis Farrakhan! Jesus Is The Key @ Mosque Maryam 	{'place_id': '1d9a5370a355ab0c', 'coordinates': {'type': 'Point', 'coordinates': [-87.5851, 41.7608]}}
22827125	2020-03-01T15:34:47.000Z	1234140033667432450	When people love each other, the very angels leave heaven to visit their home and sing for joy. - Brahman proverb via 	{'place_id': '1d9a5370a355ab0c'}
822228032417071104	2020-03-01T15:32:56.000Z	1234139565100797954	"""Those"" People don't drink Corona Beer......THIS Punk DON'T either!CORONA IS EVERY WHERE.EVEN AT TRUMP RALLIES!!But...Y'all keep going 0 the..Traveling Jerking Off Monkey Show!😂😂😂😂*(THOSE)....U know who you ASSHATS are...... "	{'place_id': '99700cd6fc455c13'}
75579122	2020-03-01T14:59:31.000Z	1234131157538803714	Please be aware of all the travel advisories out. A lot of countries are not allowing people to enter. Here’s the list: 	{'place_id': '1d9a5370a355ab0c'}
14923129	2020-03-01T14:44:44.000Z	1234127437660815362	It begins. March marks the onset of 0 months of travel (inbetween working) for my wife and I: Amsterdam, Florida, Frankfurt, Munich, Austin TX, Edinburgh. Very excited to see more of Earth.    	{'place_id': '1d9a5370a355ab0c'}
49664764	2020-03-01T14:11:07.000Z	1234118975828692993	“The confidence you exude make the fools stay away”  - Hov ••               … 	{'place_id': '1d9a5370a355ab0c', 'coordinates': {'type': 'Point', 'coordinates': [-87.632496, 41.883222]}}
17982331	2020-03-01T13:44:26.000Z	1234112261469458434	 I help people travel to other countries so they can learn stuff.	{'place_id': '1d9a5370a355ab0c'}
19032351	2020-03-01T13:22:32.000Z	1234106748627279873	  It’s ALWAYS worth the travel.	{'place_id': '1d9a5370a355ab0c'}
2369449952	2020-03-01T13:07:01.000Z	1234102846662025216	             I’m a black coffee drinker, but increasingly in moderate amounts only.That’s one bad habit that I picked up from the latter stages of my PhD program—where I would drink *pots* of coffee—that I’ve done an okay job breaking.	{'place_id': '1d9a5370a355ab0c'}
409530974	2020-03-01T13:06:32.000Z	1234102724737650688	_________               @ Chicago, Illinois 	{'place_id': '1d9a5370a355ab0c', 'coordinates': {'type': 'Point', 'coordinates': [-87.632496, 41.883222]}}
966662714809573376	2020-03-01T12:51:41.000Z	1234098984827990016	Week and race recap. It has been another busy week of travel, workouts, and more show choir. A big shout-out to all the climbers and volunteers at the Hustle Chicago climb raising funds for the Respiratory Health… 	{'place_id': '1d9a5370a355ab0c', 'coordinates': {'type': 'Point', 'coordinates': [-87.632496, 41.883222]}}
23210456	2020-03-01T07:54:57.000Z	1234024311415021574	Air travel still seen as safe as coronavirus fears spread  via  Ratings	{'place_id': '1d9a5370a355ab0c'}
238241159	2020-03-01T05:44:06.000Z	1233991381917540355	My travel 'mingo made it another trip to Vegas and back. 	{'place_id': '07d9c930b2c85002'}
1095848508316368896	2020-03-01T05:40:39.000Z	1233990512178274304	 We all should be so blessed to travel to heaven with a waffle filled belly. 😇	{'place_id': '5b0b1baf24cf0a6a'}
3253317031	2020-03-01T05:12:54.000Z	1233983531342270464	bridget just told me she has this account muted because my travel stories stress her out and honestly that’s fair	{'place_id': '1d9a5370a355ab0c'}
238264752	2020-03-01T05:10:21.000Z	1233982888028360704	Thanking God First!  Please Support me on my Babette Peyton GoFundme Pages or Become a Sponsor to help me in preparation and the acquistion of required equipment (bows, Arrows,  Accessories & Competition Wheelchair a paid Aide to travel with me & all else	{'place_id': '1d9a5370a355ab0c'}
1161310106363060224	2020-03-01T04:42:22.000Z	1233975846177734656	 When are you coming back to Chicago to visit	{'place_id': '1d9a5370a355ab0c'}
916000220839862272	2020-03-01T04:37:45.000Z	1233974683961352192	Had a great a great visit today at Robert Morris university  	{'place_id': '1d9a5370a355ab0c'}
1087974330498195459	2020-03-01T04:35:36.000Z	1233974141230907397	Was looking for places to visit and eat in Atlanta. Google showed me this, thoughts?         	{'place_id': '1d9a5370a355ab0c'}
21728901	2020-03-01T04:24:23.000Z	1233971319160672261	Just got  Next stop: Business Travel	{'place_id': '08695e38fe9e7edf'}
407988095	2020-03-01T02:31:14.000Z	1233942845754572800	One month. Can't do part time in a suburb 0 hours away and be able to pay for anything but travel to and from work, right, C******e?Also that was smack dab in the middle of what ended up being the most emotionally heartbreaking time of my life for other reasons so yeah. 	{'place_id': '1d9a5370a355ab0c'}
835898475875291138	2020-03-01T02:19:03.000Z	1233939779340902400	My whole family loves traveling. That’s what we are known for. Ask about us. 💁🏽‍♀️	{'place_id': '97d83d40844c1807'}
555534451	2020-03-01T02:06:22.000Z	1233936589182636032	The fact I gotta fly to Chicago just to see my bby effy is too much	{'place_id': '1d9a5370a355ab0c'}
835898475875291138	2020-03-01T01:25:50.000Z	1233926386148167681	My family needs this cause we travel to damn much 	{'place_id': '1d9a5370a355ab0c'}
111395646	2020-03-01T01:23:08.000Z	1233925709225168896	By tattoomercy  visit us ...   #          … 	{'place_id': '1d9a5370a355ab0c', 'coordinates': {'type': 'Point', 'coordinates': [-87.7245499, 41.9393]}}
84312792	2020-03-01T00:44:37.000Z	1233916015827935239	  I gotta coordinate with your travel but I need out this cold	{'place_id': '1d9a5370a355ab0c'}
1532877811	2020-03-01T00:39:44.000Z	1233914785282039808	They passed the customer service test already. I’m liking my first visit. Let’s see how these Jerk Salmon Fries are	{'place_id': '0e0e928c59953000'}
29250272	2020-03-01T00:30:38.000Z	1233912497138274305	Just got the fabled $0 Megabus ticket for a visit to Indy. I didn’t know they actually existed.	{'place_id': '1d9a5370a355ab0c'}
