555420640	2020-03-30T23:59:34.000Z	1244776313912733697	Prior to the hanky code, queer men participated in different types of coded language. Travel books like Vagabond not only provided information on safe spaces throughout the country, but also sold branded jewelry… 	{'place_id': '1d9a5370a355ab0c', 'coordinates': {'type': 'Point', 'coordinates': [-87.66822, 41.99864]}}
100538298	2020-03-30T23:22:09.000Z	1244766897394114560	Here's a graphic with some info on unemployment for creative professionals. Visit my Facebook biz page for more resources as I continue to find them.  	{'place_id': '1d9a5370a355ab0c'}
161149335	2020-03-30T23:18:29.000Z	1244765972461948928	Visit on my spots in the city. mellowyellowrestaurant in Hyde Park. They got good burgers and breakfast. Visit the website for a full menu and order for takeout! @ Mellow Yellow Restaurant in Hyde Park 	{'place_id': '1d9a5370a355ab0c', 'coordinates': {'type': 'Point', 'coordinates': [-87.58862952, 41.79976102]}}
14972350	2020-03-30T22:27:09.000Z	1244753054114643968	We carefully considered our options for safely serving the public and came up with two. Visit  choose “The Shop” from the menu, and decide whether you’d like to order/pay online, or visit us during our socially distant tap room hours. 	{'place_id': '1d9a5370a355ab0c'}
334855002	2020-03-30T22:15:53.000Z	1244750218140307461	In this unprecedented time, NIRI community joins forces...Visit chapters ' Twitter pages/more info, REGISTER (Gratuit/NIRI-Chicago members) [Details below]  (tomorrow!),  (0/0),  (0/0) &  (0/0)    	{'place_id': '1d9a5370a355ab0c'}
1099062341067595776	2020-03-30T21:28:01.000Z	1244738173974065157	Visit  for some very unique jewelry!!! 	{'place_id': '1d9a5370a355ab0c'}
1217887237607694338	2020-03-30T21:21:13.000Z	1244736461435555841	We’ve partnered with   and other businesses to provide hand sanitizer and other resources to  officers as they battle the frontlines of the pandemic. For a list of needed supplies & drop off centers, visit  	{'place_id': '1d9a5370a355ab0c'}
706931937768656897	2020-03-30T20:58:10.000Z	1244730662806061059	When you can't be on the road for spring travel, get cozy WFH with a pair of  socks! 🧦💜 	{'place_id': '1d9a5370a355ab0c'}
111395646	2020-03-30T20:49:00.000Z	1244728355628486656	Done a few weeks ago By nezz_alva  visit us  0-0-0 ...       … 	{'place_id': '1d9a5370a355ab0c', 'coordinates': {'type': 'Point', 'coordinates': [-87.7245499, 41.9393]}}
444410740	2020-03-30T20:42:20.000Z	1244726677634154498	Met a guy from Oklahoma in town visiting his family in Chicago. I asked if I could visit and if we could go to Joe Exotics zoo. He said absolutely, it’s only 0 min from his place. I think I just found my soul mate	{'place_id': '1d9a5370a355ab0c'}
602351331	2020-03-30T19:57:58.000Z	1244715513441325056	Please make sure to visit  for a list of free resources offered for Chicago residents. There is information for health, food, housing, employment/financial support, utilities, and also information for undocumented individuals. Feel free to share this.	{'place_id': '1d9a5370a355ab0c'}
25828514	2020-03-30T19:48:58.000Z	1244713248437436417	" it is a good start, but the ""Travel Rule"" compliance is going to give headaches from a technical perspective (i spoke about that here:       "	{'place_id': '57ac88aefcd20988', 'coordinates': {'type': 'Point', 'coordinates': [-88.1157503, 41.8342135]}}
956571637041672192	2020-03-30T19:09:44.000Z	1244703375695974406	I Got this is so excited to be participating in National Drug and Alcohol Facts Week! Visit  or  for more information! I Got This is a communication campaign in Chicago working to prevent underage alcohol use.   	{'place_id': '1d9a5370a355ab0c', 'coordinates': {'type': 'Point', 'coordinates': [-87.5933951, 41.7780694]}}
380573728	2020-03-30T18:58:16.000Z	1244700487905169408	This shit is hilarious at this point. Life, work, summer , traveling, just all of it. 	{'place_id': '1d9a5370a355ab0c'}
31853596	2020-03-30T17:35:43.000Z	1244679714939297794	Years ago, I had a bar regular who owned tigers. I was working in the suburbs of Chicago, and while he don’t have them at his home, he kept them at a farm and would visit them regularly. 	{'place_id': '1d9a5370a355ab0c'}
225175535	2020-03-30T17:34:10.000Z	1244679322637668353	 That’s a hard task ahead of you.. I would visit you regardless. 🙂	{'place_id': 'f73e32e0ec3fcc45'}
918889065294041088	2020-03-30T16:51:43.000Z	1244668639510487040	THIS SHIT IS RIDICULOUS! I NEED A MF HAIRCUT, I MISS MY FRIENDS, I MISS THE STREETS, I MISS GETTING DAY DRUNK WITH MY FRIENDS, BASEBALL GOT CANCELED, CANT EVEN VISIT MY FAMILY :/ I FUCKING HATE IT HERE!!! 	{'place_id': '1d9a5370a355ab0c'}
34423051	2020-03-30T16:41:29.000Z	1244666064220364800	Great idea, can we do virtual visit for our museums here?  	{'place_id': '1d9a5370a355ab0c'}
722772954	2020-03-30T16:27:10.000Z	1244662461653045250	 True, but we could still do it lmao. It just wouldn’t look the same, but sound still gone travel 😂	{'place_id': '1d9a5370a355ab0c'}
409530974	2020-03-30T15:53:00.000Z	1244653863715475456	A walk in the park__________             … 	{'place_id': '1d9a5370a355ab0c', 'coordinates': {'type': 'Point', 'coordinates': [-87.632496, 41.883222]}}
540628749	2020-03-30T15:43:43.000Z	1244651527215747073	 I told my family it probably isn’t wise for me to be traveling to visit as much as I’d like.	{'place_id': '1d9a5370a355ab0c'}
30252520	2020-03-30T14:45:51.000Z	1244636967574425602	 Hope to visit later in the fall/winter, otherwise again in the spring ✨	{'place_id': '1d9a5370a355ab0c'}
1205499469	2020-03-30T14:45:29.000Z	1244636873433198594	Had a dream last night I went to go see the Bands Visit and Bernie Sanders was in the cast	{'place_id': '1d9a5370a355ab0c'}
705218297269190663	2020-03-30T14:34:56.000Z	1244634216287141888	It’s so intense with COVID my sons doctor has to see him via Telehealth. Meaning I have to log into a link at his scheduled appointment time so we can have a virtual video visit to discuss my concerns 😭😩	{'place_id': '1d9a5370a355ab0c'}
1112795871861751808	2020-03-30T13:33:22.000Z	1244618724902080512	☀️ Great Morning Chicago! For everything and anything Real Estate 🏡 visit   or tweet me.   	{'place_id': '50f296a1bd4198b6'}
762671966	2020-03-30T13:30:04.000Z	1244617894316539904	Time to take a break from cooking? We’re open daily for curbside pickup and delivery from 0pm-0pm. Visit our website or find us on  🇵🇪    	{'place_id': '1d9a5370a355ab0c'}
1136781960964116480	2020-03-30T12:49:36.000Z	1244607712396300288	Check in daily Album of the day :  - Evolver Website to check out:Candidate to visit -  and  at  Movie of the day : 	{'place_id': '3009292baa8dda23'}
30252520	2020-03-30T11:37:20.000Z	1244589522559606784	 I'm in self isolation...from everyone in Japan...which started when I had to cancel my usual visit in March a few weeks ago... 😔Guess I missed out on 🌨🌸 and being able to lock down in what would've been my final week of the trip 🤷🏻‍♂️	{'place_id': '1d9a5370a355ab0c'}
1237149610369523716	2020-03-30T09:48:55.000Z	1244562238859509761	    NOT All Americans are rude. Visit   Lower on crime now 👏, Great on manners.	{'place_id': '1d9a5370a355ab0c'}
778698305672929286	2020-03-30T08:00:27.000Z	1244534944703143936	When I was 0 my cousin was in jail in STL his wife would come to Chicago and then drive to STL to go visit him in jail. For the last 0 years of his sentence I visited him once a year. I was 0 so I didn’t know how serious he took these visits because as I got older I learned-	{'place_id': '1d9a5370a355ab0c'}
382759559	2020-03-30T04:11:16.000Z	1244477267167903746	And if you don’t live with your S.O. Why the fuck y’all still hanging out? 	{'place_id': '1d9a5370a355ab0c'}
100701816	2020-03-30T04:02:30.000Z	1244475061135912969	 Text me whenever you're playing and wanna come or want to visit! I've only had one friend come so far. He gave me my ladder 🥺😂	{'place_id': 'e2c96cf8c0a43c1d'}
28846021	2020-03-30T02:16:48.000Z	1244448460763533312	 Jemma will give her code out BUT if you visit your have time bring an offering to her Gift Gulch	{'place_id': '1d9a5370a355ab0c'}
409530974	2020-03-30T01:21:07.000Z	1244434446499135488	__________               … 	{'place_id': '1d9a5370a355ab0c', 'coordinates': {'type': 'Point', 'coordinates': [-87.632496, 41.883222]}}
409530974	2020-03-30T01:19:25.000Z	1244434020135366656	__________               … 	{'place_id': '1d9a5370a355ab0c', 'coordinates': {'type': 'Point', 'coordinates': [-87.632496, 41.883222]}}
1237149610369523716	2020-04-01T22:20:56.000Z	1245476266381361153	Fear of  becomes a reality. 😳	{'place_id': '1d9a5370a355ab0c'}
771303997831544832	2020-04-01T22:06:31.000Z	1245472640845991939	Going on a trip in my favorite rocket ship!     @ Skokie, Illinois 	{'place_id': '4b3758bc32868265', 'coordinates': {'type': 'Point', 'coordinates': [-87.7473, 42.0263]}}
1029793559363416068	2020-04-01T21:39:57.000Z	1245465952512344065	  I’ve refocused my writing to address the issues my community is interested in like the topic below (discussing why canceling / changing your travel plans is the prudent thing to do in the midst of COVID-0!) ⤵️Hope this helps! ♥️  	{'place_id': '1d9a5370a355ab0c'}
492920675	2020-04-01T21:33:37.000Z	1245464359800901634	Since we can’t visit museums or anything during quarantine. Here’s some art shot for    during the Andy Warhol exhibit opening.          	{'place_id': '1d9a5370a355ab0c'}
146565835	2020-04-01T21:27:16.000Z	1245462760156258304	Lol my mom sent us a slide show of photos from when my family came to visit me in Scotland and I’ve only had one glass of wine today, but I def just cried watching it haha I miss my fam and that beautiful country more than I can say ❤️	{'place_id': '1d9a5370a355ab0c'}
624467490	2020-04-01T21:21:59.000Z	1245461431857950721	Healthy Chicago guys due to not being able to travel 0 hours  only $0	{'place_id': '1d9a5370a355ab0c'}
1138512375714160640	2020-04-01T21:17:14.000Z	1245460235915010049	Please join Lori and me, Governor J.B. Pritzker and M.K. in supporting the arts community through  a free, interactive hub to unite us during  and provide funding for artists and orgs affected. Visit  to support, explore and share. 	{'place_id': '1d9a5370a355ab0c'}
722146156755730432	2020-04-01T20:29:49.000Z	1245448303506006018	i fell out on my way out of a bar a couple of weeks ago and split my noggin and now i'm $0k in debt bc a bunch a strangers made the financial decision FOR ME to call an ambulance over a little blood, ignoring my insistence that i couldn't afford a hospital visit.	{'place_id': '1d9a5370a355ab0c'}
374150915	2020-04-01T20:05:51.000Z	1245442273451683841	Completed my first  visit in clinic this AM and gave a  lecture on  to  M0s + PAs this PM. Silver lining of  maximizing appropriate utilization of electronic communication! 	{'place_id': '1d9a5370a355ab0c'}
1102924608	2020-04-01T19:23:19.000Z	1245431566467305475	I am a big supporter of the Arts!  has launched a Relief Fund to help support artists and art organizations who are unable to work or keep the lights on because of the devastating impact of  on the industry.  Please visit  to help.	{'place_id': '88bddb0e2768943d'}
2424148879	2020-04-01T19:08:24.000Z	1245427814138097666	Make sure you visit our web page at  for updates on programming and services for students! 	{'place_id': '50f296a1bd4198b6'}
1281711924	2020-04-01T18:52:50.000Z	1245423898482671616	Anyone want to be friends and visit my island. Gates will be open :)    	{'place_id': '1d9a5370a355ab0c'}
343144721	2020-04-01T18:50:52.000Z	1245423402996969472	   0) Trump knew it was a major threat, acted fast w/ a travel ban, then spent the next 0 weeks downplaying the threat, golfing, holding rallies, and generally ignoring that threat because he stupidly thought a ban would do anything more than buy time from the US being infected.	{'place_id': '1d9a5370a355ab0c'}
251950387	2020-04-01T18:50:34.000Z	1245423325687488518	I’ve been tryna have  do a live with me! We have such good travel stories 	{'place_id': '1d9a5370a355ab0c'}
343144721	2020-04-01T18:49:34.000Z	1245423075438538753	   Yes, this. There are two schools of thought here. 0) Trump didn't believe Covid was a threat and merely used the situation to further his travel ban policies against foreigners.	{'place_id': '1d9a5370a355ab0c'}
797886046684008448	2020-04-01T18:42:44.000Z	1245421354733776904	       Mine was every time aunt Esther walked in the door, The look on Fred Sanford‘s face and when he would say damn another visit from the ugly. And Ralo LOL everybody had a friend like Ralo.	{'place_id': '222efb7ee8b98c58'}
1204911788082360324	2020-04-01T18:16:31.000Z	1245414755856089089	Life was good when I was traveling 😪 	{'place_id': '0fc38f0a8014c003'}
331300799	2020-04-01T18:13:14.000Z	1245413932946382849	I wanna visit all the 0 wonders in a month. But I am poor. 🙃🙂	{'place_id': '1d9a5370a355ab0c'}
216400495	2020-04-01T18:00:24.000Z	1245410699750322176	0 University of Texas students test positive for coronavirus after Mexico spring break trip, officials say  via 	{'place_id': '04c0488a01ad05ce'}
45878438	2020-04-01T17:33:17.000Z	1245403879090634754	We now have Easter baskets available! Chocolate is sure to bring those front line workers some joy. Visit  to donate a basket to a local Chicago hospital now      	{'place_id': '1d9a5370a355ab0c'}
318759353	2020-04-01T17:24:06.000Z	1245401568222068736	Everyone pray for me.. I’m about to fly to Japan🙏	{'place_id': '1d9a5370a355ab0c'}
52660879	2020-04-01T17:22:46.000Z	1245401230349938688	I’m trying to visit someone’s island with mables shop already set up so drop y’alls tag or whatever. 	{'place_id': '1d9a5370a355ab0c'}
1301940242	2020-04-01T16:34:02.000Z	1245388965361967105	Cleaning out my truck😖 It's been reassigned. (@ Pilot Travel Centers in Alsip, IL w/       	{'place_id': '9fdc3d1edf51a0a0', 'coordinates': {'type': 'Point', 'coordinates': [-87.701114, 41.663639]}}
14608335	2020-04-01T16:31:27.000Z	1245388315072909312	I’ve watched the UPS truck travel all around my neighborhood without stopping at my building. This has been a real emotional rollercoaster.	{'place_id': '1d9a5370a355ab0c'}
1213644532228612096	2020-04-01T16:25:43.000Z	1245386872353939456	Follow our stories and posts for specific prompts, and visit the website to submit your ideas and stories.  0/0 	{'place_id': '1d9a5370a355ab0c'}
2903273660	2020-04-01T16:17:15.000Z	1245384743052619776	does anyone have a time traveling machine to jump ahead to 0	{'place_id': '1d9a5370a355ab0c'}
708550851699191808	2020-04-01T16:13:43.000Z	1245383852920647688	Under Contract! List your home with the hottest real estate brokerage in Chicagoland! Email m.applegate or visit  if you want next!   	{'place_id': '725db070ce9dc494'}
14972350	2020-04-01T16:09:30.000Z	1245382793993035776	Curbside pick-up hours begin today! Visit our fancy online shop  &  to place your order, pay, and set-up your pick-up time. Our socially distant carry out hours continue this week as well: Fri 0p-0p & Sat 0p-0p.  	{'place_id': '1d9a5370a355ab0c'}
489907660	2020-04-01T15:36:33.000Z	1245374499576598535	 Your phone number is not available? I need to cancel a flight that my 0+ mother is supposed to go on today. But she is afraid of traveling right now.	{'place_id': '1d9a5370a355ab0c'}
12284252	2020-04-01T14:51:05.000Z	1245363059444588545	Just watching travel vlogs of folks who’re flying into Barra Beach airport and getting misty at how beautiful it is, like a totally normal person.	{'place_id': '7c41123461ee14c9'}
409530974	2020-04-01T14:37:31.000Z	1245359643259527177	One of my favorite shots from my Chicago trip last year was capturing this empty city street.__________       … 	{'place_id': '1d9a5370a355ab0c', 'coordinates': {'type': 'Point', 'coordinates': [-87.632496, 41.883222]}}
409530974	2020-04-01T14:35:08.000Z	1245359045919354880	__________              … 	{'place_id': '1d9a5370a355ab0c', 'coordinates': {'type': 'Point', 'coordinates': [-87.632496, 41.883222]}}
976805946344210432	2020-04-01T14:14:47.000Z	1245353924661522432	These numbers for air travel though!? 😯 	{'place_id': '90c2fa83ca7cbd80'}
1969113937	2020-04-01T13:17:25.000Z	1245339485820329986	Do you know where Google came from? Most kids (and adults!) don’t. Join me for a 0-minute author visit that will knock your socks off! Best for kids 0-0.Now online only at      	{'place_id': '2a313fd924081b90'}
1136781960964116480	2020-04-01T13:04:20.000Z	1245336193581092864	Check in daily Album of the day :  -Colour the Small One Website to check out:  -howard Candidate to visit -  and  ur  Movie of the day : Big Fish	{'place_id': '3009292baa8dda23'}
20548213	2020-04-01T12:53:35.000Z	1245333488515112961	Also due to our decreased air travel I am now missing the white airline agents who assume my husband - who looks nothing like Mr. Burton - is Levar Burton. We got offered so many, many upgrades. And drinks. 🤣🤣 	{'place_id': '1d9a5370a355ab0c'}
517117048	2020-04-01T11:58:37.000Z	1245319655767642113	After a lot of therapy, and a bit of time, I’ve finally come to realize: love is not enough. I wish I could time travel back to that martini at the hotel bar and tell myself “That doubt you’re feeling? It’s real. Get the fuck out of here, now.”	{'place_id': '1d9a5370a355ab0c'}
50419863	2020-04-01T10:59:23.000Z	1245304750259736581	My dadcu was horrifically injured at Dunkirk, he spent the war years mining tin in Cornwall, and learned to speak Cornish. He also spoke Romani as he was mates with the traveling folk.	{'place_id': '6db05c8d8e092528'}
19826881	2020-04-01T10:56:54.000Z	1245304123337170944	 We keep postponing Mom's visit; she's 0 hours away and we couldn't make it work until March. Then...Hugs from here.	{'place_id': '4b3758bc32868265'}
181252363	2020-04-01T07:26:55.000Z	1245251281578590220	i seriously wanna travel for spencer and surprise him	{'place_id': '0e0b9a037618a313'}
1127245045797728256	2020-04-02T23:56:22.000Z	1245862673117376512	Lori Lightfoot just paid her nephew Webster a visit to make sure his ass was in the house. .          	{'place_id': '1d9a5370a355ab0c'}
1114962231127617536	2020-04-02T23:50:07.000Z	1245861099162857474	  Sisterhood of the traveling jacket	{'place_id': '1d9a5370a355ab0c'}
156156106	2020-04-02T23:31:23.000Z	1245856382177300480	Take a throne wherever you go... It’s more of a peace-maintenance concept than anything else. You’re the only person that can maintain your peace. —Sincerely, Tyra For more motivation, visit our website:… 	{'place_id': '1d9a5370a355ab0c', 'coordinates': {'type': 'Point', 'coordinates': [-87.632496, 41.883222]}}
524524080	2020-04-02T23:01:17.000Z	1245848810502250497	AKF AdvocacyAmericans who can’t afford their  should not delay a doctor visit if they believe they have  We've joined 0 other organizations urging the ten largest health insurers to… 	{'place_id': '99700cd6fc455c13', 'coordinates': {'type': 'Point', 'coordinates': [-87.4804, 41.5957]}}
389842196	2020-04-02T22:42:03.000Z	1245843970455785473	 Just save it for ‘0, mate. International travel is prob going to be cancelled this year 😶	{'place_id': '1d9a5370a355ab0c'}
1896079111	2020-04-02T22:31:50.000Z	1245841399779454976	 I feel like you need to invite me on a trip when all this is over. Thanks	{'place_id': '08695e38fe9e7edf'}
2979880791	2020-04-02T21:30:14.000Z	1245825893731196929	 Armchair environmental impact of  I’m assuming if fuel consumption down then overall transportation sector is down (personal & commercial travel including airlines). Transportation sector emissions as whole for 0st quarter will be significantly lower than previous years.	{'place_id': '1d9a5370a355ab0c'}
97546280	2020-04-02T21:03:34.000Z	1245819183985823744	Toast to the ones here today 🎆 Toast to the ones that we lost on the way. Memories bring back you        @ Chicago, Illinois 	{'place_id': '1d9a5370a355ab0c', 'coordinates': {'type': 'Point', 'coordinates': [-87.632496, 41.883222]}}
2781518696	2020-04-02T19:31:00.000Z	1245795890637484032	 in October we walked in to  to make a statement and looking at some of the refined   I’d say we did prettyyyyy good kehcorreia  apaixonadosporviagens leoblacck … 	{'place_id': '1d9a5370a355ab0c', 'coordinates': {'type': 'Point', 'coordinates': [-87.632496, 41.883222]}}
182224892	2020-04-02T18:59:15.000Z	1245787898626048000	$JBolo wish he could say the same thing!! But you come visit me, tease me, give me “Greenball” from all this foreplay, then hang around all day, then leave! Without so much as a handjob!!! 😔🥺 	{'place_id': '1d9a5370a355ab0c'}
24627188	2020-04-02T18:38:50.000Z	1245782762726047744	  Ummm, why are u traveling Kim?	{'place_id': '1d9a5370a355ab0c'}
3947649988	2020-04-02T18:14:02.000Z	1245776519278051328	had a dream that  came to visit me and she peed in my closet. can someone with straight-across bangs tell me what this means	{'place_id': '1d9a5370a355ab0c'}
983414952441663489	2020-04-02T17:37:55.000Z	1245767431899033600	Post how you’re observing social distancing in our  and what gardening projects you’ve started on  in Willowbrook Facebook page! Visit    	{'place_id': '0e0b9a037618a313'}
15605988	2020-04-02T17:37:49.000Z	1245767407018311680	 One of my fondest memories of an Amanda visit was Getting To Know Lupo with you.	{'place_id': '1d9a5370a355ab0c'}
54749712	2020-04-02T17:37:03.000Z	1245767211605770240	I need to see a doctor but this is the definitely the wrong time to swing by for a visit.	{'place_id': '1d9a5370a355ab0c'}
19096078	2020-04-02T17:29:42.000Z	1245765361334718464	I am challenging everyone to post a photo you've taken from a place you've been. The only thing is that you NOT appear in it. Just a pic, no description. Let's flood profiles with landscapes to ease this isolation. Copy this, post a photo & let's travel virtually around the 🌎✨  	{'place_id': '1d9a5370a355ab0c'}
359048252	2020-04-02T17:28:01.000Z	1245764940113358849	The ONLY reason I wanted to be on this project was for the travel and now I can’t even do that 😭	{'place_id': '1d9a5370a355ab0c'}
19096078	2020-04-02T17:20:37.000Z	1245763077854953472	I am challenging everyone to post a photo you've taken from a place you've been. The only thing is that you NOT appear in it. Just a pic, no description. Let's flood profiles with landscapes to ease this isolation. Copy this, post a photo & let's travel virtually around the 🌎✨  	{'place_id': '1d9a5370a355ab0c'}
2800456061	2020-04-02T16:57:46.000Z	1245757327837409287	My favorite in the mix— “A hundred springs will come and I won’t go outside, I’m scared you will visit my home and I won’t be there,” by Vahshi Bafghi.  	{'place_id': '1d9a5370a355ab0c'}
2228216426	2020-04-02T16:46:51.000Z	1245754581939826690	. was yesterday, but you still can & must complete your household's  Mail back the form or visit  ASAP! 	{'place_id': '99700cd6fc455c13'}
2284485344	2020-04-02T16:37:00.000Z	1245752100904153088	You could be salty about  or you could spice it up. Today’s  is to make a PAINTING inspired by MYTHOLOGY using spices.  Visit the slides for resources on painting with spices.  	{'place_id': '1d9a5370a355ab0c'}
2205664916	2020-04-02T16:29:42.000Z	1245750264231010305	And that’s how we ended up living in  I used to say that I’ll never move here, just visit! At the time my two sisters and my brother lived in Chicago.My Mom and I in El Paso! Life always take us to unexpected places. I am so grateful being with most of my family!	{'place_id': '1d9a5370a355ab0c'}
155925154	2020-04-02T16:17:52.000Z	1245747286979772416	  Great interview with one of the nicest coworkers I have ever known I think we should all make a point when this is over to go to his restaurant someday soon. He was so classy and fun and very like able. Sorry I left there sometimes to work In travel.	{'place_id': 'b23478d3162b126e'}
170872474	2020-04-02T16:02:50.000Z	1245743501402353664	Mat Pilates!Pilates is my Happy Hour.     For full video link in the bio or visit our website at  @ Home 	{'place_id': 'd77ed7c9521c898d', 'coordinates': {'type': 'Point', 'coordinates': [-88.05330771, 41.86853735]}}
49188555	2020-04-02T15:45:28.000Z	1245739130455314432	 to this solo trip I took years ago in Chicago in the summer. I rode a bike on the lakefront on that day, then headed to Lou Malnati’s and had some amazing deep dish pizza 😋 If you want to travel somewhere and… 	{'place_id': '1d9a5370a355ab0c', 'coordinates': {'type': 'Point', 'coordinates': [-87.661532, 42.012531]}}
100538298	2020-04-02T15:38:08.000Z	1245737285615792128	We're going live with the label tonight at 0:0 CST.You can also visit my page for a growing list of resources for musicians and artists in need of some help. Some are just for Chicago, but many aren't.    	{'place_id': '1d9a5370a355ab0c'}
2275243568	2020-04-02T15:02:24.000Z	1245728294294740994	What an awful time to buy Global Entry and a travel credit card	{'place_id': '1d9a5370a355ab0c'}
22098528	2020-04-02T14:48:43.000Z	1245724851702202370	Me: I pour my coffee into my travel mug. : my mouth is my travel mug.	{'place_id': 'b8fcb766f3f544fe'}
61906166	2020-04-02T14:47:26.000Z	1245724526853398528	However, our Amsterdam host won’t ALLOW us to cancel let alone give us our money back. She apparently wants us to be responsible for possibly spreading  to her neighbors and potentially other guests. The State Dept made it clear to avoid all international travel. 	{'place_id': '1d9a5370a355ab0c'}
409530974	2020-04-02T14:41:48.000Z	1245723108365029376	More cool shots from Chicago__________             … 	{'place_id': '1d9a5370a355ab0c', 'coordinates': {'type': 'Point', 'coordinates': [-87.62614846, 41.88046793]}}
