771617167	2020-02-27T16:05:24.000Z	1233060573388169216	Come visit the 🚚 at UOFC (0th & Ellis) for this truffle BlT.  0-0pm @ The University of Chicago 	{'coordinates': {'type': 'Point', 'coordinates': [-87.60090083, 41.79142072]}, 'place_id': '1d9a5370a355ab0c'}
624704425	2020-02-27T16:01:09.000Z	1233059503613984768	Chicago-it’s a joy to be back again!!! Here to step in for a colleague sadly unable to travel, but I have the privilege of singing Beethoven with the most amazing group of people whom I have adored for a long time… 	{'coordinates': {'type': 'Point', 'coordinates': [-87.62325168, 41.88265611]}, 'place_id': '1d9a5370a355ab0c'}
330504364	2020-02-27T15:57:55.000Z	1233058691861164032	I literally looked up the Astros schedule so I can go boo them. They visit Chicago in August btw. 	{'place_id': '1d9a5370a355ab0c'}
124069966	2020-02-27T15:46:35.000Z	1233055836685193218	 Lol my travel bug is byke!	{'place_id': '1d9a5370a355ab0c'}
1345094438	2020-02-27T15:23:35.000Z	1233050048516194304	Heading to set up our booth for the  Next year we’re going to just get a dunk tank for our booth and put  in it. But for this year, it’ll be the same as always. Come visit us at booth 0	{'place_id': '1d9a5370a355ab0c'}
1001525736161722369	2020-02-27T15:22:47.000Z	1233049850406551559	❄️ Cold Weather vs Client Calls📱 ➡️➡️➡️..When your traveling during the cold 🥶🧳 but and then hop on a call with a client 😎😁⠀⠀    ⠀⠀ @ Chicago, Illinois 	{'coordinates': {'type': 'Point', 'coordinates': [-87.632496, 41.883222]}, 'place_id': '1d9a5370a355ab0c'}
733332854038368257	2020-02-27T15:09:56.000Z	1233046613762985985	                                                  Amazing piece of artwork I love it	{'place_id': '1d9a5370a355ab0c'}
1608802118	2020-02-27T15:08:17.000Z	1233046201467101185	I need a group of homies to travel with .	{'place_id': '1d9a5370a355ab0c'}
410491494	2020-02-27T15:05:36.000Z	1233045525877968896	Today is the day!   This is our school’s biggest student, staff, family, and community collaboration. If you only visit Lara once, it should be for this. $0 gets you a taste of all the different pozoles and you vote for the winner! 	{'place_id': '1d9a5370a355ab0c'}
805827393470332928	2020-02-27T15:00:10.000Z	1233044157955899392	We are still accepting applications for next school year. Call the school office or visit us online to schedule your personalized tour      @ St.… 	{'coordinates': {'type': 'Point', 'coordinates': [-87.68031342, 41.6796724]}, 'place_id': '1d9a5370a355ab0c'}
733332854038368257	2020-02-27T15:00:08.000Z	1233044148934074368	                                                 I really love that beautiful dress she's wearing	{'place_id': '1d9a5370a355ab0c'}
733332854038368257	2020-02-27T14:59:21.000Z	1233043952565092353	                                                 thanks Carolina studart 😀😄😄😀 the artwork looks good	{'place_id': '1d9a5370a355ab0c'}
733332854038368257	2020-02-27T14:58:09.000Z	1233043650042564619	                                                 awesome pictures nice camera work ho yes	{'place_id': '1d9a5370a355ab0c'}
733332854038368257	2020-02-27T14:53:58.000Z	1233042594743103488	                                                 all four of these pictures are absolutely gorgeous smooth colors to	{'place_id': '1d9a5370a355ab0c'}
733332854038368257	2020-02-27T14:51:13.000Z	1233041903479906305	                                                 nice pictures my friend	{'place_id': '1d9a5370a355ab0c'}
330504364	2020-02-27T14:48:26.000Z	1233041205371559936	 Very few fans travel though. You can maximize money with this model. They even built a monstrosity in Wrigleyville. But honestly. Sox could use something	{'place_id': '1d9a5370a355ab0c'}
211252731	2020-02-27T13:46:50.000Z	1233025703077085187	   Not a good sign when he’s not made an official visit to Kentucky.	{'place_id': '8b351eeb91372dc7'}
270044717	2020-02-27T13:37:56.000Z	1233023462429675522	 I really love to travel, see how other people live.	{'place_id': '5b0b1baf24cf0a6a'}
1044614220237737984	2020-02-27T13:24:44.000Z	1233020141379751936	Traveling if a lil risky rite now😷. 	{'place_id': '1d9a5370a355ab0c'}
732583794113314817	2020-02-27T11:24:45.000Z	1232989945008140288	"""Rejoice always, pray continually, give thanks in all circumstances; for this is God’s will for you in Christ Jesus.""0 Thessalonians 0:0-0 NIVCome visit us @  "	{'place_id': 'f1dfa58974449052'}
138497751	2020-02-27T09:11:55.000Z	1232956516178833408	Visit us at the ABA TechShow 0 / get a Free Appearance coverage & the coolest thermos bottle - Booth 0                	{'place_id': '1d9a5370a355ab0c'}
1223824611881766912	2020-02-27T06:06:36.000Z	1232909879670706181	Schedule for Chicago United Quidditch and my first tournament back from knee surgery! Woot! 😁        	{'place_id': '1d9a5370a355ab0c'}
1223824611881766912	2020-02-27T05:45:04.000Z	1232904463091929088	A couple days until departure 🛫! (Need to ditch this snow...🌨️🥶). Traveling ✈️with the squad  ( 🏙️ ) this weekend; flight leaves Chicago Friday night! Competing in the first ever Hoot n Howdy Brawl… 	{'coordinates': {'type': 'Point', 'coordinates': [-87.632496, 41.883222]}, 'place_id': '1d9a5370a355ab0c'}
743325372876394496	2020-02-27T04:53:50.000Z	1232891568656351233	My dad wanted to take a picture of me when I landed at the airport, but I immediately ran to his arms and started balling my eyes out after hiding so much anxiety and sadness this past week of traveling from SK and the virus. But my mom took a decent picture though 😅  	{'place_id': '1d9a5370a355ab0c'}
9362802	2020-02-27T04:40:27.000Z	1232888201901154304	  Mitchell’s last “made basket” shot should have been a travel! He landed before letting go of the ball.	{'place_id': '51e20b11ca1deda7'}
2791124550	2020-02-27T04:34:14.000Z	1232886635337068549	 Oh man. I love both to death. But the greatest time travel RPG will always stand the test of time. CT.	{'place_id': 'c8b021ffd0c94ffc'}
223266825	2020-02-27T04:33:19.000Z	1232886406181195776	I only visit my old coworkers at the office to challenge them at ping pong	{'place_id': 'c8b021ffd0c94ffc'}
733332854038368257	2020-02-27T03:56:02.000Z	1232877021178540035	                                                 hello Carolina studart 💢💐💕💕🌹🥀💞💞😃	{'place_id': '1d9a5370a355ab0c'}
14117772	2020-02-27T03:51:24.000Z	1232875856512589825	Past, current and future  leaders, when you make travel plans for  arrive in time to make this meeting Sunday morning!  	{'place_id': '72efa03540804278'}
887024851885715458	2020-02-27T03:39:04.000Z	1232872751016415232	In my lifetime I’ve had to clean bathrooms and empty trash, work cash registers, arrest shoplifters, interrogate people, manage stores, manage hospital revenue cycles, classify imports and exports, be chronically unemployed, and travel to the other side of the world to deliver IT	{'place_id': '1d9a5370a355ab0c'}
38945991	2020-02-27T03:38:17.000Z	1232872554618130434	 I work Tuesdays and Wednesday. Pat works Mondays and Fridays. Cleon works Tuesdays and Thursdays. So depending on who ya want to see, you can come visit any day lol	{'place_id': '1d9a5370a355ab0c'}
120240767	2020-02-27T03:31:56.000Z	1232870958509252610	 Mourning the passing of time. Slow / Fast travel into the ether-future with no negotiating abilities until after the fact. Thanks. 😂🤣😭	{'place_id': '1d9a5370a355ab0c'}
1029793559363416068	2020-02-27T02:41:07.000Z	1232858168637542400	A little  travel hack — you can take peel off your old international  photo, make 0 photocopies at a place like Walgreens / CVS, cut the copies to size using the original dimensions and BOOM, submit the copies for the new license! 	{'place_id': '1d9a5370a355ab0c'}
261514017	2020-02-27T02:37:17.000Z	1232857205541613568	It wasn't until I started traveling and meeting ppl that I realized most niggas have the education level of a 0th grader.	{'place_id': '1d9a5370a355ab0c'}
799003926225965057	2020-02-27T02:31:10.000Z	1232855665439379456	i think omar was one of the only niggas that came to visit ya boy back when i was living in denver thats some rns right there	{'place_id': '1d9a5370a355ab0c'}
866199202778550272	2020-02-27T02:25:04.000Z	1232854130982604802	   Ahhh I want to visit you again!	{'place_id': '8b351eeb91372dc7'}
1019979847010062336	2020-02-27T02:01:59.000Z	1232848321439465478	My favorite thing about traveling is the guaranteed 0 minute taxi once I land at 	{'place_id': '1d9a5370a355ab0c'}
733670447976439809	2020-02-27T01:48:06.000Z	1232844827332612096	I really wanted to travel this spring and summer. I’m not going anywhere until this corona virus is under control.  Thanks Trump! 🥴	{'place_id': '1d9a5370a355ab0c'}
23696330	2020-02-27T01:47:22.000Z	1232844643949215744	Can’t wait to visit. And as a shameless  plug, hope everyone else does too.  We need to remember our history.    	{'place_id': '1d9a5370a355ab0c'}
772095122230091779	2020-02-27T01:38:17.000Z	1232842355453108224	My loves coming to visit me in Chicago for their birthdays! swear i can’t wait💞 same weekend too. It’s up!	{'place_id': '1d9a5370a355ab0c'}
3159888878	2020-02-27T01:27:37.000Z	1232839672801513473	 i’d love to visit finally instead of just passing through!	{'place_id': '1d9a5370a355ab0c'}
852116929	2020-02-27T01:23:17.000Z	1232838580940218374	Project I been working on . Thanks for lending your 👀 . Also For a quicker response with  booking an appointment ,please visit my website at                                               .  .… 	{'coordinates': {'type': 'Point', 'coordinates': [-87.87843148, 41.73236569]}, 'place_id': '572b2bb5c161e847'}
17217976	2020-02-27T01:12:33.000Z	1232835880060100611	The president kept saying he was widely criticized by Democrats when he issued travel ban and no one seems to call him out for it.  was there any criticism for China related restrictions? I found this from washpost on Jan 0 	{'place_id': '1d9a5370a355ab0c'}
79185483	2020-02-27T01:02:38.000Z	1232833384042450947	My roommate  is traveling to India via Abu Dhabhi tomorrow evening and we tried to get a mask but were told it's out of stock. Could you guys please help        	{'place_id': '918c943e88cc3e5d'}
1962178447	2020-02-27T00:48:37.000Z	1232829855303163912	 To entice people to visit me in Chicago 😂😂	{'place_id': '1d9a5370a355ab0c'}
119790662	2020-02-27T00:39:10.000Z	1232827480752480256	Omg.  We couldn’t have a public health expert in charge?   Maybe be more afraid to stay home thsn travel abroad? 	{'place_id': '1d9a5370a355ab0c'}
763761197707620356	2020-02-28T23:20:11.000Z	1233532376539652098	NCS staff members are showing off some vintage NCS swag today!We are preparing for all of the exciting events and professional learning opportunities taking place in March! Visit our website to stay updated:   	{'place_id': '07d9ccd80f082001'}
1226283258570252290	2020-02-28T22:46:09.000Z	1233523814547496963	Ican travel while she gets fulfilled hard.	{'place_id': '07d9ec6fd3c88001'}
1705125571	2020-02-28T22:01:12.000Z	1233512499439382531	I don't know which part was worse: An 0-hour flight or landing in O'hare... 😆 	{'place_id': '1d9a5370a355ab0c'}
54900209	2020-02-28T22:00:24.000Z	1233512298867757056	Recycling 0: Can bottle tops go in your recycling container? Visit  to learn more about recycling do's and don'ts from Waste Management, Oak Park's refuse and recycling contractor. More info about recycling in  is at  	{'place_id': 'c8b021ffd0c94ffc', 'coordinates': {'type': 'Point', 'coordinates': [-87.7953024, 41.8906112]}}
51652027	2020-02-28T21:58:22.000Z	1233511789964537859	Though I definitely wish the circumstances were better as far as sickness goes right now (especially being Asian and traveling 🙃), I wish people respected space like this ALL THE TIME. Happy  	{'place_id': '1d9a5370a355ab0c'}
24764819	2020-02-28T21:30:30.000Z	1233504776534380544	 ‘s          … 	{'place_id': '1d9a5370a355ab0c', 'coordinates': {'type': 'Point', 'coordinates': [-87.632496, 41.883222]}}
24764819	2020-02-28T21:29:00.000Z	1233504399395303426	 ‘s           … 	{'place_id': '1d9a5370a355ab0c', 'coordinates': {'type': 'Point', 'coordinates': [-87.632496, 41.883222]}}
111921081	2020-02-28T20:43:28.000Z	1233492938593832964	 making us proud   Thank you for your surprise visit. You made my day @ The PowerHouse Restaurant 	{'place_id': '1d9a5370a355ab0c', 'coordinates': {'type': 'Point', 'coordinates': [-87.62675, 41.85365]}}
3868014977	2020-02-28T20:26:44.000Z	1233488729890750464	ATT in HOMEWOOD, IL celebrating reaching above 0.0 ✨ on Google for reviews! Come visit us and see what all the buzz is about!     	{'place_id': '07d9dba21bc85001'}
1400941496	2020-02-28T20:15:37.000Z	1233485929706332160	Omfg I had a dream(on my flight) that my plane crash down and we all survived but they told us that we were not gonna fly to Chicago until tomorrow and I was sooo upset cuz I was going to miss the Aventura concert, like sobbing 😭😭😭	{'place_id': '1d9a5370a355ab0c'}
1126141398238027777	2020-02-28T19:32:18.000Z	1233475028584484865	Ed Grant representing  this morning on  He spoke with  about JASC’s upcoming gala on Friday, March 0th— featuring rare Japanese art and Koto music. Visit  for tickets! 	{'place_id': '07d9e4c9f2487000'}
1011297234154086401	2020-02-28T19:28:19.000Z	1233474028922376192	          Great job Paris and Team!!! Balancing the biz and great seeing this store maximize throughout our visit. Keep up the great work 	{'place_id': '1d9a5370a355ab0c'}
765662789226692609	2020-02-28T19:25:38.000Z	1233473350095298561	Operational changes / Travel Updates / KSA 🇸🇦 	{'place_id': '088c56ad174b8e80'}
907479812415131649	2020-02-28T19:14:45.000Z	1233470612263161856	Amazing first site visit for  at  Thank you for having us and sharing more about your work🤩 	{'place_id': '1d9a5370a355ab0c'}
55005867	2020-02-28T19:13:24.000Z	1233470273480949762	More coronavirus headaches for airlines and passengers holding tix to Germany:  a massive travel trade show due to start next week, was just canceled.	{'place_id': '1d9a5370a355ab0c'}
518612612	2020-02-28T19:01:43.000Z	1233467333273935873	I need to get back to chicago jakemelnickscornertap ....              … 	{'place_id': '1d9a5370a355ab0c', 'coordinates': {'type': 'Point', 'coordinates': [-87.62656, 41.89558]}}
4230548164	2020-02-28T18:59:31.000Z	1233466779164381186	There's just a few bling tees in stock. Shop online at  or pay us a visit at  in  ...........  … 	{'place_id': '6db05c8d8e092528', 'coordinates': {'type': 'Point', 'coordinates': [-87.66556, 41.5613]}}
708550851699191808	2020-02-28T18:42:39.000Z	1233462533203406848	Sold and closed!  Work with the hottest real estate brokerage in Chicagoland! Email m.applegate or visit  if you want next!    	{'place_id': '07d9e2c031484000'}
43619388	2020-02-28T18:06:59.000Z	1233453557900333056	Our U.S. History students have acquired a greater appreciation of Black History Month with this visit to the    	{'place_id': '0fc347a5b0155000'}
1389699836	2020-02-28T18:03:32.000Z	1233452690254028803	Come visit the Indonesian Pavillion at the Inspired Home Show in McCormick Place Chicago, March 0-0, 0! Proudly produced in Indonesia, we offer vibrant and high-quality household goods ranging from glassware to appliances. Stay tuned for more!  	{'place_id': '1d9a5370a355ab0c'}
857285982953099266	2020-02-28T17:13:18.000Z	1233440049406136323	 Love orsay!  Visit lorangerie if you have time!  My fave museum ever!	{'place_id': '9a02ce6ca066fcdc'}
357874922	2020-02-28T17:03:09.000Z	1233437493300809728	Guten Tag from  at University of Illinois at Chicago! Happy that, even in my side gig as a school field trip chaperone, I got to visit a library. Also a historical shiver to see original      	{'place_id': '07d9f736cec83000'}
1378500738	2020-02-28T16:53:51.000Z	1233435153915092994	"Lightfoot ""fear cannot guide us""...urges people to continue to enjoy the city...visit neighborhoods including Chinatown. "	{'place_id': '1d9a5370a355ab0c'}
14058851	2020-02-28T16:34:32.000Z	1233430294763646976	 Ok that’s worth changing travel plans if you can!	{'place_id': 'f2da3efc48696715'}
14260909	2020-02-28T16:21:25.000Z	1233426991447183360		{'place_id': '1d9a5370a355ab0c'}
120229326	2020-02-28T16:16:39.000Z	1233425792484495361	Who’s at  today? What are you excited to see? What booths should we visit? Say hello if you see us walking around!   	{'place_id': '1d9a5370a355ab0c'}
1223824611881766912	2020-02-28T15:41:49.000Z	1233417026351378432	Ready for work to be done 😅; punch out 0pm! C U soon Atlanta ✈️      	{'place_id': '1d9a5370a355ab0c'}
73566694	2020-02-28T15:30:16.000Z	1233414118733996032	 Also, you’re letting your kid visit Purdue? What the Hell? U of I or GTFO.	{'place_id': '1d9a5370a355ab0c'}
236984238	2020-02-28T15:16:54.000Z	1233410754671497218	The Kubert School is at  at booth  All application fees are waived at the show!For more info on The Kubert School please visit  or contact us at info       	{'place_id': '1d9a5370a355ab0c'}
218657311	2020-02-28T15:02:12.000Z	1233407056755003392	Chi trying to recruit the ole lady long term. Love this city... def coming back to visit	{'place_id': '1d9a5370a355ab0c'}
44388921	2020-02-28T14:59:46.000Z	1233406443388309507	 But generally speaking, I’ve seen these rates regardless of Geo if you are willing to travel. If you are less willing to travel the rates modulate to your local market.	{'place_id': '5b0b1baf24cf0a6a'}
1199823146422898688	2020-02-28T14:53:24.000Z	1233404842065977346	Day  of the  we have new shirts and new coffee 😉 today we will be serving local Chicago coffee. Come visit booth 0 to start your day off right!     	{'place_id': '0fc296eaecd5e000'}
3004167455	2020-02-28T14:37:25.000Z	1233400820848263169	Looking for signs of spring??🐰🌷 visit Maggie Daley Park Saturday February 0th for a chance to see Peter Rabbit, he will be leaping around the park this leap year promoting his new movie with some fun give aways!. 0-0pm! 	{'place_id': '1d9a5370a355ab0c'}
1107719998221574144	2020-02-28T13:36:03.000Z	1233385375772573697	Learn to perfect classic  combos at  in  Email noahg0 for more info or visit 	{'place_id': '1d9a5370a355ab0c'}
75485823	2020-02-28T13:14:22.000Z	1233379920514093058	 Come visit booth 0!	{'place_id': '1d9a5370a355ab0c'}
2811975708	2020-02-28T13:11:09.000Z	1233379111541841920	Dior Eau Sauvage Couch Couple/Cologne 0's by Rene Gruau.Can be purchased on our websiteVisit us        … 	{'place_id': '1d9a5370a355ab0c', 'coordinates': {'type': 'Point', 'coordinates': [-87.63325, 41.9017]}}
732583794113314817	2020-02-28T12:58:05.000Z	1233375822465163272	"""Whoever confesses that Jesus is the Son of God, God abides in him, and he in God.""I John 0:0 NKJVVisit us @  "	{'place_id': 'f1dfa58974449052'}
1225106361429757952	2020-02-28T11:59:31.000Z	1233361084322631680	We truly are thankful!! Please come back and visit us again! 	{'place_id': '1d9a5370a355ab0c'}
43188208	2020-02-28T07:44:58.000Z	1233297021475442691	 You’ll love it! The Primal Rage II cab should be next to it too. Primal Rage 0.0J has a special hardware configuration, so, if it isn’t active when you visit, ask a staff member at the arcade about it.	{'place_id': 'da31845899ddf47e'}
1187041277805826048	2020-02-28T05:50:54.000Z	1233268319274373120	I bet everyone who’s favorite wish was to travel the world 🌍 Has a new favorite wish of ‘Not leaving the house’   	{'place_id': '6af99a29bfae42a2'}
2649663138	2020-02-28T05:39:29.000Z	1233265444989087744	It has fully taken Red Line run 0 over THIRTY minutes to travel from Grand to North/Clybourn ma’am—	{'place_id': '1d9a5370a355ab0c'}
1472073320	2020-02-28T04:49:45.000Z	1233252930381156353	Levi The Poet Documentary - Day 0 // I arrived in Albuquerque, New Mexico this morning and Levi and I went to visit his sister  at her salon townshairshop. We took photos, got some candid footage, and… 	{'place_id': '5a483763a916e21d', 'coordinates': {'type': 'Point', 'coordinates': [-87.914753, 41.892386]}}
52585436	2020-02-28T04:43:54.000Z	1233251458155470849	Today I reviewed plans for some major corporations for the  I must say the firms that are well run have detailed plans for employees, guests visiting their offices, travel rules for all staff, sanitation rules for offices etc. the weaker firms need to get to work now.	{'place_id': '1d9a5370a355ab0c'}
16520356	2020-02-28T04:43:12.000Z	1233251282045018112	 Often one is the hardest decisions when packing for away travel.	{'place_id': '1d9a5370a355ab0c'}
211740329	2020-02-28T04:07:25.000Z	1233242272990420994	Ahhhh, it's a magical first aid kit that sends him through time and space. He can't time travel at will 	{'place_id': '1d9a5370a355ab0c'}
613127850	2020-02-28T03:48:30.000Z	1233237513587826689	Here's the dinner party with     and  after a successful seminar visit to   on Scanned Oblique Plane Illumination Microscopy. This meeting was facilitated by Twitter! 	{'place_id': '107433bb0ad46001'}
775522884219392000	2020-02-28T03:20:41.000Z	1233230514842198019	      Loved the traveling snack cart surprise!  Very appreciated!	{'place_id': '4b3758bc32868265'}
36898720	2020-02-28T02:36:23.000Z	1233219364045893632	I am available now in Chicago, Illinois, United States! To contact me, visit  0 0 0   	{'place_id': '918c943e88cc3e5d'}
1206886166034894853	2020-02-28T02:15:28.000Z	1233214099787538432	  the volume's like so low on the travel channel that i can't hear it for some reason lol 😩	{'place_id': '1d9a5370a355ab0c'}
1184146967565340672	2020-02-28T01:39:36.000Z	1233205076208029696	  Jeffe is always extremely excited to travel with the boys!	{'place_id': '1d9a5370a355ab0c'}
103422729	2020-02-28T01:26:31.000Z	1233201781888425985	  Have been traveling for almost a month straight so I’m just going to make sure my affairs are in order	{'place_id': '283403107f5c191b'}
455869077	2020-02-28T01:06:12.000Z	1233196668847370240	  Come visit	{'place_id': '8b351eeb91372dc7'}
28463684	2020-02-28T00:56:34.000Z	1233194246565453824	freshman year of undergrad, video dropped when I was in my chemistry lecture. I watched the video with a classmate, Tashina. We both failed that class. She’s a model, traveling the world now but still has time to like all my IG pics 😂 	{'place_id': '1d9a5370a355ab0c'}
783054475862900736	2020-02-28T00:36:00.000Z	1233189068038688768	Congratulations to Northside Frosh Olivia Petrillo on becoming an IHSA state finals qualifier for the girls basketball 0pt shooting contest. She will travel to Bloomington next Thursday for the first round At Illinois State University. 	{'place_id': '07d9db39bcc85001'}
301170383	2020-02-28T00:30:47.000Z	1233187755162787840	 you have a responsibility to acknowledge the 0 cases in the US Plus visit & embrace all the people as well    	{'place_id': '1d9a5370a355ab0c'}
32658538	2020-02-28T00:28:09.000Z	1233187095939813376	How to add stress to your interview:  fly to a foreign city, leave children with babysitters (separately), have school canceled for snow the day you are away. Answer: scramble, have amazing family and friends, interview like you never sweat.	{'place_id': '1d9a5370a355ab0c'}
1711401102	2020-02-28T00:24:33.000Z	1233186189001269251	They might not be able to read, but they love your book,  This mama is going to have a late night reading! Thanks again for coming to visit Erickson   	{'place_id': '1aa7803ca6707875'}
78713648	2020-02-28T00:13:48.000Z	1233183481599053831	Nothing better than when friends and family come to visit you even though you live in a frozen tundra ❄️  @ Chicago, Illinois 	{'place_id': '1d9a5370a355ab0c', 'coordinates': {'type': 'Point', 'coordinates': [-87.632496, 41.883222]}}
288638696	2020-02-29T23:43:33.000Z	1233900646404952071	0 , this  doesn't even visit his own son . 	{'place_id': 'd73cbce54317ffaa'}
889092186968657921	2020-02-29T23:10:21.000Z	1233892292601274371	Special News: الحمد الله we have a visit from our elder & teacher Abu Muhammad Al-Maghribi حفظه الله scheduled for next week fromMar 0rd - Mar 0th إن شاء الله.Join Us Next Week For Reminders After Fajr  إن شاء اللهFajr @ 0:0 AM إن شاء الله 	{'place_id': '4b3758bc32868265'}
288453398	2020-02-29T22:58:50.000Z	1233889392189562880	Goodbye Duluth | Hello Chicago        @ Chicago O'Hare International Airport 	{'place_id': '1d9a5370a355ab0c', 'coordinates': {'type': 'Point', 'coordinates': [-87.885934, 41.980642]}}
253389132	2020-02-29T22:08:00.000Z	1233876598518165510	  And it’s a shorter flight from New York than it would be to travel to LA	{'place_id': '1d9a5370a355ab0c'}
106784516	2020-02-29T22:07:41.000Z	1233876521548427268	For  participants  U.S. Department of State |  	{'place_id': '1d9a5370a355ab0c'}
21728901	2020-02-29T20:47:53.000Z	1233856440227520512	Just got  Next stop: Business Travel Iowa and South Carolina	{'place_id': '08695e38fe9e7edf'}
776959003	2020-02-29T20:36:33.000Z	1233853584527196160	Sauté, braise, stir fry, grill, the possibilities are endless. The ultimate curry powder made with the brightest flavors and over a dozen spices. Enjoy global flavors without traveling.  @ Chicago, Illinois 	{'place_id': '1d9a5370a355ab0c', 'coordinates': {'type': 'Point', 'coordinates': [-87.632496, 41.883222]}}
2811975708	2020-02-29T20:14:33.000Z	1233848050805809152	Peugeot Motorbikes original French 0 vintage poster by Artist:  E. Thelem (Ernest Barthelemy Lem).  Can be purchased on our website  visit us   … 	{'place_id': '1d9a5370a355ab0c', 'coordinates': {'type': 'Point', 'coordinates': [-87.63325, 41.9017]}}
23889610	2020-02-29T20:10:08.000Z	1233846937343922176	🙏🏾 I need my money back! Lol U.S. Reports First Coronavirus Death, Imposes New International Travel Restrictions 	{'place_id': '1d9a5370a355ab0c'}
