233297632	2020-02-24T23:49:55.000Z	1232090308101525504	I have always always hated ads to “visit California” ... like don’t tell me to go hand gliding in another part of the country ...	{'place_id': '1d9a5370a355ab0c'}
14085798	2020-02-24T23:41:34.000Z	1232088209498296321	Chicago band. Chicago label. Recorded in Chicago. Pressed in Chicago.✶ ✶ ✶ ✶Thank you  for letting us visit and watch the  LPs get made today! 👀👀👀👀Debut album cominatcha March 0th! Pre-order at  	{'place_id': '0f2ab821ad15b000'}
111422483	2020-02-24T23:36:27.000Z	1232086920693518344	A delicious change of pace.dish: Camarones al Ajillo📸 hashimeats Visit our 0 Seasons Patio! Reservations: Delivery: 0.0.0Directions: Free Parking: 0 W… 	{'place_id': '1d9a5370a355ab0c', 'coordinates': {'type': 'Point', 'coordinates': [-87.685749, 41.938002]}}
61537047	2020-02-24T23:24:04.000Z	1232083805852311552	BAE IN THE STU 🔥🔥🔥🔥🔥🔥 cant wait to visit KY 	{'place_id': '1d9a5370a355ab0c'}
70249613	2020-02-24T23:14:24.000Z	1232081371604144129	 This is me every Monday when I go visit my mom. Work & that drive be having me exhausted 😩	{'place_id': 'f73e32e0ec3fcc45'}
774946861157380096	2020-02-24T23:02:45.000Z	1232078437508145154	Illinois Youth Soccer is hosting a National C License Course this Spring. For more information or to register, visit: Have questions? Shoot me an email at: marekr  	{'place_id': '0fc2f26c47d46000'}
774946861157380096	2020-02-24T22:54:11.000Z	1232076284194361346	 is hosting a National C License Course this Spring. For more information or to register, visit: Have questions? Shoot me an email at: marekr  	{'place_id': '0fc2f26c47d46000'}
30252520	2020-02-24T22:47:01.000Z	1232074478974308352	 My biggest worry everytime I visit 🇯🇵 is needing to use the washroom, and only having a squat toilet as the nearest option 😅	{'place_id': '1d9a5370a355ab0c'}
56517268	2020-02-24T21:52:58.000Z	1232060876284448769	Finally got to visit this place and get my favorite coffee,whiskey barrel-aged coffee. And I'm not much of a coffee person. Lol  @ Chicago World's Largest Starbucks 	{'place_id': '1d9a5370a355ab0c', 'coordinates': {'type': 'Point', 'coordinates': [-87.62461565, 41.89387249]}}
1083775154	2020-02-24T21:10:52.000Z	1232050284454653954	 Sir , we NRI community of US are thankful President Mr Trump's visit to Our mother land India.Thanks,Hasmukh Patel -Chicago, USA.* NRI -0- MODIJI *	{'place_id': '57ac88aefcd20988'}
17354313	2020-02-24T21:09:12.000Z	1232049865162657793	Maybe Trump could visit China & see what they r doing to stop the coronavirus.  Let him visit the hospitals in Wuhan & he can throw ppl medical masks 	{'place_id': '227d358f6ed8d29e'}
22869423	2020-02-24T21:08:56.000Z	1232049797114351616	Some of my favorite pieces from my visit to  the Art Institute of Chicago. I've seen Frank Lloyd Wright chairs and ancient Hindu sculptures, and I haven't visited all the exhibits yet.  I am… 	{'place_id': '1d9a5370a355ab0c', 'coordinates': {'type': 'Point', 'coordinates': [-87.62338036, 41.87979578]}}
1083775154	2020-02-24T21:05:20.000Z	1232048888728686593	 Namaskar , we NRI are very happy & fill proudly about President Mr Trump' s visit to Ahmedabad , Gujarat , India. Hope India / US relation grow stronger & better .Regards,Hasmukh Patel- Chicago, USA.* NRI -0- MODIJI *	{'place_id': '57ac88aefcd20988'}
93306999	2020-02-24T20:26:23.000Z	1232039086296358913	Came to visit my primo 	{'place_id': '88bddb0e2768943d'}
50199748	2020-02-24T20:25:16.000Z	1232038805277773825	New Decade, New Home! Are you thinking about buying? Do you want to take the homeownership challenge? You set the timeline, you could be ready in 0, 0, 0 days! RSVP for our next HomeBuyer Meet-up visit:… 	{'place_id': '1d9a5370a355ab0c', 'coordinates': {'type': 'Point', 'coordinates': [-87.632496, 41.883222]}}
864313968554364929	2020-02-24T20:16:20.000Z	1232036557789462529	I'm still here for another 0 hours or so but I wanted to thank everyone who made this trip great:  for being the best traveling partner out there (happy birthday!).  for sharing her time and endless wealth of Chicago knowledge with us.	{'place_id': '1d9a5370a355ab0c'}
494635090	2020-02-24T19:20:36.000Z	1232022533140090880	living in a daydream •••          @ Shedd Aquarium 	{'place_id': '1d9a5370a355ab0c', 'coordinates': {'type': 'Point', 'coordinates': [-87.61425887, 41.86756865]}}
400101074	2020-02-24T19:08:55.000Z	1232019593520144384	First grade spent part of their visit building scenes based on stories they’ve read lately. Sometimes it’s fun to create for creation’ sake.   	{'place_id': '2a313fd924081b90'}
2976394090	2020-02-24T18:49:37.000Z	1232014736096710657	“LA Latino men need to fly to New York and take some lessons from Dominican & Puerto Rican Demons and then come back and apply it” - 💀🤣	{'place_id': '1d9a5370a355ab0c'}
100538298	2020-02-24T18:27:47.000Z	1232009241529081856	"During my ""reward Phil"" visit to downtown on Saturday, I strolled by a couple places I spent time gettin' educated.My first vocal coach was at The Fine Arts building on Michigan Avenue in about 0.My last vocal… "	{'place_id': '1d9a5370a355ab0c', 'coordinates': {'type': 'Point', 'coordinates': [-87.62614846, 41.88046793]}}
1030966412150558720	2020-02-24T18:13:33.000Z	1232005659274641409	Thank you  and  for providing our scholars with the opportunity to visit the museum campus 🙌🏽🙌🏽🙌🏽        	{'place_id': '1d9a5370a355ab0c'}
2383156466	2020-02-24T17:48:43.000Z	1231999412139851778	For as long as I could remember I’ve always wanted to visit what I would call “The Bean” ever since I saw it on “The Vow” (Lol 🙊) yesterday my Husband made that happen for Me! He drove us… 	{'place_id': '1d9a5370a355ab0c', 'coordinates': {'type': 'Point', 'coordinates': [-87.62325168, 41.88265611]}}
1608248515	2020-02-24T17:44:45.000Z	1231998410766594050	 Sending love and hugs to you as you’re traveling through those beautiful clouds.	{'place_id': 'c8b021ffd0c94ffc'}
67252803	2020-02-24T17:44:42.000Z	1231998400528293890	 There’ll be a new jail in the tony part of DC so you can visit all your friends whenever you like	{'place_id': '1d9a5370a355ab0c'}
150794946	2020-02-24T17:31:17.000Z	1231995022872129536	Cancer clinical trials offer advanced treatments before the general public can access them. An estimated 0% of cancer patients don’t enroll because clinical trial sites are often far from home, making travel for patients both difficult and financially burdensome.	{'place_id': '1d9a5370a355ab0c'}
150794946	2020-02-24T17:29:58.000Z	1231994689827561479	The law clarifies that reimbursing patients for the out-of-pocket expenses necessary to travel to a clinical trial site is not to be considered inducement or coercion.	{'place_id': '1d9a5370a355ab0c'}
408523268	2020-02-24T17:10:23.000Z	1231989762942230529	 Same nephew also explosively sneezed into my open eye and mouth.These kids are a delight, and I'm not being sarcastic. They're fun and funny and generally well behaved, so it was a great weekend visit, but I forgot how much work the little guys are just to, like, keep alive.	{'place_id': '1d9a5370a355ab0c'}
218446809	2020-02-24T16:36:16.000Z	1231981176417587206	   en Chicago metropolitan area 	{'place_id': '1d9a5370a355ab0c', 'coordinates': {'type': 'Point', 'coordinates': [-87.6461792, 41.90023277]}}
225520184	2020-02-24T16:09:46.000Z	1231974509961449472	Only REAL gamers have 0 dance pads and 0 guitar hero guitars in their moms basement that she yells at them about everytime you visit	{'place_id': '0a1066f231fd366d'}
331300799	2020-02-24T16:05:11.000Z	1231973355265437696	Really considering dropping out and traveling. 😂🤦🏽‍♀️	{'place_id': '1d9a5370a355ab0c'}
53310693	2020-02-24T15:40:15.000Z	1231967080263692289	 Knowing you’re in the Chicagoland area, Cedarberg, WI is nice. It is a tiny historic town with a lot of old country charm. They’ve a nice winery that does tours, a candy shop, etc. not sure if it is your speed but I visit every few years for a four day affordable getaway.	{'place_id': '1d9a5370a355ab0c'}
19315424	2020-02-24T15:37:36.000Z	1231966411607748609	It’s been a good few days to be Xander.  The temps were perfect for long walk and a visit to     This sweet furry man joined us just a year ago.  A little more.  He has brought us joy and… 	{'place_id': '1d9a5370a355ab0c', 'coordinates': {'type': 'Point', 'coordinates': [-87.632496, 41.883222]}}
44983352	2020-02-24T15:30:39.000Z	1231964665003040768	Trump visit 0  harms poor for rally  0 DECENCY Dump Trump CULT COWARDLY GOP Senators                  	{'place_id': '5cba3a162965b0e2'}
733332854038368257	2020-02-24T15:30:15.000Z	1231964564071342080	                                                 thanks my friend	{'place_id': '1d9a5370a355ab0c'}
733332854038368257	2020-02-24T15:29:35.000Z	1231964394373963776	                                                 good morning magic Mike	{'place_id': '1d9a5370a355ab0c'}
733332854038368257	2020-02-24T15:27:17.000Z	1231963818089156609	                                                 I've already seen this picture before Ahmed	{'place_id': '1d9a5370a355ab0c'}
733332854038368257	2020-02-24T15:16:37.000Z	1231961133617164290	                                                 I really like the makeup around the eye area done by two professional	{'place_id': '1d9a5370a355ab0c'}
1412766708	2020-02-24T15:09:06.000Z	1231959241889632261	 Shiny new cars aren’t the priority for Cuba. Instead it’s universal health care, free daycare, free university / student housing & more. Also it’s hard to buy anything outside of Cuba given the US Embargo which has cost Cuba US$ 0 billion. PS safe & no gun violence. Come visit.	{'place_id': '1d9a5370a355ab0c'}
336115591	2020-02-24T14:54:34.000Z	1231955582925594634	 Cool! Do Trumps Travel now!	{'place_id': '1d9a5370a355ab0c'}
29209089	2020-02-24T14:45:49.000Z	1231953380144111618	Travel Vlog   choosechicagomx     @ Chicago, Illinois 	{'place_id': '1d9a5370a355ab0c', 'coordinates': {'type': 'Point', 'coordinates': [-87.632496, 41.883222]}}
1045012989072543744	2020-02-24T14:10:52.000Z	1231944586077048833	False.....the first of THREE steps comes AFTER the last dribble. As a skill development trainer, it’s embarrassing to watch the NBA continue to let this happen. If the dribble came at the same time as that first left foot step, it wouldn’t be a travel. 🤷🏽‍♂️ 	{'place_id': 'c8b021ffd0c94ffc'}
409530974	2020-02-24T12:38:03.000Z	1231921227821961224	The delicate dance moves of alex.mikolaj_________            … 	{'place_id': '1d9a5370a355ab0c', 'coordinates': {'type': 'Point', 'coordinates': [-87.632496, 41.883222]}}
732583794113314817	2020-02-24T11:58:57.000Z	1231911388408352770	"""And the master said to the servant, 'Go out to the highways and hedges and compel people to come in, that my house may be filled."" Luke 0:0 ESVVisit us @  "	{'place_id': 'f1dfa58974449052'}
191461957	2020-02-24T10:57:19.000Z	1231895878559862784	 thanks for the hoodie!!!! It’s one of my favorite travel sweaters! 💙💋🐝 @ Chicago Midway International Airport 	{'place_id': '1d9a5370a355ab0c', 'coordinates': {'type': 'Point', 'coordinates': [-87.74588742, 41.78656582]}}
3254879508	2020-02-24T08:30:24.000Z	1231858904851714049	ALRIGHTY THEN, now we wait to see how big a damn fool he’ll make of himself and how bad will he embarrass our country.Trump set for his biggest rally crowd yet in whirlwind visit to India amid trade friction  via 	{'place_id': 'bcc6dcc930424146'}
2462262230	2020-02-24T04:32:07.000Z	1231798937817944064	Revising an earlier  tweet.Coming up next:NYC, Miami, Havana, London, Los Angeles, and San Juan (PR).🗽🏖️🇨🇺🇬🇧🕶️🇵🇷	{'place_id': '09d1d6ab1d85412c'}
1149811170704076801	2020-02-24T04:28:28.000Z	1231798021282783234	In Schaumburg, IL ready for a great week surrounded by inspiring educators at   Come visit me at the  booth  I have  swag 🎊   	{'place_id': '918c943e88cc3e5d'}
443465755	2020-02-24T04:18:36.000Z	1231795539458564096	Call us for house sitting, dog walking and dog transportation visit to vet for appointments.   Chicago (0) 0-0Baton Rouge (0) 0-0 … 	{'place_id': '1d9a5370a355ab0c', 'coordinates': {'type': 'Point', 'coordinates': [-87.62614846, 41.88046793]}}
1447343340	2020-02-24T03:22:44.000Z	1231781479736369159	Be sure to visit  and I at the AMPlivation Station in the Exhibit Hall! 	{'place_id': '918c943e88cc3e5d'}
541284940	2020-02-24T03:19:39.000Z	1231780703169400833	I hope I’ll be able to fly in 0 weeks ... Coronavirus: Travel limitations and closed borders as cases of reported infections rise  	{'place_id': '088c56ad174b8e80'}
35488742	2020-02-24T03:19:21.000Z	1231780628699455488	 For unplugging I would fly to Portland, maybe stay a day or two because it’s cute and good eats, but most important would be renting a car and getting out to Canon Beach or Newport. Small, quiet, cute seaside towns.	{'place_id': '31afdbc173c17f0c'}
16967711	2020-02-24T02:30:34.000Z	1231768348314210304	Enjoying a weekend visit to our favorite local tiki bar.    	{'place_id': '0fbeae307b15e000'}
111395646	2020-02-24T01:53:28.000Z	1231759012347203584	By tattoomercy  visit us ...   #          … 	{'place_id': '1d9a5370a355ab0c', 'coordinates': {'type': 'Point', 'coordinates': [-87.7245499, 41.9393]}}
446070869	2020-02-24T01:39:13.000Z	1231755428905857024	That’s not a travel in the NBA, your are allowed to gather 	{'place_id': '1d9a5370a355ab0c'}
446070869	2020-02-24T01:38:51.000Z	1231755333867053056	Not a travel you are allowed to gather 	{'place_id': '1d9a5370a355ab0c'}
1847260723	2020-02-24T01:07:24.000Z	1231747420083621889	 😂🤣that’s what a day of traveling does to you!!! I also said “well” but I meant “we’ll” I trust in predict-a-text WAY too much 😂🤷🏽‍♀️🤔	{'place_id': '918c943e88cc3e5d'}
20715454	2020-02-24T01:05:44.000Z	1231747000804298752	Now the reason for my visit to  Picked up this beautiful 0  Select Jazz Bass in Amber Burst. It was an absolute pleasure to do business with Scott. Legendary shop and incredible customer… 	{'place_id': '1d9a5370a355ab0c', 'coordinates': {'type': 'Point', 'coordinates': [-87.67053, 41.94194]}}
2892906001	2020-02-24T00:53:02.000Z	1231743804354572288	 Nah Chief Lmaoo that’s a full blown travel	{'place_id': '1d9a5370a355ab0c'}
192659972	2020-02-24T00:41:31.000Z	1231740905092272129	Have you ever thought about becoming an  volunteer? It’s not only a great way to network, but also make new friends and opportunities for travel. Swipe 👉 to see some of our fun Chicago adventures … 	{'place_id': '1d9a5370a355ab0c', 'coordinates': {'type': 'Point', 'coordinates': [-87.632496, 41.883222]}}
18944001	2020-02-24T00:16:39.000Z	1231734648088285185	Dreams do come true!  Thank you Car Chix for all that you do for us, today was epic!  Special thanks to ALL the fellow racers and fans that stop by to visit.  Best of all luck to all the Car Chix’s this summer on the track! 	{'place_id': '918c943e88cc3e5d'}
1206268272	2020-02-24T00:14:52.000Z	1231734200879009792	 So many of my favorite intl shows!! I would like to nominate cable girls - takes place in the 0’s in Madrid, also would like to suggest most beautiful thing/coisa mais linda takes place in 0’s rio. One more- high seas, takes place on a luxury ship in the 0s traveling to Rio 	{'place_id': 'f2da3efc48696715'}
305373413	2020-02-25T23:49:38.000Z	1232452623950700544	Partner just told me don’t plan on taking any trips anywhere in March or April so 🥺🥺🥺 I’m on lockdown. come visit me so I don’t lose my mind. 😭😂	{'place_id': '1d9a5370a355ab0c'}
1085937775164248064	2020-02-25T23:21:54.000Z	1232445645539012608	  Yo me and my brother just got into an argument about the ice wall in the North Pole. Imma need you to make a video traveling pass them so I can prove to him that another planet is not on the other side of it. Thanks.	{'place_id': '1d9a5370a355ab0c'}
764124805180317696	2020-02-25T23:18:37.000Z	1232444822071300096	 has two spots at this years  Come visit us at Booth 0 and in the  Playground. Learn more about esports, accessibility, new features, & more!    	{'place_id': '07d9cac96ec82001'}
50581294	2020-02-25T23:11:23.000Z	1232442999197421568	I love this fireplace!    @ The Rose Hotel Chicago O'Hare 	{'place_id': 'f48e110211eee6ef', 'coordinates': {'type': 'Point', 'coordinates': [-87.87076177, 41.97424072]}}
111395646	2020-02-25T23:02:56.000Z	1232440872127451136	By eljosetattoo  visit us  ..               … 	{'place_id': '1d9a5370a355ab0c', 'coordinates': {'type': 'Point', 'coordinates': [-87.7245499, 41.9393]}}
182666383	2020-02-25T22:49:23.000Z	1232437462393221120	   it means that doctor (or anyone traveling) could have easily gone to your grocery store or church, numnuts	{'place_id': '1d9a5370a355ab0c'}
39422144	2020-02-25T22:29:14.000Z	1232432391181881344	     It is March 0-0! Those sound like fun travel plans, too!!	{'place_id': '1d9a5370a355ab0c'}
109793596	2020-02-25T22:28:26.000Z	1232432190048178176	Gee I just looked at my schedule im bout to be traveling like crazy until literally like the end of the year 🤦🏾‍♂️😂 .......I hateeeee It !!	{'place_id': '1d9a5370a355ab0c'}
4856934494	2020-02-25T22:04:00.000Z	1232426040682741760	Fun times with friends while bowling. A visit from  again! Thank for visiting us!   	{'place_id': '2eb3293957fd451a'}
1428691806	2020-02-25T21:25:59.000Z	1232416474553294848	Resurrection high school students visit the Chicago Police Department  to learn about the daily duties of Police Officers. 	{'place_id': '07d9ed1f8ac85000'}
16910090	2020-02-25T21:16:38.000Z	1232414120726544384	What is “Blended Living”   Could it be in your apartment?    tonight at 0pm: 	{'place_id': 'f16f37294392e394'}
18190142	2020-02-25T21:15:19.000Z	1232413789095649280	That  when you suddenly realize that your afternoon walk was actually a visit to the    streetervet    … 	{'place_id': '1d9a5370a355ab0c', 'coordinates': {'type': 'Point', 'coordinates': [-87.6197, 41.8938]}}
31853596	2020-02-25T21:14:12.000Z	1232413507590684673	Due to its terrifying nature, tonight’s screening of THE BEYOND (0) at Cigars & Stripes has been CANCELLED! We will be showing J.D.’S REVENGE but if you want to check out Fulci’s Italian by way of NOLA gore fest, please visit  for your exploitation needs! 	{'place_id': '1d9a5370a355ab0c'}
160126165	2020-02-25T21:08:14.000Z	1232412008793956353	The moves that James Harden do would be called travel for lesser players 	{'place_id': '1d9a5370a355ab0c'}
3380578715	2020-02-25T20:38:11.000Z	1232404446451249152	Come visit   and   at Booth   in the exhibit hall.  We have K Cups!! 	{'place_id': '918c943e88cc3e5d'}
1365704540	2020-02-25T20:22:15.000Z	1232400435899662337	This is my new travel partner. I have taken GlutenAway with me on a work trip to Indiana, to the InnovateHer Summit, to an executive immersion day and even on the train. I find comfort know I have a friend who will… 	{'place_id': '1d9a5370a355ab0c', 'coordinates': {'type': 'Point', 'coordinates': [-87.632496, 41.883222]}}
2746571940	2020-02-25T20:18:30.000Z	1232399492923744256	" When will you visit China to prove that the Coronavirus isn't deadly? And that you personally can't get it?I mean since you're the ""Chosen One."" It stands to reason that NOTHING could hurt you! To be doubly sure. Take Paula White with you to keep praying over u."	{'place_id': '8b351eeb91372dc7'}
2811975708	2020-02-25T19:01:11.000Z	1232380036151271424	Reglisse Sanguinede Montpellier Rare 0 vintage poster by Leonetto Cappiello.Can be purchased on our website  visit us     … 	{'place_id': '1d9a5370a355ab0c', 'coordinates': {'type': 'Point', 'coordinates': [-87.63325, 41.9017]}}
541284940	2020-02-25T18:56:43.000Z	1232378912510038018	You just need one person to show up and hundreds of people are under lockdown.. on the airports too..I even question do I fly to Carolina in 0 weeks... Hundreds of guests 'on lockdown' in Tenerife hotel after positive coronavirus case  	{'place_id': '088c56ad174b8e80'}
19515495	2020-02-25T18:30:41.000Z	1232372359115497472	AWP Roll Call! Will you be in San Antonio?! I hope so! Would love to see you, meet you, hug and say hello! Visit the  Booth  I only come to love on y’all. Stop by & say hello! Plus, we gots some beautiful new books to show off!!!  	{'place_id': '8b351eeb91372dc7'}
28910747	2020-02-25T18:26:42.000Z	1232371357524078593	Check on your loved ones young and old... call them, visit them! Just check on them.	{'place_id': '1d9a5370a355ab0c'}
874613729853394944	2020-02-25T18:16:20.000Z	1232368749124165640	Huge thanks to Mr. Diaz and Mr. Allen for organizing and inviting the  Office of School Counseling & Postsecondary Advising team out to support the Collective Impact Visit today at  ! We are full speed ahead to ensure all seniors  ! 	{'place_id': '07d9d2c536887000'}
934373196312338433	2020-02-25T18:00:26.000Z	1232364748202762240	anything more pathetic than being a travel professional with two weeks off and realizing you let your passport expire...  	{'place_id': '1d9a5370a355ab0c'}
305373413	2020-02-25T17:55:08.000Z	1232363412048482305	I’m going to be traveling so much thr next few months and I’m not prepared for it. 😭😭 lawd	{'place_id': '1d9a5370a355ab0c'}
778366803168731137	2020-02-25T17:51:40.000Z	1232362542422528000	Seats are filling up FAST for our 0-0 school year!  high school artists there is still time to apply. Take your   and  to the next level! For more info and our application visit:  	{'place_id': '07d9dbd3ddc81007'}
262223441	2020-02-25T17:15:08.000Z	1232353346247438337	Today’s the last day to visit our agents in the booth! Stop by booths 0-0 for more information on any of the Collegiate Empowerment programs!  	{'place_id': '1d9a5370a355ab0c'}
22529991	2020-02-25T17:10:57.000Z	1232352295289081859	🎧 | “Let’s Work” | PrinceGet your outfits and costumes ready. We want to see you dress for the annual celebration of the music if Prince | Saturday, April 0th, 0 | at the Promontory. Visit  for… 	{'place_id': '1d9a5370a355ab0c', 'coordinates': {'type': 'Point', 'coordinates': [-87.58755028, 41.79914318]}}
2729594068	2020-02-25T17:00:24.000Z	1232349639808094208	I went to visit a HS today for work and this school had a Starbucks, food court and yoga studio in it,,, my school sold pizza on Fridays for $0	{'place_id': 'ed888f00de07aa3a'}
1609698074	2020-02-25T16:54:57.000Z	1232348266148306946	Join our team! Visit  or call 0-0-0 @ Region American Taekwondo Karate for Kids 	{'place_id': 'e2c96cf8c0a43c1d', 'coordinates': {'type': 'Point', 'coordinates': [-87.45749, 41.55479]}}
253353900	2020-02-25T16:39:33.000Z	1232344392947470338	Session 0 begins in five minutes. Go visit  they’re on tour here at our   	{'place_id': '07d9cac96ec82001'}
52556817	2020-02-25T16:20:00.000Z	1232339473180057602	  Will see if you are as apologetic as you are certain that he will be able to handle MLS. You are seriously basing your feelings on nothing. At least I am stating there are things he has never faced in his career before like traveling farther distances, climates, surfaces etc	{'place_id': '07c0b6b4c3ac42c4'}
874613729853394944	2020-02-25T16:10:46.000Z	1232337150231896065	Today our   Office of School Counseling & Postsecondary Advising Collective Impact Visit is at  HS! We are assisting seniors w/ working on their concrete postsecondary plans!  is our initiative to bridge the gaps for all!💪 	{'place_id': '07d9d2c536887000'}
23522673	2020-02-25T16:01:10.000Z	1232334730508611590	 Just ordered my book from  and secured my place in line for your visit.  Keeping my preorder from Amazon though so I don’t have to wait until end of April to read it. I’m good with that! 😃	{'place_id': '1d9a5370a355ab0c'}
229361416	2020-02-25T15:56:18.000Z	1232333505666985985	Who’s ever seen Yesterday, the only explanation is time travel	{'place_id': '99700cd6fc455c13'}
113464594	2020-02-25T15:48:50.000Z	1232331627860242432	Volunteers Needed for  Visit us at  to sign up! RT to help spread the word. 	{'place_id': '1d9a5370a355ab0c'}
16595438	2020-02-25T15:46:17.000Z	1232330987650060290	When will the  update travel recs? We cannot cancel my dad’s  trip to Tuscany in early March, despite a  outbreak AND no assurances should they be quarantined in Italy. You can’t give us a safety plan? Return our money.	{'place_id': '4b3758bc32868265'}
3980795174	2020-02-25T15:41:36.000Z	1232329806563495937	Our 0th grade students had a guest character from the Towervale book and online game. The presentation gave students a preview of the characters and realms they will visit in Towervale. 📚🐾 	{'place_id': '088c56ad174b8e80'}
819735589503176705	2020-02-25T15:37:48.000Z	1232328850832531457	 Love this! Steve Oren is a living legend on the north side. At 0 years old, he spends all of his free time traveling around the city to phone bank and notarize petitions for progressive candidates. He has so many stories. I’ve been wanting to submit him for a profile for a while	{'place_id': '1d9a5370a355ab0c'}
136792646	2020-02-25T15:37:08.000Z	1232328682993156096	Episode 0 (Season 0 Finale) of Travel Taste and Talk (airs this Wednesday February 0th at 0pm CST) features keyboardist/songwriter/producer/Gospel Legend:Percy BadyPercy has penned hits for Yolanda Adams, The… 	{'place_id': '1d9a5370a355ab0c', 'coordinates': {'type': 'Point', 'coordinates': [-87.632496, 41.883222]}}
2855144564	2020-02-25T15:08:19.000Z	1232321430794252288	The Elevating the Alpha Spirit Campaign visited the Southern California District, this past weekend! Attached are photos highlighting our visit with the Brothers of MΣΛ, ZΣΛ, BΨΛ Chapters THANK YOU to the Brothers for their hospitality!  (Photos ≠ endorsement) 	{'place_id': '1d9a5370a355ab0c'}
