373366362	2021-12-27T23:12:01.000Z	1475605418374307847	Starting to feel like a prisoner in the country I fought for. What is happening to freedom? 	{'place_id': '9f3d755fe1a081a4'}
488143925	2021-12-27T22:25:30.000Z	1475593710243090435	I really went from not being able to leave Carbondale to traveling consistently for two years straight now ✨✨✨✨	{'place_id': '1d9a5370a355ab0c'}
847714411	2021-12-27T22:22:15.000Z	1475592892211253256	  Really get ahead of this thing by ramping up masks and tests and putting an FAA travel requirement for vaccine and masking.Biden Administration: how about no?	{'place_id': '5b217454f4bd5f04'}
1004469472399429637	2021-12-27T22:15:47.000Z	1475591266037600265	We are looking to fill two games this week. Currently on an overnight layover in Chicago.Willing to play either in the Chicagoland area or can travel out to Baltimore/DC area. DM or contact JohnsonT  	{'place_id': 'f48e110211eee6ef'}
1322664602	2021-12-27T22:14:09.000Z	1475590853716553730	no more music festivals for me, this year we are only traveling to new places 😌	{'place_id': '5a483763a916e21d'}
1136373342007697413	2021-12-27T21:44:23.000Z	1475583363314589709	Because let me tell you. I went to visit KC and she had me in a 0 step skin care routine with aloe Vera socks on by 0pm 😭	{'place_id': '1d9a5370a355ab0c'}
1371907073680752643	2021-12-27T21:34:40.000Z	1475580917599162378	Here is a preview of some items (in stock) & other that I will have in stock 🔜 ! If you visit my website  you will get 0% off of your 0st purchase. 😊 I hope you enjoy this video, if you do, please share. Thank you & Happy Shopping! 📣on! 	{'place_id': '1d9a5370a355ab0c'}
814297483677433856	2021-12-27T19:35:27.000Z	1475550916707336193	 has finals said it out loud what all us  have been thinking: it’s time to start thinking of allowing only fully  to fly domestically. We can’t keep playing games. The  just don’t care. Screw em. 	{'place_id': '1d9a5370a355ab0c'}
146613692	2021-12-27T17:06:03.000Z	1475513317967937540	Did you forget to check your list twice and miss some Christmas gifts? We’ve got you covered! Visit  and send your friends & family a Streeter’s gift card via email!       	{'place_id': '1d9a5370a355ab0c'}
1125032548764196865	2021-12-27T16:12:21.000Z	1475499806097350660	 I’m furious that NO LEADER in this country is doing what really needs to be done. It’s so bad that any difference between what the GOP would have done if in power instead is meaningless. No fucking mandates for air travel?? No free tests and paid leave for people? We’re fucked.	{'place_id': '1d9a5370a355ab0c'}
3004167455	2021-12-27T16:04:39.000Z	1475497865116012551	 If the ribbon closes we will post on social media and our website. For ticket information please visit 	{'place_id': '1d9a5370a355ab0c'}
476329345	2021-12-27T14:03:42.000Z	1475467429115535363	 thank you for the double win on a trip to the PNW with cancelations to the left and right!	{'place_id': '1d9a5370a355ab0c'}
15542613	2021-12-27T13:29:00.000Z	1475458697262518274	It is going to get worse before it gets better. You have to get vaccinated and boosted and wear a mask and social distancing yourself. This is the best protection. Essential trips only and safe travel if you venture out. 	{'place_id': '68e2040481279657'}
15244373	2021-12-27T05:14:24.000Z	1475334227055067138	With nearly every famous location, cleverly opportunistic  are capitalizing on market needs and wants. The hot cocoa station in this story is terrific! At the behest of ’s nephew, a few years ago we visited these fame-hallowed grounds.  	{'place_id': '2a313fd924081b90'}
1402462996807442435	2021-12-27T05:07:29.000Z	1475332485517086722	  I need to visit Iceland. Great shot!	{'place_id': '1d9a5370a355ab0c'}
20440293	2021-12-27T04:44:29.000Z	1475326699172737029	 Much easier to travel to Europe than the county of Kentucky.  Fix it.	{'place_id': '1d9a5370a355ab0c'}
1398002956621037574	2021-12-27T04:14:36.000Z	1475319176612962312	 Right. I am currently working on my insecurities. I hope I get over this issues and when a right timing and money comes (🥲) I can travel more	{'place_id': '1d9a5370a355ab0c'}
1398002956621037574	2021-12-27T03:53:42.000Z	1475313915332546565	 So amazing!!! That is my dream!! I always want to explore New England area. It’s amazing you can live like you do and traveling solo as a woman. I have a lot of respect to a lady like you!! Also thank you so much for giving me the follow on IG. My Instagram is dead but ☺️✨	{'place_id': '1d9a5370a355ab0c'}
87091888	2021-12-27T03:46:52.000Z	1475312196603326473	Hawks are supposed to visit Winnipeg the following day. Haven’t played since  Saturday, the 0th in Dallas. 	{'place_id': '1d9a5370a355ab0c'}
1175948591829004288	2021-12-27T03:44:15.000Z	1475311539842428929	You know what it is whenever I visit 	{'place_id': '1d9a5370a355ab0c'}
4403506333	2021-12-27T03:38:18.000Z	1475310042387828740	I have so much fun traveling w my man	{'place_id': '1d9a5370a355ab0c'}
31340940	2021-12-27T03:13:11.000Z	1475303721739427844	I’m wondering how possible it is really to dodge this new Rona Remix with how contagious it is outside of a full scale lock down, which America won’t do. I have some travel planned, and although I’m vaxxed + boosted, that’s not even the relief if was a few weeks ago.	{'place_id': '1d9a5370a355ab0c'}
25765620	2021-12-27T03:12:48.000Z	1475303625413074953	Reason # 0,0 - why I don’t have kids: Today while traveling a young dad asked his 0 small children what they thought a provisioning truck was loading on the plane. I wanted to answer bodies. 	{'place_id': '1d9a5370a355ab0c'}
1398002956621037574	2021-12-27T02:51:24.000Z	1475298240845262858	 Yes… I really love to. Did you travel in it on your own? Was it safe?	{'place_id': '1d9a5370a355ab0c'}
995645852	2021-12-28T22:06:00.000Z	1475951191846760449	Join us in making end of the year gift to  that will enable us to continue our impact and outreach to those in need. Visit  to learn more about ways to support us! 	{'place_id': '1d9a5370a355ab0c'}
353677199	2021-12-28T21:25:00.000Z	1475940873955381253	  That seems to be their objective. Fans should stop buying tickets or ever traveling again.	{'place_id': '6b029ca925395e1b'}
618700588	2021-12-28T21:22:43.000Z	1475940297091727361	Who’s down for some ramen in Chicago, someone visit me on my lunch break.	{'place_id': '1d9a5370a355ab0c'}
861614733752979456	2021-12-28T21:03:05.000Z	1475935357069934597	Layering season is upon us. Visit one of our team shops to pair your favorite looks. 	{'place_id': '1d9a5370a355ab0c'}
316698745	2021-12-28T20:50:22.000Z	1475932156778139652	“a 0-year-old who wants to travel” 👋🏾 	{'place_id': '1d9a5370a355ab0c'}
32882761	2021-12-28T20:27:10.000Z	1475926320370618374	BREAKING NEWS: CDC now warns that you should not, in fact, visit Funky Town.	{'place_id': '1d9a5370a355ab0c'}
4700712252	2021-12-28T20:15:04.000Z	1475923274970419206	If I’m honest I just wanna travel this year new experiences in a different city , state , or country ❤️I just need new scenery	{'place_id': '1d9a5370a355ab0c'}
14110293	2021-12-28T20:10:16.000Z	1475922066104893444	The week between Christmas & New Years is always a critical reset for me. I don’t like to travel or do much other than reflect, exercise, set intentions and re-charge.	{'place_id': '0fb8d7b7e21d86a5'}
15281728	2021-12-28T20:09:35.000Z	1475921893257621515	 *if not I’m all about the red wine to help me chill the F out about this snow day goofin my travel plans 😫	{'place_id': '1d9a5370a355ab0c'}
188398596	2021-12-28T19:53:44.000Z	1475917906647134208	It is just garbage! Why are you paying so much to have it hauled away?  is Chicago's  Garbage Broker and will save you money!Call: 0-0-0 for a free assessment or visit  	{'place_id': '1d9a5370a355ab0c'}
22416579	2021-12-28T18:28:33.000Z	1475896469253201920	I'm watching BTS Bon Voyage S0 and I so badly want to go to Europe now. Or travel anywhere internationally, really. 😭	{'place_id': '1d9a5370a355ab0c'}
2462262230	2021-12-28T17:59:35.000Z	1475889180039335936	I enjoyed a morning at  including their current exhibition of art and artifacts related to the Great Chicago Fire.The second painting here, near the exhibit's entrance, I found particularly interesting and illustrative.Worth a visit. 	{'place_id': '1d9a5370a355ab0c'}
182993025	2021-12-28T17:44:15.000Z	1475885317953658892	Windy City… 🌃🌬⚡️⚡️..            🤎🤎🤎 en Chicago, Illinois 	{'coordinates': {'type': 'Point', 'coordinates': [-87.632496, 41.883222]}, 'place_id': '1d9a5370a355ab0c'}
49161297	2021-12-28T17:38:34.000Z	1475883889231073281	Listen to be traveling at the beginning of covid was a whole new world. No line, airports empty, flights $0, u had a whole row to yourself. That was love. They got they money back in BLOOD in 0 though 	{'place_id': '1d9a5370a355ab0c'}
790886306	2021-12-28T17:01:43.000Z	1475874617621364743	I’m sorry I don’t feel bad for people stuck at the airport bc why tf did you travel anyway ?	{'place_id': '1d9a5370a355ab0c'}
78399032	2021-12-28T16:55:05.000Z	1475872946350706691	Looking for plans in  or  this  Visit  for some ideas! 	{'place_id': '1d9a5370a355ab0c'}
380191960	2021-12-28T16:48:49.000Z	1475871367669207044	What’s even funnier is none of these countries will stop traveling to America either way. None of this matters and you are being lied to for greed. 	{'place_id': '1d9a5370a355ab0c'}
1032020152068526080	2021-12-28T16:37:49.000Z	1475868601202655235	It’s last day for  testing at Phalanx in 0. Visit us to know your status. 🙏🏿💯👩🏿‍⚕️👨🏿‍⚕️ 	{'place_id': '1d9a5370a355ab0c'}
1201744214901559297	2021-12-28T15:55:50.000Z	1475858035264397314	Iceland I will visit you one of these days 	{'place_id': '1d9a5370a355ab0c'}
38114378	2021-12-28T15:32:36.000Z	1475852190690467847	 Turo it’s awesome. It’s like air BB for cars use it whenever I travel	{'place_id': '1d9a5370a355ab0c'}
740959699	2021-12-28T15:23:00.000Z	1475849771558572043	Please consider The Unity in Community Foundation for an end of year donation. Visit  to make a donation.  Thank you.       	{'place_id': 'da64cd6b4a6e157c'}
3004167455	2021-12-28T14:27:38.000Z	1475835839796191240	Coming to skate and looking for a convenient place to park 🚘⁉️ Park right below the park  $0 for 0 hours must book online before your visit!  	{'place_id': '1d9a5370a355ab0c'}
38114378	2021-12-28T13:37:03.000Z	1475823108288393218	  I’m with you! Worked since I was 0 never had more than a couple weeks off. Took a new job in June and now that I’m getting older, have a family this new job will allow me to spend winter with them traveling and making memories.	{'place_id': '1d9a5370a355ab0c'}
15048470	2021-12-28T06:03:11.000Z	1475708888557232129	 It was good as well except it became clear I probably won’t visit my family in Oz until later next year than expected - because Covid	{'place_id': '1d9a5370a355ab0c'}
1357189902304243712	2021-12-28T05:20:26.000Z	1475698133665562631	Good ‘ol    	{'place_id': '5538a3aae89abc08'}
827968056	2021-12-28T04:58:04.000Z	1475692501923205121	I need a friend everywhere so when I travel I have someone to look forward to seeing ❤️	{'place_id': '1d9a5370a355ab0c'}
23409992	2021-12-28T04:28:10.000Z	1475684978042224643	If you aint never dub WHPK,and yo name isn't  or one of the Gods, don't you fix yo face to ask me about no fucking verse of the year. Ask ya father when you visit that nigga in MDC.	{'place_id': '1d9a5370a355ab0c'}
27102400	2021-12-28T04:13:19.000Z	1475681241714339846	Airline travel right now is a total mess. 🐑🐑🐑	{'place_id': '1898951ad80c007d'}
988399524	2021-12-28T03:21:41.000Z	1475668249429909506	  💯 ...and DO NOT travel during pandemic 💯	{'place_id': '1d9a5370a355ab0c'}
1154114720632311808	2021-12-28T02:49:19.000Z	1475660103751806993	COVID has prevented my travel to Israel in past few years. So it’s been a while since I’ve had good schwarma (no offense to anyone).True parental love is your aba making incredible homemade lafot/pitot & your ima making a darn good version of schwarma on the bbq.A happy boy. :) 	{'place_id': '8b351eeb91372dc7'}
19952460	2021-12-28T01:34:33.000Z	1475641288242384897	 I visit a SMART group on occasion, they just are poorly attended so it always feels weird.	{'place_id': '1d9a5370a355ab0c'}
1110599173651480577	2021-12-28T01:23:09.000Z	1475638419422420992	Wow Can Reddish with a travel! 	{'place_id': '1d9a5370a355ab0c'}
49720927	2021-12-28T01:21:08.000Z	1475637910644867078	   My one and only visit to Toronto. I have stories.	{'place_id': '1d9a5370a355ab0c'}
3054733038	2021-12-29T23:51:04.000Z	1476340018360852481	I pointed out that their tourism ambassador has said in interviews that their approach to pitching BA influencers to come to Ghana was “y’all visit Thailand and other under developed places throw some of that spotlight our way, come spend with us”. 	{'place_id': '1d9a5370a355ab0c'}
344803795	2021-12-29T23:23:41.000Z	1476333129103290374	When traveling  and  you want family-friendly meals that are crazy simple to make with only a few ingredients, like my four ingredient Microwave  ⁣⁣___      	{'place_id': '1d9a5370a355ab0c'}
844932007075500034	2021-12-29T23:22:52.000Z	1476332923376881664	  This is the Christmas surge After New Years it willSoar past half a million New casesper day.People got to partyGot to travel We spent Xmass alone We will spend New Years alone too And we're Boosted	{'place_id': '1d9a5370a355ab0c'}
2830202522	2021-12-29T22:04:55.000Z	1476313305736175624	Last week he was the busiest man in the world! This week, Santa and his elves gave us one last present... A✨Highlight Video 🎥 of his visit to our clinic. If you were there on DEC 0th you might've made the video! Watch closely 👀 Happy Holidays!🎄  	{'place_id': '1d9a5370a355ab0c'}
1356311017228144640	2021-12-29T21:51:21.000Z	1476309890519998467	Have you downloaded our Wild Taco app? Download now (On Google Play and Apple App Store) and get a free taco on your next visit! @ Old Town, Chicago 	{'place_id': '1d9a5370a355ab0c', 'coordinates': {'type': 'Point', 'coordinates': [-87.6395, 41.9111]}}
995645852	2021-12-29T21:28:34.000Z	1476304160211574789	0 is almost here! Visit  to explore our winter offerings! From our engagement courses like Alpha, Following Jesus, Women Winter Course and Bible in One Year to our growth courses we do love to help you to grow in faith and community! 	{'place_id': '107ccaa2c9d4c001'}
1407103273052606464	2021-12-29T20:01:44.000Z	1476282306813911047	0 likes and I’ll visit oblock😁	{'place_id': '1d9a5370a355ab0c'}
274136314	2021-12-29T19:34:55.000Z	1476275556924760064	 I remember talking to TJ and Sam about that when I went to visit lol	{'place_id': '1d9a5370a355ab0c'}
604893656	2021-12-29T19:10:51.000Z	1476269502191001600	Thank you  for an amazing meal and wonderful dining experience. We will be back next time we visit  .   	{'place_id': '1d9a5370a355ab0c'}
1197101494832680965	2021-12-29T18:21:29.000Z	1476257075932151811	I am available now in Chicago, Illinois, United States! To get in touch, visit me on  	{'place_id': '1d9a5370a355ab0c'}
3855140355	2021-12-29T18:12:34.000Z	1476254834428887040	Pet peeve: traveling during the holidays and the local church hasn’t updated their website or Facebook page for six months so you can’t figure out what time their Christmas, Easter, Epiphany, whatever service is.	{'place_id': '5b217454f4bd5f04'}
61679419	2021-12-29T17:51:41.000Z	1476249577456029705	If you plan on gathering for NYE, follow the guidance from  ✅ Get vaxxed and boosted✅ Wear a well-fitting 😷✅ Avoid gatherings and travel if you are unvaccinated✅ Get tested✅ If you are sick, stay home✅ Visit  	{'place_id': '1d9a5370a355ab0c'}
1253485489258102786	2021-12-29T17:41:50.000Z	1476247100832768009	"Those looking to enjoy the lakefront at  need to travel north or south of the campus to do so (as evidenced by shots like these).Episode 0 - ""Lakefront"" with authors Joseph D. Kearney and Thomas W. Merrill.   "	{'place_id': '1d9a5370a355ab0c'}
168275427	2021-12-29T17:16:33.000Z	1476240738660847622	I also don't understand the desire to visit Auschwitz. 	{'place_id': '1cf51d4fa867b58a'}
1398002956621037574	2021-12-29T16:16:26.000Z	1476225607851819017	 I hope you can come to visit us near future. I love fog when the city is half covered. It’s amazing feeling to chasing a frame	{'place_id': '1d9a5370a355ab0c'}
3081071273	2021-12-29T14:16:34.000Z	1476195441532448773	Great to see traveling version  	{'place_id': '1d9a5370a355ab0c'}
2986047500	2021-12-29T11:11:26.000Z	1476148851023224842	PRE CHRISTMAS GATHERING WITH FAMILY Thank you Marco for gracing the family by your visit from Washington, DC, and treating us with dim sum! Yum! @ Minghin Naperville 	{'place_id': '3227bcceb76b6a37', 'coordinates': {'type': 'Point', 'coordinates': [-88.12074983, 41.80044437]}}
847714411	2021-12-29T04:19:38.000Z	1476045219380576258	 0 years later:Why does my kid never visit?	{'place_id': '5b217454f4bd5f04'}
2579503212	2021-12-29T03:45:54.000Z	1476036729794707458	Suppose to surprise my OG on a trip for her birthday... wish me luck	{'place_id': '1d9a5370a355ab0c'}
15244373	2021-12-29T03:36:40.000Z	1476034406305472514	“The U.S. record for daily  cases has been broken, as two highly contagious variants — Delta and  — have converged to disrupt holiday travel and gatherings, deplete hospital staffs and plunge the United States into another long winter.”  	{'place_id': '0b9c2aedc0d4a001'}
128788920	2021-12-29T03:01:59.000Z	1476025676272742401	. Health Services did a phenomenal job @ the  by doing 0+ free health screenings for the uninsured/underinsured. ThanQ  & To find out more about our work and support it by your precious donations, please visit  	{'place_id': '07d9d1ab32087001'}
1019238096284672005	2021-12-29T02:06:02.000Z	1476011595536941059	DO NOT TRUST EXPEDIA TO BOOK YOUR TRAVEL.	{'place_id': '1d9a5370a355ab0c'}
1283218907243962369	2021-12-29T01:17:02.000Z	1475999266858577923	Come shop now for the best in the game to match your Air Jordan “Patent” 0’s Visit🚨 (🚨 and shop now to support a black owned business!         	{'place_id': '08695e38fe9e7edf'}
30252520	2021-12-30T23:35:47.000Z	1476698561224089603	" I haven't lived in Japan for significant periods of time, but when I visit a new prefecture/city/town, I'm always on the lookout for regional or micro local variations that are unique from the accepted ""norm"".Kinda fun to compare and contrast (unless it's natto 😏)"	{'place_id': '1d9a5370a355ab0c'}
826495641983528960	2021-12-30T23:12:58.000Z	1476692820576677888	I should travel bc my money will return & not my time?? Sounds very rich to me	{'place_id': '1d9a5370a355ab0c'}
1142437271536381955	2021-12-30T22:34:07.000Z	1476683040961269765	So..now I wanna visit                   Where else?	{'place_id': '1d9a5370a355ab0c'}
120680949	2021-12-30T22:25:22.000Z	1476680842441277442	 Hows colorado? I wanna visit	{'place_id': '1d9a5370a355ab0c'}
397045833	2021-12-30T21:19:19.000Z	1476664220028649473	 See Imma have to come visit u with all the goodies ☺️	{'place_id': '1d9a5370a355ab0c'}
23813941	2021-12-30T21:16:57.000Z	1476663624869556233	Brought Jerry Bryant  with me (in spirit) to the show last night, sending him all the love and healing vibes as he recovers from open heart surgery. Going to visit when he gets out of ICU so if you would like to send him a message drop it here &lt;0 	{'place_id': '1d9a5370a355ab0c'}
2553481375	2021-12-30T20:18:43.000Z	1476648969396752390	GIVE THE GIFT OF DANCE!,GIVE A LIFETIME EXPERIENCE!GIFT CERTIFICATES in any amount!Call the Studio 0-0-0 for detailsor visit us online 	{'coordinates': {'type': 'Point', 'coordinates': [-87.91191522, 41.75037694]}, 'place_id': '0e0b9a037618a313'}
782313907	2021-12-30T19:54:17.000Z	1476642818957402115	"🤔 ""CDC warned that the risk of catching Covid on cruise ships is very high regardless of vaccination status."" "	{'place_id': '1d9a5370a355ab0c'}
137122656	2021-12-30T19:14:29.000Z	1476632803857121280	   You should definitely make a visit, Neil! It’s a really neat place.	{'place_id': '1d9a5370a355ab0c'}
981475173210697728	2021-12-30T18:26:48.000Z	1476620801747079178	We were showered by our friends and family in September. We broke bread with our moms and   and  who came to Chicago to visit. There aren’t words for how grateful i am to have friends like these in my life. 	{'place_id': '1d9a5370a355ab0c'}
1352657499057496074	2021-12-30T17:26:20.000Z	1476605587114938368	" Ask her how much she was paid per ""visit."" How many of her friends did she persuade to join her in her debauchery? How many times did she visit Epstein? Did her parents know? Who was ""exloiting"" whom? And by what stretch of morality was she EVER a ""victim?"""	{'place_id': '1d9a5370a355ab0c'}
906415765464797184	2021-12-30T17:03:53.000Z	1476599934887632897	  Beautiful! Hope to visit someday! 🤞🏼	{'place_id': '8b351eeb91372dc7'}
1104130556651102208	2021-12-30T17:03:02.000Z	1476599724027301891	On January 0st, the Cook County minimum wage is set to increase to $0.0 for tipped workers and $0 for non-tipped workers. Visit  for more information on the Cook County Minimum Wage Ordinance. 	{'place_id': '1d9a5370a355ab0c'}
224033349	2021-12-30T16:21:48.000Z	1476589344681037837	  Shoe come visit the 🔒	{'place_id': '07c0b6b4c3ac42c4'}
1058437679518490625	2021-12-30T16:21:24.000Z	1476589245389234179	I was time traveling on shrooms once and when the stop came to slavery I shot tf up off the bed with the speed of lightning. Not even on drugs was I interested in finding tf out. 	{'place_id': '1d9a5370a355ab0c'}
272369295	2021-12-30T15:59:34.000Z	1476583752159662093	What a tough busy week at work!!!    	{'place_id': '1d9a5370a355ab0c'}
82796879	2021-12-30T15:42:49.000Z	1476579537689399304	 Go visit  in Berwyn	{'place_id': '1d9a5370a355ab0c'}
589384668	2021-12-30T14:56:22.000Z	1476567844615770114	 Come visit Chicago !!	{'place_id': '8b351eeb91372dc7'}
25322513	2021-12-30T14:50:41.000Z	1476566414282657801	  if kudos to Delma at ORD priority desk and the folks at the G0 Ambassador Club for above and beyond. International travel is challenging these days and each of them made a positive impact. Thank you!	{'place_id': '1d9a5370a355ab0c'}
1442135164620967956	2021-12-30T13:17:45.000Z	1476543028470951939	First vet visit, final round of shots and then we can finally take Mr. P on walks!  	{'place_id': '088c56ad174b8e80'}
974983370009731073	2021-12-30T11:02:11.000Z	1476508910072774660	Friendly reminder, no videos tomorrow! I’m taking a short break for the holidays! I will be back next week (January 0th) for some more unique and amazing travel content. 😎Thanks a lot and have a wonderful holidays season. 🎄Take the train 🚆 	{'place_id': '07d9d65588482004'}
1328087891222949888	2021-12-30T07:26:46.000Z	1476454701013028864	I’m a come visit you one day we gone kick the bobos 😮‍💨💕 	{'place_id': '1d9a5370a355ab0c'}
1117764270	2021-12-30T06:59:22.000Z	1476447804000251907	Visiting this gnome in Australia is now on my travel bucket list. 	{'place_id': '1d9a5370a355ab0c'}
1302303643983638531	2021-12-30T06:17:46.000Z	1476437334807695366	Special shout out to DMO (&  for the connect) 🙏DMO invited me, a stranger, to his tailgate in front of the Palace, offered top-shelf hospitality, & toasted literature 💯😂. Beers were dranken (rapidly) & asses were kicked on the FB field.Travel vid coming! 	{'place_id': '1d9a5370a355ab0c'}
1082583160251133952	2021-12-30T05:11:45.000Z	1476420723006660608	I had been using a couple of these per recommendation of my employer and the experiences were mostly negative (da-dum) but my most recent visit to one has yielded no results.As in I took a rapid and PCR and haven’t even been given a result for the rapid. 	{'place_id': '1d9a5370a355ab0c'}
65759506	2021-12-30T04:49:05.000Z	1476415020393189378	Guys my mom and brothers are 0% and are here to visit us for New Years. Man I can’t wait to see them. 🥳	{'place_id': '1d9a5370a355ab0c'}
3058111143	2021-12-30T04:34:37.000Z	1476411379401871363	shmoking weed en mi casita todo solito while i watch everyone’s stories about how they’re in bars and traveling before they catch covid, so many seasons to this show 	{'place_id': '1d9a5370a355ab0c'}
424556600	2021-12-30T04:15:30.000Z	1476406568887402496	 I was just remarked by the way you handled the whole situation with your daughter and her surgery and long rehab and all the traveling you and still kept it together	{'place_id': '1d9a5370a355ab0c'}
1171466366349656064	2021-12-30T03:53:57.000Z	1476401144167550976	At this point - I won’t be living anywhere with all this travel. See you soon 	{'place_id': '1d9a5370a355ab0c'}
1204775038727151618	2021-12-30T02:40:22.000Z	1476382625816363011	 I'm in the same boat. I didn't go to CSWE so I feel like I need to go to SSWR, that and I have the travel plans. Pero no se. I know I shouldn'tPero me gusta la mala vida	{'place_id': '1d9a5370a355ab0c'}
1467700087472152579	2021-12-30T01:58:26.000Z	1476372072033050626	Ready to purchase their limited NFTs and play at ROBOTECHWAR, visit our website 🔥🔥🔥🔥 	{'place_id': '1d9a5370a355ab0c'}
742016846744985600	2021-12-30T01:38:44.000Z	1476367114663571459	 Congrats! Betta come visit	{'place_id': '1d9a5370a355ab0c'}
782313907	2021-12-30T00:26:02.000Z	1476348821064069124	🤔Strange, for a mild variant, with CDC shortening the recommended time for isolation for the public.  	{'place_id': '1d9a5370a355ab0c'}
827968056	2021-12-30T00:09:07.000Z	1476344561895149575	I been doing Khala dishes since I got here 🙄 I know when she comes to visit I better get the same.	{'place_id': '1d9a5370a355ab0c'}
