906428404844650496	2021-10-18T23:26:28.000Z	1450241901286862853	Had a quick bite after the doctor visit! Walking home, now! (at  in Chicago, IL) 	{'coordinates': {'type': 'Point', 'coordinates': [-87.71822669, 41.9535451]}, 'place_id': '1d9a5370a355ab0c'}
3317428649	2021-10-18T23:13:52.000Z	1450238731596832769	As a parent of a travel basketball player, pay special attention to the tournaments that you are playing in and just observe!! That will tell you a lot!!	{'place_id': '1d9a5370a355ab0c'}
30585301	2021-10-18T22:49:24.000Z	1450232574337601539	 Baby’s first ER visit.	{'place_id': 'c8b021ffd0c94ffc'}
130510962	2021-10-18T21:59:40.000Z	1450220058052108292	I still don’t know what my game plan is for cons in 0, but I hope I get to go to a few. I miss friends, and I absolutely miss meeting new people. Photography has been a means of meeting lots of really cool and sweet people, and a good excuse for traveling	{'place_id': 'f48e110211eee6ef'}
834692690	2021-10-18T21:32:19.000Z	1450213174687510532	At this point I wish my parents never even came back to visit…they’re literally causing more unnecessary stress and anxiety to my life on top of the trauma they’ve already caused.	{'place_id': '1d9a5370a355ab0c'}
15281728	2021-10-18T21:06:19.000Z	1450206634026934283	 Holy schnikes, she is beyond cute!  What's her name? Also, thank you for this.  Traveling w luggage from ORD via CTA & in Das Boot is painful like whoa(not just to my sad ankle), I needed this midday goodness. 💜	{'place_id': '1d9a5370a355ab0c'}
14288934	2021-10-18T20:55:55.000Z	1450204015845838858	Off we go. I’ll be updating on          @ Chicago O'Hare International Airport 	{'coordinates': {'type': 'Point', 'coordinates': [-87.90120921, 41.97655691]}, 'place_id': '1d9a5370a355ab0c'}
2388492578	2021-10-18T20:50:22.000Z	1450202617095901184	Stopped for my second lunch of the day at the Pittsfield Cafe. Travel is hard work! 	{'place_id': '1d9a5370a355ab0c'}
186340537	2021-10-18T20:48:04.000Z	1450202038273445891	  Def gotta go pay you a visit.	{'place_id': '1d9a5370a355ab0c'}
380573728	2021-10-18T20:39:50.000Z	1450199969382731780	I miss traveling like I used to.	{'place_id': '1d9a5370a355ab0c'}
264395036	2021-10-18T20:34:38.000Z	1450198659430293511	   Yes. Saturday I found tears coming out for no reason. I did have a stressful week prior. But Iam not a crier. I had to get up NUMEROUS times during Saturday and Sunday night to visit john...unusual. Arm is still sore. It is what it is. I am glad I did it.	{'place_id': '1d9a5370a355ab0c'}
218589945	2021-10-18T20:28:44.000Z	1450197175653314569	One of my favorite memories as a first year   was our Worcester Art Museum visit with Dr. Andrew Singer and    	{'place_id': '1d9a5370a355ab0c'}
941538966871912448	2021-10-18T19:28:23.000Z	1450181986316955655	The Niigata Geigi: Japan's 'other' geishas  via   This whole Geisha culture fascinates me.  I don’t pretend to understand it and how it still exists but nevertheless🤷‍♀️	{'place_id': '98a64980f963518d'}
1044284325762670593	2021-10-18T19:03:52.000Z	1450175817456177152	The power of the future rides on innovation and  a Chicago based company that specializes in shared alternative transportation, has connected innovation with sustainability creating a new way to travel. Our director Eric VandeVoorde got to stop in for a visit! 	{'place_id': '1d9a5370a355ab0c'}
292059783	2021-10-18T19:00:51.000Z	1450175058308214786	This quick lil Chicago visit has been lovely but daddy is READY to get back to nyc tonight	{'place_id': '1d9a5370a355ab0c'}
19286551	2021-10-18T18:32:42.000Z	1450167973050789896	I’m continuing to look into possibly hitting up Las Vegas for All In next year.  Would be nice to go on a trip finally and partake in some buffet shenanigans.	{'place_id': '4b3758bc32868265'}
14288934	2021-10-18T18:26:38.000Z	1450166446542237702	On the road. First international trip since the pandemic hit. Felt odd at first but got back into rhythm pretty quick. Services at US airports are skeletal to say the least, hoping it’s better at my destination.  	{'coordinates': {'type': 'Point', 'coordinates': [-87.90120921, 41.97655691]}, 'place_id': '1d9a5370a355ab0c'}
1109593682	2021-10-18T18:14:12.000Z	1450163316333158408	Don't wait till it's too late for holiday shipping. Visit any of the Prinaj locations to send your items today.  0-0-0-PRINAJ (0-0), +0-0-0-0, +0-0-0-0, +0-0-0-0 | info |     	{'place_id': 'f1dfa58974449052'}
810597348162334720	2021-10-18T18:11:41.000Z	1450162685245632526	Had a amazing game day visit   thanks for the opportunity      and thanks for the tour around the facility 	{'place_id': '48f2609344f0c3f7'}
448252519	2021-10-18T17:11:02.000Z	1450147421070282756	There are over 0 collection site locations throughout the Chicagoland/Northwest Indiana region led by fantastic law enforcement & prevention partners like    many others. To find a collection site near you, visit  	{'place_id': '1d9a5370a355ab0c'}
408965169	2021-10-18T16:52:39.000Z	1450142797651136523	0 in 0 women will develop invasive Breast Cancer in their lifetime. In recognization of  Breast Cancer Awareness Month,  will donate $0 for every vehicle sold to the Susan G Komen Foundation 💕 visit  to learn more 	{'place_id': '6af99a29bfae42a2'}
216242374	2021-10-18T16:17:08.000Z	1450133855638228992	I need to visit here next time I go there 	{'place_id': '1d9a5370a355ab0c'}
17368360	2021-10-18T16:02:15.000Z	1450130113870405632	 staff are excited to connect with you at   Visit us at Booth 0 and get your free … shirt, while supplies last. 	{'place_id': '1d9a5370a355ab0c'}
47090195	2021-10-18T15:58:57.000Z	1450129281196204036	 Plan to visit NYC and him in December	{'place_id': '1d9a5370a355ab0c'}
2563031431	2021-10-18T15:58:37.000Z	1450129195753934858	This pouring thru   and  is taking a LOT longer than I originally budgeted. It’s   AND  combined gets me throwing a F.I.T.  Gonna need a two full days. Plus, some are still traveling. So it’s not all even posted yet…	{'place_id': 'c567a00616152df6'}
867071344353083392	2021-10-18T15:48:03.000Z	1450126537806815232	The Burbank Fire Department paid us a visit today.🚒 We learned about fire safety and how they use the jaws of life!     	{'place_id': '48f2609344f0c3f7'}
1418412711386435585	2021-10-18T15:01:56.000Z	1450114933555859469	 TRAVEL	{'place_id': '8b351eeb91372dc7'}
1377383549876199433	2021-10-18T14:56:28.000Z	1450113557329289220	Was so inspiring to visit  yesterday where I also met  . Thanks for sharing your stories and for all of the solid advice. 	{'place_id': '1d9a5370a355ab0c'}
181252363	2021-10-18T14:31:07.000Z	1450107175687315456	happy birthday to one of my best friends. i’m so grateful to have you in my life. my travel buddy for boybands, forever. i love you so much ❤️ 	{'place_id': '13d0994d4df436f8'}
2305477914	2021-10-18T14:12:22.000Z	1450102460186513413	 you are now down to 0 trains to OHare an HOUR at the high of morning commute. Chronic problem. Beware Chicago. Add 0 minutes more to your travel time.	{'place_id': '1d9a5370a355ab0c'}
1244066844501331968	2021-10-18T14:03:17.000Z	1450100174756384771	 Thank you. My birthday was in July but I just went to visit them about 0 weeks ago. My daughter’s is in August so we exchanged gifts in person ☺️	{'place_id': '5e4243758a966b81'}
85644676	2021-10-18T13:51:26.000Z	1450097189263454212	And we're off!   Visit   to watch the live stream. These next 0 days will be full of learning opportunities for the water sector   	{'place_id': '0d8519ccc356e001'}
1014082676	2021-10-18T12:24:58.000Z	1450075432439762945	Flying home today I am feeling refreshed and renewed from a weekend away & seeing my friends! I'm thankful for the fandoms that connect us and the opportunity to travel to be a part of it all. Comic con brings together people in such a unique way! I miss everyone already! 	{'place_id': '1d9a5370a355ab0c'}
518059822	2021-10-18T11:40:55.000Z	1450064343412916226	Praying for Traveling Grace	{'place_id': '1d9a5370a355ab0c'}
403481070	2021-10-18T11:05:37.000Z	1450055459927437312	                                             the      connected 0me will make sure you can work with extraterrestrials so we can develop very advanced transportation & technology 0 eventually visit other planets with humans on it	{'place_id': '1d9a5370a355ab0c'}
3189393715	2021-10-18T11:00:00.000Z	1450054048170790912	Impressive that I can get jet lag when traveling within the same time zone.	{'place_id': '1d9a5370a355ab0c'}
1226574865475481600	2021-10-18T05:10:28.000Z	1449966086158524418	This how I look when I’m on the ones & twos. Check out this mix I made and come on through & visit me at Paradise Park located at 0 W. North Ave. in Chicago. Click the link below ⬇️ Help me give House Music a home. I hope to see you there! 😉	{'place_id': '8b351eeb91372dc7'}
17584334	2021-10-18T01:32:47.000Z	1449911302047125504	 coming to a property near YOU soon!  Episode 0 airs on The Travel Channel October 0th at 0 am in most markets across America, and we shoot Episode 0 next week. 🎥   	{'place_id': '1d9a5370a355ab0c'}
23448129	2021-10-18T01:09:11.000Z	1449905366439956482	Fantastic  scan of the Architecture Is Fun  exhibit If you’re an aspiring     visit   	{'place_id': '1d9a5370a355ab0c'}
46726866	2021-10-18T01:03:53.000Z	1449904030835163139	We have a volunteer program!⠀The JR. Critter Crew accepts volunteers 0 years old and older to help socialize our birds and learn to properly handle and care for our pets! For more information the  Jr. Critter Crew visit our website!   	{'place_id': '07d9d22ec8087001'}
409468260	2021-10-18T00:48:42.000Z	1449900209291530243	What are we to do as Christians in a culture that is changing constantly?For more info visit:   	{'place_id': '1d9a5370a355ab0c'}
335744385	2021-10-19T23:47:04.000Z	1450609476797616132	 Send him to visit me!!	{'place_id': '1d9a5370a355ab0c'}
1364076528871628800	2021-10-19T23:43:25.000Z	1450608558404427778	I just updated my tours on my  profile! Catch me in Chicago and Washington DC soon. To pre-book, visit 	{'place_id': '1d9a5370a355ab0c'}
1387969560	2021-10-19T23:33:58.000Z	1450606177352552457	I just want everyone to understand we now have the ability to travel to space commercially, but there's still no such thing as a safe cold/flu medicine for my 0 yr old niece to take. Capitalism truly is ass.	{'place_id': '1d9a5370a355ab0c'}
127428259	2021-10-19T23:30:12.000Z	1450605231704846337	Travel event with  @ River Roast 	{'coordinates': {'type': 'Point', 'coordinates': [-87.6323045, 41.8879471]}, 'place_id': '1d9a5370a355ab0c'}
329314944	2021-10-19T23:22:54.000Z	1450603391588216832	 Make sure you come visit me 😒.	{'place_id': '1d9a5370a355ab0c'}
1026984229085884417	2021-10-19T21:58:08.000Z	1450582059345453061	  Thank you for coming to visit, Terri! 	{'place_id': '918c943e88cc3e5d'}
106010466	2021-10-19T20:50:13.000Z	1450564967116201992	 Yes he does! He lives  Comiskey Park  New 0 and   soilder field!! Any time I go  to sox game  or Bears game  I feel visit  him!  Watch  Bears   game or sox game it field of dreams  Bonnie	{'place_id': '1d9a5370a355ab0c'}
1424362706765811718	2021-10-19T20:49:53.000Z	1450564885910282248	   I live downtown it’s getting worse and worse each month. Not a place to visit. No place is safe.	{'place_id': '1d9a5370a355ab0c'}
10043572	2021-10-19T19:42:41.000Z	1450547973994254338	Just a short stroll from Andersonville to Lincoln Park. *...           @ Chicago, Illinois 	{'coordinates': {'type': 'Point', 'coordinates': [-87.632496, 41.883222]}, 'place_id': '1d9a5370a355ab0c'}
347926119	2021-10-19T19:39:35.000Z	1450547192935161859	Quick visit to the  booth to see some new products. They are featuring these air release valves.  	{'place_id': '1d9a5370a355ab0c'}
554799466	2021-10-19T18:39:07.000Z	1450531978848133120	 Very beautiful! You should definitely pay a visit. You won’t regret it	{'place_id': 'd64afac908bf795d'}
485902719	2021-10-19T18:08:03.000Z	1450524159394697217	Thank you Daryl Harris and   ( ) for bringing me back to KY the in September for TADx. Great visit as always. Till we meet again...           	{'place_id': '1d9a5370a355ab0c'}
47864806	2021-10-19T17:36:02.000Z	1450516101209669636	One more for the books! Thank you for all the love & support! ❤️Travel, adventure, create, keep working & create moments worth remembering! @ The Promontory 	{'coordinates': {'type': 'Point', 'coordinates': [-87.58755028, 41.79914318]}, 'place_id': '1d9a5370a355ab0c'}
1021490330594672641	2021-10-19T17:33:50.000Z	1450515547695820807	Reason 0,0,0 to travel the world 	{'place_id': '41bc24e82dfe5a2c'}
2303628068	2021-10-19T16:42:08.000Z	1450502536444747776	Came to Chicago to visit a friend. Turns out we’re just in time for the  championship parade! 🏆🏀 	{'place_id': '11db8d5339546000'}
3403201023	2021-10-19T16:30:52.000Z	1450499702307295234	In the wintertime I be looking for somebody son to feed & cuddle with. This winter ima just feed friends and travel	{'place_id': '1d9a5370a355ab0c'}
1472073320	2021-10-19T15:57:25.000Z	1450491284548902916	We are back home from Kansas City. Thanks  for the fun and thanks as always to  for being the best travel buddy and LD / PA. Two new videos coming soon from these gentlemen 	{'coordinates': {'type': 'Point', 'coordinates': [-87.914753, 41.892386]}, 'place_id': '5a483763a916e21d'}
347926119	2021-10-19T15:41:18.000Z	1450487228979990530	First booth visit of the day with  They are talking about their software suit, but specifically  OMNI.  	{'place_id': '1d9a5370a355ab0c'}
51335781	2021-10-19T15:28:24.000Z	1450483981665947658	US Secretary of Defense Lloyd Austin, on a visit to Kyiv, UA informs:“Let us make it clear – Russia has started this war, and Russia is the stone that hinders a peaceful settlement. They began to violate the territorial integrity & sovereignty of Ukraine” 	{'place_id': '7ca9cc3e813b1534'}
1300966373322043397	2021-10-19T14:51:34.000Z	1450474710148472847	Happy Italian-American Heritage Month! Throughout this month, I’ll be highlighting some cultural gems like The Little Italy Neighborhood. Located on the near-west side of Chicago, Italian restaurants, bakeries, and delis can be found along Taylor St. I encourage you to visit! 	{'place_id': '51f856eacad92bcb'}
336036892	2021-10-19T14:39:19.000Z	1450471628450713609	Been bothering me I’ve been trying find his bm for the longest so I can visit his daughter but I have no clue where she at. Shit sucks man	{'place_id': '5a483763a916e21d'}
36350694	2021-10-19T14:17:40.000Z	1450466181329133583		{'place_id': '99700cd6fc455c13'}
23196051	2021-10-19T13:38:03.000Z	1450456211028127746	This morning’s visit 	{'place_id': '07d9db099f088003'}
2558017418	2021-10-19T13:32:46.000Z	1450454882247495681	I’m really going on a trip with my blue and white CL0B’s 💙 I’m so excited!	{'place_id': '6b029ca925395e1b'}
221418161	2021-10-19T13:05:21.000Z	1450447983250661378	A couple of no-brainers we’ll visit on our Haunted Ho-Flo ride next Tuesday. You got a house or street you’re dying for us to see? Spill your guts to us in a DM, we might add it to the tour. @ Homewood, Illinois 	{'coordinates': {'type': 'Point', 'coordinates': [-87.66555556, 41.55722222]}, 'place_id': '6db05c8d8e092528'}
111925748	2021-10-19T12:48:31.000Z	1450443746697531392	Video Shows Travel Nurses  Begging Staffing Agency For SAFE Housing, Photos Go Viral 	{'place_id': '1d9a5370a355ab0c'}
780764247156330501	2021-10-19T12:26:46.000Z	1450438271046197248	🚨 GAMEDAY! 🚨🆚 Ridgewood HS⏰ 0:0📍 Ridgewood HS🏆 IHSA Regional Semifinal🎟 $0 Entry FeeOctober soccer is here! Your Bulldogs travel to Norridge to begin IHSA state playoffs!  	{'place_id': '1d9a5370a355ab0c'}
1184697492736073728	2021-10-19T02:41:43.000Z	1450291040066412547	traveling with you is everything x 	{'place_id': '1d9a5370a355ab0c'}
18742427	2021-10-19T00:40:42.000Z	1450260585468338189	i miss getting dressed up for things, but when traveling all day it has to be the comfy clothes for me (plz don’t judge) 😎 	{'place_id': '1d9a5370a355ab0c'}
1071533919252680704	2021-10-19T00:39:58.000Z	1450260401657106435	Purple Line trains bypass most of the local stops made by the Red Line, but don't travel at a higher rate of speed. Additionally, south of Belmont, the Purple Line makes all local stops that the Brown Line makes, and therefore isn't really any faster.	{'place_id': '47fe07f1c6b38dbd'}
2388492578	2021-10-19T00:06:37.000Z	1450252008858980358	 Well worth the visit! I want to go back and see more.	{'place_id': '1d9a5370a355ab0c'}
91272555	2021-10-20T23:42:50.000Z	1450970796978024453	We loved beautiful Pebble Beach!       	{'place_id': '57ac88aefcd20988'}
36475665	2021-10-20T23:32:29.000Z	1450968194370441216	Misery (0)Rob Reiner   It made Bates a star, was a highlight performance in Caan’s career, proved that Reiner could go dark and convinced everyone that NO ONE should visit Rural Maine in the winter! Top notch horror! 	{'place_id': '1d9a5370a355ab0c'}
988399524	2021-10-20T23:12:15.000Z	1450963099469721600	Visit your favorite local restaurant and say your 'thanks' to the chef, for it's  🧑‍🍳 And you can gift them today's food item, they will DEFINITELY find a use for them -  🍐 🍎 🥃 	{'place_id': '1d9a5370a355ab0c'}
105359738	2021-10-20T23:04:36.000Z	1450961174527414277	FOUND A NEW VEGAN SPOT TO VISIT IN LA :-)))))	{'place_id': '1d9a5370a355ab0c'}
2619159051	2021-10-20T22:32:41.000Z	1450953143836160005	Across 0 States &  in under a minute 😍🤗               	{'coordinates': {'type': 'Point', 'coordinates': [-87.90120921, 41.97655691]}, 'place_id': '1d9a5370a355ab0c'}
920679377255350272	2021-10-20T22:07:18.000Z	1450946757232365581	 don’t ever visit the melrose park ,I’ll location 0 north av they just tried charging me almost 0 dollars for 0 mcchickens with cheese and a large drink 0 dollar extra for each piece of cheese and a dollar more per sandwich then any other McDonald’s Burger King now	{'place_id': '20c885d40cb26f0f'}
1250642051731001344	2021-10-20T22:02:50.000Z	1450945632336859141	This how me and my mama travel. We gone EAT 😂😂😂 	{'place_id': '1d9a5370a355ab0c'}
451933426	2021-10-20T21:55:00.000Z	1450943659554353153	  Gurllll byeeee! You don’t even come visit for a weekend!!! 🙄	{'place_id': '893163e131e6e67c'}
471748983	2021-10-20T21:32:42.000Z	1450938048489873408	Can not stress enough how proud I am of my little brother. He’s been working with the  as an athletic trainer & It’s so cool to see his experiences working w/ these athletes & getting to travel & see the country. He’s worked really hard to get there, Love ya Sam 💜 	{'place_id': '1d9a5370a355ab0c'}
99138746	2021-10-20T21:09:44.000Z	1450932270064406528	I'm at O'Hare Oasis Travel Plaza in Schiller Park, IL 	{'coordinates': {'type': 'Point', 'coordinates': [-87.88328592, 41.95059817]}, 'place_id': '7c9d51a2fd0a7552'}
169684909	2021-10-20T20:59:00.000Z	1450929566155935751	 about to make me fly to California and smack the shit outta him w/ a bottle of wine	{'place_id': '1d9a5370a355ab0c'}
4862436401	2021-10-20T20:54:22.000Z	1450928400449875972	 It was my treat! You have a beautiful space, and it made me appreciate a section of the river I don’t often visit.	{'place_id': '1d9a5370a355ab0c'}
2537874118	2021-10-20T20:40:25.000Z	1450924890098446346	0 more states to go..couldn’t be more happier to travel them with you❤️ 	{'place_id': '1d9a5370a355ab0c'}
347926119	2021-10-20T20:35:37.000Z	1450923680821911554	The last booth visit from  is  They are showing off their new Series 0 electric actuators in multiple sizes. 	{'place_id': '1d9a5370a355ab0c'}
408219132	2021-10-20T20:13:47.000Z	1450918188162719746	 You been traveling a lot lately bro, you in Alabama now?	{'place_id': '1d9a5370a355ab0c'}
29824624	2021-10-20T19:48:19.000Z	1450911780474077188	The jet fuel based carbon footprint of women on Hinge has to be massive. You don't need to travel that much or that far.	{'place_id': '1d9a5370a355ab0c'}
742043463244382208	2021-10-20T18:24:13.000Z	1450890614904659970	 i’m gonna have to fly to denver today for this 🥶	{'place_id': '1d9a5370a355ab0c'}
343144721	2021-10-20T18:00:10.000Z	1450884562712768522	    The bubble where there's no excuse not to have a valid photo ID because it's needed to travel to Mexico... Thought that was obvious. Education must suck in your bubble.	{'place_id': 'ed888f00de07aa3a'}
58690623	2021-10-20T17:47:38.000Z	1450881407824375815	Normally I travel to different neighborhoods to admire different architecture styles, but sometimes I remind myself that there are some absolute gems in my own backyard. 	{'place_id': '1d9a5370a355ab0c'}
15281728	2021-10-20T16:43:40.000Z	1450865311163379720	You know you're gonna have a good time traveling when a surprise  is on your flight!  See ya soon 	{'place_id': 'f73e32e0ec3fcc45'}
1611670422	2021-10-20T15:25:43.000Z	1450845691958411269	 that shit traveling fast!	{'place_id': '1d9a5370a355ab0c'}
36475665	2021-10-20T14:54:54.000Z	1450837938745524226	Only 0-Hours until   0 Hour Marathon begins!  and I are so excited to visit our favorite theater in the world after an almost 0 year absence! The line-up is AMAZING 🔥 this year (as always) - something for everyone! Can👏not👏wait 👏! 	{'place_id': '1d9a5370a355ab0c'}
22523235	2021-10-20T13:59:21.000Z	1450823959604305921	0 mins to travel less than 0 miles.  WTF, is up with the ongoing traffic issues in Rogers Park / Edgewater?!  What a nightmare...DAILY.  Get it together, Chicago's City Planning Dept.!/End of rant     	{'place_id': '1d9a5370a355ab0c'}
216740490	2021-10-20T13:56:15.000Z	1450823177454510088	  Helps on travel costs.	{'place_id': '1d9a5370a355ab0c'}
2348369840	2021-10-20T13:22:43.000Z	1450814738007531523	  I better be on the list when I come visit you! 	{'place_id': '1d9a5370a355ab0c'}
99138746	2021-10-20T13:17:52.000Z	1450813521407655936	I'm at O'Hare Oasis Travel Plaza in Schiller Park, IL 	{'coordinates': {'type': 'Point', 'coordinates': [-87.88328592, 41.95059817]}, 'place_id': '7c9d51a2fd0a7552'}
316698745	2021-10-20T12:53:43.000Z	1450807442758148099	My junior year in Caceres, Spain, &  senior individualized project (SIP) in Freetown, Sierra Leone were deeply impactful experiences for me (K’0), contributing greatly to my lifelong love of international travel & career as an immigration attorney.    🐝🐝🐝🐝 	{'place_id': '1d9a5370a355ab0c'}
29905725	2021-10-20T11:42:57.000Z	1450789633361653767	i've been toying with the idea of flying back to my hometown(s) and working from there for a week just to remind myself what it's like to be trapped & miserable	{'place_id': '1d9a5370a355ab0c'}
287925165	2021-10-20T10:36:51.000Z	1450772998181556228	 Everytime u travel it’s either Stl or Vegas. U know the lifestyle u be living	{'place_id': 'f8834b23cf9ae9f3'}
879925564668248064	2021-10-20T04:10:20.000Z	1450675728786370562	bro imma time travel back to the Salem witch trials with a 0mm and show them some witchcraft	{'place_id': '99700cd6fc455c13'}
99138746	2021-10-20T02:16:31.000Z	1450647084567339016	I'm at O'Hare Oasis Travel Plaza in Schiller Park, IL 	{'coordinates': {'type': 'Point', 'coordinates': [-87.88328592, 41.95059817]}, 'place_id': '7c9d51a2fd0a7552'}
409468260	2021-10-20T02:02:29.000Z	1450643552044789763	What are we to do as Christians in a culture that is changing constantly?For more info visit:   	{'place_id': 'c8b021ffd0c94ffc'}
16020880	2021-10-20T01:45:58.000Z	1450639395472691204	 I’m familiar with the black tank. Just figure there are better portable potty options than a bucket. Do you plan on traveling to somewhere warm in the winter?	{'place_id': '1d9a5370a355ab0c'}
1385057131553038338	2021-10-20T01:20:51.000Z	1450633074933440514	Holy shit this should be shown on every recruiting visit. If you want to develop, come to Illinois. 	{'place_id': '1d9a5370a355ab0c'}
2749576780	2021-10-20T00:34:10.000Z	1450621327392612355	We’ll be there, but you’d better bring your wide angle lens …we travel big for the best team in all the land! Let’s go Huskies!!! 	{'place_id': 'b8fcb766f3f544fe'}
873339022227025922	2021-10-20T00:12:23.000Z	1450615844128575490	R U Still 👀👀 0 nuru massage I am traveling soon 0🦋 Davenport, IA 0/0🦋 Lafayette, IN 0/0🦋 Binghamton, NY 0/0rd🦋 Las Vegas, NV  0/0rdBringing my nuru gel...🥰Misslisacharms 	{'place_id': '1d9a5370a355ab0c'}
184120900	2021-10-21T23:32:39.000Z	1451330624334217219	I used to speak bein a traveling barber all over my life & its happening now.	{'place_id': '1d9a5370a355ab0c'}
1421541857620803592	2021-10-21T22:06:10.000Z	1451308860170387477	Can’t wait to travel to St. Louis for this Showcase! Check out  this weekend. Love being able to show our skill and play some tough competition.      	{'place_id': 'c4419b2786243b50'}
1302303643983638531	2021-10-21T21:25:14.000Z	1451298558402039808	I think it’s smart. In this age of travel the geographic distinctions mean less than ever. Get your two best squads together and play it off. 	{'place_id': '1d9a5370a355ab0c'}
36125085	2021-10-21T20:44:57.000Z	1451288420505038852	At least here were some free samples to “feast” on for our delayed Southwest flight home to KC.          	{'coordinates': {'type': 'Point', 'coordinates': [-87.74588742, 41.78656582]}, 'place_id': '1d9a5370a355ab0c'}
26524285	2021-10-21T19:43:35.000Z	1451272976909938698	 neighborhood visit today is  — great vibe, biz growth,housing. And a lot where old ambulances go to retire 	{'place_id': '11c8177772160000'}
16629885	2021-10-21T17:31:24.000Z	1451239712585363461	 thank you for making the trip to Chicago and inspiring our group. Your story was exactly what we needed to hear as we travel home today to hug our wives, husbands, and kids. You’ve got a new fan and follower in me. 👍🏼 	{'place_id': '0fc3438a29542000'}
