3054733038	2021-12-30T00:05:24.000Z	1476343627723030530	With todays conversations on the TL about BA privilege when traveling abroad it’s got me thinking again about all of this. Cause it’s all related.	{'place_id': '1d9a5370a355ab0c'}
47653371	2021-12-30T00:02:45.000Z	1476342959360692225	Also like if traveling was the majority of my job, and the company said they weren’t doing mandatory testing during the biggest surge of cases in close to a year I would nope out too	{'place_id': '4c46121d44b7ce9e'}
33337339	2021-12-30T00:02:34.000Z	1476342913202372613	  I don’t think you understand the term “lecture” in this context. How about you visit a Black barbershop and bring up the topic of exploitation in sports. You might learn that this has been a topic in our community for years. The Madden game isn’t exempt from that convo.	{'place_id': '1d9a5370a355ab0c'}
1367287015440539650	2021-12-31T23:11:51.000Z	1477054927922995202	Long ass day of traveling.  More than 0 hours to go.	{'place_id': '1d9a5370a355ab0c'}
2984414301	2021-12-31T21:43:52.000Z	1477032785231683584	 long time customer and have had it! Three freaking days multiple times on hold, today when I'm next after waiting get hung up on. I just want my perception transferred so I can take my medication when I travel.	{'place_id': '4b3758bc32868265'}
1037397531506958337	2021-12-31T21:30:03.000Z	1477029308690583559	The song on repeat for this last day of 0 which saw an end to my 0 year relationship and me losing my best friend here, losing a family member to COVID, traveling a lot and meeting so so many new people. So many 💔 but also ❤️‍🩹 In My Life 	{'place_id': '1d9a5370a355ab0c'}
838761545207328768	2021-12-31T21:08:24.000Z	1477023858414829578	  As a native DCian, I am happy to pin up any posters and collect cards/comments for colleagues who are opting not to travel. Slide on into my DMs	{'place_id': '1d9a5370a355ab0c'}
1315667470158569473	2021-12-31T20:59:03.000Z	1477021504554606594	   Honestly?  Since FL is a hotbed for covid and the governor won't mandate anything, why would anyone go there?  I have family down there.  There is no way I would go down there to visit.  Love AOC but completely understand the accusations of hypocrisy.	{'place_id': '003cc2276dfcaca4'}
341933421	2021-12-31T19:05:30.000Z	1476992931236139008	 0. That man looks AMAZING for 0.0. I would visit him daily	{'place_id': '1d9a5370a355ab0c'}
14345294	2021-12-31T19:05:07.000Z	1476992832535736322	Our final park visit of 0 was to Oriole Park on the NW Side, Sloane’s 0th Chicago park.It has 0 playgrounds!We’ve been to about 0 parks this year (incl some repeats from 0), which is around a quarter of the 0+  	{'place_id': '1d9a5370a355ab0c'}
29581101	2021-12-31T19:04:27.000Z	1476992666089013256	Mild weather in Chicago this morning,  rode 🚲 out to visit the secret mermaid 🧜‍♀️  at 0th Street Beach.  Happy New Year ✌❤🍾 	{'place_id': '1d9a5370a355ab0c'}
1245542384282320896	2021-12-31T18:48:20.000Z	1476988612101255172	Come visit me this weekend? 💙 	{'place_id': '0fc342f89315b000'}
2738813435	2021-12-31T18:35:51.000Z	1476985469091127303	Just took me over 0 minutes to find my running shoes that were tucked away under my travel gear from the last time I ran.I’ve wasted weeks of my life just looking for things.	{'place_id': '1d9a5370a355ab0c'}
440526794	2021-12-31T18:32:20.000Z	1476984583811907584	PT enjoying our las   visit  @ United Club Lounge 	{'coordinates': {'type': 'Point', 'coordinates': [-87.90664474, 41.97459258]}, 'place_id': '1d9a5370a355ab0c'}
21089995	2021-12-31T17:49:08.000Z	1476973712096309254	 Maybe he should shut up and spend his riches in a visit to an actual war zone.	{'place_id': '1d9a5370a355ab0c'}
1350853724	2021-12-31T17:11:04.000Z	1476964132431802377	going into 0 knowing my worth and quadrupling it. MAMA I’M A OFFICIALLY A TRAVEL NURSE!! 😭	{'place_id': '1d9a5370a355ab0c'}
16410034	2021-12-31T16:36:49.000Z	1476955512629604355	When the hotel you your favourite view 🌽...     @ Kimpton Hotel Monaco Chicago 	{'coordinates': {'type': 'Point', 'coordinates': [-87.6260099, 41.8865399]}, 'place_id': '1d9a5370a355ab0c'}
16410034	2021-12-31T16:35:00.000Z	1476955054032707585	This city 😍...     @ Chicago, Illinois 	{'coordinates': {'type': 'Point', 'coordinates': [-87.632496, 41.883222]}, 'place_id': '1d9a5370a355ab0c'}
206805016	2021-12-31T16:15:35.000Z	1476950169606234112	Eso de desayunar con café es muy 0, y ya casi estamos en el 0… a cerrar el año bien 😎😂            	{'place_id': '1d9a5370a355ab0c'}
203445310	2021-12-31T15:39:04.000Z	1476940978346938373	Gotta see my dude Mo at  barber shop, for that EOY  and to look fly to play uncle for the night with the old high school crew.    	{'place_id': '4c46121d44b7ce9e'}
995645852	2021-12-31T15:26:25.000Z	1476937796854202368	Looking for a  join me for the Bible in One Year! Or join Fr. John Kartje in the intro Course to the Bible! Visit our website for more info! We do love you to join the journey!   	{'place_id': '1d9a5370a355ab0c'}
12487222	2021-12-31T15:22:23.000Z	1476936782507745285	Jump on this offer! A better  travel option than car or plane.... 	{'place_id': '99700cd6fc455c13'}
381549942	2021-12-31T14:44:18.000Z	1476927198871359493	 It's not a dig, they're both unemployed. She was dropped from RHOBH and he no longer wanted to travel & report, he wanted to be CA based.	{'place_id': '97d83d40844c1807'}
47653371	2021-12-31T13:54:34.000Z	1476914683022123045	Someone explain the Progress, wrestle travel, THA GOD Double J situation to me	{'place_id': '4c46121d44b7ce9e'}
884137781953482753	2021-12-31T12:09:25.000Z	1476888217664241694	(0/0) (Bottom Row, Left to Right) 0️⃣ Announcing my candidacy for DuPage County Chairman in the 0 election. Visit  🗳✅0️⃣ Speaking about increasing economic opportunity with  at Innovation DuPage 📈. 0️⃣ Recieving my  vaccine. 🇺🇸	{'place_id': '47fe07f1c6b38dbd'}
165089896	2021-12-31T09:22:17.000Z	1476846160186859522	People in Hawaii been traveling & going out the entire pandemic then refusing to get vaccinated lbvs 	{'place_id': '1d9a5370a355ab0c'}
278344972	2021-12-31T09:03:03.000Z	1476841320551534618	If you don’t get me out of this travel noodle I’m going to throw up everywhere	{'place_id': '1d9a5370a355ab0c'}
206805016	2021-12-31T06:32:15.000Z	1476803367439589410	Viajar y no comer, es como ir a una pista de baile y no bailar…           	{'place_id': '07d9e38e1a887000'}
961702778220548096	2021-12-31T06:05:47.000Z	1476796709288218626	Xmas Eve flew to  to visit my huge extended family. We all agreed to perform Rapid Ag tests prior to  arriving at my parents since they are older but otherwise active and healthy for their age (&gt; 0). (0/0)	{'place_id': '1d9a5370a355ab0c'}
958755296024899590	2021-12-31T06:02:42.000Z	1476795933291601947	 Visit me in Chicago anytime! 😈	{'place_id': '1d9a5370a355ab0c'}
3191170998	2021-12-31T05:44:01.000Z	1476791232412200969	I don’t visit my mom cause I know visiting her I’m bound to run into my bitchass bd but you know what idgaf no more he gon see what he fucked up on me	{'place_id': '1d9a5370a355ab0c'}
108811654	2021-12-31T05:23:12.000Z	1476785992338190337	Gonna go to KC to visit my one of my BFFs for my birthday and cannot wait!!!	{'place_id': '1d9a5370a355ab0c'}
1125517538002198528	2021-12-31T02:45:01.000Z	1476746183716622337	This shit can time travel 	{'place_id': '1d9a5370a355ab0c'}
1753696598	2021-12-31T02:44:45.000Z	1476746114695110662	Should I go visit bottom lounge ?	{'place_id': 'f48e110211eee6ef'}
23196051	2021-12-31T02:21:06.000Z	1476740163724357632	 I visit it often.	{'place_id': '1d9a5370a355ab0c'}
1006919818933690368	2021-12-31T01:35:58.000Z	1476728807788883995	Very grateful i got 0travel this year n visit many of my equally insane friends and watch amazing shit with them,      Also  for being my lifetime partner in crime, even if only virtually Luv u all!	{'place_id': '1d9a5370a355ab0c'}
759396260	2021-12-31T00:37:28.000Z	1476714083382697984	It seems like everyone has a story about breakthrough COVID this week. Here’s mine: we went to Michigan to visit in-laws for the holidays, saw literally five people, all fully vaccinated. Husband came home with COVID, mild symptoms. The kids and I have (so far)🤞 tested negative.	{'place_id': '1d9a5370a355ab0c'}
14311780	2021-12-31T00:33:00.000Z	1476712959414001665	I seriously had a job in 0 where I sat in a room in Wisconsin with the internet & instructed Amex cardholders how to find an office to go get a temporary card made while traveling when they lost theirs.	{'place_id': '1d9a5370a355ab0c'}
34779222	2022-01-02T23:02:37.000Z	1477777377535180802	Watching the sun set in the  in Chicago    	{'place_id': '1d9a5370a355ab0c'}
1440321825032982532	2022-01-02T22:48:48.000Z	1477773903028269056	 Yes I planned to visit my daughter and her family in Los Angeles. Her school went remote three weeks ago. She's tested positive since, but  we decided maybe over the summer. I wouldn't even consider Florida at this time.  .maybe next year.	{'place_id': '1d9a5370a355ab0c'}
847714411	2022-01-02T22:16:27.000Z	1477765758977466368	Hold up. I've been traveling all day. Just how bad are the Giants?	{'place_id': '5b217454f4bd5f04'}
1440321825032982532	2022-01-02T22:16:19.000Z	1477765728665276422	 Yes I hoped to fly to Los Angeles this week, but it's just a good time. Maybe over the summer 🤔	{'place_id': '1d9a5370a355ab0c'}
892455350087159809	2022-01-02T22:11:23.000Z	1477764486505369601	I am available now in Chicago, Illinois, United States! To get in touch, visit me on  	{'place_id': '1d9a5370a355ab0c'}
