1197593698877366272	2021-08-14T02:26:29.000Z	1426369605497507845	Pablo Picasso was well represented during my visit to the  today. Thought  would appreciate the shoutout. Thinking of you while traveling. 	{'place_id': '1d9a5370a355ab0c'}
995645852	2021-08-14T02:05:10.000Z	1426364243134324737	Join us this fall at the  for our fall course on faith and science with Fr. John Kartje, PhD, STD, Rector and the President of the University of Saint Mary of the Lake. Visit  to learn more and register! 	{'place_id': '1d9a5370a355ab0c'}
618581306	2021-08-14T01:59:10.000Z	1426362732341780481	Prost! The finest Märzen brewed in Chicago! Reminds me of traveling south from Berlin to München on the Autobahn in a Mercedes van w/ the fam while playing this album. NP: Kraftwerk - Trans-Europe Express 🇩🇪 🍺🤘?... (Festbier) 	{'place_id': '1d9a5370a355ab0c', 'coordinates': {'type': 'Point', 'coordinates': [-87.6334457, 41.870533]}}
746077482739171328	2021-08-14T01:26:15.000Z	1426354446888546305	Those who participate in screening testing are eligible to test to stay in school if they are a close contact. View the Health & Safety protocols on the website for details ( & visit PowerSchool to complete the consent form.  	{'place_id': 'cdf74b55fc0d4600'}
1053939120	2021-08-14T00:53:55.000Z	1426346311784280074	 Its a nice place to visit.	{'place_id': '1d9a5370a355ab0c'}
60307583	2021-08-14T00:53:12.000Z	1426346131420758017	Camden met his Aunt KeKe today! Thanks for coming to visit us  it’s been wayyyyy too long! ••     @ Chicago, Illinois 	{'place_id': '1d9a5370a355ab0c', 'coordinates': {'type': 'Point', 'coordinates': [-87.632496, 41.883222]}}
1227285698023231489	2021-08-14T00:37:28.000Z	1426342172694044675	Made the Brussel sprout salad with avocado vinegrette from RPM Italian because I don't want to travel downtown. 	{'place_id': '1d9a5370a355ab0c'}
353677199	2021-08-15T21:57:42.000Z	1427026739184775168	 Apparently Kay is against travel because of his radio show and how easy it is for him.	{'place_id': '1d9a5370a355ab0c'}
906415765464797184	2021-08-15T21:33:56.000Z	1427020759617179651	           🔥🔥🔥	{'place_id': '8b351eeb91372dc7'}
2537984836	2021-08-15T20:49:48.000Z	1427009652215193606	 It is great to come back and visit! It makes me appreciate it so much more than when I lived here	{'place_id': '1d9a5370a355ab0c'}
750016934	2021-08-15T20:25:09.000Z	1427003449963593733	 omygod wait are you coming to visit me??😏	{'place_id': '1d9a5370a355ab0c'}
635650370	2021-08-15T19:33:11.000Z	1426990369871388674	 thank you❤️ can’t wait for your next visit to the windy city🤘🏼	{'place_id': '1d9a5370a355ab0c'}
906428404844650496	2021-08-15T19:08:00.000Z	1426984033951621122	Had lunch here after church; heading to Regency to visit Colleen (at  in Chicago, IL) 	{'coordinates': {'type': 'Point', 'coordinates': [-87.78351359, 41.99324564]}, 'place_id': '1d9a5370a355ab0c'}
1315667470158569473	2021-08-15T18:23:17.000Z	1426972781317603331	 Again, critical thinking isn't playing a part here.  If the secede, they will have nothing the federal government provides.  How would they get health insurance since those companies are now in a foreign country?  How would they travel to the US?  Their passports would be invalid	{'place_id': '003cc2276dfcaca4'}
1323108864443764737	2021-08-15T17:47:21.000Z	1426963739362877440	 I’m finna fly to Atlanta	{'place_id': '6db05c8d8e092528'}
713512832646524928	2021-08-15T17:14:02.000Z	1426955352625618950	Please visit our new website and contact us for any entertainment needs. @ EPIC DJ Services 	{'coordinates': {'type': 'Point', 'coordinates': [-87.80558, 41.91713]}, 'place_id': '1d9a5370a355ab0c'}
18739604	2021-08-15T17:07:08.000Z	1426953616364085248	Over here at the Rock, Shop and Roll Craft and Vendor Fair with  Come pay us a visit. @ Dell Rhea's Chicken Basket 	{'coordinates': {'type': 'Point', 'coordinates': [-87.9392521, 41.74564272]}, 'place_id': '13d0994d4df436f8'}
36905602	2021-08-15T16:46:31.000Z	1426948427162787842	Spent my Friday at both the DMV and  it is official…  stores have surpassed the DMV as “Worst place to visit” im actually impressed.  Didn’t think it was possible.	{'place_id': '1d9a5370a355ab0c'}
2369449952	2021-08-15T16:29:04.000Z	1426944037064478727	     ATX Bodega is certainly worth the visit.	{'place_id': '1d9a5370a355ab0c'}
1238543517108113409	2021-08-15T15:46:17.000Z	1426933271410225155	When traveling be sure to keep your priorities in order… 	{'place_id': 'ef28358de03cb92e'}
173839154	2021-08-15T14:36:20.000Z	1426915667001884674	 Hello. A sim of my mom traveling to USA lost all it's incoming n messages. Need immediate help please.	{'place_id': '088c56ad174b8e80'}
97613792	2021-08-15T13:45:03.000Z	1426902762005094402	i actually think i might be patient enough to deal with having a kid at 0 but i wanna enjoy my money first and visit a few more continents	{'place_id': '1d9a5370a355ab0c'}
32005244	2021-08-15T12:11:48.000Z	1426879292307345412	Today it is. Flyin out. Chicago it’s been real. I’ll be back to visit	{'place_id': '1d9a5370a355ab0c'}
33357518	2021-08-15T09:16:14.000Z	1426835111992086529	 I can hop on a plane anytime but now is not the time to travel for fun.	{'place_id': '1d9a5370a355ab0c'}
334353532	2021-08-15T05:13:32.000Z	1426774034386194433	Going back out in chicago is a no for me I’m just that old, I rather continue to travel & mind my business	{'place_id': '5b0b1baf24cf0a6a'}
73406355	2021-08-15T02:02:59.000Z	1426726080040382468	When you visit friends and they leave the room so you can pretend you also live           @ Andersonville 	{'coordinates': {'type': 'Point', 'coordinates': [-87.6701, 41.9796]}, 'place_id': '1d9a5370a355ab0c'}
1071790387453407232	2021-08-15T01:04:40.000Z	1426711405865148417	Fags should never enter their Master’s home clothed.  When I visit my Master’s house, I must strip naked on the deck before I am admitted.  And of course, I am forbidden to wear clothes in his house. 	{'place_id': '1d9a5370a355ab0c'}
803991183999594497	2021-08-15T00:43:38.000Z	1426706111252598789	 I have. My pal said she laminated a copy for travel and left the original at home. I have to be tested before coming home..so it won't matter	{'place_id': '1d9a5370a355ab0c'}
803991183999594497	2021-08-15T00:38:21.000Z	1426704780592881664	 No..im traveling abroad	{'place_id': '1d9a5370a355ab0c'}
803991183999594497	2021-08-15T00:28:37.000Z	1426702332591542275	 All is well then. When ol boy us traveling they sandwich me in..puts me to sleep	{'place_id': '1d9a5370a355ab0c'}
