776783579225419777	2020-05-10T16:00:31.000Z	1259513659761537024	This is not my dad, but his last trip out of state was to visit my brother and see his newly created grand daughter. Don’t let these moments pass you by. 	{'place_id': '1c69a67ad480e1b1'}
219893490	2020-05-10T15:43:32.000Z	1259509386042638337	So Glad we got to visit you today Dad! I was Such a Beautiful day to spend some time with U. Hope to see you again Soon! Love and Miss You Dad! 🙏🏽🥰💙✝️ @ Houston, Texas 	{'coordinates': {'type': 'Point', 'coordinates': [-95.3694, 29.7602]}, 'place_id': '1c69a67ad480e1b1'}
307592042	2020-05-10T15:26:46.000Z	1259505166782529536	Love you Uncle Brother💖 Thank you for always making sure I was taken care of when momma and daddy could not. I will miss your bear hugs and your honest advise when I was able to visit! Momma and Granny B will be so… 	{'coordinates': {'type': 'Point', 'coordinates': [-95.42415086, 29.74157182]}, 'place_id': '1c69a67ad480e1b1'}
898478682	2020-05-10T12:35:08.000Z	1259461974171279361	Check it out  Now there's another really great reason for you to come visit Tejas brother!! 🤙	{'place_id': '6ef928bfe164fa3c'}
792820407082508288	2020-05-10T12:15:01.000Z	1259456910874599424	Happy Mothers Day! To my dearest daughter: When this world reopens we are going to travel to the English countryside, indulge in afternoon tea and mummy will explain her fascination with British culture (in her best Cockney accent) 	{'place_id': '1c69a67ad480e1b1'}
1242789888	2020-05-10T10:09:42.000Z	1259425370920620034	 He’s the guy who doesn’t celebrate Mother’s Day with the mother of his children because “she’s not his mom”. He goes home to visit is mom so she can make him a sandwich. His present is to make her do her mom job again.	{'place_id': '1c69a67ad480e1b1'}
151607698	2020-05-10T07:32:20.000Z	1259385768625266688	 Most undervalued talent at 0? Do you in your heart of hearts think the NBA returns this year with California apparently not allowing teams to travel?	{'place_id': '1c69a67ad480e1b1'}
15813570	2020-05-10T06:35:39.000Z	1259371504527192065	 Bro I learned the hard way to never go cheap on travel accommodations... it’s one comfort earned as an outcome for hard work... plus putting those (insane) red flags aside... how nasty do you think those sheets are?!? 😖🤮	{'place_id': '1c69a67ad480e1b1'}
417482666	2020-05-10T04:03:23.000Z	1259333187685232640	I move out & my parents took the whole ass wifi box to their room??? Selfish??? I barely even get any wifi signal all the way in my room now when I visit	{'place_id': '1c69a67ad480e1b1'}
455533453	2020-05-10T03:59:49.000Z	1259332287235264512	Time flies! ✊🏾 seems like yesterday I was coming on my first visit 	{'place_id': 'bcb210d6cf34438a'}
756345368040747009	2020-05-10T03:53:56.000Z	1259330809972080641	   At this point, I feel like there has to be a certain amount of personal responsibility. Don’t travel if you don’t have to risk it, Avoid crowds; if you must travel like this for work, request M0 masks from your job (in writing). Paper makes people think about liability.	{'place_id': '1c69a67ad480e1b1'}
50383882	2020-05-10T01:11:31.000Z	1259289932432056321	Weekend Mood 😁.ignitehoustonfete is 🔥🔥🔥.     @ Houston, Texas 	{'coordinates': {'type': 'Point', 'coordinates': [-95.3694, 29.7602]}, 'place_id': '1c69a67ad480e1b1'}
235979076	2020-05-10T00:52:14.000Z	1259285079848861697	 Cap. I’ll be there to visit soon brother. Trust me.	{'place_id': '1c69a67ad480e1b1'}
16524361	2020-05-10T00:33:56.000Z	1259280476914814977	This was TODAY. What happened to blocking out middle seats for social distancing      	{'place_id': '7a41192a2879ee24'}
