397706454	2020-07-23T15:47:33.000Z	1286327096797589504	I’m going to get up, go for a run, start work and not think of  all day. Or I’m just going to get up run and go to work.  	{'place_id': '3b77caf94bfc81fe'}
775094212702318593	2020-07-23T15:02:04.000Z	1286315652446212096	I have a 0-Day weekend. What to do? It’s not like I can go out and do stuff. I’m not go out and dine and I’m not into hiking and the beaches... no. I’ll watch movies, drink beer, bbq, and play records.	{'place_id': 'd563cf7307e4ba95'}
473384312	2020-07-23T14:38:57.000Z	1286309835294691329	  hi- yes- spend some time reading about capitalism & hierarchy of need - & sports / gamers military pipeline or (black kids get schools w/0path to college- via a stadium) otherwise jail or military- their “choice.”	{'place_id': '3b77caf94bfc81fe'}
353892308	2020-07-23T14:34:28.000Z	1286308705500196864	Go to school face shinning like a mf😂 	{'place_id': '3b77caf94bfc81fe'}
748662033135054849	2020-07-23T14:19:07.000Z	1286304844240662529	I’m ready to bring back children to school when it’s safe to do so. Make the commitment to protect our teachers, students and staff. Labor endorsed candidate.     	{'place_id': '0706a21788cadb8d'}
2442705600	2020-07-23T13:56:20.000Z	1286299109721141249	 Yeah like be featured maybe. But she has said before that when she has her kid she won’t make music till the kid is off to school 🥴	{'place_id': '07dccb89e8f25a8f'}
921439571283341312	2020-07-23T13:45:12.000Z	1286296308622299137	 for this incredible  ! To all that helped make the  and all you out there who have supported it!  Go out and make some of your own  !  The world needs you now more than ever!   	{'place_id': '3b77caf94bfc81fe'}
1214063748270317568	2020-07-23T08:15:20.000Z	1286213293871230976	Me: Hey! Tryna go out shawty?Her fat best friend: “HAHAHA so this mofo that want you, he don’t even look good.” Me: 	{'place_id': '3b77caf94bfc81fe'}
1583807959	2020-07-23T07:59:58.000Z	1286209426836217864	I don’t understand why smoking weed has such a bad stigma?? I still have a job, I still go to school, I still dgaf about your opinion....mind ya business 🙂	{'place_id': '7a615ec218d177f6'}
492756316	2020-07-23T07:57:30.000Z	1286208803965243392	why are so many parents going out with their kids? been seeing a lot of folks on social media hanging out in vegas with their kids. no judgement, but i just want to know if i’m missing something	{'place_id': '3b77caf94bfc81fe'}
2855071868	2020-07-23T06:44:31.000Z	1286190437535907840	 Totally disagree, and sorry about your brother. Covid is overblown so much that you're equating death to going to school. Numbers inflated, death in a hospital gets Covid stamp even when my friend died from moto accident. Sick	{'place_id': '7b2a70199c4d7b6d'}
1002651858782097408	2020-07-23T06:18:49.000Z	1286183970632212480	If I could, I’d be in Portland right now. I would go out and help. Black Lives Matter is a movement, not a moment. DONT YOU EVER FORGET THAT!	{'place_id': '6f24e28976abe656'}
2588709103	2020-07-23T06:18:10.000Z	1286183809172430849	fuck, contemplating going  to work tomorrow	{'place_id': 'fa424f169eef946e'}
1578605221	2020-07-23T05:26:57.000Z	1286170917974839297	 And kids cant go to school because.......................	{'place_id': 'cf2d9d01f16e9bd4'}
363129363	2020-07-23T04:46:29.000Z	1286160734301216769	I will never, ever understand intentionally reckless + stupid drivers. Like, I’m not a great driver, but it’s not on purpose lmao. If you go out of your way to drive like a moron, then I hope karma gets your ass 🥰	{'place_id': '3b77caf94bfc81fe'}
1117133475851558912	2020-07-23T04:45:34.000Z	1286160502737928192	Apparently you don't have any children  IN school WHY do you want to send people back to school back to their DEATHS. I've been socially isolating wearing a mask if I go out. hairstyle is TRAGIC tragically outdated you should shoot your or wait a minute from looks of you🖕🍊😷💙 	{'place_id': '3b77caf94bfc81fe'}
25203689	2020-07-23T04:45:08.000Z	1286160396164849664	   I didn’t have a huge party or go out or have a single person over for my birthday lmao a birthday isn’t an excuse to put a bunch of people at risk.	{'place_id': '3b77caf94bfc81fe'}
3304649479	2020-07-23T04:29:13.000Z	1286156388654125056	      so do i. but i really dont care about my typos or what i say on twitter because guess what, i go to college and i know im not stupid. idgaf what other people think. this is the internet like chill 😂	{'place_id': '3b77caf94bfc81fe'}
65216696	2020-07-23T04:19:46.000Z	1286154012522434561	Can we discuss the heartthrob known as Sunny. I think she deleted her page but if you went to school in the AUC you know Sunny been bad since day 0.Photographer:  //•••• … 	{'place_id': '01c060cf466c6ce3', 'coordinates': {'type': 'Point', 'coordinates': [-118.1938, 33.7692]}}
41960210	2020-07-23T03:08:19.000Z	1286136029267730433	  Sis is going out SAD! 	{'place_id': '10de09f288b1665c'}
77845008	2020-07-23T03:07:42.000Z	1286135876196528128	"Like they're gonna make you out to be crazy, troubled or a ""conspiracy"" so why not just go out with a bang!"	{'place_id': '3b77caf94bfc81fe'}
49817709	2020-07-23T02:26:07.000Z	1286125411030536193	Chugged a glass of wine and now I’m gonna go out for a run. What is life?	{'place_id': 'f227fd9a20f20e9d'}
715654283488849926	2020-07-23T02:05:01.000Z	1286120099913506816	😷 DO NOT SIGN ANY COVID-0 SCHOOL DEATH WAIVERS FOR YOUR CHILD TO GO TO SCHOOL. 🛑 If you feel coerced to sign it then sign, “I DO NOT AGREE” on the signature line.🙅🏾‍♀️ 	{'place_id': '3b77caf94bfc81fe'}
21964913	2020-07-23T01:44:39.000Z	1286114975321210881	Thats not going to work 	{'place_id': '3b77caf94bfc81fe'}
433190816	2020-07-23T00:36:17.000Z	1286097771083137025	 Your party wants to send kids back to school without safety measures in place. I'm a teacher, so I could die too. Luckily, after November, your entire party will become an answer in a 'Remember When?' trivia game.	{'place_id': '1af9758d2214d4b8'}
2171061331	2020-07-23T00:25:59.000Z	1286095177401081858	She gets mad a me when I tell her shes number 0. She gets mad at me when I say I'm going out with some other chick. Yet she will bring some dude to my work while shes wearing my hickies all over her neck. Can anyone explain???	{'place_id': '20ba6fb3b1ee82da'}
39865975	2020-07-23T00:15:53.000Z	1286092636252585984	MY G!!!!!! I got a 0.0 GPA my first year back to school after 0 years away. 0 semesters + a FT. 💪🏽💪🏽💪🏽	{'place_id': '3b77caf94bfc81fe'}
28051634	2020-07-23T00:08:02.000Z	1286090662035693571	 Yessssss I love my own company for real. And I like breaks from my husband lol I make him go out with his friends & I’m happy alone 🤣	{'place_id': 'bbdaba1428d18b5c'}
1059610933188734976	2020-07-23T00:04:36.000Z	1286089795005865984	I really don’t wanna go back to school but I have to.	{'place_id': '3b77caf94bfc81fe'}
27968647	2020-07-24T23:41:59.000Z	1286808881188896769	 I'd bet that Conway won't send his daughter back to school, until it's safe to do so.	{'place_id': '206e932cc0e89fa2'}
4851713143	2020-07-24T23:39:09.000Z	1286808167683223555	 THIS !!!! so many people I went to college with( even some roommates) would say this and literally their parents would pay for everything school and all !!! While there are some of us who are actually broke trying to pay for college on our own and feed ourselves	{'place_id': '2feb76248fd9c581'}
28051634	2020-07-24T22:53:31.000Z	1286796682177343488	Need a new job or need to go back to school. I’m just over it. Or a side suga daddy. 😩	{'place_id': '0c2e6999105f8070'}
120930494	2020-07-24T22:46:42.000Z	1286794968913178624	swear i ain’t going out sad	{'place_id': '3b77caf94bfc81fe'}
578622691	2020-07-24T22:29:15.000Z	1286790575119691777	People go out to hang out with friends and act so surprised when their Covid tests come back positive	{'place_id': '3b77caf94bfc81fe'}
15126202	2020-07-24T22:23:22.000Z	1286789094584881152	I can’t grasp the surprise at wanting to send children back to school.As a nation, we crossed the Rubicon in 0, when we decided it was tolerable to murder children. These actions seek to not only tolerate, but codify.Well done, us.	{'place_id': '3b77caf94bfc81fe'}
968579204601208832	2020-07-24T22:10:42.000Z	1286785908490952704	 We learn from our mistakes just like when i wore a vest with no shirt one day to school. That was a mistake	{'place_id': '01c060cf466c6ce3'}
210580181	2020-07-24T21:35:57.000Z	1286777161534156801	" Well you need to go back to school. The information you posted does not prove masks stop viruses.  It proves viruses are not spread in a way a mask would be affective.  The other peer approved article says no evidence exists. Then goes on to sight studies they say ""suggest""."	{'place_id': '3b77caf94bfc81fe'}
210580181	2020-07-24T21:30:09.000Z	1286775704466513921	They just discovered that Corona is spread by farts. So now we are all going to have to wear buttplugs⁰ when we go out in public. So before you can get into the grocery store they will check to make sure you are wearing your buttplug. You all OK with that?	{'place_id': '3b77caf94bfc81fe'}
3234392024	2020-07-24T19:58:01.000Z	1286752518932856832	People do not understand STAY THE FUCK HOME STOP GOING OUT AND WEAR YOUR FUCKEN MASKS	{'place_id': 'c1e1a49e92ce1ba0'}
1410778140	2020-07-24T19:54:39.000Z	1286751672094449666	TBH they were probably learning a long set of biased educational values that have long been refuted or updated. And a good deal of women only went to college to find husbands. Boomers are what they are due to a resistance to change. They’ve never had to to get what they want. 	{'place_id': '0fc6568d145d84ac'}
972865760518275079	2020-07-24T19:36:03.000Z	1286746989342928896	The IE special , niggas be dressing nice but they have no job and don’t go to school w no car 😭😂 but they be flexing hahaha 	{'place_id': 'cf2d9d01f16e9bd4'}
1945108915	2020-07-24T19:19:53.000Z	1286742919303454722	$DKNG look at those bulls go to work	{'place_id': '2fd93ef04260afec'}
842110915428343808	2020-07-24T18:48:16.000Z	1286734963979640833	Y'all need to check out the new Family Dollar store by Art's they got a lot of shit for cheap and every time i go it's empty and I don't want it to go out of business :(	{'place_id': 'c2ad98c80a97adde'}
110734811	2020-07-24T18:10:25.000Z	1286725439826743296	 Half white and half black, lots of curls 😂 write primarily 0-min drama. Won the ISA Fellowship in 0, and a few months later, won the Austin Film Festival. Finalist in ABC/Disney. Repped at 0 Arts. About to go out on the town with a limited series pilot! 🤞🏽🤞🏽🤞🏽	{'place_id': '3b77caf94bfc81fe'}
253466758	2020-07-24T17:52:50.000Z	1286721014907379714	"   You do realize EVERYONE sees what you do right? Like how you wished a known pedofile sex trafficker to ""be well"" during her trial since you two met ""numerous"" times you say. This distraction isn't going to work, especially since you never signed made in America policy into law."	{'place_id': '3b77caf94bfc81fe'}
1216129490583076864	2020-07-24T17:46:41.000Z	1286719464680165377	 to when I was a  for  backpacks. Hey, maybe they can reuse it now for the current bum rush to send kids back to school. “Hey kids! Now with more room! For your survival kit for when you… 	{'coordinates': {'type': 'Point', 'coordinates': [-118.384, 34.0847]}, 'place_id': '1927193c57f35d51'}
3320957466	2020-07-24T17:40:21.000Z	1286717873419739136	Bruh it’s going to feel weird as hell when were actually able to go out normally with no masks and shit.Don’t even know what it feels like to not worry bout a stupid Virus anymore 😂	{'place_id': 'a5655a07276e4caf'}
23264490	2020-07-24T17:15:20.000Z	1286711575408021504	 Why?  The kids he is taking about are not going to school with those of the wealthy he has been ruling for.	{'place_id': '3b77caf94bfc81fe'}
3620624472	2020-07-24T16:39:07.000Z	1286702461961433088	Lmao this the first time I wanted some Jordan’s in a minute but I’m never about to go out my way for these shoes	{'place_id': '3b77caf94bfc81fe'}
59047876	2020-07-24T16:23:10.000Z	1286698449094623232	CDC Director Says He’s ‘0’ Percent On His Grandchildren Going Back To School, Calls It ‘Critical’ To Get Schools Open  via 	{'place_id': '3b77caf94bfc81fe'}
1187852117156851712	2020-07-24T16:13:15.000Z	1286695951046815744	 Mushroom sucker!  You’re sending kids back to school to please Trump! You already have blood on your hands now you want children’s blood on your hands?? WTF is wrong with you!  If you don’t tell the truth you’ll be fired by President Biden!    	{'place_id': '3b77caf94bfc81fe'}
69141567	2020-07-24T16:07:59.000Z	1286694625856466950	these 0 are going out to their new home TODAY 🤍🤍🤍🤍🤍 	{'place_id': '3b77caf94bfc81fe'}
504990810	2020-07-24T15:39:23.000Z	1286687429596856320	That gets a big nope from this parent. You guys just try to force me to send my kids to school like it's normal. I dare you. Ain't happening. 	{'place_id': 'c84cc6061e2af8da'}
1114672817457455105	2020-07-24T15:27:25.000Z	1286684420242513921	I had a fun morning. Was getting ready to go to work in the rocket factory. About to start and I hear a noise from the shower.That’s odd.Open the curtain. Cockroach. Big one. I named him “Little Fucker”	{'place_id': '0c2e6999105f8070'}
2474734177	2020-07-24T15:26:50.000Z	1286684270577082369	 just saw you on  thank you for the real about sending kids back to school!	{'place_id': '3b77caf94bfc81fe'}
2957741635	2020-07-24T15:22:26.000Z	1286683163977084929	Thank you to those of you that joined the conversation! I appreciate you and I learned from you! ❤️🙏🏼 Please do not take offense that I will now delete the previous thread so I can go to work with a new enlightenment & enjoy my day! Wishing you the same !	{'place_id': '3b77caf94bfc81fe'}
908541758849482762	2020-07-24T15:19:36.000Z	1286682452434358272	We can not trust the cdc to tell us how dangerous it realy is to send our children back to school there kissing trumps ass and putting our childrens lives in danger.	{'place_id': 'fcd177d5a0545c9c'}
82177280	2020-07-24T15:12:36.000Z	1286680691774590976	Quarantine morning 0 with banana chocolate chip pancakes, vegan bacon, coffee, Carole King (the kindest voice I ever knew until I started going to school), and the saltwater mist in my little stairwell. 🥞🌊☕️✨ 	{'place_id': '07d9f31c56088003'}
47695096	2020-07-24T15:02:55.000Z	1286678253072084992	*revisits large corp statement* it’s not just go out and make more for a smaller brand lol and two asking a smaller brand to account for their product being inorganically removed from market doesn’t sound smart. 	{'place_id': '97e336e1e3ed9e1e'}
2827689220	2020-07-24T15:02:10.000Z	1286678064605179904	So you sending your kids to school if they reopen for 0/0?	{'place_id': '3b77caf94bfc81fe'}
236164593	2020-07-24T14:52:53.000Z	1286675729338384385	 Lol I was on the plane with like 0 ppl that went to school with us	{'place_id': '3b77caf94bfc81fe'}
28478176	2020-07-24T14:47:58.000Z	1286674489036611586	Abso-f******-lutely! California, please refund my educational money. My kids are healthy and will be fine going to school. Let me find someone who will teach my kids since you won't. 	{'place_id': '20ba6fb3b1ee82da'}
31448934	2020-07-24T14:30:26.000Z	1286670079573110784	Yesterday Trump canceled the RNC in Jacksonville because it’s too risky with COVID-0, but he’s insistent that kids go back to school.	{'place_id': '59612bd882018c51'}
1196270154990022657	2020-07-24T13:48:55.000Z	1286659629884162048	Before I go to work 	{'place_id': '3b77caf94bfc81fe'}
1466425519	2020-07-24T13:45:06.000Z	1286658669245902848	 Barron is a child,  a quiet introvert, who doesn’t like to go out in public that much .  I’m sure there are lots more private photos with him and his dad,  than Trump with Maxwell in public.  Those public photos of the rich hanging out does not mean much.	{'place_id': 'd563cf7307e4ba95'}
26780297	2020-07-24T13:10:03.000Z	1286649847836155904	He claims credit for states that tamped the virus down by ignoring his idiotic ramblings. He cancels an in-person convention because he’s ‘setting an example,’ but he still ‘orders’ America’s children to return to school. Tests ‘create cases.’ And some of you still support this?	{'place_id': '575c6d4e1b73546d'}
1025883473821630465	2020-07-24T11:26:31.000Z	1286623792760942592	When I die, I’m going out as the underdog that never lost hope	{'place_id': '3b77caf94bfc81fe'}
2234760798	2020-07-24T10:36:48.000Z	1286611284029407233	Trump doesn’t give a damn about you or your kids. Here, at the White House, he surrounds himself with children for a photo op with zero masks, zero socially distancing. This is the guy insisting your kids go back to school. 	{'place_id': '3b77caf94bfc81fe'}
1440471522	2020-07-24T07:11:05.000Z	1286559511193346048	wish i didn’t fall in love and went to college right out of hs💀	{'place_id': '3b77caf94bfc81fe'}
1086150706698964993	2020-07-24T06:59:19.000Z	1286556552158035968	 Broo this day I remember I begged my mom I didn’t wanna go to school and when we got there they told us it was canceled 😭	{'place_id': '3b77caf94bfc81fe'}
81759848	2020-07-24T06:08:01.000Z	1286543641335328768	"""We could go to some shady spots, I know some really shady spots."" talking about going out doing nature shit"	{'place_id': '0b93bc6a33455615'}
1354744549	2020-07-24T05:54:58.000Z	1286540357451149314	 But they want our children to go to school but they’re to scared to stay 0 nights in a hotel at the RNC that’s your  republican party everyone! They would dare take a chance on our American children shame on you! 	{'place_id': '3b77caf94bfc81fe'}
2401058924	2020-07-24T05:36:41.000Z	1286535757201412096	" ...and don't forget Eric ""Blackwater"" Prince's sister: Betsy ""Let's force the kids back to school during a pandemic"" DeVos...you can't make this shirt up..."	{'place_id': '3b77caf94bfc81fe'}
708875839283154944	2020-07-24T05:32:47.000Z	1286534773473595392	 My mom when I was late to school	{'place_id': '4d1d90faa5484b1c'}
36529472	2020-07-25T23:39:29.000Z	1287170641150402560	A female employee approached me as though we were old friends, complimented my dress and told us to follow her to make our return. She asked about our day and if we were going out for a nice dinner later...	{'place_id': '3b77caf94bfc81fe'}
1086150706698964993	2020-07-25T23:23:25.000Z	1287166597052772352	 Let’s go out then	{'place_id': '3b77caf94bfc81fe'}
1264748733972885504	2020-07-25T23:00:42.000Z	1287160880547770375	Since riley was a baby if I'm going out & she spending the night at my mamas I still go get her & take her home wit me while I get dressed	{'place_id': '3b77caf94bfc81fe'}
38382011	2020-07-25T22:17:25.000Z	1287149988124880896	Definitely should have went to school to be a therapist bc all my friends think I’m theirs..😳	{'place_id': '3b77caf94bfc81fe'}
2262256675	2020-07-25T22:13:56.000Z	1287149109502021632	My new roommate has kids. I was excited at first because I love kids, but I’ve discovered he’s not much of a mask-wearer, and now I’m thinking about them going back to school and well 😬	{'place_id': '3b77caf94bfc81fe'}
1214063748270317568	2020-07-25T21:35:53.000Z	1287139534057033728	 I wanna go out wit u and cuff u .🥰	{'place_id': '3b77caf94bfc81fe'}
154416309	2020-07-25T21:21:30.000Z	1287135914641121280	Real shit I know too many women that talk so much about independence. If certain people left their life they would be super down and out. They’ll be struggling and won’t even try to work more for the shit. They just want the handouts. Don’t go out like that.	{'place_id': '3b77caf94bfc81fe'}
53758385	2020-07-25T21:17:42.000Z	1287134956448342017	July 0:Me - yo  Ive had ’s records in rotation for some time now. Such a dope artist.  - oh yeah? That’s dope. Also, we’re going out tonight to this spot I think you’ll have a good time 😏😎Of course I find  in the cut haha 	{'place_id': '3b77caf94bfc81fe'}
1493172848	2020-07-25T21:07:20.000Z	1287132349038129152	the girls are telling me to go out with the guy i have a crush on 🥺	{'place_id': '59612bd882018c51'}
762786218073403394	2020-07-25T20:52:05.000Z	1287128511140913152	When you're still high from last night but still gotta go to work 	{'place_id': '3b77caf94bfc81fe'}
15386891	2020-07-25T20:24:31.000Z	1287121576253480960	You were OUT OF CONTROL down here, Now go OUT OF CONTROL up in the sky Regis. RIP  	{'place_id': '3b77caf94bfc81fe'}
116972959	2020-07-25T20:20:46.000Z	1287120631826386945	How long before CDs and DVDs go out of production like VHS?	{'place_id': '3b77caf94bfc81fe'}
794693886	2020-07-25T20:03:27.000Z	1287116274313515009	I’m still in awe that people’s parents let them drink before they went to college or turn 0 like tf... 	{'place_id': 'efdc0bd6b3e2a8fb'}
553937182	2020-07-25T20:03:16.000Z	1287116225516933121	God bless you T. Prayers going out to you and your family. Get healthy bro the we need you. Still lots of work to be done 🙏🏾 	{'place_id': '3b77caf94bfc81fe'}
2258422687	2020-07-25T19:37:28.000Z	1287109732868620288	Finnick did NOT deserve to go out like that 	{'place_id': '0c2e6999105f8070'}
189379034	2020-07-25T19:34:44.000Z	1287109045082640386	My Uber Driver yesterday. Out of nowhere started singing Nora Nora la exploradora. Jajaja Cause  order me a. Uber to go to work. If you know you know. Backpack backpack. Lmao @… 	{'place_id': '3b77caf94bfc81fe', 'coordinates': {'type': 'Point', 'coordinates': [-118.24059, 33.939839]}}
813483229642506241	2020-07-25T19:34:02.000Z	1287108868422565889	Everybody crying about Halloween being canceled but some of these people don’t know how to go out in their mask lol	{'place_id': '3b77caf94bfc81fe'}
786269086573395968	2020-07-25T19:30:02.000Z	1287107861093335040	 That’s really cool. Do you go out there often?	{'place_id': '70707114a9202b98'}
22780275	2020-07-25T19:06:23.000Z	1287101911783444480	Citadel back to school sales signs now say back to zoom back to style back to fun instead of back to school 😂	{'place_id': 'be347aa731d4353b'}
955661809280692224	2020-07-25T19:02:45.000Z	1287100997785939969	If anyone ever needs any skin care advice my dms are always open i went to school for this pls i miss it	{'place_id': '0c2e6999105f8070'}
1027394208	2020-07-25T18:51:38.000Z	1287098199669268480	   Interesting. I think that he’s handled the pandemic terribly with the exception of the stimuli. I am single dad with 0 kids. There’s been absolutely no national plan to address going back to school. I get it comes down to the states but there’s been no guidance.	{'place_id': '741e9df4d2522275'}
23564725	2020-07-25T18:36:01.000Z	1287094270415867905	 It’s not even noon time and Luke is just getting active !!!!!!!! His Mom couldn’t wake him up to go out this morning per apparently I have to go too  & was out running errands. 	{'place_id': '3b77caf94bfc81fe'}
813475385555886080	2020-07-25T17:52:34.000Z	1287083334644805632	Seee I witnessed sum shit like dis at school b0 and been traumatized ever since 😭😭 that's why u always do shit in private just in case u go out sad 😭😂 	{'place_id': '3b77caf94bfc81fe'}
189048721	2020-07-25T17:23:20.000Z	1287075978359971840	 Like???? She gone put go to work first… lmaooo	{'place_id': '3b77caf94bfc81fe'}
47361730	2020-07-25T17:16:47.000Z	1287074331546103808	 Lol yes friend that’s good!! I need to stop going to work n stay home haha	{'place_id': 'cf2d9d01f16e9bd4'}
624223996	2020-07-25T17:15:06.000Z	1287073906050785282	You’re a better artist intrinsically if you’re not a hateful shithead! Go out and create knowing this!	{'place_id': '3b77caf94bfc81fe'}
109360451	2020-07-25T16:22:06.000Z	1287060567740432386	😭 I tried to go out with Kyra last night, but I was too tired from slavery. So, we gone try again tonight. I’m ready, today ☝🏾	{'place_id': '3b77caf94bfc81fe'}
1053858465121103873	2020-07-25T16:19:32.000Z	1287059924141268992	if you guys don’t wear mask, go out with friends, try to throw parties or anything like that just know you guys are stupid🥰	{'place_id': '3b77caf94bfc81fe'}
1183447392	2020-07-25T15:03:38.000Z	1287040819661176833	A nigga making all that money and not spending none on their girl, but spending it on hella nights going out doesn’t deserve to be in a relationship.simple	{'place_id': '3b77caf94bfc81fe'}
28051634	2020-07-25T14:24:22.000Z	1287030939772571649	Ah yes, nothing like going to work on your day off... 	{'place_id': 'bbdaba1428d18b5c'}
27295545	2020-07-25T14:19:52.000Z	1287029807125913605	 Ha!  I’m about to go out and get it done!  Have a great day 💪🏻	{'place_id': 'a077793faceeda6f'}
251820493	2020-07-25T13:50:19.000Z	1287022371820322816	Come to Pomona’s Community Resource Center for Back to school supplies.     @ Pomona, California 	{'place_id': '6f24e28976abe656', 'coordinates': {'type': 'Point', 'coordinates': [-117.750158, 34.057766]}}
138395262	2020-07-25T13:46:31.000Z	1287021413153398784	Trump is a sicko broke kid go to school rich kids home school smart idea trump 	{'place_id': '3b77caf94bfc81fe'}
985995886042861568	2020-07-25T12:54:22.000Z	1287008292229660673	The amount of people on my other social media's going out without masks is making me explode. We're never getting US tournaments back...	{'place_id': '3b77caf94bfc81fe'}
2941052208	2020-07-25T12:51:38.000Z	1287007603512418304	Damn i don’t feel like going to work	{'place_id': '3b77caf94bfc81fe'}
1008142038	2020-07-25T11:17:51.000Z	1286984000863531008	& i get the fucking worst of their fucking bs because belligerent ass ppl go out to the balcony that’s RIGHT FUCKING NEXT TO MY WINDOW & fucking yell. I’m so fucking over this shit.	{'place_id': '3b77caf94bfc81fe'}
