938935084911955968	2020-03-19T21:29:02.000Z	1240752163401449474	Hello SCU Alums! Did you know you can visit  for official updates on COVID-0? Stay safe!     @ Whittier, California 	{'coordinates': {'type': 'Point', 'coordinates': [-118.03407, 33.97542]}, 'place_id': 'f8f8ee516109ee0e'}
959116206	2020-03-19T21:23:16.000Z	1240750713862381568	It’s been two weeks since I last saw my parents &as much as I would love to visit em I don’t want to risk getting em sick even though I feel healthy. This virus isn’t allowing me to hug my parents 😭 chinga tu madre pinche  	{'place_id': '3b77caf94bfc81fe'}
1390712454	2020-03-19T21:23:14.000Z	1240750705037590529	we have a do not travel.. but i can't get a refund on my plane tickets 🙃	{'place_id': '3b77caf94bfc81fe'}
3920852773	2020-03-19T21:11:34.000Z	1240747766026063875	Visit my store Playdays Collectibles and check out my inventory at 0 penn street, whittier CA 0.0-0:0pm. On Thursdays we close at 0pm. Open 0 days a week. Thank you for your business and support. Don’t… 	{'coordinates': {'type': 'Point', 'coordinates': [-118.0458, 33.97498]}, 'place_id': 'f8f8ee516109ee0e'}
3920852773	2020-03-19T21:11:15.000Z	1240747689375158272	Visit my store Playdays Collectibles and check out my inventory at 0 penn street, whittier CA 0.0-0:0pm. On Thursdays we close at 0pm. Open 0 days a week. Thank you for your business and support. Don’t… 	{'coordinates': {'type': 'Point', 'coordinates': [-118.0458, 33.97498]}, 'place_id': 'f8f8ee516109ee0e'}
3920852773	2020-03-19T21:10:39.000Z	1240747536324984834	Visit my store Playdays Collectibles and check out my inventory at 0 penn street, whittier CA 0.0-0:0pm. On Thursdays we close at 0pm. Open 0 days a week. Thank you for your business and support. Don’t… 	{'coordinates': {'type': 'Point', 'coordinates': [-118.0458, 33.97498]}, 'place_id': 'f8f8ee516109ee0e'}
3920852773	2020-03-19T21:10:13.000Z	1240747429311340545	Visit my store Playdays Collectibles and check out my inventory at 0 penn street, whittier CA 0.0-0:0pm. On Thursdays we close at 0pm. Open 0 days a week. Thank you for your business and support. Don’t… 	{'coordinates': {'type': 'Point', 'coordinates': [-118.0458, 33.97498]}, 'place_id': 'f8f8ee516109ee0e'}
3920852773	2020-03-19T21:09:36.000Z	1240747271500767232	Visit my store Playdays Collectibles and check out my inventory at 0 penn street, whittier CA 0.0-0:0pm. On Thursdays we close at 0pm. Open 0 days a week. Thank you for your business and support. Don’t… 	{'coordinates': {'type': 'Point', 'coordinates': [-118.0458, 33.97498]}, 'place_id': 'f8f8ee516109ee0e'}
3920852773	2020-03-19T21:09:09.000Z	1240747160603430915	Visit my store Playdays Collectibles and check out my inventory at 0 penn street, whittier CA 0.0-0:0pm. On Thursdays we close at 0pm. Open 0 days a week. Thank you for your business and support. Don’t… 	{'coordinates': {'type': 'Point', 'coordinates': [-118.0458, 33.97498]}, 'place_id': 'f8f8ee516109ee0e'}
3920852773	2020-03-19T21:08:35.000Z	1240747018735087616	Visit my store Playdays Collectibles and check out my inventory at 0 penn street, whittier CA 0.0-0:0pm. On Thursdays we close at 0pm. Open 0 days a week. Thank you for your business and support. Don’t… 	{'coordinates': {'type': 'Point', 'coordinates': [-118.0458, 33.97498]}, 'place_id': 'f8f8ee516109ee0e'}
15011833	2020-03-19T21:08:33.000Z	1240747010094854145	Wedding anniversary is a week away and we can’t go to a fancy restaurant or even travel. Any ideas? Send them my way.	{'place_id': '01c060cf466c6ce3'}
3920852773	2020-03-19T21:07:33.000Z	1240746756117233676	Visit my store Playdays Collectibles and check out my inventory at 0 penn street, whittier CA 0.0-0:0pm. On Thursdays we close at 0pm. Open 0 days a week. Thank you for your business and support. Don’t… 	{'coordinates': {'type': 'Point', 'coordinates': [-118.0458, 33.97498]}, 'place_id': 'f8f8ee516109ee0e'}
3920852773	2020-03-19T21:06:54.000Z	1240746594204635143	Visit my store Playdays Collectibles and check out my inventory at 0 penn street, whittier CA 0.0-0:0pm. On Thursdays we close at 0pm. Open 0 days a week. Thank you for your business and support. Don’t… 	{'coordinates': {'type': 'Point', 'coordinates': [-118.0458, 33.97498]}, 'place_id': 'f8f8ee516109ee0e'}
3920852773	2020-03-19T21:06:16.000Z	1240746433290162178	Visit my store Playdays Collectibles and check out my inventory at 0 penn street, whittier CA 0.0-0:0pm. On Thursdays we close at 0pm. Open 0 days a week. Thank you for your business and support. Don’t… 	{'coordinates': {'type': 'Point', 'coordinates': [-118.0458, 33.97498]}, 'place_id': 'f8f8ee516109ee0e'}
3920852773	2020-03-19T21:05:52.000Z	1240746335252492292	Visit my store Playdays Collectibles and check out my inventory at 0 penn street, whittier CA 0.0-0:0pm. On Thursdays we close at 0pm. Open 0 days a week. Thank you for your business and support. Don’t… 	{'coordinates': {'type': 'Point', 'coordinates': [-118.0458, 33.97498]}, 'place_id': 'f8f8ee516109ee0e'}
3920852773	2020-03-19T21:05:15.000Z	1240746177080877062	Visit my store Playdays Collectibles and check out my inventory at 0 penn street, whittier CA 0.0-0:0pm. On Thursdays we close at 0pm. Open 0 days a week. Thank you for your business and support. Don’t… 	{'coordinates': {'type': 'Point', 'coordinates': [-118.0458, 33.97498]}, 'place_id': 'f8f8ee516109ee0e'}
1213944590123716609	2020-03-19T20:59:53.000Z	1240744826036838400	Ugh travel ban.....Can’t travel outside California. All of my long term dream guest star roles are on tv shows, and parts in movies being considered and or in prepro all film outside of California. 	{'place_id': '3b77caf94bfc81fe'}
21235818	2020-03-19T20:50:16.000Z	1240742408460984321	 a bootcamp visit Ft. Dix NJ @ Woodland Hills, California 	{'coordinates': {'type': 'Point', 'coordinates': [-118.611, 34.1689]}, 'place_id': '3b77caf94bfc81fe'}
375553768	2020-03-19T20:48:45.000Z	1240742025881956352	California 0 🇺🇲 Sixth stop: Venice Beach 🚣 ....             … 	{'coordinates': {'type': 'Point', 'coordinates': [-118.24209778, 34.05308364]}, 'place_id': '3b77caf94bfc81fe'}
30543716	2020-03-19T20:43:29.000Z	1240740699558928385	 What about travel to Hawaii? I leave today	{'place_id': '3b77caf94bfc81fe'}
4880363587	2020-03-19T20:39:01.000Z	1240739577658142720	 Might have to travel to South Korea to get one, this administration has screwed the pooch on this.	{'place_id': 'c1e1a49e92ce1ba0'}
225176527	2020-03-19T20:17:29.000Z	1240734157283553280	 Barely?!?! Might as well ban international travel.	{'place_id': '3b77caf94bfc81fe'}
38601520	2020-03-19T20:06:40.000Z	1240731434194780163	Answering your questions: BEAUTY.Linking things in stories, so stop by there..My approach is to give the skin what it needs and what it likes. So, what I do changes at times, depending on if I travel, work on… 	{'coordinates': {'type': 'Point', 'coordinates': [-118.40033, 34.07347]}, 'place_id': '741e9df4d2522275'}
16382769	2020-03-19T19:55:08.000Z	1240728530905784321	I replaced all my in-person socializing with vicarious travel in  and soon virtual mingling in  to fight COVID-0. Join me in taking the pledge and social distancing immediately 🙌🙌  	{'place_id': '59612bd882018c51'}
3073441070	2020-03-19T19:54:28.000Z	1240728363108569092	My current travel plans! Be safe everybody! 🕺🏾🕺🏾🕺🏾🙏🏽🙏🏽🙏🏽 	{'place_id': 'a75bc1fb166cd594'}
57805365	2020-03-19T19:33:33.000Z	1240723100926271488	 For more information visit the official website  or contact the office at info	{'place_id': '38bf3f5b8e273118'}
23038788	2020-03-19T19:31:12.000Z	1240722508648599552	  It’s not an instant refund. It’ll take 0-0+ days. Also, some CC’s have travel insurance as a perk.	{'place_id': '20ba6fb3b1ee82da'}
1203705388685615104	2020-03-19T19:31:03.000Z	1240722473185734656	 😂😂😂😂😂remind me to never come visit where you live! Ahaha but, I understand why. It’s getting crazy out here throughout the globe! 	{'place_id': '3b77caf94bfc81fe'}
338766166	2020-03-19T19:28:23.000Z	1240721802365562881	S.A.F Boutique will be close until further notice , please visit or call for any items desire thank you 😊 and wash your hand 🖐 	{'place_id': '3b77caf94bfc81fe'}
23850184	2020-03-19T19:22:49.000Z	1240720397961547776	"      Probably more so in volleyball. Fewer clubs.The ""all in one place"" aspect is the key. In basketball/baseball some travel teams are really bad and I'd rather see HS teams.If there were tournaments set up in the same manner for multiple HS teams it would attract college coaches too"	{'place_id': 'bcd6f5a92e969e33'}
16716641	2020-03-19T19:22:22.000Z	1240720285499711488	Virtually travel to the bayous of East Texas (did you even know Texas had a bayou?) with this post from  	{'place_id': '3b77caf94bfc81fe'}
633374497	2020-03-19T19:21:06.000Z	1240719968397713408	Beautiful day after rainy days ...•              … 	{'coordinates': {'type': 'Point', 'coordinates': [-118.52679, 34.04709]}, 'place_id': '3b77caf94bfc81fe'}
14143601	2020-03-19T19:05:42.000Z	1240716093959725056	Visit my local eateries. 	{'place_id': '3b77caf94bfc81fe'}
850126139699847169	2020-03-19T19:00:59.000Z	1240714907584094208	 A ton of weeds, villagers forget about you or they ask why you dont talk to them. They could leave. And some online events will still be locked no matter how long you time travel.	{'place_id': 'e04653ebc39b100c'}
275578472	2020-03-19T18:52:17.000Z	1240712716991389696	Travel Advisory: Threat Level 0 on Balcony - Avoid at all costs 	{'place_id': '3b77caf94bfc81fe'}
24002908	2020-03-19T18:45:12.000Z	1240710933397139456	 thank you for the visit.         @ Tarzana, California 	{'coordinates': {'type': 'Point', 'coordinates': [-118.5501, 34.17529]}, 'place_id': '3b77caf94bfc81fe'}
36298373	2020-03-19T18:31:41.000Z	1240707533674704898	Visit our YouTube channel to catch this weeks VIP video, dropping today at 0pm ET w/ 💎🧊💎🧊WATCH HERE:  	{'place_id': '3b77caf94bfc81fe'}
2938849242	2020-03-19T18:24:52.000Z	1240705817390669830	If I see one more person travel to different state for their leisure I’m gonna fight them.	{'place_id': '20ba6fb3b1ee82da'}
585391355	2020-03-19T18:24:10.000Z	1240705639900254208	  Hahaha what is this even a video for though? A travel agency?	{'place_id': '3b77caf94bfc81fe'}
17895234	2020-03-19T18:22:47.000Z	1240705291710115842	Vet visit in the pandemic era. Wait in car and talk to vet on phone. Smart. Careful. Rain does not help. @ Silver Lake, Los Angeles 	{'coordinates': {'type': 'Point', 'coordinates': [-118.2675, 34.09444444]}, 'place_id': '3b77caf94bfc81fe'}
21815783	2020-03-19T18:18:58.000Z	1240704331914956800	After watching this excellent video I asked myself, when did I stop buying Irish Spring & Ivory bar soap & start using liquid shower gel?  Had to search my travel bags for hotel guest soaps!! Also hungry  for carbs… 	{'coordinates': {'type': 'Point', 'coordinates': [-118.52679, 34.04709]}, 'place_id': '3b77caf94bfc81fe'}
170417924	2020-03-19T18:13:20.000Z	1240702913665622016	 Let them stay in the hospital and visit patients who are in isolation and struggling to live every day!	{'place_id': 'eb1bb64775708bc1'}
946928034	2020-03-19T18:05:54.000Z	1240701042985013250	" says that stranded Americans ""waited too long"" to travel home from foreign countries. He must blame someone else for everything! "	{'place_id': '01c060cf466c6ce3'}
110881215	2020-03-19T18:04:49.000Z	1240700772280438785	  Lemme quickly fly to michigan again and go to a pc or ps0 for online lol	{'place_id': '3e5f2219d3106113'}
177226313	2020-03-19T18:04:14.000Z	1240700622988390400	Share some love at this difficult time and support small businesses! Maybe purchase some cards and send some snail mail to friends in need of cheering up! Visit  to find some amazing artists to support!   	{'place_id': '0fc349d50094f000'}
423795798	2020-03-19T18:01:56.000Z	1240700046145773569	Visit our teaching faculty bargaining blog at  and learn how you can get involved in our campaign for  and         	{'place_id': '3b77caf94bfc81fe'}
1167159309668503553	2020-03-19T17:47:18.000Z	1240696361407803392	Given our high call volume in the midst of  patients are also encouraged to visit our Facebook page where I put regular updates and resource links.  You can also ask questions which I will answer.	{'place_id': '59612bd882018c51'}
1220897281517477889	2020-03-19T17:45:41.000Z	1240695956888158209	Rain drops ☔️     	{'place_id': '3b77caf94bfc81fe'}
804860145159180288	2020-03-19T17:36:53.000Z	1240693742597636096	If you LOVE cars like me the  is doing $0 livestream vault tours throughout the day. Enjoy some awesome automobiles like this classic Toyota and more! Visit their insta for more info. ❤️🏎… 	{'coordinates': {'type': 'Point', 'coordinates': [-118.3612898, 34.06224131]}, 'place_id': '3b77caf94bfc81fe'}
27693951	2020-03-19T17:25:52.000Z	1240690969835520001	We're west coast bound everyone! Issue  + are now available for purchase and ship on demand at  in Los Angeles California! If you're in the LA area visit this amazing store! Thank you so much! 	{'place_id': '3b77caf94bfc81fe'}
580467523	2020-03-19T17:11:00.000Z	1240687226666643456	The one to fly .. I could probably fly to my mans 😭😭 	{'place_id': '01c060cf466c6ce3'}
850126139699847169	2020-03-19T17:05:31.000Z	1240685848892329986	 Was going to visit but since the  I did not want to risk the students or staff. Ill visit when this all blows over.	{'place_id': 'e04653ebc39b100c'}
116616596	2020-03-19T16:01:32.000Z	1240669747173158916	Please visit our new webpage  for the latest updates, important resources, and a local business guide!	{'place_id': '3b77caf94bfc81fe'}
223716586	2020-03-19T15:46:55.000Z	1240666067124375552	 Come visit meeeeee !!!!	{'place_id': '3b77caf94bfc81fe'}
32260592	2020-03-19T15:43:01.000Z	1240665086441619457	everyyytime my sister and I go visit, dad gotta get a picture to post 😩😭 big dad energy 😍💕 	{'place_id': '3b77caf94bfc81fe'}
1211874589451571200	2020-03-19T15:35:57.000Z	1240663307133939712	Visit my website  You will find a lot of information @ Barnes & Noble Events, The Grove 	{'coordinates': {'type': 'Point', 'coordinates': [-118.35833086, 34.07189172]}, 'place_id': '3b77caf94bfc81fe'}
544850084	2020-03-19T15:35:50.000Z	1240663276301639680	Cruises are, and always will be, the Florida Man of travel.	{'place_id': '20ba6fb3b1ee82da'}
3271524948	2020-03-19T15:34:45.000Z	1240663005001474050	 It sounds like you’re due for a visit then 😊	{'place_id': '3b77caf94bfc81fe'}
23850184	2020-03-19T15:26:45.000Z	1240660990561112064	     The wiser thing would be to extend the season as far into summer as necessary. There is no real good reason not to. Schools have summer school, kids are playing anyway. So unless you want to argue travel is more important than HS that's moot too. I'm still not buying that	{'place_id': 'bcd6f5a92e969e33'}
31676696	2020-03-19T15:22:34.000Z	1240659938851950592	Spring begins today -- the earliest it's been in more than a century	{'place_id': 'fdb4ee1440650043'}
16716641	2020-03-19T15:20:36.000Z	1240659445614444552	An armchair travel thread for this time of quarantine - when it’s imperative we stay home to help stop the spread of ー0 - have a great photo essay you want people to see? Send me the link! 	{'place_id': '3b77caf94bfc81fe'}
16716641	2020-03-19T15:08:48.000Z	1240656472725323776	Virtually travel to Ireland with this post from  	{'place_id': '3b77caf94bfc81fe'}
101367405	2020-03-19T15:05:04.000Z	1240655536456171521	My Nikkaz We Be Ball & We Lit & We Big Tipping All Of The Strippers 😜 😛 💴 (song lyrics) “Lit Up” Out Now ! Visit  to view full video @ Click Link in Bio 	{'coordinates': {'type': 'Point', 'coordinates': [-118.41281, 34.15078]}, 'place_id': '3b77caf94bfc81fe'}
2163744890	2020-03-19T14:53:27.000Z	1240652611440672769	Quarantine day 0? (Also I haven’t been quarantined I get to go to work) and I’m sobbing at a news story of a family celebrating their 0 yr old grandmas bday through a window at a nursing home bc they can’t visit bc of covid 😭😭😭😭😭😭😭😭😭😭😭😭😭	{'place_id': '01c060cf466c6ce3'}
22202816	2020-03-19T14:50:53.000Z	1240651965949861889	Time travel may have happened and produced better timelines than this one and we're just stuck in one that everyone who could abandon, did. I mean... I would if I could! 	{'place_id': '3b77caf94bfc81fe'}
3338331314	2020-03-19T14:32:18.000Z	1240647289258954752	Good morning  and welcome to the  Earliest arrival of Spring in more than a century  via 	{'place_id': '3b77caf94bfc81fe'}
2270628523	2020-03-19T13:36:14.000Z	1240633177426653184	"United States: ""We ain't got a barrel of money,  maybe we're ragged and funny,  but,  will travel along singing our song,  side by side?"	{'place_id': '59105f0e84773bdd'}
17180678	2020-03-19T13:08:13.000Z	1240626129204998144	 There are visiting exceptions for end of life. Be persistent and demand you get to visit your father. Do that today!	{'place_id': '01c060cf466c6ce3'}
108961386	2020-03-19T12:37:24.000Z	1240618373542637568	This was always my biggest fear when I used to visit my family in Zambia by road. 	{'place_id': '3b77caf94bfc81fe'}
26190492	2020-03-19T10:46:33.000Z	1240590477835018240	Visit at Extractor Depot, the Home Depot of extraction companies in cannabis industry. Besides being a very exciting meeting, it was the perfect thing to do during the biggest Pandemic in centuries...... I found… 	{'coordinates': {'type': 'Point', 'coordinates': [-118.115, 34.0144]}, 'place_id': '2da132a7bfebfc0c'}
24700460	2020-03-19T07:23:45.000Z	1240539441631858688	Now, I think of those friends who I spent hours with, laughing, learning who I was, and becoming the person that my partner fell in love with. I cry, because when we go to our hometown to visit family, they don't want to see me. (0/*)	{'place_id': '3b77caf94bfc81fe'}
1201877612563439616	2020-03-19T07:04:20.000Z	1240534555632828418	Every time I look at the Eiffel Tower, it completely blows my mind.           … 	{'coordinates': {'type': 'Point', 'coordinates': [-118.3032652, 34.18663973]}, 'place_id': 'b0b79caecef59fb5'}
99426660	2020-03-19T06:42:28.000Z	1240529050008842250	OAHU Grand Circle Island Day Tour (Part 0) | Hawaii Travel Vlog  via 	{'place_id': 'a5655a07276e4caf'}
883349476785741824	2020-03-19T06:37:35.000Z	1240527824219324421	0 hours of travel still got another 0 to go I’m about to start seeing sounds	{'place_id': '3b77caf94bfc81fe'}
629841578	2020-03-19T05:59:26.000Z	1240518222136266755	 I have been trying to reach the travel rewards line for 0 days.  Your main credit card department is unable to transfer the call.  How do I cancel my booking for a las vegas hotel this weekend?	{'place_id': '5e68ca240e32025a'}
497500374	2020-03-19T05:47:05.000Z	1240515114152759299	 Wtf you’re not working and you didn’t even tell me so I can go visit ??!	{'place_id': '56909099a1d44057'}
20696181	2020-03-19T05:29:09.000Z	1240510601530613760	Just posted a photo @ Travel Town Museum Foundation 	{'coordinates': {'type': 'Point', 'coordinates': [-118.30765033, 34.15445363]}, 'place_id': '3b77caf94bfc81fe'}
704867591303483392	2020-03-19T05:17:35.000Z	1240507688133353474	If you ever wanted to come visit LA, now is the best time. Cheap hotels. Cheap flights. No traffic on the road.	{'place_id': 'bcd6f5a92e969e33'}
29351945	2020-03-19T05:08:23.000Z	1240505375796768768	Before  My ⁦⁦⁩ visit  Fashion to break old style of talking about  and give  place in Space,Space Economy for all,human potential.Flying forward, post Corona  Space  also matters. Let’s be better on  	{'place_id': '3b77caf94bfc81fe'}
92359562	2020-03-19T05:04:25.000Z	1240504374956150784	I’m tryna come visit 🌚 	{'place_id': '97e336e1e3ed9e1e'}
968388592589455360	2020-03-19T04:32:04.000Z	1240496234739032065	 What about travel agents..We are being affected just as much	{'place_id': '6f24e28976abe656'}
14141281	2020-03-19T04:06:19.000Z	1240489754073763842	 I wish! No, holed up at home in L.A. But as soon as plane travel is up and running again, I'm getting tickets to ... Dublin or Rome (or both!).	{'place_id': '3b77caf94bfc81fe'}
1666689163	2020-03-19T03:51:32.000Z	1240486036783820801	Now is a great time to enjoy the outdoors!	{'place_id': '3b77caf94bfc81fe'}
2669629842	2020-03-19T03:50:46.000Z	1240485839953489927	PSA: during these tough times where traveling is very restricted, I would like to say that I miss my travel buddy 	{'place_id': '3b77caf94bfc81fe'}
2749585928	2020-03-19T03:45:09.000Z	1240484430382116864	It may not fight  but Vitamin C is still important.••                	{'place_id': 'e9b2c8beb5442ec5'}
22028259	2020-03-19T03:36:05.000Z	1240482146713649153	Upbeat and really hoping to rediscover the Silly/goody/dork inside and to visit the same places I go with a renewed sense of wonder, then lockdowns happened.  A master at unintentionally isolating, I find I am not given much of a choice now, But..!	{'place_id': 'ef74afb7ccba74d6'}
1663295839	2020-03-19T03:34:41.000Z	1240481793507127296	my mom & I were supposed to fly to nashville tomorrow and now im just straight up DEPRESSED bc instead ill be on my couch sober not surrounded by cute men smh	{'place_id': '2feb76248fd9c581'}
19101889	2020-03-19T03:34:11.000Z	1240481666813939719	We are still moving forward with our  project for  Visit us on the web at  and sign up for our email list. Don’t worry, we won’t spam you. Unless you like that 😘🤪 	{'place_id': '3b77caf94bfc81fe'}
633374497	2020-03-19T03:20:22.000Z	1240478190361026560	A peaceful evening..•                  … 	{'coordinates': {'type': 'Point', 'coordinates': [-118.1676, 33.8044]}, 'place_id': '97290292acb29ff8'}
30287813	2020-03-19T03:17:53.000Z	1240477566948929539	Serving the Downtown Long Beach community is DLBAs top priority. We are working to provide resources and services to our businesses and residents and encourage you to visit and share our new webpage for COVID-0 updates and information:  	{'place_id': '01c060cf466c6ce3'}
49443	2020-03-19T03:00:18.000Z	1240473139605164032	 i recommend California enact a Florida travel ban.	{'place_id': '3b77caf94bfc81fe'}
464241063	2020-03-19T02:45:17.000Z	1240469360940142598	 • • • • • •I’ve loved food and travel for as long as I can remember, so being able to produce content about it is certainly a dream come true! I was always a creative little girl, but I really… 	{'coordinates': {'type': 'Point', 'coordinates': [-118.33937063, 34.09216004]}, 'place_id': '3b77caf94bfc81fe'}
16730860	2020-03-19T02:30:25.000Z	1240465619197165568	 when this all shakes out someday you will come back to Los Angeles and write the best Los Angeles-in-Covid-0-Recovery-Mode travel piece ever.	{'place_id': '3b77caf94bfc81fe'}
789600358439931904	2020-03-19T02:27:01.000Z	1240464766230921216	Want to read the candidate platforms? Visit ⁠ 🎁 If you vote/d check out our Instagram post for details on an opportunity drawing for 0️⃣Apple Airpods, 0️⃣ Nintendo Switch, or 0️⃣$0 Gift cards!  	{'place_id': '01c060cf466c6ce3'}
3920852773	2020-03-19T02:24:18.000Z	1240464081737461763	Yes we are open until further notice👍🚙💯👏😎. We got your Hotwheels fix 🚗. Visit my store Playdays Collectibles and check out my inventory at 0 penn street, whittier CA 0.0-0:0pm. On Thursdays we close at 0pm.… 	{'coordinates': {'type': 'Point', 'coordinates': [-118.0458, 33.97498]}, 'place_id': 'f8f8ee516109ee0e'}
16716641	2020-03-19T02:09:58.000Z	1240460473767583745	Virtually travel to DC’s cherry blossoms with this post from Julie and Charles: 	{'place_id': '3b77caf94bfc81fe'}
824780606	2020-03-19T02:07:43.000Z	1240459906831896576	Go get the corona virus and then go visit your grandma/grandpa. Selfish assholes. 	{'place_id': '3b77caf94bfc81fe'}
927075651621761024	2020-03-19T02:06:12.000Z	1240459526320484352	Travel 	{'place_id': '174309ec90de94d0'}
1079298172948668416	2020-03-19T01:57:47.000Z	1240457410688339969	This girl just told me “call me when you’re downstairs I need to go to superior”... my nigga I’m not coming to visit my grandmother! No!	{'place_id': '3b77caf94bfc81fe'}
28427989	2020-03-19T01:27:54.000Z	1240449889034633217	Ima keep it 0 now that I’m home: ya corona virus omg don’t travel or whatever mad annoying. My anxiety was off the roof in the UK because everyone and their mother kept reaching out to me through something they saw in the news. Stop letting media control you guys.	{'place_id': '3b77caf94bfc81fe'}
380046307	2020-03-19T01:04:28.000Z	1240443992946311168	Hey, back when we could aspire to travel, be road comics!!!     . 	{'place_id': '3b77caf94bfc81fe'}
3772676234	2020-03-19T00:42:13.000Z	1240438392866799617	 Can’t fly anywhere anyways, DOD travel ban. I already gotta cancel a bunch of tickets too. Sucks	{'place_id': '0706a21788cadb8d'}
24073793	2020-03-19T00:39:33.000Z	1240437719198650368	I’m at the part where my kids are pissed they can’t go into stores or visit with friends. What chapter are you on? 😷🦠☹️ 	{'place_id': '3b77caf94bfc81fe'}
20353156	2020-03-19T00:36:07.000Z	1240436857361448960	We encourage you to sign up for NotifyLA. This platform will allow you to receive all urgent notifications about local emergencies by phone, email, and/or text message. Subscribe to alerts for your neighborhood, schools, businesses and media Visit  	{'place_id': '3b77caf94bfc81fe'}
25184732	2020-03-19T00:29:04.000Z	1240435082839486464	Invitations to respond to the  are in the mail! The mailing will include instructions on how to respond online, by phone or by mail. Ready to mark the census off your list today? ✅ Just visit  & use your address to get started. It takes 0mins! 	{'place_id': 'fdb4ee1440650043'}
