2020-07-11T15:46:06.000Z	1281978078508523520	It should ALWAYS be about common sense, common purpose, cooperation n compromise to the benefit of the majority while causing as little injury (of all kinds) to the minority.  Not loyalty to a party but instead to the People and the Union. 	{'place_id': '53c4c0f31bd9e72b'}
2020-07-11T15:35:24.000Z	1281975386948145152	So ya not gonna eat out at Spanish spots no more cause they support Goya? Ya not eating moms cooking no more ? Grandmas cooking? No more patecons? No more el valle? No more pr & dr parade ? EVERY RESTAURANT IN THE HEIGHTS USE GOYA. Ya staying away from DYKEMEN ? YEAH OK!	{'place_id': '01a9a39529b27f36'}
2020-07-11T15:16:10.000Z	1281970546817798145	i know  and my mom already got my whole wedding planned (both trad and white), but the one place i draw the line is my wedding dress. i have been watching Say Yes to the Dress for too long.	{'place_id': 'fa3435044b52ecc7'}
2020-07-11T15:06:06.000Z	1281968010597736448	    0 0 0 Action Limousine inc @ Cranford, New Jersey 	{'place_id': 'de7b13455f6b23f3', 'coordinates': {'type': 'Point', 'coordinates': [-74.3017, 40.6575]}}
2020-07-11T14:10:15.000Z	1281953958517407744	Attending my first streamed wedding tonight. Excited to not be wearing heels or standing outside in July. Yes yes, also excited to celebrate love! 💕	{'place_id': '011add077f4d2da3'}
2020-07-11T13:59:44.000Z	1281951309097246720	 Was at a FABULOUS gay wedding of 0 of my nearest & dearest in Manhattan (I’m straight) & was recently single, I strike up a convo with a lovely woman & we end up dancing all night & I think I’m impressing her. Rumer Willis. Who just won DWTS🤷🏻‍♀️😳😂 She was so sweet to me.	{'place_id': '00c39537733fa112'}
2020-07-11T12:43:46.000Z	1281932192336289798	   Another shit wedding (Ciara/Ben) right around the corner.	{'place_id': '876ed0bcf9594134'}
2020-07-11T12:16:29.000Z	1281925326734581760	 With folks ordering in/taking out, one tip I can offer is to NOT eat out of restaurant containers. Put take out food on regular plates, as if you made the meal at home.  Eating out of  paper/ plastic cartons is less mindful.	{'place_id': '01489e6d380fb511'}
2020-07-11T11:37:47.000Z	1281915585367093249	 I used to buy something every time I went to the mall 😍 and I wasn’t even a teen I think younger lol	{'place_id': '00c39537733fa112'}
2020-07-11T11:03:36.000Z	1281906984858669057	 Pence just standing in the background, compromising his “Christian values” by ignoring the racist & discriminatory policies POTUS has blatantly championed & lobbied for & still goes to Church on Sundays!?! Blood boiling! One cannot be a “convenient Christian” who buries his head.	{'place_id': '011add077f4d2da3'}
2020-07-11T06:49:47.000Z	1281843111292030977	Oh nun, sitting at work crying while listening to songs for my wedding.😭😩❤️	{'place_id': '00c39537733fa112'}
2020-07-11T05:47:08.000Z	1281827344525725697	Updated: Incident on  Both directions from Court Square Station to Church Avenue Station 	{'place_id': '00c39537733fa112', 'coordinates': {'type': 'Point', 'coordinates': [-73.944422, 40.746397]}}
2020-07-11T04:22:13.000Z	1281805974798512128	      Another Carnivore Zealot*? Sorry, I'm late to the party	{'place_id': '86fc60f26e1639cc'}
2020-07-11T04:06:35.000Z	1281802039555698688	This is so cool, but I can’t imagine doing all that painstaking work just to cut it open to prove that it’s a cake. At least have a party, or something. 	{'place_id': '011add077f4d2da3'}
2020-07-11T03:56:15.000Z	1281799437698957313	   So 0% of Hispanics have to hate Trump? How come AMLO is working with him. What Hispanic community have you impacted for the better, what about your charitable donations, do you go to church?	{'place_id': '002e24c6736f069d'}
2020-07-11T03:55:30.000Z	1281799249479569409	If I take my headphones off and put my shades on at your wedding...shots about to real 🤣	{'place_id': 'bceb8153865c4a49'}
2020-07-11T03:44:22.000Z	1281796447491457024	Updated: Incident on  Both directions from Court Square Station to Church Avenue Station 	{'place_id': '00c39537733fa112', 'coordinates': {'type': 'Point', 'coordinates': [-73.944422, 40.746397]}}
2020-07-11T03:42:43.000Z	1281796032259653633	 Gotta be wedding crashers. Never left a theater having laughed so hard	{'place_id': '01a9a39529b27f36'}
2020-07-11T03:23:31.000Z	1281791200459202562	I bet Will wishing he went through with this wedding after all  	{'place_id': '011add077f4d2da3'}
2020-07-11T03:06:36.000Z	1281786942301130759	 Oh shut up . If people want to go to church let them wear masks and social distance	{'place_id': '54719aecdeecbbe8'}
2020-07-11T01:16:55.000Z	1281759342056833024	I wanna go back to my part-time gig.. see'n all my people dressed up coming to the concert..selling merch.. complaining that my feet hurt n threatening to quit	{'place_id': 'b87b05856ab8dbd8'}
2020-07-12T22:48:26.000Z	1282446747869093888	i been eating out way too much lately, lemme go home and cook tonight	{'place_id': '01a9a39529b27f36'}
2020-07-12T22:43:29.000Z	1282445505935609861	 Ugh I missed out on a sick wedding	{'place_id': 'ecff2a43d54be774'}
2020-07-12T21:48:00.000Z	1282431539289165827	   So what? There are many at-risk elderly people, including my 0 yr-old- mother and mother-in-law who live there. They go shopping at Publix and get manicures and their hair done bec the Gov says it’s ok. Young, asymptomatic people can be super spreaders. Very, very selfish	{'place_id': '01a9a39529b27f36'}
2020-07-12T21:25:14.000Z	1282425811069526016	First time eating out since Covid, much needed ramen. 	{'place_id': '4788f93db732fe58'}
2020-07-12T20:38:04.000Z	1282413941369470978	 Hello hello please I invite you and your wife and all you staff to enjoy every night the  party at 0thStreetbetween CP and Manhattan,  wow this is  Section 0, don’t forget bringing, vodka, whiskey, 🍻, air conditioning, come to the party 🎉	{'place_id': '01a9a39529b27f36'}
2020-07-12T20:36:33.000Z	1282413558945517571	  NYC the new Shithole of America. U cant walk down the street without fear of being shot, cant use subway for fear of being stabbed, cant go to the beach even though dr's. says UV rays kill covid, u cant go to church, cant say ALL LIVES MATER but u can protest, riot and loot.	{'place_id': '3c6a77e80605a98e'}
2020-07-12T20:34:50.000Z	1282413126726582277	  NYC the new Shithole of America. U cant walk down the street without fear of being shot, cant use subway for fear of being stabbed, cant go to the beach even though dr's. says UV rays kill covid, u cant go to church, cant say ALL LIVES MATER but u can protest, riot and loot.	{'place_id': '3c6a77e80605a98e'}
2020-07-12T18:51:43.000Z	1282387176270036996	A taco wall at a wedding...alrighty 	{'place_id': '00c39537733fa112'}
2020-07-12T18:48:32.000Z	1282386375724105729	I wonder if Kid Cudi wants to take me on a date	{'place_id': '00c39537733fa112'}
2020-07-12T18:38:39.000Z	1282383890854879232	 So a fall wedding it is🤣	{'place_id': '01a9a39529b27f36'}
2020-07-12T17:49:55.000Z	1282371626236084224	We really, really miss going to the movies.Had no idea Skyline Drive-In existed! It was truly wonderful to sit outside on a comfortable summer night and take in Anchorman (and this incredible Manhattan view) with a crowd of people laughing along.  	{'place_id': '11acab47b7960000'}
2020-07-12T17:27:28.000Z	1282365977074835460	I remember I took my friend to a party and they don’t even hang out with me anymore they hang out with the people that didn’t invite him...	{'place_id': 'fa3435044b52ecc7'}
2020-07-12T17:22:49.000Z	1282364803596668929	Updated: Incident on  Both directions from Court Square Station to Church Avenue Station 	{'place_id': '00c39537733fa112', 'coordinates': {'type': 'Point', 'coordinates': [-73.944422, 40.746397]}}
2020-07-12T17:22:49.000Z	1282364803542024196	Updated: Incident on  Both directions from Court Square Station to Church Avenue Station 	{'place_id': '00c39537733fa112', 'coordinates': {'type': 'Point', 'coordinates': [-73.944422, 40.746397]}}
2020-07-12T16:40:01.000Z	1282354034809208832	I almost forgot it was Sunday, then Facebook took me to       @ Brooklyn, New York 	{'place_id': '011add077f4d2da3', 'coordinates': {'type': 'Point', 'coordinates': [-73.95, 40.65]}}
2020-07-12T16:28:18.000Z	1282351087597608960	 0 must be wild. Only 0 guests at an historic wedding? WHY ONLY 0? Other members of Eli or Lani's family NOT THERE! Disgrace!!!!!	{'place_id': '876ed0bcf9594134'}
2020-07-12T14:33:34.000Z	1282322211521671169	  Well, I had no idea what Action Park was, and then my barber was like “go home and Google that shit. I hope your wedding isn’t haunted.”	{'place_id': '011add077f4d2da3'}
2020-07-12T13:41:20.000Z	1282309067822727173	 Wait till you hear Disco Polo out of Poland 😂😂🥴🥴 (still slaps at any Polish wedding tho)	{'place_id': '01a9a39529b27f36'}
2020-07-12T13:24:22.000Z	1282304799069872128	Cleared: Incident on  Both directions from Court Square Station to Church Avenue Station	{'place_id': '00c39537733fa112', 'coordinates': {'type': 'Point', 'coordinates': [-73.944422, 40.746397]}}
2020-07-12T13:24:22.000Z	1282304797685755906	Incident on  Both directions from Court Square Station to Church Avenue Station 	{'place_id': '00c39537733fa112', 'coordinates': {'type': 'Point', 'coordinates': [-73.944422, 40.746397]}}
2020-07-12T13:24:22.000Z	1282304797681614854	Incident on  Both directions from Court Square Station to Church Avenue Station 	{'place_id': '00c39537733fa112', 'coordinates': {'type': 'Point', 'coordinates': [-73.944422, 40.746397]}}
2020-07-12T13:24:22.000Z	1282304797564166146	Cleared: Incident on  Both directions from Court Square Station to Church Avenue Station	{'place_id': '00c39537733fa112', 'coordinates': {'type': 'Point', 'coordinates': [-73.944422, 40.746397]}}
2020-07-12T13:12:03.000Z	1282301697533116417	I just want to say, I appreciate not having to go to church these last 0 months. Best time of my life	{'place_id': '364a45c10832ed51'}
2020-07-12T12:59:35.000Z	1282298559832879106	I do miss events......I hope they will be back soon. ☹             … 	{'place_id': '01a9a39529b27f36', 'coordinates': {'type': 'Point', 'coordinates': [-74.0064, 40.7142]}}
2020-07-12T12:55:51.000Z	1282297620703084544	You can do it I hope in you Liv and go to the gym let’s someone to teach you some news moves but you are good 	{'place_id': '011add077f4d2da3'}
2020-07-12T12:18:08.000Z	1282288131459485696	0sitevisit is a wedding venue virtual tour company.     @ Brooklake Country Club 	{'place_id': 'cf24f6a1fc150ee7', 'coordinates': {'type': 'Point', 'coordinates': [-74.37781221, 40.76599483]}}
2020-07-12T11:47:29.000Z	1282280415064203264	Buhbye wedding. 	{'place_id': '27747238af7c459a'}
2020-07-12T09:27:37.000Z	1282245217664610306	One time I went out on a date in Brazil with a girl who speaks 0 Eng (I speak no Port), we talked the entire time using Google translate. Then, she had me meet her bro, he gave her car keys, I got into the car and let her drive me to a motel.How do I have 0 kidneys still.	{'place_id': '011add077f4d2da3'}
2020-07-12T07:16:11.000Z	1282212141379059713	Updated: Incident on  Both directions from Court Square Station to Church Avenue Station 	{'place_id': '00c39537733fa112', 'coordinates': {'type': 'Point', 'coordinates': [-73.944422, 40.746397]}}
2020-07-12T07:16:10.000Z	1282212135251202049	Updated: Incident on  Both directions from Court Square Station to Church Avenue Station 	{'place_id': '00c39537733fa112', 'coordinates': {'type': 'Point', 'coordinates': [-73.944422, 40.746397]}}
2020-07-12T06:00:37.000Z	1282193125302325248	Periods are like the annoying uncle that's creepy and who always shows up to the party that you tell ppl not to tell him about 	{'place_id': '00504a961360c1a2'}
2020-07-12T04:17:08.000Z	1282167079987228672	Late to the party, but just tuned into couch lands 😰🦖🦕🦖🦕🦖🦕	{'place_id': '94542c3c348faf28'}
2020-07-12T04:17:05.000Z	1282167067354058754	This time last year I was in Thailand for a friends wedding and was able to justify the cost bc I got much needed dental work there and the whole vacation cost about the same as getting a crown and fillings in the USA 💀	{'place_id': '01a9a39529b27f36'}
2020-07-12T03:34:19.000Z	1282156305722019840	Tb to when one of the actors I thought of casting for BAIB stood me up for a meeting after lying about being on his way then like a week later tried to ask me out on a date 💀💀💀	{'place_id': '011add077f4d2da3'}
2020-07-12T02:19:18.000Z	1282137428057378816	 hi chona! Are you still married to Robert? I am an old friend of his from NYC. I went to your wedding. This I Laurie.	{'place_id': 'b46619b2722d9703'}
2020-07-12T02:13:12.000Z	1282135894946992130	Anyone who works in, or has been to a bar in downtown Montreal since July 0 is being told to get tested. The city has a customer registry to track bar patrons but it was  launched on Friday, after the people who tested positive had already been to the bars in question.  	{'place_id': '01a9a39529b27f36'}
2020-07-12T02:06:49.000Z	1282134287450542081	  I am late to the party	{'place_id': '00c39537733fa112'}
2020-07-12T01:49:38.000Z	1282129960325480449	And some of y'all will still leave a weak tip or not tip at all. TIP THE RESTAURANT WORKERS OR DONT EAT OUT 	{'place_id': '011add077f4d2da3'}
2020-07-12T01:24:28.000Z	1282123629183066112	I wanna go on a date 🥺 	{'place_id': '011add077f4d2da3'}
2020-07-12T01:22:51.000Z	1282123222645903360	       I really enjoy watching you. You play at one speed ... 💨... and bring Energy to the gym  got them a WINNER.	{'place_id': '011add077f4d2da3'}
2020-07-12T01:08:44.000Z	1282119668183040001	 Welcome to the party Anne. You’ve been a long time coming. You’ve made Bill Mahar very happy I suspect	{'place_id': '011add077f4d2da3'}
2020-07-12T00:49:55.000Z	1282114936152428544	 Y’all still have flowers covering the  center aisle of the church after a wedding. Not to mention the petals that fall off the flowers adorning the church the rest of the year...	{'place_id': '00c55f041e27dc51'}
2020-07-12T00:30:19.000Z	1282110000740130817	. L👀K! Ashley says he’s finally presidential! This is the day! Can we all have a party?  	{'place_id': '01a9a39529b27f36'}
2020-07-12T00:27:00.000Z	1282109166358798336	Ever since I got back on Twitter, I’ve realized how tardy to the party Instagram is.	{'place_id': '011add077f4d2da3'}
2020-07-06T02:06:47.000Z	1279959953093144576	It is with deep sadness that we learn of Broadway actor Nick Cordero’s passing after a long battle with COVID-0 complications. A devastating loss to the theater community. Our thoughts are with his family and friends. 	{'place_id': '00c39537733fa112'}
2020-07-07T17:42:24.000Z	1280557794756898817	I think I can finally get a haircut this weekend	{'place_id': '00c39537733fa112'}
2020-07-07T13:49:59.000Z	1280499304604536836	Hey aimbot users, do you also use bumpers when you go bowling?	{'place_id': '00c55f041e27dc51'}
2020-07-07T23:18:57.000Z	1280642490966687745	Great gathering of current + former (& future???) Twitter news partnerships team!!!! Great to see  &  showing how this parenting thing is done!!! 	{'place_id': '07d9de9744c85000'}
2020-07-07T23:11:24.000Z	1280640592196907015	. we the people of the McCarren Vigil have voted that you are not welcome to speak at this gathering. You’ve failed us despite marching with us weeks ago. We ask that you hold a  to explain your failure to  in the city budget	{'place_id': '011add077f4d2da3'}
2020-07-07T21:03:38.000Z	1280608437597097984	 Black / White Magic The Gathering cards are fun as fuck to play though I might fuck this raccoon if we’re being honest	{'place_id': '011add077f4d2da3'}
2020-07-07T20:50:54.000Z	1280605232033075200	When you’re playing a 0 deck Magic the Gathering EDH game all by yourself and then “All By Myself” comes on the radio    	{'place_id': '00c39537733fa112'}
2020-07-07T17:19:39.000Z	1280552071037620230	The community marches on at the  gathering. The vigil is into its second month now and continues fostering space in the neighborhood to learn about and support       	{'place_id': '07d9e389dd086003'}
2020-07-07T17:07:49.000Z	1280549091676733441	Tonight at 0pm,  gathering at  Please be sure to wear a mask and practice    	{'place_id': '01a9a39529b27f36'}
2020-07-07T14:14:05.000Z	1280505370604113923	 Thank god you’ve fixed the world by gathering up tickets ... thank you for your service 	{'place_id': '01d7322a3937ed14'}
2020-07-07T13:43:46.000Z	1280497741634965504	   Notepad++ is literally my post-it app because it saves unsaved files.Sometimes I use it to massage data into CSV format or whatever but that's it.	{'place_id': 'de7b13455f6b23f3'}
2020-07-08T22:25:43.000Z	1280991483089293313	Don’t mess with Selena! 💯🌺🌺🎤👑🌺🌺            	{'place_id': '00c39537733fa112'}
2020-07-08T20:40:56.000Z	1280965113814671362	Last night was emotional at the  gathering. We were brought to tears by the words of an 0 y.o. who shared a personal story about an interaction with police. Her emotion & bravery to share was powerful beyond words.   	{'place_id': '07d9e389dd086003'}
2020-07-08T17:06:21.000Z	1280911110225477633	We also have slated a weekly community gathering in which we will award the Queen Bee of the Week, for the students who exhibits our core values the best each week for summer academy. I was able to get 0 amazon cards donated for true incentives.	{'place_id': '011add077f4d2da3'}
2020-07-08T16:59:35.000Z	1280909407702978561	Schools ARE an INDOOR gathering!!!   You DON’T even have the data on children!!	{'place_id': 'b046074b1030a44d'}
2020-07-08T14:46:35.000Z	1280875935986847750	Tonight at 0pm,  gathering feat. guest speaker  Please bring a sign or candles to replace what was taken from the altar last night and be sure to wear a mask &      	{'place_id': '07d9e389dd086003'}
2020-07-08T11:12:48.000Z	1280822137515839489	 Look at that gathering ..Most of them don’t have masks on !! 🤦‍♀️ Just wondering why these douche bags haven’t contracted    yet ?! 😡	{'place_id': '38718ccc91e76508'}
2020-07-08T08:21:44.000Z	1280779085518643203	 So wonderful your videos of bees gathering nectar of flowers dearest DonnaMarie! Have a beautiful day!😊🌷💗😊🙏	{'place_id': '011add077f4d2da3'}
2020-07-08T07:39:59.000Z	1280768579328147463	 Good to see JSQ development continues apace. Would be nice if JSQ was a true square with a green gathering space at the center and so forth.	{'place_id': 'fa3435044b52ecc7'}
2020-07-08T03:39:53.000Z	1280708157388591105	 NY Actor/director/producer/writer/designer/founder of The Drilling Company, Bryant Park Shakespeare, continuer of Shakespeare in the Parking Lot, seen on some great TV shows and films, known for gathering brilliant artists together.	{'place_id': '01a9a39529b27f36'}
2020-07-08T02:40:12.000Z	1280693135077773313	 Chiyoh! She is resourceful and compassionate and complex. We’d build a shelter, outline a hunting/gathering plan and never run out of things to discuss.	{'place_id': '00c39537733fa112'}
2020-07-09T14:57:48.000Z	1281241148904869888	Tonight at 0pm,  gathering featuring guest speaker Tyrek Laing - Founder & CEO of Educators For Justice. Please be sure to wear a mask and practice     	{'place_id': '07d9e389dd086003'}
2020-07-09T13:57:47.000Z	1281226042498318337	      The other minor detail is we are in the throws of a global pandemic!!!  Canceling because of the greater public health threat posed by any large gathering should be the first priority!	{'place_id': '00c39537733fa112'}
2020-07-09T01:13:08.000Z	1281033611530113024	  He wrote back very diplomatically and said he was certain our author merely forgot the passages were direct quotes when she was gathering her materials and said he was certain she would remember this if brought to her attention. /0	{'place_id': '01a9a39529b27f36'}
2020-07-10T22:24:55.000Z	1281716056734801920	I made infused fried Oreos for a gathering & I ate one and I’m clapped OKAY 😭😭😭🗣🗣🗣 	{'place_id': '002e24c6736f069d'}
2020-07-10T19:34:52.000Z	1281673261189865472	When your only plan for today was to do COGS expenses auditing and yet one call altered everything. Gathering proofs of my own incident since police officers CAN’THeading to a precinct for the police report (that is supposed to be available for me online)Lawyer meeting. 🤯	{'place_id': '00c39537733fa112'}
2020-07-10T15:38:24.000Z	1281613751104479232	 ・・・Host your next social distancing gathering in our Garden or on one of our Terraces! It can be made private for your party. —📹: a.balkin @ Goosefeather 	{'coordinates': {'type': 'Point', 'coordinates': [-73.85794529, 41.05085424]}, 'place_id': '5bc740e49d25a1a5'}
2020-07-11T23:43:30.000Z	1282098220877971457	ZOOM Gathering ~ Kirtan And Yoga Philosophy With Spirit Soul And Friends  	{'place_id': '01a9a39529b27f36', 'coordinates': {'type': 'Point', 'coordinates': [-74.0007613, 40.7207559]}}
2020-07-11T23:19:40.000Z	1282092222947696640	clouds gathering, nyc 	{'place_id': '01a9a39529b27f36'}
2020-07-11T16:18:00.000Z	1281986105122988035	Tonight at 0pm, join the  gathering featuring guest speaker  If you’ve seen him speak before at the vigil, you know tonight is not one to miss. Be sure to wear a mask & practice     	{'place_id': '07d9e389dd086003'}
2020-07-11T14:01:38.000Z	1281951787965194241	Covid won’t change the underlying appeal of places with cultural density. I’ve been in NYC through all this, and aside from bars and restaurants and cultural gathering places being (temporarily!) closed and mobility restricted, it feels the same underneath.	{'place_id': '01a9a39529b27f36'}
2020-07-11T13:50:46.000Z	1281949053178257408	CAN PESTS BECOME PETS?Everyone interacts with people and animals, whether it is at home, work, place of worship or any social gathering. These meetings lead to interactions which could be of benefit to a person or detrimental.	{'place_id': '011add077f4d2da3'}
2020-07-12T23:57:19.000Z	1282464086815584261	 Yes, exactly. It is unsafe for them and us as well, as they can get struck by traffic, and they are not wearing masks as they sit there waiting to eat. No social distancing, and gathering too many people in one place. One of the many worst moves by diblasio	{'place_id': '00c39537733fa112'}
2020-07-12T12:27:41.000Z	1282290532178264066	Trump Appointee Might Not Extend Visas for Foreign Journalists at V.O.A.: The action could be a blow to the news-gathering abilities of Voice of America, an independently operated media agency funded by the government.  (vía NYtimes) 	{'coordinates': {'type': 'Point', 'coordinates': [-74.00187056, 40.7332086]}, 'place_id': '01a9a39529b27f36'}
2020-07-12T11:49:19.000Z	1282280876131352576	 Go with a mask. I went to a small gathering recently. Since we were outside we didn’t wear masks because we distanced from each other but when we went into the house we put them on. Complete Isolation isn’t good for people I think. Good luck with whatever you choose!	{'place_id': '011add077f4d2da3'}
2020-07-12T06:31:54.000Z	1282200996761030658	Got to share the stage with my great friend Baron Raymonde, a small gathering for his birthday tonight, always a pleasure to play with the Baron and share the stage even if it was 0 feet apart Happy Birthday… 	{'coordinates': {'type': 'Point', 'coordinates': [-74.1924, 40.8073]}, 'place_id': 'dc4ad595a56393ac'}
2020-07-12T06:26:10.000Z	1282199556093095936	Gathering Rhythm	{'place_id': '002e24c6736f069d'}
2020-07-12T05:48:23.000Z	1282190046288805890	  Not a Yankee fan either. George took care of that in the early 0's when he cried the neighborhood wasn't safe enough for his fans to come to the stadium. The truth was his team(s) sucked and didn't deserve an audience.	{'place_id': '002e24c6736f069d'}
2020-07-12T02:20:44.000Z	1282137789795045381	 I would counter that the majority of protests happened primarily in blue states.Much of the explosive growth and Covid0 cases is happening in red states. The early opening of bars and other social gathering spots can't be ignored as a contributing factor = to the protests.	{'place_id': '00c39537733fa112'}
