2020-07-07T23:27:45.000Z	1280644705903050752	All of the trips 😭 Vegas (conference), Atlanta (my bach party), NOLA (Essence Fest), Vegas again (friends Bach), (Possible LA weekend), Poland (wedding planning), Mexico (friends wedding) 🥴 	{'place_id': '00c39537733fa112'}
2020-07-08T23:46:53.000Z	1281011905805639680	I literally am ready to stay single for a long ass time but man sometimes do I just wanna go on a date w a cute ass girl and get called pretty lmfaooooo	{'place_id': '00c39537733fa112'}
2020-07-08T23:40:40.000Z	1281010342332686348	So do Paige and I hop on a plane to Vegas next month so I can walk my sister down the aisle at her wedding or	{'place_id': '011add077f4d2da3'}
2020-07-08T23:22:03.000Z	1281005660193333249	I’m mad that my old  studio is open but my current one is still closed.... I got charged and still can’t go to the gym 🙄	{'place_id': '3317d9d862253ccb'}
2020-07-08T23:03:24.000Z	1281000966129684480	Updated: Incident on  Both directions from Court Square Station to Church Avenue Station 	{'coordinates': {'type': 'Point', 'coordinates': [-73.944422, 40.746397]}, 'place_id': '00c39537733fa112'}
2020-07-08T23:01:38.000Z	1281000519029395460	On time I was on a date and the lady had box braids I couldn’t stop itching had to excuse myself	{'place_id': '01a9a39529b27f36'}
2020-07-08T22:42:38.000Z	1280995739028553728	 i mean i think, like everything, there are extremely stark class divides. a TON of dirt poor people go to church bc that’s all they have. but i understand what you’re saying	{'place_id': '00c55f041e27dc51'}
2020-07-08T22:18:46.000Z	1280989732537872385	"It’s a $0 million ""Eat out to help out"" discount scheme to boost spending at restaurants, cafes and pubs that have been crippled by COVID-0 - half-priced meals from to get people spending again. Hmm.. 🤔"	{'place_id': '01a9a39529b27f36'}
2020-07-08T21:55:48.000Z	1280983951067287555	   Was supposed to be at a wedding in Arizona so I never got tickets so....	{'place_id': '000829b517fc66b2'}
2020-07-08T21:20:02.000Z	1280974952095760390	 movies:the boythe autopsy of jane doemy big fat greek wedding the lazarus effectFML moanaspiderman far from homeother shows:(youve prob seen these)orange is the new blackstranger things some of these arent on netflix but theyre pretty easy to find.	{'place_id': '01a9a39529b27f36'}
2020-07-08T20:55:43.000Z	1280968833050836992	I need to go shopping 🛍 are stores open ? 	{'place_id': '011add077f4d2da3'}
2020-07-08T20:24:01.000Z	1280960854788374536	 I would like to know is it safe to have a wedding of 0 people or more or any type of indoor events without social distancing and without a mask??	{'place_id': '00c55f041e27dc51'}
2020-07-08T19:44:30.000Z	1280950911657967619	Hannity ,what’s with Geraldo on your show ? Give more time to Bongino ,without your constant interruption ; you go shopping each week ,with your mask,,? Laughable !!! 	{'place_id': '00c55f041e27dc51'}
2020-07-08T19:11:34.000Z	1280942621922177024	Reflections of a Wedding Singer: She looked everywhere for proof of the magic of love and has managed to center her work life on finding it.  (vía NYtimes) 	{'coordinates': {'type': 'Point', 'coordinates': [-74.00187056, 40.7332086]}, 'place_id': '01a9a39529b27f36'}
2020-07-08T17:58:00.000Z	1280924109128548352	Hello   Very late to the party.	{'place_id': '002e24c6736f069d'}
2020-07-08T17:55:13.000Z	1280923407945814017	im so late to the party but tik tok is lit	{'place_id': '4a4c49cb161a4eb9'}
2020-07-08T17:47:30.000Z	1280921464288534529	 Happy Anniversary! Great wedding ❗️	{'place_id': 'de7b13455f6b23f3'}
2020-07-08T17:31:51.000Z	1280917525388242945	Just imagine the wedding speeches in 0-0 years. 	{'place_id': '011add077f4d2da3'}
2020-07-08T17:26:29.000Z	1280916177959739396	 Wedding day- Saint jhn	{'place_id': '00c39537733fa112'}
2020-07-08T17:16:45.000Z	1280913726925832192	Exciting Times - Destination Wedding Photography in France  	{'coordinates': {'type': 'Point', 'coordinates': [-74.0007613, 40.7207559]}, 'place_id': '01a9a39529b27f36'}
2020-07-08T17:02:43.000Z	1280910196160770048	  Penn, my family just presented me with my birthday video, and you were the star...thank you so much...what a fun surprise. Some time ago I offered to clarify the sound track on your wedding video. The offer still stands. 	{'place_id': 'ef8a0ca90efdf8cb'}
2020-07-08T16:23:43.000Z	1280900382634455041	 This is true...he didn’t care about his brother in his death bed went to the movies instead 	{'place_id': 'fa3435044b52ecc7'}
2020-07-08T16:21:55.000Z	1280899929200787457	We walked by this wedding as it was taking place under the Brooklyn Bridge! 	{'place_id': 'f97108ab3c4a42ed'}
2020-07-08T16:01:13.000Z	1280894717677502465	  You still ain’t taking yo aaa to the gym. So deal with it.	{'place_id': '011add077f4d2da3'}
2020-07-08T15:59:16.000Z	1280894228323864581	 Shut up. I go to the best gym in the world  and nobody is wanting to go to the gym more than me. But I also want to live and be safe. So I will wait. And so will you. It’s not that damn serious.	{'place_id': '011add077f4d2da3'}
2020-07-08T15:32:09.000Z	1280887403587264512	I need to go to the mall 🙄🙄	{'place_id': '00c55f041e27dc51'}
2020-07-08T15:27:48.000Z	1280886309037445121	 Only thing missing from this wedding was Orpheus escaping and pulling a gun on Justin.	{'place_id': '876ed0bcf9594134'}
2020-07-08T15:14:33.000Z	1280882975991832578	Walking around the Village and stopping into any random bar for a drink - especially in spring when it first gets warm. 	{'place_id': '011add077f4d2da3'}
2020-07-08T14:45:44.000Z	1280875722190598149	Tbh, I just want all my nyc pigs and tops to have a party and get covered in sweat and cum together.	{'place_id': '011add077f4d2da3'}
2020-07-08T14:13:41.000Z	1280867659039608837	Best musical band in the city, always best go with Ismaila Diarra band.You are always welcome to join us for event,festival,party,wedding, for any available event contact us. Thanks.Please the video below. 	{'place_id': '07d9d210bf085000'}
2020-07-08T14:08:44.000Z	1280866411536097280	i set my co worker and best friend up on a date... idk if i’m gonna regret that or love it 	{'place_id': '011add077f4d2da3'}
2020-07-10T23:28:23.000Z	1281732028707348482	bro. 0 nights at sandals negril is $0. bitch im not leaving that resort for nothing. after my moms wedding im doing all the activities during the day and getting fckd up at night.	{'place_id': '01a9a39529b27f36'}
2020-07-10T22:50:56.000Z	1281722602051055622	     0 0 0 Action Limousine inc @ Westfield, New Jersey 	{'coordinates': {'type': 'Point', 'coordinates': [-74.3478, 40.6502]}, 'place_id': '777dd5b3b30a625e'}
2020-07-10T22:48:19.000Z	1281721945323708416	How are you going to ask someone on a date and your money isn’t right? 🤧	{'place_id': '01a9a39529b27f36'}
2020-07-10T22:40:44.000Z	1281720037087338502	     0 0 0   @ Westfield, New Jersey 	{'coordinates': {'type': 'Point', 'coordinates': [-74.3478, 40.6502]}, 'place_id': '777dd5b3b30a625e'}
2020-07-10T22:13:24.000Z	1281713158948827137	 As if a hurricane, storm, or tornado can't hit your way. You are not God so you don't know what he is doing. The main disease spreading  is hatred like you are displaying now. Then you wonder why a lot of young people don't want to go to church.	{'place_id': '01a9a39529b27f36'}
2020-07-10T21:35:32.000Z	1281703629263646722	 couple’s wedding on hold, N.J. banquet hall refuses to return $0K deposit, suit says 	{'place_id': 'e9143a85705b4d40'}
2020-07-10T21:29:18.000Z	1281702058777870337	Updated: Incident on  Both directions from Court Square Station to Church Avenue Station 	{'coordinates': {'type': 'Point', 'coordinates': [-73.944422, 40.746397]}, 'place_id': '00c39537733fa112'}
2020-07-10T21:24:27.000Z	1281700838533103616	Plan now for your wedding in 0.  From small weddings to large, destination weddings to right in your own backyard, we'll work within YOUR time frame and budget to create the PERFECT DAY of your dreams.… 	{'coordinates': {'type': 'Point', 'coordinates': [-73.96016789, 40.79824355]}, 'place_id': '01a9a39529b27f36'}
2020-07-10T21:16:51.000Z	1281698924923957248	  I’ve been wearing a mask since March and I STOPPED GOING TO CHURCH ⛪️ TOWARDS THE LAST WEEK IN FEBRUARY WHEN I FIRST HEARD ABOUT THE CORONAVIRUS.Many visitors sit in the balcony where I sit	{'place_id': '01a9a39529b27f36'}
2020-07-10T21:04:43.000Z	1281695874742181889	I wanna go to the mall just so i can get some “my kitchen” food & some naan bread from that Indian spot	{'place_id': 'a227c629b631eea2'}
2020-07-10T20:39:27.000Z	1281689515845967874	Ugh here go my IG notifications late to the party .	{'place_id': 'fa3435044b52ecc7'}
2020-07-10T20:36:49.000Z	1281688850595815426	Politically correct decisions?Not for tasting or quality but now we have to go shopping for political reasons?🙄 	{'place_id': '65e3a577f1940550'}
2020-07-10T19:35:16.000Z	1281673363224694786	 Hipsters cop albums and go to concerts OD. You eating out here no question.	{'place_id': 'e9143a85705b4d40'}
2020-07-10T19:13:47.000Z	1281667957236662278	0sitevisit is a wedding venue virtual tour company.      @ Rockleigh, New Jersey 	{'coordinates': {'type': 'Point', 'coordinates': [-73.9271, 41.00141]}, 'place_id': 'c0a33beab4228a50'}
2020-07-10T19:00:11.000Z	1281664534005063681	   I guess you don’t understand the amount of outreach and aid the Catholic Church does if you’re going to compare them to a restaurant. I can promise you that most people who work for parishes didn’t just stop working during the lockdown.	{'place_id': '002e24c6736f069d'}
2020-07-10T18:58:24.000Z	1281664082316328960	 I went on a date yesterday with a girl 0 pounds heavier than her pictures. Legit thought about running away	{'place_id': '00c55f041e27dc51'}
2020-07-10T18:57:04.000Z	1281663749443719168	Check out how just a little ray of of light makes our champagne gold glitter aisle runner dance. These glitter beauties are now 0% off!  Call to order. .....  … 	{'coordinates': {'type': 'Point', 'coordinates': [-74.34173, 40.80896]}, 'place_id': '24661d47b426cdac'}
2020-07-10T18:30:27.000Z	1281657050016157696	ive always wanted to go on a date to the aquarium🥺	{'place_id': '002e24c6736f069d'}
2020-07-10T18:24:32.000Z	1281655559905632256	It's all about perspective, and these jaw-dropping snapshots prove that the view from the top is breathtaking. ➡️ for the most unique ceremony photos we have ever seen.  … 	{'coordinates': {'type': 'Point', 'coordinates': [-74.0064, 40.7142]}, 'place_id': '01a9a39529b27f36'}
2020-07-10T18:08:24.000Z	1281651502587580416	 found your wedding cakes 	{'place_id': '01a9a39529b27f36'}
2020-07-10T17:34:23.000Z	1281642940872314880	Updated: Incident on  Both directions from Court Square Station to Church Avenue Station 	{'coordinates': {'type': 'Point', 'coordinates': [-73.944422, 40.746397]}, 'place_id': '00c39537733fa112'}
2020-07-10T17:34:11.000Z	1281642889202860040	Let's Go Shopping: Cute Pajamas Haul!  	{'coordinates': {'type': 'Point', 'coordinates': [-74.0007613, 40.7207559]}, 'place_id': '01a9a39529b27f36'}
2020-07-10T16:27:52.000Z	1281626202491551744	I don’t see a wedding ring... maybe there’s a Karen out there he hasn’t met yet.. idea for tv reality show??? What do you think  	{'place_id': '01a9a39529b27f36'}
2020-07-10T15:58:11.000Z	1281618732465500165	     0 0 0 Action Limousine inc	{'place_id': 'dfa88de1ece1a505'}
2020-07-10T15:34:27.000Z	1281612756865736706	The physicals are finally in front of us! T-0 months until we get hitched nah mean      @ Brooklyn, New York 	{'coordinates': {'type': 'Point', 'coordinates': [-73.95, 40.65]}, 'place_id': '011add077f4d2da3'}
2020-07-10T15:21:34.000Z	1281609514240954368	Stunning outdoor wedding by our long time client  ❤️. The lush greenery coupled with these amazing flowers turns this large outdoor space into an intimate setting for the ceremony. Honored to have been… 	{'coordinates': {'type': 'Point', 'coordinates': [-73.61489126, 40.75872224]}, 'place_id': '6b0f2ded51928926'}
2020-07-10T15:02:39.000Z	1281604757325570048	Thanks rain 🌧 for not letting me go shopping 🛍 today 🙄	{'place_id': '01a9a39529b27f36'}
2020-07-10T14:53:53.000Z	1281602549024464897	Cooking at home will always be better than eating out. Not sure why I spent so much money at restaurants. Prolly for the experience	{'place_id': '00c39537733fa112'}
2020-07-10T13:58:39.000Z	1281588649898004486	When life gives you lemons...decorate! 🍋              … 	{'coordinates': {'type': 'Point', 'coordinates': [-74.0064, 40.7142]}, 'place_id': '01a9a39529b27f36'}
2020-07-10T13:29:31.000Z	1281581316333502464	Updated: Incident on  Both directions from Court Square Station to Church Avenue Station 	{'coordinates': {'type': 'Point', 'coordinates': [-73.944422, 40.746397]}, 'place_id': '00c39537733fa112'}
2020-07-10T13:19:08.000Z	1281578704221741056	Our bride Stephanie came to our shop with a wedding just 0 day’s away! We found a perfect gown to fit her beautiful and accommodated the accessories right away 💕.If you don’t have a gown and your wedding just weeks… 	{'coordinates': {'type': 'Point', 'coordinates': [-74.0064, 40.7142]}, 'place_id': '01a9a39529b27f36'}
2020-07-10T12:53:55.000Z	1281572357090541569	  I’m going to the mall peace out🤣🤣🤣	{'place_id': '00edde1d2ec0a4d4'}
2020-07-10T12:48:06.000Z	1281570896315064320	Wedding gig in Bali next year?! Tell Mother Nature to put a cigarette out on those floods because ya boy tryna see some islands before the world ends 🥰	{'place_id': 'd9da081322efe6e7'}
2020-07-10T11:06:31.000Z	1281545329918177280	It seemed impossible that it’s been 0 years since our wedding day. That was until I went looking for a photo for this post and couldn’t find anything that didn’t look pixelated. I never knew 0 years could go by so… 	{'coordinates': {'type': 'Point', 'coordinates': [-73.8309, 40.7]}, 'place_id': '00c39537733fa112'}
2020-07-10T06:09:53.000Z	1281470681159479303	Cleared: Incident on  from Smith Street-0th Street Station to Church Avenue Station	{'coordinates': {'type': 'Point', 'coordinates': [-73.997779, 40.674777]}, 'place_id': '011add077f4d2da3'}
2020-07-10T06:09:53.000Z	1281470680958197760	Cleared: Incident on  from Smith Street-0th Street Station to Church Avenue Station	{'coordinates': {'type': 'Point', 'coordinates': [-73.997779, 40.674777]}, 'place_id': '011add077f4d2da3'}
2020-07-10T06:09:53.000Z	1281470680953954304	Cleared: Incident on  SB from Smith Street-0th Street Station to Church Avenue Station	{'coordinates': {'type': 'Point', 'coordinates': [-73.997779, 40.674777]}, 'place_id': '011add077f4d2da3'}
2020-07-10T06:09:53.000Z	1281470680354230274	Cleared: Incident on  SB from Smith Street-0th Street Station to Church Avenue Station	{'coordinates': {'type': 'Point', 'coordinates': [-73.997779, 40.674777]}, 'place_id': '011add077f4d2da3'}
2020-07-10T05:42:23.000Z	1281463760071397377	I wanna go on a date 😔	{'place_id': '011add077f4d2da3'}
2020-07-10T05:40:45.000Z	1281463350564655104	 little falls New Jersey  the wedding party band my father’s the gutair player and vocalist!! 	{'place_id': '51b45b88191c1a6e'}
2020-07-10T05:09:28.000Z	1281455475322650625	Updated: Incident on  Both directions from Court Square Station to Church Avenue Station 	{'coordinates': {'type': 'Point', 'coordinates': [-73.944422, 40.746397]}, 'place_id': '00c39537733fa112'}
2020-07-10T05:05:26.000Z	1281454460708028416	 when is the wedding sis	{'place_id': '002e24c6736f069d'}
2020-07-10T04:37:59.000Z	1281447554543235074	Updated: Incident on  from Smith Street-0th Street Station to Church Avenue Station 	{'coordinates': {'type': 'Point', 'coordinates': [-73.997779, 40.674777]}, 'place_id': '011add077f4d2da3'}
2020-07-10T04:37:59.000Z	1281447553805037570	Updated: Incident on  SB from Smith Street-0th Street Station to Church Avenue Station 	{'coordinates': {'type': 'Point', 'coordinates': [-73.997779, 40.674777]}, 'place_id': '011add077f4d2da3'}
2020-07-10T04:37:59.000Z	1281447553804963842	Updated: Incident on  SB from Smith Street-0th Street Station to Church Avenue Station 	{'coordinates': {'type': 'Point', 'coordinates': [-73.997779, 40.674777]}, 'place_id': '011add077f4d2da3'}
2020-07-10T04:37:59.000Z	1281447553800732674	Updated: Incident on  from Smith Street-0th Street Station to Church Avenue Station 	{'coordinates': {'type': 'Point', 'coordinates': [-73.997779, 40.674777]}, 'place_id': '011add077f4d2da3'}
2020-07-10T04:36:35.000Z	1281447202544586754	Imagine going to a restaurant in Houston where the cases of Covid are spiking out of control to pick up the to go order you placed and doing something like this.This is the disdain wealthy people feel for the working class. 	{'place_id': '011add077f4d2da3'}
2020-07-10T04:29:36.000Z	1281445444359458816	I went to a party once and saw people playing flip cup with patron. I knew that party wasn’t for me so I stayed and played till I got drunk AF. Ahh man 0 was wild.	{'place_id': '002e24c6736f069d'}
2020-07-10T03:11:27.000Z	1281425777507078145	feening to go to the mall tm omg	{'place_id': '10d2f6857b8ac152'}
2020-07-10T02:52:37.000Z	1281421038715383810	Times Square to Church and Flatbush,  NYC Blackout 0. 	{'place_id': '011add077f4d2da3'}
2020-07-10T02:08:27.000Z	1281409922207449088	Saturday, 0AM: QDR Cleanup at Flushing Meadows Corona Park and World’s Fair Marina Meetup: Queens Unisphere Our Parks and shared spaces deserve better. Nothing has illustrated this point more effectively than… 	{'coordinates': {'type': 'Point', 'coordinates': [-73.841264, 40.743055]}, 'place_id': '00c39537733fa112'}
2020-07-10T02:02:44.000Z	1281408482474954764	 Please sign and/or share       	{'place_id': '7356b662670b2c31'}
2020-07-10T01:49:58.000Z	1281405268748836864	got asked out on a date haven’t flirted in a while keep me in your thoughts	{'place_id': '011add077f4d2da3'}
2020-07-10T01:42:17.000Z	1281403336525336577	  my fiancé promised we can do “grow old with you” as our first dance at our wedding in Staten Island. Is Mr. Sandler free August 0? :)Best,Mark Dukshtein, MDManhattan Beach, Brooklyn	{'place_id': 'b046074b1030a44d'}
2020-07-10T01:28:46.000Z	1281399936395939840	I want a very luxurious but small wedding.	{'place_id': '002e24c6736f069d'}
2020-07-10T01:04:15.000Z	1281393766126034945	Updated: Incident on  Both directions from Court Square Station to Church Avenue Station 	{'coordinates': {'type': 'Point', 'coordinates': [-73.944422, 40.746397]}, 'place_id': '00c39537733fa112'}
2020-07-10T00:44:13.000Z	1281388723234643971	    0 0 0 Action Limousine inc @ Action Limousine Testimonials 	{'coordinates': {'type': 'Point', 'coordinates': [-74.33206, 40.6502]}, 'place_id': '87c0309373176f40'}
2020-07-10T00:43:57.000Z	1281388655689584640	    0 0 0 Action Limousine inc	{'place_id': '01a9a39529b27f36'}
2020-07-10T00:39:21.000Z	1281387500301365250	Being on house arrest don't mean you are in a restaurant eating out....Lock Him Up 	{'place_id': '011add077f4d2da3'}
2020-07-10T00:28:17.000Z	1281384715262599174	wedding singer too, absolute icon 	{'place_id': '011add077f4d2da3'}
2020-07-10T00:10:43.000Z	1281380294029869062	Wedding planning & canceling a 0 person wedding & planning a Plan B wedding in your favorite spot while moving is the best relationship test of all time ❤️ Dress fitting numero uno with my stand-in bridesmaid (bc all my actual ones have evacuated NYC) ....ilysm  	{'place_id': '01a9a39529b27f36'}
2020-07-10T00:05:53.000Z	1281379075588751363	Wow they got me back to the gym lmaooo 	{'place_id': '00c55f041e27dc51'}
2020-07-10T00:02:56.000Z	1281378333972889602	I am sick of people not wearing Mask. I confront this every time i go shopping. I am sick that the mask  was politicize. Fuk. Fox news who are enablers of masks are not a key to stopping the spread of Covid. Don't follow fox or other POLITICIANS .	{'place_id': '00c55f041e27dc51'}
2020-07-11T23:15:38.000Z	1282091204935639044	 Lmaoooo you are one of my funniest followers for sure! And hey friend! I’m thinking we gonna do that meetup soon.  I need a good friend chat	{'place_id': '011add077f4d2da3'}
2020-07-11T23:01:24.000Z	1282087624790863872	Covid0 Wedding.  We aim to please and will work with the current time and locations during this stressful time.      … 	{'place_id': '00c39537733fa112', 'coordinates': {'type': 'Point', 'coordinates': [-73.936101, 40.747149]}}
2020-07-11T22:35:05.000Z	1282081000856727558	 I need your help. I was supposed to get married on 0/0 my current license expired. I’m trying PROJECT CUPID and no one is responding.   I rescheduled my wedding for 0/0 and I need a license.  No appointments are open.	{'place_id': '00c39537733fa112'}
2020-07-11T22:31:37.000Z	1282080130165350400	Rolling thru the city....had to make a stop at  for a drink..Miss spending my Tuesday night here DJing and hanging out here for events @ Fat Buddha 	{'place_id': '01a9a39529b27f36', 'coordinates': {'type': 'Point', 'coordinates': [-73.980568, 40.729812]}}
2020-07-11T22:06:40.000Z	1282073851833311232	I’m excited for my meditation virtual meetup tonight - we always end the meeting so fulfilled and empowered. ✨	{'place_id': '01a9a39529b27f36'}
2020-07-11T22:05:53.000Z	1282073653870559233	So  is reopening but I still can’t go to the gym. Okay 👌🏻	{'place_id': 'cd13d7c07e4e78e7'}
2020-07-11T22:05:08.000Z	1282073466619953159	 I’m still afraid of being in public or go shopping	{'place_id': '00c55f041e27dc51'}
2020-07-11T22:02:38.000Z	1282072834890780673	Tatiana and I eloped a year to the day before our big wedding, but we had no idea at the time that we were trend-setters .There have been so many hardships for couples who were planning on getting married in 0… 	{'place_id': '01a9a39529b27f36', 'coordinates': {'type': 'Point', 'coordinates': [-73.96559, 40.77133]}}
2020-07-11T21:42:44.000Z	1282067827776684035	Just spent the afternoon trying to get my wedding album pics from 0 to 0, directly followed by a FaceTime of walking my parents through setting up and logging into Disney+ on their Roku and I don’t wish this day on anyone.	{'place_id': '01a9a39529b27f36'}
2020-07-11T21:14:55.000Z	1282060826736840706	     0 0 0 Action Limousine inc	{'place_id': 'dfa88de1ece1a505'}
2020-07-11T21:14:12.000Z	1282060647904182274	     0 0 0 Action Limousine inc @ Colonia, New Jersey 	{'place_id': 'dfa88de1ece1a505', 'coordinates': {'type': 'Point', 'coordinates': [-74.3139, 40.5911]}}
2020-07-11T20:30:25.000Z	1282049629320884224	Wait until our wedding ...	{'place_id': '926fea31818e07d2'}
2020-07-11T20:08:25.000Z	1282044091535183877	Went to a Zoom wedding today and it was the most heartwarming moment I’ve lived in a while ✨😭	{'place_id': '01a9a39529b27f36'}
2020-07-11T19:08:56.000Z	1282029124798775300	Man, nothing will piss me off more than someone proposing at MY wedding!	{'place_id': '011add077f4d2da3'}
2020-07-11T19:06:46.000Z	1282028577639333889	Update: we are not going to the wedding (and I feel a sense of relief but also like shit about it) 	{'place_id': '011add077f4d2da3'}
2020-07-11T18:58:06.000Z	1282026395800088582	0 was absolutely positively one of the strangest years of my life. I think the only things that kept me sane were going to the gym and video chats with Daniel. 	{'place_id': '011add077f4d2da3'}
2020-07-11T18:50:54.000Z	1282024585907646470	Love 💕 you Irving ... this   if you & Mrs. McLaughlin is breathtakingly  !  ☝️♥️🙏   - Julia  ‘‘‘‘‘‘‘ … 	{'place_id': '01a9a39529b27f36', 'coordinates': {'type': 'Point', 'coordinates': [-74.0064, 40.7142]}}
2020-07-11T18:50:44.000Z	1282024540995039232	Love 💕 you Irving ... this   if you & Mrs. McLaughlin is breathtakingly  !  ☝️♥️🙏   - Julia  ‘‘‘‘‘‘‘ … 	{'place_id': '01a9a39529b27f36', 'coordinates': {'type': 'Point', 'coordinates': [-74.0064, 40.7142]}}
2020-07-11T18:50:29.000Z	1282024480001449985	Love 💕 you Irving ... this   if you & Mrs. McLaughlin is breathtakingly  !  ☝️♥️🙏   - Julia  ‘‘‘‘‘‘‘ … 	{'place_id': '01a9a39529b27f36', 'coordinates': {'type': 'Point', 'coordinates': [-74.0064, 40.7142]}}
2020-07-11T18:49:14.000Z	1282024163444654080	I know I’m late to the party but wow I feel SO OLD watching the Baby-Sitters Club  show. I read the books in middle school and thought the characters were so hip and cool lmao	{'place_id': '01a9a39529b27f36'}
2020-07-11T18:16:12.000Z	1282015854159429633	Updated: Incident on  Both directions from Court Square Station to Church Avenue Station 	{'place_id': '00c39537733fa112', 'coordinates': {'type': 'Point', 'coordinates': [-73.944422, 40.746397]}}
2020-07-11T18:10:57.000Z	1282014531766673410	Action Limousine inc0-0-0                  Action… 	{'place_id': '65b4760a2b411e11', 'coordinates': {'type': 'Point', 'coordinates': [-74.27852, 40.55452]}}
2020-07-11T17:58:46.000Z	1282011462785957890	Lmao I dead took myself on a date. 🥴	{'place_id': '002e24c6736f069d'}
2020-07-11T17:45:18.000Z	1282008075000516608	Be nice when you go to the mall. All the employees look like the wanna die.	{'place_id': '5a700e3c73cbf9b9'}
2020-07-11T17:40:00.000Z	1282006742797373440	SOTA Wedding       	{'place_id': '01a9a39529b27f36', 'coordinates': {'type': 'Point', 'coordinates': [-74.0007613, 40.7207559]}}
2020-07-11T17:13:32.000Z	1282000082561372160	Wanna take you on a date some time...	{'place_id': '39411d80c106aa80'}
2020-07-11T16:01:56.000Z	1281982063755898880	I wanna go shopping today.	{'place_id': '01a9a39529b27f36'}
2020-07-11T15:59:18.000Z	1281981401311653888	Updated: Incident on  Both directions from Court Square Station to Church Avenue Station 	{'place_id': '00c39537733fa112', 'coordinates': {'type': 'Point', 'coordinates': [-73.944422, 40.746397]}}
